user_id,first_session_day,last_session_day,total_sessions,total_user_energy,distinct_stations_used,first_session_date,last_session_date,active_span_days
1000031,6/4/2019,6/4/2019,1,4.959,1,2019-06-04,2019-06-04,0
1000311,5/24/2019,5/24/2019,1,13.43,1,2019-05-24,2019-05-24,0
100061V,11/5/2019,2/27/2020,3,34.569,2,2019-11-05,2020-02-27,114
10013,10/31/2016,9/27/2019,2,9.469000000000001,2,2016-10-31,2019-09-27,1061
100161V,11/14/2019,9/29/2020,4,33.824,4,2019-11-14,2020-09-29,320
1001801,2/13/2020,2/13/2020,1,9.348,1,2020-02-13,2020-02-13,0
1001861,8/2/2018,8/2/2018,1,5.388,1,2018-08-02,2018-08-02,0
1001941,9/30/2017,9/30/2017,1,2.398,1,2017-09-30,2017-09-30,0
1002211,1/5/2020,10/21/2017,2,25.097,2,2020-01-05,2017-10-21,-806
100243,1/10/2017,9/9/2017,250,2381.289586,11,2017-01-10,2017-09-09,242
1002641,10/6/2017,9/9/2017,3,33.709,3,2017-10-06,2017-09-09,-27
100393,3/10/2018,4/25/2018,2,3.1500000000000004,2,2018-03-10,2018-04-25,46
1004021,11/9/2020,8/29/2018,5,17.783,1,2020-11-09,2018-08-29,-803
100523,1/16/2018,8/25/2017,25,200.035,8,2018-01-16,2017-08-25,-144
1005971,12/15/2017,12/15/2017,1,8.022,1,2017-12-15,2017-12-15,0
1006431,1/3/2018,1/3/2018,1,5.03,1,2018-01-03,2018-01-03,0
1006701,10/7/2017,10/7/2017,1,14.444,1,2017-10-07,2017-10-07,0
100673,6/12/2017,6/12/2017,1,22.572,1,2017-06-12,2017-06-12,0
1007091,3/10/2020,3/10/2020,1,9.923,1,2020-03-10,2020-03-10,0
1007181,3/30/2019,6/23/2019,7,18.097,4,2019-03-30,2019-06-23,85
1007341,4/25/2018,4/25/2018,1,15.217,1,2018-04-25,2018-04-25,0
1007531,11/2/2018,6/17/2019,4,40.755,4,2018-11-02,2019-06-17,227
100813,10/5/2018,11/22/2017,2,12.466000000000001,2,2018-10-05,2017-11-22,-317
1008231,7/13/2019,9/18/2018,3,25.794,2,2019-07-13,2018-09-18,-298
1008591,8/10/2019,8/10/2019,1,25.394,1,2019-08-10,2019-08-10,0
1008731,2/25/2019,2/25/2019,1,7.583,1,2019-02-25,2019-02-25,0
1009181,9/23/2019,9/23/2019,1,1.865,1,2019-09-23,2019-09-23,0
1009521,1/5/2020,9/24/2017,7,74.666,6,2020-01-05,2017-09-24,-833
1010901,10/8/2018,10/8/2018,1,6.107,1,2018-10-08,2018-10-08,0
1011251,9/24/2017,9/24/2017,1,6.011,1,2017-09-24,2017-09-24,0
1012301,1/18/2018,9/5/2020,14,47.535,8,2018-01-18,2020-09-05,961
1012481,3/6/2020,7/27/2018,4,40.924,4,2020-03-06,2018-07-27,-588
1013921,10/4/2018,10/4/2018,1,3.698,1,2018-10-04,2018-10-04,0
1013991,7/23/2019,7/23/2019,1,18.883,1,2019-07-23,2019-07-23,0
101473,6/22/2017,6/22/2017,1,3.712,1,2017-06-22,2017-06-22,0
101503,3/11/2019,3/11/2019,1,1.352,1,2019-03-11,2019-03-11,0
1015901,8/8/2018,8/8/2018,1,10.231,1,2018-08-08,2018-08-08,0
101603,7/2/2017,8/21/2016,2,20.618003,2,2017-07-02,2016-08-21,-315
1016401,1/18/2020,1/18/2020,1,12.458,1,2020-01-18,2020-01-18,0
1016421,11/1/2017,11/1/2017,1,5.93,1,2017-11-01,2017-11-01,0
1016681,1/5/2019,1/5/2019,1,11.426,1,2019-01-05,2019-01-05,0
1016931,12/28/2017,9/6/2019,8,77.865,6,2017-12-28,2019-09-06,617
1017331,12/23/2019,6/7/2019,2,21.226,2,2019-12-23,2019-06-07,-199
1018741,1/31/2018,10/2/2017,2,26.672,1,2018-01-31,2017-10-02,-121
1019221,5/20/2018,6/7/2018,3,38.598,3,2018-05-20,2018-06-07,18
1019311,4/1/2019,4/1/2019,1,13.109,1,2019-04-01,2019-04-01,0
1019471,4/18/2018,4/18/2018,1,4.415,1,2018-04-18,2018-04-18,0
101973,12/8/2017,12/8/2017,1,4.124,1,2017-12-08,2017-12-08,0
1019901,5/13/2018,9/23/2017,2,14.14,2,2018-05-13,2017-09-23,-232
1021821,10/14/2017,10/14/2017,1,9.467,1,2017-10-14,2017-10-14,0
1021941,11/8/2018,2/17/2018,2,10.614,2,2018-11-08,2018-02-17,-264
1022181,8/23/2018,8/23/2018,1,7.433,1,2018-08-23,2018-08-23,0
10223,5/7/2017,5/7/2017,1,4.285,1,2017-05-07,2017-05-07,0
1022581,2/1/2020,5/12/2019,3,11.241,3,2020-02-01,2019-05-12,-265
102333,1/10/2017,9/9/2016,166,1395.391601,5,2017-01-10,2016-09-09,-123
1023421,12/5/2018,3/20/2019,2,29.232,2,2018-12-05,2019-03-20,105
1023841,1/7/2020,9/22/2020,4,7.913,2,2020-01-07,2020-09-22,259
1023981,11/17/2017,4/19/2018,2,1.975,2,2017-11-17,2018-04-19,153
1024321,8/7/2018,8/7/2018,1,3.405,1,2018-08-07,2018-08-07,0
1025171,1/11/2018,9/25/2019,36,214.863,11,2018-01-11,2019-09-25,622
1025461,5/13/2018,9/24/2017,3,23.845,2,2018-05-13,2017-09-24,-231
1025481,9/14/2017,9/14/2017,1,6.357,1,2017-09-14,2017-09-14,0
1026531,10/6/2018,12/21/2018,3,23.97,3,2018-10-06,2018-12-21,76
1026621,4/12/2018,8/8/2018,2,29.153,2,2018-04-12,2018-08-08,118
1026701,1/12/2018,9/28/2017,23,271.085,8,2018-01-12,2017-09-28,-106
1027111,10/5/2017,10/5/2017,1,9.92,1,2017-10-05,2017-10-05,0
1027351,5/2/2018,5/2/2018,1,5.591,1,2018-05-02,2018-05-02,0
1028071,1/31/2020,9/28/2020,21,166.677,11,2020-01-31,2020-09-28,241
1029271,1/3/2020,9/7/2018,29,125.068,8,2020-01-03,2018-09-07,-483
10293,1/12/2017,9/7/2019,29,116.595352,5,2017-01-12,2019-09-07,968
1029581,10/10/2017,11/12/2017,5,34.666,4,2017-10-10,2017-11-12,33
1029651,10/17/2018,9/30/2018,4,19.599,2,2018-10-17,2018-09-30,-17
103073,6/28/2019,6/28/2019,1,4.626,1,2019-06-28,2019-06-28,0
1031331,7/5/2019,7/5/2019,1,13.017,1,2019-07-05,2019-07-05,0
1032001,12/2/2017,2/27/2018,2,12.687,2,2017-12-02,2018-02-27,87
1032031,9/1/2019,9/1/2019,1,21.311,1,2019-09-01,2019-09-01,0
1034101,6/16/2019,9/16/2017,2,16.839,1,2019-06-16,2017-09-16,-638
1034351,2/7/2018,2/7/2018,1,6.456,1,2018-02-07,2018-02-07,0
1034421,11/2/2019,9/16/2017,2,1.738,1,2019-11-02,2017-09-16,-777
1035811,2/17/2020,2/17/2020,1,16.63,1,2020-02-17,2020-02-17,0
1037501,6/9/2018,6/9/2018,1,13.205,1,2018-06-09,2018-06-09,0
1038641,7/1/2019,7/1/2019,1,3.472,1,2019-07-01,2019-07-01,0
103873,1/20/2019,9/28/2019,19,71.693328,11,2019-01-20,2019-09-28,251
10393,1/18/2017,5/11/2018,2,15.742,2,2017-01-18,2018-05-11,478
1039521,7/12/2020,9/12/2020,2,28.844,1,2020-07-12,2020-09-12,62
1039681,5/22/2019,5/28/2019,2,4.675,1,2019-05-22,2019-05-28,6
1039831,1/26/2018,7/9/2018,50,379.693,8,2018-01-26,2018-07-09,164
1040311,5/27/2018,9/7/2019,5,32.211,5,2018-05-27,2019-09-07,468
1041261,11/13/2017,11/13/2017,1,8.0,1,2017-11-13,2017-11-13,0
1041321,12/16/2017,12/16/2017,1,6.364,1,2017-12-16,2017-12-16,0
1041911,10/28/2017,10/28/2017,1,3.688,1,2017-10-28,2017-10-28,0
1042061,6/16/2018,6/16/2018,1,8.57,1,2018-06-16,2018-06-16,0
1042661,5/13/2019,5/13/2019,1,14.715,1,2019-05-13,2019-05-13,0
104333,3/18/2018,3/18/2018,1,5.844,1,2018-03-18,2018-03-18,0
1043501,4/2/2019,7/3/2018,5,26.041,5,2019-04-02,2018-07-03,-273
1043561,2/13/2019,2/14/2019,2,39.669,2,2019-02-13,2019-02-14,1
1043591,1/16/2020,9/9/2019,56,827.277,11,2020-01-16,2019-09-09,-129
1043701,1/15/2019,6/24/2019,37,804.659,6,2019-01-15,2019-06-24,160
1043781,10/14/2017,4/13/2018,3,13.106,2,2017-10-14,2018-04-13,181
1043891,3/21/2018,3/21/2018,1,7.783,1,2018-03-21,2018-03-21,0
1043991,1/28/2020,6/6/2019,8,80.258,6,2020-01-28,2019-06-06,-236
1044851,1/18/2018,9/21/2018,35,222.433,6,2018-01-18,2018-09-21,246
1045071,12/9/2019,8/2/2020,3,20.663,2,2019-12-09,2020-08-02,237
1045341,10/25/2018,9/19/2020,3,41.477000000000004,3,2018-10-25,2020-09-19,695
1045561,10/13/2017,9/7/2018,14,102.033,9,2017-10-13,2018-09-07,329
1045611,10/29/2017,10/29/2017,1,22.635,1,2017-10-29,2017-10-29,0
1046281,12/26/2018,12/26/2018,1,5.359,1,2018-12-26,2018-12-26,0
1046981,3/18/2018,5/12/2018,2,13.741,2,2018-03-18,2018-05-12,55
104811,10/6/2016,5/9/2017,4,12.364608,4,2016-10-06,2017-05-09,215
1048201,1/30/2018,8/25/2018,14,328.49,4,2018-01-30,2018-08-25,207
1048271,1/21/2018,5/6/2018,5,12.671,4,2018-01-21,2018-05-06,105
1048501,11/19/2019,11/19/2019,1,11.294,1,2019-11-19,2019-11-19,0
1048961,9/30/2017,9/30/2017,1,32.75,1,2017-09-30,2017-09-30,0
104983,11/15/2020,11/15/2020,1,9.826,1,2020-11-15,2020-11-15,0
1050441,7/19/2018,7/19/2018,1,4.039,1,2018-07-19,2018-07-19,0
105053,3/10/2017,8/23/2016,3,50.28985,3,2017-03-10,2016-08-23,-199
1051861,1/1/2018,9/28/2017,109,836.891,11,2018-01-01,2017-09-28,-95
1052531,3/1/2018,3/1/2018,1,12.41,1,2018-03-01,2018-03-01,0
1052671,12/13/2019,6/29/2018,16,211.945,4,2019-12-13,2018-06-29,-532
105363,1/14/2017,9/14/2016,2,11.0001,2,2017-01-14,2016-09-14,-122
1054021,11/16/2019,11/16/2019,1,9.751,1,2019-11-16,2019-11-16,0
1054491,1/11/2020,1/11/2020,1,10.784,1,2020-01-11,2020-01-11,0
105613,2/8/2018,2/8/2018,1,9.509,1,2018-02-08,2018-02-08,0
1056541,12/21/2018,9/29/2018,6,42.88,4,2018-12-21,2018-09-29,-83
1057011,1/28/2019,4/9/2019,33,162.81,5,2019-01-28,2019-04-09,71
1057261,2/24/2019,2/24/2019,1,5.169,1,2019-02-24,2019-02-24,0
1057481,3/7/2020,7/1/2019,2,10.15,2,2020-03-07,2019-07-01,-250
105793,7/20/2017,7/20/2017,1,2.691,1,2017-07-20,2017-07-20,0
1057991,9/28/2017,9/28/2017,1,10.235,1,2017-09-28,2017-09-28,0
1058681,3/4/2018,9/23/2017,3,9.525,2,2018-03-04,2017-09-23,-162
1058891,11/27/2017,12/8/2017,2,42.024,1,2017-11-27,2017-12-08,11
1059201,1/12/2018,6/22/2018,4,37.995000000000005,3,2018-01-12,2018-06-22,161
105973,2/27/2018,2/27/2018,1,5.443,1,2018-02-27,2018-02-27,0
1059881,1/8/2019,1/8/2019,1,2.771,1,2019-01-08,2019-01-08,0
1059961,1/8/2019,11/22/2017,2,27.503,2,2019-01-08,2017-11-22,-412
1060781,4/24/2018,4/24/2018,1,0.026,1,2018-04-24,2018-04-24,0
1061491,1/12/2020,8/23/2018,7,50.902,4,2020-01-12,2018-08-23,-507
1062591,12/29/2017,12/29/2017,1,5.482,1,2017-12-29,2017-12-29,0
1063551,9/22/2017,9/22/2017,1,6.964,1,2017-09-22,2017-09-22,0
106403,10/30/2016,9/2/2018,6,31.192,4,2016-10-30,2018-09-02,672
1064141,9/8/2018,9/8/2018,1,13.161,1,2018-09-08,2018-09-08,0
106453,10/8/2016,10/8/2016,1,7.482557,1,2016-10-08,2016-10-08,0
1064711,1/19/2018,8/5/2018,9,180.83100000000002,3,2018-01-19,2018-08-05,198
1064991,11/4/2018,11/4/2018,1,2.823,1,2018-11-04,2018-11-04,0
106513,1/30/2017,3/5/2017,3,9.658999999999999,2,2017-01-30,2017-03-05,34
106553,1/10/2018,9/16/2017,14,64.482,5,2018-01-10,2017-09-16,-116
1066401,3/17/2019,3/17/2019,1,4.894,1,2019-03-17,2019-03-17,0
1066971,12/17/2019,8/5/2018,3,29.278,3,2019-12-17,2018-08-05,-499
1067841,10/27/2017,9/29/2017,7,94.875,3,2017-10-27,2017-09-29,-28
10693,2/19/2018,2/19/2018,1,8.93,1,2018-02-19,2018-02-19,0
1069311,1/11/2018,9/26/2018,126,1121.983,6,2018-01-11,2018-09-26,258
106933,1/12/2019,2/23/2019,4,14.706,2,2019-01-12,2019-02-23,42
1069811,1/10/2020,12/2/2018,3,34.188,2,2020-01-10,2018-12-02,-404
107,7/23/2017,7/23/2017,1,9.713,1,2017-07-23,2017-07-23,0
1070031,10/24/2019,2/18/2020,3,22.433,2,2019-10-24,2020-02-18,117
1070121,1/13/2018,9/28/2017,55,185.525,6,2018-01-13,2017-09-28,-107
107013,1/23/2017,9/12/2016,16,90.736527,4,2017-01-23,2016-09-12,-133
1071161,4/27/2019,4/27/2019,1,5.156,1,2019-04-27,2019-04-27,0
1071601,5/19/2018,7/11/2018,3,12.684000000000001,3,2018-05-19,2018-07-11,53
107173,9/8/2016,9/8/2016,1,3.694788,1,2016-09-08,2016-09-08,0
1071731,9/24/2017,9/24/2017,1,5.749,1,2017-09-24,2017-09-24,0
1072041,1/22/2019,1/22/2019,1,6.965,1,2019-01-22,2019-01-22,0
107223,3/6/2019,5/15/2019,2,11.451,2,2019-03-06,2019-05-15,70
1072861,8/21/2018,8/21/2018,1,8.227,1,2018-08-21,2018-08-21,0
107303,12/17/2016,12/17/2016,1,10.44,1,2016-12-17,2016-12-17,0
1073031,9/24/2017,9/24/2017,1,2.682,1,2017-09-24,2017-09-24,0
107413,12/15/2016,8/11/2017,2,9.634,2,2016-12-15,2017-08-11,239
1074431,12/3/2017,12/3/2017,1,6.568,1,2017-12-03,2017-12-03,0
107453,10/2/2016,10/2/2016,1,5.780495,1,2016-10-02,2016-10-02,0
1074751,2/24/2018,2/24/2018,1,9.821,1,2018-02-24,2018-02-24,0
1074861,1/26/2018,9/26/2017,2,6.632,2,2018-01-26,2017-09-26,-122
1074901,2/17/2019,2/17/2019,1,5.913,1,2019-02-17,2019-02-17,0
1074991,5/28/2020,6/16/2020,2,17.852,2,2020-05-28,2020-06-16,19
107503,9/10/2016,9/10/2016,1,8.736198,1,2016-09-10,2016-09-10,0
1075071,1/17/2019,9/15/2019,9,57.238,3,2019-01-17,2019-09-15,241
107523,11/18/2016,11/18/2016,1,5.993,1,2016-11-18,2016-11-18,0
1075891,11/27/2019,11/27/2019,1,6.868,1,2019-11-27,2019-11-27,0
1076051,6/7/2018,6/7/2018,1,9.094,1,2018-06-07,2018-06-07,0
1077471,10/20/2018,8/23/2019,3,11.553,3,2018-10-20,2019-08-23,307
1077491,3/8/2020,3/8/2020,1,6.141,1,2020-03-08,2020-03-08,0
1077581,9/25/2017,9/25/2017,1,10.059,1,2017-09-25,2017-09-25,0
1077661,8/8/2019,8/8/2019,1,0.903,1,2019-08-08,2019-08-08,0
1077671,5/12/2018,5/12/2018,1,7.784,1,2018-05-12,2018-05-12,0
1077791,1/5/2019,9/28/2017,9,8.206,3,2019-01-05,2017-09-28,-464
1078691,11/21/2019,9/7/2018,6,90.045,3,2019-11-21,2018-09-07,-440
1078711,12/2/2018,7/22/2018,2,3.086,2,2018-12-02,2018-07-22,-133
1079161,12/4/2017,9/28/2017,6,33.193,2,2017-12-04,2017-09-28,-67
1079191,7/9/2018,7/9/2018,1,17.774,1,2018-07-09,2018-07-09,0
1079501,10/31/2017,9/26/2017,2,29.994,1,2017-10-31,2017-09-26,-35
10803,12/22/2018,12/22/2018,1,3.65,1,2018-12-22,2018-12-22,0
10813,7/13/2019,7/13/2019,1,2.122,1,2019-07-13,2019-07-13,0
1081741,10/2/2019,8/31/2019,4,17.512999999999998,2,2019-10-02,2019-08-31,-32
1082021,9/27/2017,9/27/2017,1,4.739,1,2017-09-27,2017-09-27,0
1082381,11/18/2017,11/18/2017,1,8.667,1,2017-11-18,2017-11-18,0
1082911,7/18/2018,9/16/2018,2,19.242,2,2018-07-18,2018-09-16,60
10833,2/26/2020,2/26/2020,1,6.928,1,2020-02-26,2020-02-26,0
1083341,9/26/2017,9/26/2017,1,3.264,1,2017-09-26,2017-09-26,0
1084161,1/19/2019,9/28/2018,22,192.422,10,2019-01-19,2018-09-28,-113
1084651,3/31/2018,3/31/2018,1,15.0,1,2018-03-31,2018-03-31,0
1084831,12/30/2018,12/30/2018,1,10.708,1,2018-12-30,2018-12-30,0
1085051,1/17/2019,2/13/2019,7,26.116,4,2019-01-17,2019-02-13,27
1085621,2/6/2018,2/6/2018,1,2.818,1,2018-02-06,2018-02-06,0
1085851,4/29/2019,5/1/2019,2,21.301000000000002,1,2019-04-29,2019-05-01,2
108693,3/13/2017,4/3/2017,2,26.15,1,2017-03-13,2017-04-03,21
108713,3/6/2018,4/6/2018,3,16.418,1,2018-03-06,2018-04-06,31
1088671,1/11/2020,9/8/2018,72,644.788,13,2020-01-11,2018-09-08,-490
1089011,11/25/2017,11/25/2017,1,3.397,1,2017-11-25,2017-11-25,0
1089381,2/11/2020,9/29/2017,3,26.925,3,2020-02-11,2017-09-29,-865
1089441,1/11/2019,8/19/2019,14,31.632,5,2019-01-11,2019-08-19,220
1089761,1/30/2019,7/24/2019,8,45.869,5,2019-01-30,2019-07-24,175
1090291,10/2/2017,9/30/2017,8,226.36100000000002,2,2017-10-02,2017-09-30,-2
1090441,11/5/2017,7/21/2019,2,10.31,2,2017-11-05,2019-07-21,623
1090641,3/19/2019,3/19/2019,1,8.891,1,2019-03-19,2019-03-19,0
1090781,11/10/2017,9/24/2018,17,284.772,3,2017-11-10,2018-09-24,318
1090851,1/26/2020,2/22/2019,2,6.57,2,2020-01-26,2019-02-22,-338
1091701,1/11/2019,2/16/2018,10,180.338,5,2019-01-11,2018-02-16,-329
1091851,5/1/2019,5/1/2019,1,0.808,1,2019-05-01,2019-05-01,0
1092381,11/22/2019,11/22/2019,1,1.016,1,2019-11-22,2019-11-22,0
1092891,10/17/2017,10/17/2017,2,10.342,2,2017-10-17,2017-10-17,0
1092931,10/24/2018,10/24/2018,1,39.488,1,2018-10-24,2018-10-24,0
109373,11/18/2019,6/21/2018,2,27.886000000000003,2,2019-11-18,2018-06-21,-515
1093821,5/29/2019,8/25/2019,2,10.427,1,2019-05-29,2019-08-25,88
1094951,5/16/2018,5/16/2018,1,9.172,1,2018-05-16,2018-05-16,0
1095451,3/20/2019,3/20/2019,1,7.898,1,2019-03-20,2019-03-20,0
1096851,8/4/2018,8/4/2018,1,4.855,1,2018-08-04,2018-08-04,0
1096861,2/5/2019,2/5/2019,1,13.733,1,2019-02-05,2019-02-05,0
1096871,1/6/2018,1/6/2018,1,12.634,1,2018-01-06,2018-01-06,0
1097501,2/4/2020,2/4/2020,1,2.932,1,2020-02-04,2020-02-04,0
1097631,9/29/2017,9/30/2017,2,9.023,1,2017-09-29,2017-09-30,1
1097831,11/26/2019,11/26/2019,1,9.191,1,2019-11-26,2019-11-26,0
1098151,6/16/2019,7/25/2018,2,19.857,2,2019-06-16,2018-07-25,-326
109823,1/16/2020,9/5/2019,36,451.806483,7,2020-01-16,2019-09-05,-133
1099001,1/4/2019,3/1/2019,2,14.733,1,2019-01-04,2019-03-01,56
1099021,10/2/2017,10/2/2017,1,14.028,1,2017-10-02,2017-10-02,0
1099481,11/19/2017,12/3/2019,2,11.536999999999999,2,2017-11-19,2019-12-03,744
1100041,7/16/2019,7/16/2019,1,4.54,1,2019-07-16,2019-07-16,0
1101701,9/8/2019,9/8/2019,1,0.775,1,2019-09-08,2019-09-08,0
1102081,12/23/2017,12/23/2017,1,3.117,1,2017-12-23,2017-12-23,0
110303,9/11/2019,9/11/2019,1,0.074,1,2019-09-11,2019-09-11,0
1103381,10/1/2017,10/10/2017,2,4.899,1,2017-10-01,2017-10-10,9
1104831,10/16/2020,9/25/2020,11,429.346,3,2020-10-16,2020-09-25,-21
1105351,2/19/2020,2/19/2020,1,0.458,1,2020-02-19,2020-02-19,0
1105851,1/30/2020,9/9/2020,123,1371.899,13,2020-01-30,2020-09-09,223
1105931,10/15/2017,10/15/2017,1,11.696,1,2017-10-15,2017-10-15,0
1106281,7/19/2018,7/19/2018,1,6.457,1,2018-07-19,2018-07-19,0
1106391,1/13/2019,9/22/2018,21,135.988,10,2019-01-13,2018-09-22,-113
1106551,1/8/2019,4/26/2019,6,48.051,5,2019-01-08,2019-04-26,108
110663,1/5/2017,3/20/2019,5,31.147,4,2017-01-05,2019-03-20,804
1107831,3/22/2018,3/22/2018,1,9.785,1,2018-03-22,2018-03-22,0
1108881,1/13/2018,3/31/2018,4,31.135,2,2018-01-13,2018-03-31,77
110983,1/1/2018,1/1/2018,1,14.536999999999999,1,2018-01-01,2018-01-01,0
1110041,3/2/2018,3/2/2018,1,6.583,1,2018-03-02,2018-03-02,0
1110761,3/17/2019,3/25/2019,2,27.680999999999997,1,2019-03-17,2019-03-25,8
1111071,9/25/2020,9/25/2020,1,6.725,1,2020-09-25,2020-09-25,0
1111371,10/5/2017,10/5/2017,1,0.631,1,2017-10-05,2017-10-05,0
1111761,1/27/2018,6/15/2019,6,28.53,5,2018-01-27,2019-06-15,504
1112431,9/3/2020,9/6/2019,2,22.227,2,2020-09-03,2019-09-06,-363
1112441,8/7/2019,8/7/2019,1,4.68,1,2019-08-07,2019-08-07,0
1112951,1/20/2018,12/6/2017,4,8.621,3,2018-01-20,2017-12-06,-45
1113321,10/15/2018,7/15/2018,5,31.407999999999998,5,2018-10-15,2018-07-15,-92
111343,1/13/2018,1/13/2018,1,2.97,1,2018-01-13,2018-01-13,0
1113931,6/7/2018,6/7/2018,1,5.376,1,2018-06-07,2018-06-07,0
1114471,1/3/2019,1/3/2019,1,8.731,1,2019-01-03,2019-01-03,0
1114891,7/14/2018,7/14/2018,2,7.595,2,2018-07-14,2018-07-14,0
1115321,10/19/2017,10/21/2017,2,21.428,2,2017-10-19,2017-10-21,2
1115891,11/1/2019,12/6/2019,4,25.431,3,2019-11-01,2019-12-06,35
111683,3/14/2017,8/4/2018,3,19.005000000000003,1,2017-03-14,2018-08-04,508
1117391,4/1/2018,4/1/2018,1,12.731,1,2018-04-01,2018-04-01,0
1118451,3/23/2018,5/20/2018,2,10.974,1,2018-03-23,2018-05-20,58
111863,11/20/2016,11/20/2016,1,4.14,1,2016-11-20,2016-11-20,0
111923,1/5/2019,9/28/2019,8,49.845,3,2019-01-05,2019-09-28,266
1119761,6/4/2020,7/9/2020,4,25.503999999999998,3,2020-06-04,2020-07-09,35
1120371,2/4/2018,2/4/2018,1,6.589,1,2018-02-04,2018-02-04,0
112043,11/3/2018,11/3/2018,1,4.218,1,2018-11-03,2018-11-03,0
1120681,11/6/2017,7/8/2019,2,7.191,2,2017-11-06,2019-07-08,609
1121651,1/11/2018,5/3/2018,6,46.107,6,2018-01-11,2018-05-03,112
112223,1/29/2019,9/4/2018,11,68.428,7,2019-01-29,2018-09-04,-147
1122261,9/14/2018,9/14/2018,1,9.076,1,2018-09-14,2018-09-14,0
1122381,12/3/2017,12/3/2017,1,17.63,1,2017-12-03,2017-12-03,0
1122801,10/12/2020,9/8/2020,91,1834.913,4,2020-10-12,2020-09-08,-34
1123261,1/11/2018,9/6/2018,95,922.197,15,2018-01-11,2018-09-06,238
1123331,10/12/2017,10/12/2017,1,14.703,1,2017-10-12,2017-10-12,0
1123621,10/29/2017,8/5/2018,2,25.097,1,2017-10-29,2018-08-05,280
112393,9/17/2016,9/17/2016,1,4.208723,1,2016-09-17,2016-09-17,0
1125261,1/13/2018,1/13/2018,1,10.595,1,2018-01-13,2018-01-13,0
1125911,12/10/2017,12/10/2017,1,1.441,1,2017-12-10,2017-12-10,0
1126631,11/25/2017,3/25/2018,2,19.084,1,2017-11-25,2018-03-25,120
112673,6/19/2017,6/19/2017,1,9.525,1,2017-06-19,2017-06-19,0
112683,1/10/2017,9/8/2017,43,454.46672,8,2017-01-10,2017-09-08,241
11273,1/22/2017,9/4/2016,16,37.372104,2,2017-01-22,2016-09-04,-140
1127331,11/3/2017,11/7/2017,2,24.377000000000002,2,2017-11-03,2017-11-07,4
1129401,12/8/2018,12/8/2018,1,2.898,1,2018-12-08,2018-12-08,0
1129471,10/23/2017,6/10/2019,3,18.918,1,2017-10-23,2019-06-10,595
1129641,2/13/2018,2/13/2018,1,3.386,1,2018-02-13,2018-02-13,0
1129791,10/21/2017,9/11/2019,18,44.879,6,2017-10-21,2019-09-11,690
1129921,10/19/2019,6/30/2018,2,11.957,2,2019-10-19,2018-06-30,-476
1129941,1/13/2019,9/27/2020,13,56.188,7,2019-01-13,2020-09-27,623
1130441,10/7/2017,11/15/2019,2,5.881,1,2017-10-07,2019-11-15,769
1131241,1/23/2018,7/3/2018,23,68.507,8,2018-01-23,2018-07-03,161
1131321,3/2/2018,3/30/2018,2,16.84,2,2018-03-02,2018-03-30,28
1131351,8/1/2018,8/1/2018,1,5.757,1,2018-08-01,2018-08-01,0
1131611,1/13/2019,9/21/2018,16,66.57000000000001,6,2019-01-13,2018-09-21,-114
1133561,1/11/2019,9/9/2019,4,30.877,3,2019-01-11,2019-09-09,241
1133681,10/18/2018,10/18/2018,1,10.867,1,2018-10-18,2018-10-18,0
1133871,2/3/2018,2/3/2018,2,4.033,2,2018-02-03,2018-02-03,0
1134141,4/10/2018,4/10/2018,1,1.88,1,2018-04-10,2018-04-10,0
1134341,7/25/2018,7/25/2018,1,5.585,1,2018-07-25,2018-07-25,0
1134631,11/8/2017,11/8/2017,1,15.602,1,2017-11-08,2017-11-08,0
1135341,1/10/2018,9/8/2018,68,293.136,3,2018-01-10,2018-09-08,241
1135651,5/15/2019,5/15/2019,1,6.941,1,2019-05-15,2019-05-15,0
1135901,2/22/2020,2/22/2020,1,5.336,1,2020-02-22,2020-02-22,0
1135931,10/10/2017,4/13/2018,17,171.358,3,2017-10-10,2018-04-13,185
1136281,10/27/2018,4/19/2019,2,21.973,2,2018-10-27,2019-04-19,174
113683,1/20/2017,1/20/2017,1,6.6,1,2017-01-20,2017-01-20,0
1137141,10/15/2017,12/17/2017,8,159.40200000000002,2,2017-10-15,2017-12-17,63
113723,10/30/2016,9/9/2016,14,145.49001,7,2016-10-30,2016-09-09,-51
1139011,10/17/2017,11/7/2017,3,11.13,2,2017-10-17,2017-11-07,21
1139351,1/11/2020,9/3/2019,67,2102.003,5,2020-01-11,2019-09-03,-130
1139431,1/12/2020,9/13/2020,22,89.05199999999999,7,2020-01-12,2020-09-13,245
1141181,10/29/2017,2/9/2019,5,27.876,4,2017-10-29,2019-02-09,468
1141411,3/4/2018,6/6/2019,3,22.565,2,2018-03-04,2019-06-06,459
114363,1/10/2020,9/29/2016,90,401.508427,5,2020-01-10,2016-09-29,-1198
1144051,10/11/2017,5/14/2019,5,13.768,2,2017-10-11,2019-05-14,580
1145491,12/20/2017,12/20/2017,1,12.12,1,2017-12-20,2017-12-20,0
1145521,10/27/2020,9/17/2020,3,25.891,2,2020-10-27,2020-09-17,-40
1145531,2/13/2018,6/12/2018,2,25.294,1,2018-02-13,2018-06-12,119
1145761,1/6/2018,3/20/2018,2,11.844000000000001,2,2018-01-06,2018-03-20,73
114693,5/24/2017,5/24/2017,1,24.299,1,2017-05-24,2017-05-24,0
1146941,3/2/2019,3/2/2019,1,2.567,1,2019-03-02,2019-03-02,0
1146961,11/9/2019,8/21/2019,4,34.258,3,2019-11-09,2019-08-21,-80
1148311,1/23/2018,5/9/2018,46,89.012,6,2018-01-23,2018-05-09,106
1148921,1/13/2018,1/13/2018,1,16.307,1,2018-01-13,2018-01-13,0
1149131,1/18/2019,9/11/2020,22,132.032,7,2019-01-18,2020-09-11,602
1149711,1/26/2018,3/12/2018,3,57.408,3,2018-01-26,2018-03-12,45
1150731,10/13/2017,10/13/2017,1,10.814,1,2017-10-13,2017-10-13,0
1150821,8/16/2018,8/16/2018,1,9.371,1,2018-08-16,2018-08-16,0
1151301,11/15/2017,11/15/2017,1,8.13,1,2017-11-15,2017-11-15,0
1151441,3/22/2019,3/22/2019,1,7.471,1,2019-03-22,2019-03-22,0
115293,1/17/2017,9/6/2016,64,338.531693,6,2017-01-17,2016-09-06,-133
1153071,10/4/2018,10/4/2018,1,4.913,1,2018-10-04,2018-10-04,0
1153641,1/14/2019,7/14/2018,6,21.019,3,2019-01-14,2018-07-14,-184
1153651,3/25/2018,3/25/2018,1,7.005,1,2018-03-25,2018-03-25,0
1155131,2/27/2019,2/27/2019,1,4.71,1,2019-02-27,2019-02-27,0
1155491,1/4/2018,5/9/2018,6,11.761,2,2018-01-04,2018-05-09,125
115553,12/31/2016,12/31/2016,1,2.42,1,2016-12-31,2016-12-31,0
1156211,9/1/2018,9/1/2018,1,4.138,1,2018-09-01,2018-09-01,0
1156251,3/29/2018,3/29/2018,1,6.624,1,2018-03-29,2018-03-29,0
115683,12/26/2017,3/23/2018,2,9.423,2,2017-12-26,2018-03-23,87
1156981,4/7/2018,4/7/2018,1,5.879,1,2018-04-07,2018-04-07,0
1157931,1/14/2019,9/17/2019,5,14.438,3,2019-01-14,2019-09-17,246
1157961,10/16/2017,10/16/2017,1,3.009,1,2017-10-16,2017-10-16,0
1158061,11/30/2018,11/30/2018,1,17.243,1,2018-11-30,2018-11-30,0
115813,10/7/2016,9/20/2018,5,34.419866,3,2016-10-07,2018-09-20,713
1158931,3/14/2018,4/4/2018,2,23.311,2,2018-03-14,2018-04-04,21
1159401,1/7/2020,9/17/2019,3,9.158999999999999,3,2020-01-07,2019-09-17,-112
115943,7/18/2017,7/18/2017,1,0.653,1,2017-07-18,2017-07-18,0
115V,9/19/2017,9/19/2017,1,5.476,1,2017-09-19,2017-09-19,0
1160341,1/25/2018,9/19/2019,20,487.39,5,2018-01-25,2019-09-19,602
1160671,1/16/2019,1/16/2019,1,6.814,1,2019-01-16,2019-01-16,0
1162261,12/14/2019,9/28/2019,6,21.716,4,2019-12-14,2019-09-28,-77
1162451,1/10/2019,9/13/2019,37,195.446,14,2019-01-10,2019-09-13,246
1162801,10/26/2017,2/20/2018,2,34.377,1,2017-10-26,2018-02-20,117
1163171,1/10/2019,9/9/2020,5,12.15,5,2019-01-10,2020-09-09,608
1163211,1/11/2018,8/8/2018,8,56.555,6,2018-01-11,2018-08-08,209
1163321,12/15/2017,7/12/2018,4,12.891,4,2017-12-15,2018-07-12,209
1163341,10/24/2018,10/24/2018,1,3.257,1,2018-10-24,2018-10-24,0
1163461,10/20/2017,10/20/2017,1,13.121,1,2017-10-20,2017-10-20,0
1163541,7/28/2018,9/12/2018,2,9.08,1,2018-07-28,2018-09-12,46
1164191,1/24/2020,1/24/2020,1,8.9,1,2020-01-24,2020-01-24,0
1165081,6/8/2018,6/8/2018,1,4.569,1,2018-06-08,2018-06-08,0
1165281,2/3/2019,9/20/2019,3,40.095,2,2019-02-03,2019-09-20,229
1165691,10/13/2017,10/13/2017,1,2.633,1,2017-10-13,2017-10-13,0
1166,1/18/2019,1/18/2019,1,5.238,1,2019-01-18,2019-01-18,0
1166361,10/16/2017,11/13/2017,2,15.544,2,2017-10-16,2017-11-13,28
1166961,7/27/2018,7/27/2018,1,3.451,1,2018-07-27,2018-07-27,0
1167111,3/9/2018,3/9/2018,1,11.235,1,2018-03-09,2018-03-09,0
1167601,4/7/2018,4/7/2018,1,5.825,1,2018-04-07,2018-04-07,0
1168041,2/18/2018,7/28/2018,3,20.891,1,2018-02-18,2018-07-28,160
1168061,2/29/2020,2/29/2020,1,8.248,1,2020-02-29,2020-02-29,0
1169651,1/11/2020,9/7/2019,90,134.728,17,2020-01-11,2019-09-07,-126
1170541,1/16/2020,7/14/2018,5,19.367,5,2020-01-16,2018-07-14,-551
1170961,12/13/2017,12/13/2017,1,3.524,1,2017-12-13,2017-12-13,0
1171121,1/5/2018,11/21/2017,4,43.251999999999995,4,2018-01-05,2017-11-21,-45
1171131,11/11/2017,11/11/2017,1,7.507,1,2017-11-11,2017-11-11,0
1171281,10/30/2018,10/30/2018,1,4.937,1,2018-10-30,2018-10-30,0
1171511,4/27/2020,5/8/2020,4,29.945999999999998,2,2020-04-27,2020-05-08,11
1172511,3/28/2018,3/28/2018,1,12.054,1,2018-03-28,2018-03-28,0
1173891,1/15/2020,9/8/2019,52,314.532,12,2020-01-15,2019-09-08,-129
1174051,10/22/2017,8/4/2018,2,14.487,2,2017-10-22,2018-08-04,286
1174881,8/25/2018,9/15/2019,2,6.680000000000001,1,2018-08-25,2019-09-15,386
1175091,12/3/2017,12/3/2017,1,6.736,1,2017-12-03,2017-12-03,0
117513,11/24/2018,8/15/2019,5,20.341,4,2018-11-24,2019-08-15,264
1175841,1/19/2020,9/9/2019,82,721.321,10,2020-01-19,2019-09-09,-132
1175971,1/24/2019,3/1/2018,5,31.496000000000002,5,2019-01-24,2018-03-01,-329
1176071,1/20/2018,1/20/2018,1,9.153,1,2018-01-20,2018-01-20,0
1176191,12/1/2017,12/3/2017,2,15.289000000000001,2,2017-12-01,2017-12-03,2
1176701,12/3/2017,2/5/2019,2,10.685,2,2017-12-03,2019-02-05,429
1176861,12/10/2017,12/10/2017,1,9.104,1,2017-12-10,2017-12-10,0
1177281,11/15/2017,3/29/2018,2,4.936999999999999,1,2017-11-15,2018-03-29,134
1177441,1/14/2018,12/31/2017,18,59.662,3,2018-01-14,2017-12-31,-14
1177451,10/5/2018,7/21/2018,3,5.202,2,2018-10-05,2018-07-21,-76
1177991,12/31/2017,12/31/2017,1,3.008,1,2017-12-31,2017-12-31,0
11783,1/21/2017,8/26/2017,10,64.24,4,2017-01-21,2017-08-26,217
1178471,1/30/2020,8/9/2019,2,18.112000000000002,2,2020-01-30,2019-08-09,-174
1178511,11/10/2017,11/10/2017,1,4.569,1,2017-11-10,2017-11-10,0
1178911,10/21/2017,2/18/2018,3,5.943,3,2017-10-21,2018-02-18,120
1179581,1/11/2018,9/5/2018,373,2263.27,10,2018-01-11,2018-09-05,237
1179711,12/30/2017,12/30/2017,1,6.293,1,2017-12-30,2017-12-30,0
117V,7/12/2017,7/12/2017,1,2.898,1,2017-07-12,2017-07-12,0
1180721,1/13/2019,9/29/2018,32,91.771,6,2019-01-13,2018-09-29,-106
1181111,8/25/2019,8/25/2019,1,9.101,1,2019-08-25,2019-08-25,0
1181621,2/19/2018,2/19/2018,1,7.888,1,2018-02-19,2018-02-19,0
1182361,1/19/2019,1/22/2019,2,10.047,2,2019-01-19,2019-01-22,3
1183001,1/11/2018,9/9/2019,164,1144.196,7,2018-01-11,2019-09-09,606
1183201,11/29/2018,11/29/2018,1,2.929,1,2018-11-29,2018-11-29,0
1183881,1/31/2018,8/15/2019,5,29.341,4,2018-01-31,2019-08-15,561
1184311,1/10/2018,9/8/2020,274,2495.36,7,2018-01-10,2020-09-08,972
1184851,1/18/2019,6/5/2019,13,60.322,4,2019-01-18,2019-06-05,138
1184891,12/14/2020,12/17/2020,3,27.233,2,2020-12-14,2020-12-17,3
1184921,7/26/2019,7/26/2019,1,13.541,1,2019-07-26,2019-07-26,0
1185751,10/15/2018,9/27/2018,3,8.153,3,2018-10-15,2018-09-27,-18
118593,4/22/2018,4/22/2018,1,5.276,1,2018-04-22,2018-04-22,0
1186101,12/19/2018,8/9/2019,2,17.823,2,2018-12-19,2019-08-09,233
1186201,5/16/2019,7/25/2020,2,25.651000000000003,2,2019-05-16,2020-07-25,436
1186411,10/28/2020,8/9/2019,3,51.971,3,2020-10-28,2019-08-09,-446
1186421,8/8/2019,8/8/2019,1,1.589,1,2019-08-08,2019-08-08,0
118653,11/18/2018,3/2/2019,3,12.374,3,2018-11-18,2019-03-02,104
1186801,12/19/2019,12/19/2019,1,4.872,1,2019-12-19,2019-12-19,0
118743,3/12/2018,4/29/2019,2,14.149999999999999,2,2018-03-12,2019-04-29,413
1187571,11/28/2017,11/28/2017,1,8.84,1,2017-11-28,2017-11-28,0
1188311,12/9/2018,12/9/2018,1,2.13,1,2018-12-09,2018-12-09,0
1189081,10/18/2017,10/18/2017,1,9.771,1,2017-10-18,2017-10-18,0
1189171,10/18/2017,10/18/2017,1,0.169,1,2017-10-18,2017-10-18,0
1189811,1/10/2020,9/9/2019,81,828.366,14,2020-01-10,2019-09-09,-123
1190571,1/23/2019,9/4/2019,19,137.935,8,2019-01-23,2019-09-04,224
119063,1/1/2017,9/8/2018,73,400.13779,13,2017-01-01,2018-09-08,615
1190631,6/10/2018,8/19/2018,3,9.724,2,2018-06-10,2018-08-19,70
1190921,4/4/2019,4/4/2019,1,13.722,1,2019-04-04,2019-04-04,0
1191221,10/19/2017,10/19/2017,1,9.698,1,2017-10-19,2017-10-19,0
1191271,10/19/2017,10/19/2017,1,0.09,1,2017-10-19,2017-10-19,0
1191601,8/26/2018,8/26/2018,1,3.302,1,2018-08-26,2018-08-26,0
1191771,11/12/2017,9/23/2018,2,21.185,1,2017-11-12,2018-09-23,315
1192091,1/29/2018,2/8/2018,6,15.112,1,2018-01-29,2018-02-08,10
1192281,1/27/2018,9/27/2020,22,158.152,10,2018-01-27,2020-09-27,974
1192721,1/30/2019,9/3/2020,18,167.531,6,2019-01-30,2020-09-03,582
1192981,11/4/2017,11/4/2017,1,1.002,1,2017-11-04,2017-11-04,0
1193101,1/10/2018,11/6/2018,2,7.699,2,2018-01-10,2018-11-06,300
1193131,11/5/2017,12/2/2017,2,22.865000000000002,2,2017-11-05,2017-12-02,27
119463,10/11/2017,9/7/2017,25,112.030737,7,2017-10-11,2017-09-07,-34
1194851,1/13/2020,9/12/2019,10,122.373,4,2020-01-13,2019-09-12,-123
11963,1/12/2019,9/15/2019,19,66.799717,9,2019-01-12,2019-09-15,246
1196491,1/1/2018,9/29/2019,150,567.942,20,2018-01-01,2019-09-29,636
1196591,6/24/2019,6/24/2019,1,2.458,1,2019-06-24,2019-06-24,0
1197521,10/20/2017,10/21/2017,2,20.775,1,2017-10-20,2017-10-21,1
1197831,12/26/2017,12/26/2017,1,7.257,1,2017-12-26,2017-12-26,0
1198251,10/7/2018,10/7/2018,1,13.302,1,2018-10-07,2018-10-07,0
1198261,12/23/2017,3/16/2019,2,15.266,2,2017-12-23,2019-03-16,448
1198411,12/20/2018,12/20/2018,1,12.868,1,2018-12-20,2018-12-20,0
119863,1/10/2017,9/9/2016,208,441.414578,8,2017-01-10,2016-09-09,-123
1199841,1/4/2019,9/18/2018,12,130.843,4,2019-01-04,2018-09-18,-108
1199881,5/26/2018,5/26/2018,1,7.052,1,2018-05-26,2018-05-26,0
1200071,1/18/2018,8/3/2019,14,114.469,7,2018-01-18,2019-08-03,562
1200511,10/21/2017,11/25/2017,5,16.316,5,2017-10-21,2017-11-25,35
1200911,10/21/2017,10/21/2017,1,0.569,1,2017-10-21,2017-10-21,0
120123,1/4/2019,9/25/2017,21,45.909649,8,2019-01-04,2017-09-25,-466
1201571,10/22/2019,9/29/2019,21,463.38,7,2019-10-22,2019-09-29,-23
1201961,1/13/2019,9/29/2019,38,186.058,7,2019-01-13,2019-09-29,259
120233,9/23/2019,9/23/2019,1,2.608,1,2019-09-23,2019-09-23,0
120243,4/29/2018,4/29/2018,1,8.793,1,2018-04-29,2018-04-29,0
1202821,9/5/2019,9/5/2019,1,5.046,1,2019-09-05,2019-09-05,0
1203271,6/18/2018,6/18/2018,1,5.549,1,2018-06-18,2018-06-18,0
1203341,1/2/2020,9/17/2019,4,44.908,2,2020-01-02,2019-09-17,-107
1204451,1/28/2018,5/28/2018,4,15.312,4,2018-01-28,2018-05-28,120
1204841,11/30/2018,11/30/2018,1,4.333,1,2018-11-30,2018-11-30,0
1205801,1/25/2019,9/5/2018,33,293.079,8,2019-01-25,2018-09-05,-142
1205841,7/26/2018,7/26/2018,1,10.918,1,2018-07-26,2018-07-26,0
1206031,10/26/2017,5/23/2018,2,10.062999999999999,2,2017-10-26,2018-05-23,209
1206561,4/19/2019,7/11/2018,2,18.239,2,2019-04-19,2018-07-11,-282
1206911,10/25/2017,6/7/2019,2,14.274,2,2017-10-25,2019-06-07,590
1207811,1/28/2018,8/13/2020,10,38.164,5,2018-01-28,2020-08-13,928
120803,8/3/2017,8/3/2017,1,1.561,1,2017-08-03,2017-08-03,0
1208561,1/7/2019,12/20/2018,2,5.481,2,2019-01-07,2018-12-20,-18
1209171,11/25/2018,9/29/2018,3,9.981,3,2018-11-25,2018-09-29,-57
1210201,12/17/2019,12/17/2019,1,6.38,1,2019-12-17,2019-12-17,0
1210321,1/25/2018,6/9/2018,4,19.299,2,2018-01-25,2018-06-09,135
1210981,10/14/2018,2/24/2018,2,10.096,2,2018-10-14,2018-02-24,-232
1211871,12/21/2020,12/21/2020,1,4.276,1,2020-12-21,2020-12-21,0
12123,1/16/2020,8/29/2018,12,42.648,6,2020-01-16,2018-08-29,-505
1213091,1/31/2018,4/13/2018,7,74.572,3,2018-01-31,2018-04-13,72
1213551,10/27/2017,11/8/2017,2,18.241,2,2017-10-27,2017-11-08,12
1213801,12/5/2019,3/2/2020,3,34.724,2,2019-12-05,2020-03-02,88
1214121,1/1/2018,9/9/2019,156,4182.135,8,2018-01-01,2019-09-09,616
121473,4/9/2018,4/9/2018,1,6.531,1,2018-04-09,2018-04-09,0
1214931,1/22/2019,9/19/2018,16,107.261,7,2019-01-22,2018-09-19,-125
1216021,10/11/2018,10/11/2018,1,8.037,1,2018-10-11,2018-10-11,0
1216251,7/10/2018,7/10/2018,1,11.289,1,2018-07-10,2018-07-10,0
1216371,10/26/2017,10/29/2017,3,33.812,2,2017-10-26,2017-10-29,3
121703,9/26/2017,9/26/2017,1,11.501,1,2017-09-26,2017-09-26,0
121763,1/24/2018,8/31/2020,6,52.836,5,2018-01-24,2020-08-31,950
121843,10/12/2017,10/12/2017,1,3.813,1,2017-10-12,2017-10-12,0
1218951,10/25/2017,10/25/2017,1,8.888,1,2017-10-25,2017-10-25,0
12193,12/6/2018,6/11/2019,5,19.337,3,2018-12-06,2019-06-11,187
1219311,12/11/2019,12/11/2019,1,18.798,1,2019-12-11,2019-12-11,0
121933,1/19/2017,9/8/2018,61,774.574764,7,2017-01-19,2018-09-08,597
1220031,9/28/2019,9/28/2019,1,15.702,1,2019-09-28,2019-09-28,0
1220231,11/21/2017,5/4/2018,3,10.376999999999999,2,2017-11-21,2018-05-04,164
122043,1/17/2020,9/1/2017,15,71.937916,9,2020-01-17,2017-09-01,-868
1220511,11/5/2017,11/5/2017,1,9.778,1,2017-11-05,2017-11-05,0
1220571,2/26/2020,3/9/2020,11,107.919,5,2020-02-26,2020-03-09,12
122063,5/25/2019,5/25/2019,1,3.481,1,2019-05-25,2019-05-25,0
1220731,1/31/2018,1/31/2018,1,38.744,1,2018-01-31,2018-01-31,0
122113,6/11/2017,6/11/2017,1,2.687,1,2017-06-11,2017-06-11,0
1222691,10/14/2019,9/26/2019,8,17.143,5,2019-10-14,2019-09-26,-18
1223531,4/11/2018,4/11/2018,1,9.748,1,2018-04-11,2018-04-11,0
1223611,5/24/2018,5/24/2018,1,7.645,1,2018-05-24,2018-05-24,0
1223841,12/14/2017,12/14/2017,1,2.843,1,2017-12-14,2017-12-14,0
1224401,11/7/2017,12/20/2018,2,7.444,2,2017-11-07,2018-12-20,408
1224651,1/29/2018,1/29/2018,1,15.025,1,2018-01-29,2018-01-29,0
1224891,10/28/2018,9/14/2018,3,13.245,3,2018-10-28,2018-09-14,-44
122533,5/26/2017,5/26/2017,1,4.115,1,2017-05-26,2017-05-26,0
1225691,10/16/2019,4/27/2018,4,46.886,3,2019-10-16,2018-04-27,-537
1225801,12/15/2017,12/15/2017,1,2.892,1,2017-12-15,2017-12-15,0
122643,1/27/2019,5/10/2019,2,40.945,2,2019-01-27,2019-05-10,103
1226441,10/27/2017,10/27/2017,1,2.869,1,2017-10-27,2017-10-27,0
1227721,7/11/2019,8/8/2019,3,27.299,3,2019-07-11,2019-08-08,28
1227771,1/19/2018,2/8/2018,2,12.491,2,2018-01-19,2018-02-08,20
122783,1/28/2018,8/30/2019,27,257.624,16,2018-01-28,2019-08-30,579
1228711,2/19/2019,2/19/2019,1,13.38,1,2019-02-19,2019-02-19,0
1229301,11/24/2019,5/5/2019,5,42.958,4,2019-11-24,2019-05-05,-203
122973,1/3/2017,3/15/2018,4,21.092,3,2017-01-03,2018-03-15,436
1229791,1/22/2020,9/26/2020,17,108.014,9,2020-01-22,2020-09-26,248
123003,10/4/2019,12/14/2016,2,5.886,2,2019-10-04,2016-12-14,-1024
123073,10/29/2019,6/21/2018,4,76.312,3,2019-10-29,2018-06-21,-495
1231041,11/23/2017,11/23/2017,1,12.719,1,2017-11-23,2017-11-23,0
123113,4/1/2018,4/1/2018,1,3.696,1,2018-04-01,2018-04-01,0
1232121,10/15/2019,2/27/2020,3,16.95,3,2019-10-15,2020-02-27,135
123213,9/22/2019,9/22/2019,1,10.775,1,2019-09-22,2019-09-22,0
1232541,1/12/2019,1/12/2019,1,8.246,1,2019-01-12,2019-01-12,0
1232741,7/20/2018,7/20/2018,1,7.333,1,2018-07-20,2018-07-20,0
1233901,1/17/2020,10/2/2019,2,16.856,2,2020-01-17,2019-10-02,-107
123393,5/3/2019,5/3/2019,1,2.396,1,2019-05-03,2019-05-03,0
123403,11/22/2016,7/25/2019,3,24.231,2,2016-11-22,2019-07-25,975
123443,10/15/2017,5/15/2017,3,10.846,2,2017-10-15,2017-05-15,-153
1235191,3/15/2018,3/15/2018,1,5.066,1,2018-03-15,2018-03-15,0
1236241,11/18/2017,7/19/2018,8,39.122,6,2017-11-18,2018-07-19,243
1236871,9/3/2018,9/3/2018,1,4.538,1,2018-09-03,2018-09-03,0
1236971,1/17/2020,1/17/2020,1,11.131,1,2020-01-17,2020-01-17,0
1237841,3/2/2019,3/2/2019,1,1.985,1,2019-03-02,2019-03-02,0
1238,11/28/2016,11/28/2016,1,1.938,1,2016-11-28,2016-11-28,0
1238601,11/15/2018,8/22/2018,4,58.029,2,2018-11-15,2018-08-22,-85
1239841,12/16/2018,9/25/2019,5,27.675,1,2018-12-16,2019-09-25,283
1240351,5/3/2019,5/3/2019,1,26.1,1,2019-05-03,2019-05-03,0
1240551,1/6/2019,11/5/2017,2,7.0200000000000005,2,2019-01-06,2017-11-05,-427
1241041,1/5/2018,2/3/2018,4,24.886,2,2018-01-05,2018-02-03,29
1241051,4/5/2018,4/5/2018,1,5.637,1,2018-04-05,2018-04-05,0
1241461,4/16/2019,4/16/2019,1,0.692,1,2019-04-16,2019-04-16,0
1242271,1/9/2018,8/26/2018,3,30.329,3,2018-01-09,2018-08-26,229
1244151,10/28/2018,9/23/2018,15,75.405,8,2018-10-28,2018-09-23,-35
1245511,2/10/2018,2/9/2018,2,16.805,2,2018-02-10,2018-02-09,-1
1245721,6/25/2019,6/25/2019,1,3.048,1,2019-06-25,2019-06-25,0
1246531,4/6/2019,4/6/2019,1,11.428,1,2019-04-06,2019-04-06,0
1246661,11/13/2018,11/13/2018,1,6.143,1,2018-11-13,2018-11-13,0
1247381,3/23/2019,3/23/2019,1,18.908,1,2019-03-23,2019-03-23,0
1247601,5/22/2019,5/22/2019,1,3.995,1,2019-05-22,2019-05-22,0
12483,1/30/2018,9/28/2018,7,25.926000000000002,6,2018-01-30,2018-09-28,241
1249011,11/1/2019,2/11/2018,2,15.114,2,2019-11-01,2018-02-11,-628
1249241,2/18/2019,2/18/2019,1,9.471,1,2019-02-18,2019-02-18,0
1250051,12/2/2017,7/25/2018,4,15.991999999999999,2,2017-12-02,2018-07-25,235
1250311,10/20/2018,10/20/2018,1,27.759999999999998,1,2018-10-20,2018-10-20,0
1250981,12/12/2018,12/12/2018,1,5.043,1,2018-12-12,2018-12-12,0
1250991,1/11/2019,9/18/2018,17,95.075,9,2019-01-11,2018-09-18,-115
1251071,10/30/2020,10/30/2020,1,7.952,1,2020-10-30,2020-10-30,0
1251731,12/31/2018,4/28/2019,2,13.123999999999999,2,2018-12-31,2019-04-28,118
1253561,1/10/2018,3/9/2018,67,764.224,5,2018-01-10,2018-03-09,58
1253681,2/16/2019,2/16/2019,1,4.068,1,2019-02-16,2019-02-16,0
1254521,11/12/2017,3/20/2019,4,26.157,4,2017-11-12,2019-03-20,493
1254871,11/2/2017,11/2/2017,1,5.971,1,2017-11-02,2017-11-02,0
1255461,1/6/2019,1/6/2019,1,3.155,1,2019-01-06,2019-01-06,0
1256281,7/25/2020,9/19/2020,2,42.989000000000004,2,2020-07-25,2020-09-19,56
1256581,11/3/2019,11/9/2019,2,17.892000000000003,1,2019-11-03,2019-11-09,6
1256671,1/10/2019,9/7/2018,118,1217.425,4,2019-01-10,2018-09-07,-125
1256851,11/1/2019,11/1/2019,1,4.472,1,2019-11-01,2019-11-01,0
1257131,11/11/2017,11/5/2017,3,12.597,2,2017-11-11,2017-11-05,-6
1258681,3/16/2018,5/5/2019,2,22.901,2,2018-03-16,2019-05-05,415
1259071,1/11/2019,8/3/2018,52,622.268,15,2019-01-11,2018-08-03,-161
1259691,8/16/2019,8/16/2019,1,1.34,1,2019-08-16,2019-08-16,0
1259861,12/16/2018,4/28/2018,2,11.829999999999998,2,2018-12-16,2018-04-28,-232
1259901,11/24/2020,11/24/2020,1,9.366,1,2020-11-24,2020-11-24,0
1260661,11/24/2018,4/6/2018,4,29.059,4,2018-11-24,2018-04-06,-232
1261121,11/10/2017,11/4/2017,2,16.363,2,2017-11-10,2017-11-04,-6
1261211,1/18/2020,8/1/2020,9,52.696,4,2020-01-18,2020-08-01,196
126133,10/10/2016,9/8/2016,9,64.410089,2,2016-10-10,2016-09-08,-32
1261681,1/16/2019,8/20/2019,38,611.024,5,2019-01-16,2019-08-20,216
1261791,11/22/2017,11/22/2017,1,3.414,1,2017-11-22,2017-11-22,0
1262051,11/10/2018,4/28/2019,3,3.42,1,2018-11-10,2019-04-28,169
1262451,11/15/2019,9/25/2019,3,13.225000000000001,3,2019-11-15,2019-09-25,-51
1263121,12/18/2018,6/11/2018,2,3.2880000000000003,2,2018-12-18,2018-06-11,-190
1263481,1/30/2019,1/30/2019,1,6.053,1,2019-01-30,2019-01-30,0
1263541,1/16/2018,2/1/2018,33,605.894,3,2018-01-16,2018-02-01,16
126381,10/15/2016,10/15/2016,1,3.064601,1,2016-10-15,2016-10-15,0
1264081,3/7/2020,3/7/2020,1,8.671,1,2020-03-07,2020-03-07,0
1264351,12/7/2017,12/7/2017,1,3.091,1,2017-12-07,2017-12-07,0
126487,3/1/2017,3/1/2017,1,2.706,1,2017-03-01,2017-03-01,0
126575,1/10/2018,9/8/2016,390,3126.002812,3,2018-01-10,2016-09-08,-489
126657,12/11/2016,12/11/2016,1,2.731,1,2016-12-11,2016-12-11,0
1266691,4/15/2018,4/22/2018,2,5.205,2,2018-04-15,2018-04-22,7
1266801,10/6/2019,10/6/2019,1,0.889,1,2019-10-06,2019-10-06,0
1267191,1/1/2019,1/1/2019,1,4.449,1,2019-01-01,2019-01-01,0
1267531,11/5/2017,11/5/2017,1,8.314,1,2017-11-05,2017-11-05,0
1267651,11/7/2020,11/7/2020,1,1.514,1,2020-11-07,2020-11-07,0
126769,12/18/2018,12/18/2018,1,4.989,1,2018-12-18,2018-12-18,0
126779,10/29/2016,9/3/2016,11,23.41863,8,2016-10-29,2016-09-03,-56
1268631,3/5/2019,3/5/2019,1,6.186,1,2019-03-05,2019-03-05,0
1269021,12/2/2019,12/2/2019,1,9.392,1,2019-12-02,2019-12-02,0
126943,1/26/2017,1/26/2017,1,8.961,1,2017-01-26,2017-01-26,0
126945,12/21/2018,12/21/2018,1,14.804,1,2018-12-21,2018-12-21,0
1269461,1/21/2018,10/10/2018,2,11.446,2,2018-01-21,2018-10-10,262
126959,1/19/2018,1/19/2018,1,7.515,1,2018-01-19,2018-01-19,0
1269761,2/7/2019,8/26/2018,3,32.366,1,2019-02-07,2018-08-26,-165
127031,3/30/2019,3/30/2019,1,6.639,1,2019-03-30,2019-03-30,0
1270641,4/8/2018,4/8/2018,1,11.856,1,2018-04-08,2018-04-08,0
1271251,10/25/2018,2/24/2019,3,25.508000000000003,3,2018-10-25,2019-02-24,122
127151,11/29/2018,11/29/2018,1,6.301,1,2018-11-29,2018-11-29,0
1272001,10/25/2019,11/20/2019,2,30.69,2,2019-10-25,2019-11-20,26
1272501,1/9/2019,8/27/2018,10,52.179,4,2019-01-09,2018-08-27,-135
1272661,12/22/2017,12/22/2017,1,1.763,1,2017-12-22,2017-12-22,0
1273261,1/11/2019,9/8/2018,8,59.281,5,2019-01-11,2018-09-08,-125
127371,10/4/2016,10/4/2016,1,3.682049,1,2016-10-04,2016-10-04,0
1273741,1/19/2018,1/19/2018,1,9.742,1,2018-01-19,2018-01-19,0
127397,1/21/2017,9/24/2016,46,52.359446,12,2017-01-21,2016-09-24,-119
1274091,11/15/2019,11/18/2017,2,6.605,2,2019-11-15,2017-11-18,-727
127429,10/6/2017,5/3/2018,3,15.109,2,2017-10-06,2018-05-03,209
12743,1/6/2018,5/18/2017,2,4.611000000000001,1,2018-01-06,2017-05-18,-233
1274811,7/10/2019,7/10/2019,1,8.428,1,2019-07-10,2019-07-10,0
1275011,6/1/2018,6/1/2018,1,6.513,1,2018-06-01,2018-06-01,0
127515,6/21/2018,6/21/2018,1,0.503,1,2018-06-21,2018-06-21,0
1275181,2/16/2019,2/16/2019,1,1.781,1,2019-02-16,2019-02-16,0
1275411,11/16/2017,4/25/2018,4,24.988999999999997,2,2017-11-16,2018-04-25,160
127547,1/12/2019,7/27/2017,34,281.601,8,2019-01-12,2017-07-27,-534
1275781,1/20/2020,9/7/2020,13,68.05,5,2020-01-20,2020-09-07,231
127731,7/27/2017,7/27/2017,1,6.735,1,2017-07-27,2017-07-27,0
1277351,2/1/2019,2/1/2019,1,5.588,1,2019-02-01,2019-02-01,0
1277701,11/7/2017,11/7/2017,1,17.393,1,2017-11-07,2017-11-07,0
1277751,12/15/2018,5/13/2019,2,31.311999999999998,2,2018-12-15,2019-05-13,149
127855,10/11/2018,7/12/2018,26,233.212,3,2018-10-11,2018-07-12,-91
127861,1/31/2020,3/22/2017,4,76.63300000000001,2,2020-01-31,2017-03-22,-1045
1278781,5/17/2019,9/25/2020,6,6.317,3,2019-05-17,2020-09-25,497
1278881,1/18/2019,7/13/2018,10,237.449,6,2019-01-18,2018-07-13,-189
1279061,12/19/2017,12/19/2017,1,5.422,1,2017-12-19,2017-12-19,0
1279581,12/20/2018,12/20/2018,1,5.798,1,2018-12-20,2018-12-20,0
1279681,11/10/2017,9/7/2019,4,15.179,3,2017-11-10,2019-09-07,666
1279731,8/1/2019,8/1/2019,1,3.713,1,2019-08-01,2019-08-01,0
127977,5/10/2018,5/10/2018,1,7.024,1,2018-05-10,2018-05-10,0
128023,11/7/2017,2/23/2018,2,9.636,2,2017-11-07,2018-02-23,108
1280301,1/12/2019,6/22/2018,3,17.201,3,2019-01-12,2018-06-22,-204
1280711,7/3/2018,7/3/2018,1,3.407,1,2018-07-03,2018-07-03,0
128077,6/2/2018,6/2/2018,1,0.072,1,2018-06-02,2018-06-02,0
1280981,10/14/2018,6/8/2018,4,19.23,4,2018-10-14,2018-06-08,-128
128105,6/15/2018,6/15/2018,1,3.926,1,2018-06-15,2018-06-15,0
128121,1/19/2019,9/28/2019,8,29.044999999999998,4,2019-01-19,2019-09-28,252
128141,7/21/2018,7/21/2018,1,5.907,1,2018-07-21,2018-07-21,0
1281471,6/28/2018,6/28/2018,1,19.714,1,2018-06-28,2018-06-28,0
1281731,4/3/2018,4/3/2018,1,12.255,1,2018-04-03,2018-04-03,0
1282331,11/24/2018,7/13/2018,3,26.154,3,2018-11-24,2018-07-13,-134
1282441,7/14/2019,7/14/2019,1,4.178,1,2019-07-14,2019-07-14,0
128279,1/10/2017,9/9/2016,271,3848.433523,17,2017-01-10,2016-09-09,-123
1282991,3/22/2019,4/1/2019,2,23.423000000000002,2,2019-03-22,2019-04-01,10
128313,4/26/2018,5/23/2018,2,9.326,1,2018-04-26,2018-05-23,27
1283351,11/6/2018,11/6/2018,1,0.33,1,2018-11-06,2018-11-06,0
1283431,12/31/2017,12/31/2017,1,4.741,1,2017-12-31,2017-12-31,0
1283691,11/17/2017,12/3/2017,2,21.569000000000003,2,2017-11-17,2017-12-03,16
128443,3/27/2018,3/27/2018,1,15.788,1,2018-03-27,2018-03-27,0
1285131,8/16/2019,8/16/2019,1,7.699,1,2019-08-16,2019-08-16,0
1285161,10/13/2019,10/13/2019,1,4.988,1,2019-10-13,2019-10-13,0
128557,10/6/2016,8/28/2017,7,31.642218,5,2016-10-06,2017-08-28,326
128559,2/9/2019,3/17/2017,2,8.581,2,2019-02-09,2017-03-17,-694
1285741,11/15/2019,11/15/2019,1,8.819,1,2019-11-15,2019-11-15,0
1286421,1/17/2018,9/3/2018,50,270.457,3,2018-01-17,2018-09-03,229
1286801,11/30/2017,5/10/2018,5,29.82,4,2017-11-30,2018-05-10,161
128697,6/2/2018,6/2/2018,1,29.983,1,2018-06-02,2018-06-02,0
1287681,3/25/2018,7/16/2019,2,22.778,2,2018-03-25,2019-07-16,478
128777,11/16/2017,11/17/2017,2,22.765,2,2017-11-16,2017-11-17,1
128827,10/10/2017,9/21/2016,6,15.021717,4,2017-10-10,2016-09-21,-384
1288761,1/12/2018,12/26/2017,10,47.661,7,2018-01-12,2017-12-26,-17
128903,12/28/2019,12/28/2019,1,8.234,1,2019-12-28,2019-12-28,0
1289401,11/29/2018,8/2/2019,5,21.152,4,2018-11-29,2019-08-02,246
1289561,11/10/2017,11/10/2017,1,2.718,1,2017-11-10,2017-11-10,0
1289971,11/10/2017,6/29/2018,2,15.759,2,2017-11-10,2018-06-29,231
1289981,9/6/2018,9/6/2018,1,7.435,1,2018-09-06,2018-09-06,0
1289991,9/22/2018,9/22/2018,1,14.86,1,2018-09-22,2018-09-22,0
129009,10/13/2017,6/13/2018,5,42.923,5,2017-10-13,2018-06-13,243
1290411,7/11/2020,8/6/2020,3,16.254,2,2020-07-11,2020-08-06,26
1290551,2/18/2018,7/4/2018,5,79.784,3,2018-02-18,2018-07-04,136
129069,2/22/2017,7/4/2017,5,39.136,4,2017-02-22,2017-07-04,132
12913,2/9/2017,2/9/2017,1,6.039,1,2017-02-09,2017-02-09,0
1292061,5/3/2019,5/3/2019,1,7.955,1,2019-05-03,2019-05-03,0
1292411,11/25/2017,11/25/2017,1,5.223,1,2017-11-25,2017-11-25,0
1292451,1/15/2018,12/27/2019,3,32.528,3,2018-01-15,2019-12-27,711
1294361,10/15/2018,9/27/2018,12,21.194,6,2018-10-15,2018-09-27,-18
1294541,2/10/2019,2/10/2019,1,23.251,1,2019-02-10,2019-02-10,0
129501,5/28/2017,5/28/2017,1,3.93,1,2017-05-28,2017-05-28,0
129525,9/21/2017,9/21/2017,1,15.283,1,2017-09-21,2017-09-21,0
1295551,10/10/2020,8/9/2020,3,19.152,2,2020-10-10,2020-08-09,-62
1295561,1/13/2018,8/17/2019,5,19.054,4,2018-01-13,2019-08-17,581
1295651,3/22/2019,3/22/2019,1,4.497,1,2019-03-22,2019-03-22,0
129579,1/25/2018,2/7/2018,3,28.749000000000002,2,2018-01-25,2018-02-07,13
129585,4/25/2019,9/25/2016,4,25.441757,4,2019-04-25,2016-09-25,-942
129601,3/11/2017,9/30/2019,2,11.232,2,2017-03-11,2019-09-30,933
129609,1/13/2017,9/5/2017,101,1133.958089,5,2017-01-13,2017-09-05,235
129635,12/11/2019,9/8/2017,2,32.455000000000005,2,2019-12-11,2017-09-08,-824
129705,11/22/2016,8/2/2016,3,9.642697,3,2016-11-22,2016-08-02,-112
129723,1/14/2017,8/29/2017,11,45.808,6,2017-01-14,2017-08-29,227
1297431,8/12/2018,8/12/2018,1,5.741,1,2018-08-12,2018-08-12,0
129797,8/12/2016,8/12/2016,1,3.592432,1,2016-08-12,2016-08-12,0
1298001,1/3/2018,8/17/2018,16,96.227,4,2018-01-03,2018-08-17,226
1298181,12/19/2017,2/22/2018,3,17.656,1,2017-12-19,2018-02-22,65
1298381,2/2/2018,2/2/2018,1,3.095,1,2018-02-02,2018-02-02,0
1298791,12/17/2018,7/16/2019,3,39.938,3,2018-12-17,2019-07-16,211
1298891,11/4/2018,11/4/2018,1,2.731,1,2018-11-04,2018-11-04,0
129903,10/28/2018,10/28/2018,1,2.844,1,2018-10-28,2018-10-28,0
1299151,12/14/2017,12/14/2017,1,16.206,1,2017-12-14,2017-12-14,0
129919,6/23/2018,6/23/2018,1,5.596,1,2018-06-23,2018-06-23,0
129925,11/22/2019,11/22/2019,1,12.504,1,2019-11-22,2019-11-22,0
129937,1/10/2017,9/29/2017,246,2024.895,16,2017-01-10,2017-09-29,262
1299591,8/16/2018,8/16/2018,1,7.527,1,2018-08-16,2018-08-16,0
129969,12/1/2018,12/29/2018,2,20.68,1,2018-12-01,2018-12-29,28
129999,10/5/2017,8/31/2017,4,28.7,2,2017-10-05,2017-08-31,-35
130055,3/13/2019,3/13/2019,1,8.493,1,2019-03-13,2019-03-13,0
1300611,1/2/2019,9/5/2018,127,831.461,10,2019-01-02,2018-09-05,-119
130067,12/16/2019,12/16/2019,1,1.552,1,2019-12-16,2019-12-16,0
1300691,1/10/2018,2/19/2018,2,10.055,2,2018-01-10,2018-02-19,40
1300761,6/1/2019,6/1/2019,2,20.206,2,2019-06-01,2019-06-01,0
130091,12/6/2016,9/3/2016,4,46.63508,4,2016-12-06,2016-09-03,-94
130099,9/7/2018,9/7/2018,1,2.234,1,2018-09-07,2018-09-07,0
130113,10/17/2018,10/17/2018,1,8.935,1,2018-10-17,2018-10-17,0
130193,10/27/2019,10/27/2019,1,8.14,1,2019-10-27,2019-10-27,0
1302391,11/25/2017,11/25/2017,1,2.859,1,2017-11-25,2017-11-25,0
1302551,1/12/2018,3/6/2018,5,59.207,4,2018-01-12,2018-03-06,53
130301,6/8/2019,6/8/2019,1,5.742,1,2019-06-08,2019-06-08,0
1303341,11/13/2017,11/13/2017,1,6.757,1,2017-11-13,2017-11-13,0
1303551,11/29/2017,12/22/2017,6,85.007,3,2017-11-29,2017-12-22,23
130391,4/22/2017,4/22/2017,1,1.085,1,2017-04-22,2017-04-22,0
1304261,4/22/2018,4/22/2018,1,6.88,1,2018-04-22,2018-04-22,0
1304311,1/19/2019,9/19/2019,10,48.259,8,2019-01-19,2019-09-19,243
1304721,10/23/2018,2/10/2019,3,13.812,3,2018-10-23,2019-02-10,110
130491,1/25/2019,8/25/2018,30,223.321,7,2019-01-25,2018-08-25,-153
130503,10/10/2017,9/19/2017,8,44.665,3,2017-10-10,2017-09-19,-21
1305041,12/1/2017,8/13/2019,2,23.372,2,2017-12-01,2019-08-13,620
1305261,3/30/2019,3/30/2019,1,1.728,1,2019-03-30,2019-03-30,0
1305291,2/13/2018,2/13/2018,1,13.801,1,2018-02-13,2018-02-13,0
130531,10/12/2017,9/6/2019,11,24.726,7,2017-10-12,2019-09-06,694
130533,1/20/2018,9/9/2019,78,800.358,5,2018-01-20,2019-09-09,597
1305341,6/28/2018,6/28/2018,1,5.526,1,2018-06-28,2018-06-28,0
1305361,10/13/2018,8/26/2020,2,18.268,2,2018-10-13,2020-08-26,683
130551,1/17/2020,6/2/2018,4,19.772000000000002,4,2020-01-17,2018-06-02,-594
130571,6/16/2018,6/16/2018,1,4.465,1,2018-06-16,2018-06-16,0
1306481,3/24/2018,3/24/2018,1,7.287,1,2018-03-24,2018-03-24,0
130669,6/15/2017,7/25/2019,3,16.222,2,2017-06-15,2019-07-25,770
1306711,6/12/2018,6/12/2018,1,10.965,1,2018-06-12,2018-06-12,0
1306901,8/25/2019,8/25/2019,1,9.02,1,2019-08-25,2019-08-25,0
130697,12/18/2016,12/18/2016,1,0.464,1,2016-12-18,2016-12-18,0
130711,1/1/2017,9/9/2016,148,2136.484636,9,2017-01-01,2016-09-09,-114
1307431,11/4/2018,11/4/2018,1,14.993,1,2018-11-04,2018-11-04,0
1307711,1/8/2019,1/8/2019,1,5.363,1,2019-01-08,2019-01-08,0
1307731,3/23/2018,3/23/2018,1,4.698,1,2018-03-23,2018-03-23,0
130789,10/26/2016,10/26/2016,1,2.634139,1,2016-10-26,2016-10-26,0
130829,10/13/2016,9/7/2020,9,64.735804,6,2016-10-13,2020-09-07,1425
1308531,5/5/2018,5/5/2018,1,6.819,1,2018-05-05,2018-05-05,0
1308901,11/14/2017,11/14/2017,1,20.398,1,2017-11-14,2017-11-14,0
1309031,11/28/2018,11/28/2018,1,11.184,1,2018-11-28,2018-11-28,0
1309331,1/14/2018,2/3/2018,2,5.628,1,2018-01-14,2018-02-03,20
1309651,2/16/2019,2/16/2019,1,4.345,1,2019-02-16,2019-02-16,0
1309671,5/4/2019,7/13/2019,2,20.2,1,2019-05-04,2019-07-13,70
1309991,7/31/2019,8/2/2019,2,16.995,2,2019-07-31,2019-08-02,2
13103,6/25/2018,6/25/2018,1,6.743,1,2018-06-25,2018-06-25,0
131055,7/8/2018,7/8/2018,1,9.238,1,2018-07-08,2018-07-08,0
131133,7/10/2017,8/19/2017,2,4.975,2,2017-07-10,2017-08-19,40
1311431,7/26/2019,7/26/2019,1,3.306,1,2019-07-26,2019-07-26,0
131207,12/4/2017,4/26/2017,4,31.808,4,2017-12-04,2017-04-26,-222
131215,10/5/2016,8/25/2019,2,2.326885,2,2016-10-05,2019-08-25,1054
131263,10/4/2018,9/23/2018,2,19.529,2,2018-10-04,2018-09-23,-11
1313151,4/19/2018,4/19/2018,1,13.006,1,2018-04-19,2018-04-19,0
131323,1/5/2020,3/1/2019,3,2.193,3,2020-01-05,2019-03-01,-310
131351,4/11/2017,4/11/2017,1,1.05,1,2017-04-11,2017-04-11,0
131363,12/28/2017,8/9/2017,2,19.286,2,2017-12-28,2017-08-09,-141
1313761,3/18/2018,9/30/2018,11,58.447,3,2018-03-18,2018-09-30,196
1313791,11/3/2018,4/27/2019,3,19.62,2,2018-11-03,2019-04-27,175
131391,1/28/2020,1/28/2020,1,0.823,1,2020-01-28,2020-01-28,0
131397,11/6/2016,4/14/2018,2,13.521,1,2016-11-06,2018-04-14,524
131439,11/20/2018,9/23/2019,2,13.642,2,2018-11-20,2019-09-23,307
1314651,10/21/2018,10/29/2018,2,18.664,1,2018-10-21,2018-10-29,8
1314801,10/26/2019,3/8/2018,2,17.254,2,2019-10-26,2018-03-08,-597
1314961,1/17/2020,1/17/2020,1,5.378,1,2020-01-17,2020-01-17,0
1315751,1/25/2019,3/29/2018,2,13.82,2,2019-01-25,2018-03-29,-302
131585,12/6/2017,12/6/2017,1,3.913,1,2017-12-06,2017-12-06,0
1316971,1/17/2020,8/28/2020,11,27.482,6,2020-01-17,2020-08-28,224
131759,1/9/2018,1/9/2018,1,28.962,1,2018-01-09,2018-01-09,0
1317591,1/12/2020,12/9/2017,3,20.080000000000002,2,2020-01-12,2017-12-09,-764
131943,10/2/2018,6/27/2019,2,26.377000000000002,2,2018-10-02,2019-06-27,268
1319681,10/13/2019,10/13/2019,1,7.168,1,2019-10-13,2019-10-13,0
1319961,12/11/2017,2/2/2018,4,50.948,3,2017-12-11,2018-02-02,53
1319991,11/17/2017,11/17/2017,1,3.305,1,2017-11-17,2017-11-17,0
1320351,12/12/2019,2/21/2020,3,35.325,2,2019-12-12,2020-02-21,71
132077,10/21/2017,12/29/2017,2,12.879999999999999,2,2017-10-21,2017-12-29,69
1320851,4/13/2019,4/15/2018,2,4.613,2,2019-04-13,2018-04-15,-363
1321731,11/19/2017,12/5/2017,5,21.468,4,2017-11-19,2017-12-05,16
132177,1/26/2017,4/17/2019,5,28.622,5,2017-01-26,2019-04-17,811
132303,1/13/2019,2/4/2019,2,16.622999999999998,2,2019-01-13,2019-02-04,22
132347,10/24/2017,10/24/2017,1,0.614,1,2017-10-24,2017-10-24,0
1323531,1/14/2018,9/29/2018,9,31.021,8,2018-01-14,2018-09-29,258
132477,5/25/2018,5/25/2018,1,13.038,1,2018-05-25,2018-05-25,0
1324971,11/18/2017,11/18/2017,1,2.933,1,2017-11-18,2017-11-18,0
132517,3/29/2019,6/5/2019,2,2.439,1,2019-03-29,2019-06-05,68
132545,12/2/2016,12/2/2016,1,5.654,1,2016-12-02,2016-12-02,0
132561,5/24/2018,5/29/2018,2,14.186,2,2018-05-24,2018-05-29,5
132585,7/15/2017,7/15/2017,1,6.695,1,2017-07-15,2017-07-15,0
132637,12/20/2019,9/21/2018,4,41.18,3,2019-12-20,2018-09-21,-455
132651,2/16/2017,9/11/2017,2,3.334,2,2017-02-16,2017-09-11,207
1326521,4/29/2018,4/29/2018,1,11.736,1,2018-04-29,2018-04-29,0
132775,10/14/2016,9/30/2016,10,250.105248,2,2016-10-14,2016-09-30,-14
1328051,3/14/2018,3/14/2018,1,8.135,1,2018-03-14,2018-03-14,0
1329051,2/18/2018,2/18/2018,1,5.867,1,2018-02-18,2018-02-18,0
1329091,1/2/2020,9/9/2019,52,145.367,9,2020-01-02,2019-09-09,-115
132919,8/22/2016,8/22/2016,1,6.827017,1,2016-08-22,2016-08-22,0
1329821,10/26/2020,10/26/2020,1,4.431,1,2020-10-26,2020-10-26,0
1329981,6/15/2018,6/17/2018,2,7.827,2,2018-06-15,2018-06-17,2
1330181,1/26/2018,1/26/2018,1,6.57,1,2018-01-26,2018-01-26,0
1330691,3/29/2019,9/18/2018,4,19.468,4,2019-03-29,2018-09-18,-192
133083,5/24/2018,9/18/2018,3,38.528999999999996,2,2018-05-24,2018-09-18,117
133173,11/24/2017,11/24/2017,1,8.859,1,2017-11-24,2017-11-24,0
1331791,5/10/2019,5/10/2019,1,3.126,1,2019-05-10,2019-05-10,0
1332361,1/18/2018,6/2/2018,4,33.909,1,2018-01-18,2018-06-02,135
133237,1/12/2017,2/16/2018,2,30.849999999999998,2,2017-01-12,2018-02-16,400
1332431,7/28/2018,7/28/2018,1,9.062,1,2018-07-28,2018-07-28,0
133301,4/29/2018,7/17/2019,2,22.62,2,2018-04-29,2019-07-17,444
133323,1/11/2017,4/25/2019,4,21.019000000000002,4,2017-01-11,2019-04-25,834
133333,4/26/2018,8/12/2018,5,66.788,3,2018-04-26,2018-08-12,108
1333441,10/14/2020,9/9/2020,46,446.272,3,2020-10-14,2020-09-09,-35
1333971,6/30/2018,6/30/2018,1,2.49,1,2018-06-30,2018-06-30,0
1334141,11/30/2019,5/14/2019,2,5.288,2,2019-11-30,2019-05-14,-200
133427,9/23/2017,9/23/2017,1,6.493,1,2017-09-23,2017-09-23,0
133429,1/11/2018,9/27/2017,11,166.470508,6,2018-01-11,2017-09-27,-106
1334551,3/7/2018,3/9/2018,2,17.012,2,2018-03-07,2018-03-09,2
133487,12/31/2016,12/5/2016,2,3.447,1,2016-12-31,2016-12-05,-26
133493,9/21/2018,9/21/2018,1,0.172,1,2018-09-21,2018-09-21,0
1334981,12/18/2017,12/20/2017,2,32.153,2,2017-12-18,2017-12-20,2
1335181,11/10/2018,11/10/2018,1,14.035,1,2018-11-10,2018-11-10,0
133527,4/10/2019,4/10/2019,1,2.789,1,2019-04-10,2019-04-10,0
1335311,1/12/2018,9/1/2019,4,5.655,2,2018-01-12,2019-09-01,597
1336181,4/24/2019,4/24/2019,1,0.943,1,2019-04-24,2019-04-24,0
1336321,2/18/2019,8/22/2020,3,5.579000000000001,2,2019-02-18,2020-08-22,551
133637,2/19/2018,5/23/2018,3,7.983,2,2018-02-19,2018-05-23,93
133641,1/19/2018,8/31/2020,20,65.57887099999999,7,2018-01-19,2020-08-31,955
1336931,11/1/2019,11/1/2019,1,5.181,1,2019-11-01,2019-11-01,0
1337031,1/22/2020,9/20/2020,5,44.260999999999996,4,2020-01-22,2020-09-20,242
1337591,10/8/2020,10/8/2020,1,0.073,1,2020-10-08,2020-10-08,0
133773,4/24/2018,4/24/2018,1,7.065,1,2018-04-24,2018-04-24,0
133787,10/17/2016,10/17/2016,1,9.629551,1,2016-10-17,2016-10-17,0
1338671,1/10/2018,9/5/2018,52,372.037,3,2018-01-10,2018-09-05,238
133877,7/28/2019,7/28/2019,1,7.914,1,2019-07-28,2019-07-28,0
1339081,11/13/2019,5/10/2019,2,8.7,2,2019-11-13,2019-05-10,-187
133943,2/22/2017,2/22/2017,1,3.073,1,2017-02-22,2017-02-22,0
1339551,1/17/2018,2/13/2018,11,83.61,3,2018-01-17,2018-02-13,27
1340481,7/28/2018,7/28/2018,1,4.728,1,2018-07-28,2018-07-28,0
1340901,5/2/2018,5/2/2018,1,9.973,1,2018-05-02,2018-05-02,0
1341121,11/18/2019,11/18/2019,1,4.309,1,2019-11-18,2019-11-18,0
1341371,1/31/2018,8/6/2018,13,56.782,7,2018-01-31,2018-08-06,187
134143,9/22/2017,9/22/2017,1,9.368,1,2017-09-22,2017-09-22,0
134197,6/1/2017,8/27/2017,2,16.53,2,2017-06-01,2017-08-27,87
1343321,8/12/2019,8/12/2019,1,5.69,1,2019-08-12,2019-08-12,0
134353,11/2/2019,3/2/2017,2,17.012,2,2019-11-02,2017-03-02,-975
1343611,12/7/2019,2/26/2019,3,25.444,3,2019-12-07,2019-02-26,-284
134391,4/1/2017,8/31/2018,3,31.585,2,2017-04-01,2018-08-31,517
134419,1/7/2018,8/13/2016,4,14.406486000000001,2,2018-01-07,2016-08-13,-512
1345211,1/17/2018,2/11/2018,3,10.875,2,2018-01-17,2018-02-11,25
134545,6/3/2018,6/3/2018,1,4.009,1,2018-06-03,2018-06-03,0
1345781,4/17/2019,7/18/2019,2,17.882,2,2019-04-17,2019-07-18,92
134597,10/20/2016,9/27/2016,8,18.304236,3,2016-10-20,2016-09-27,-23
1346281,1/4/2018,9/1/2018,13,195.324,3,2018-01-04,2018-09-01,240
134631,1/7/2017,9/4/2016,8,81.569516,3,2017-01-07,2016-09-04,-125
134635,12/12/2017,12/12/2017,1,4.958,1,2017-12-12,2017-12-12,0
1346931,10/20/2019,10/20/2019,1,7.434,1,2019-10-20,2019-10-20,0
134699,2/11/2017,9/13/2017,10,83.431,4,2017-02-11,2017-09-13,214
134703,1/25/2020,5/31/2017,4,21.168,3,2020-01-25,2017-05-31,-969
134719,1/17/2019,1/17/2019,1,0.678,1,2019-01-17,2019-01-17,0
1347231,3/18/2018,6/22/2018,3,21.07,2,2018-03-18,2018-06-22,96
134743,1/31/2017,2/8/2017,4,22.816,3,2017-01-31,2017-02-08,8
1347741,11/28/2018,9/3/2019,4,34.57,4,2018-11-28,2019-09-03,279
1347801,11/11/2018,9/11/2019,19,43.705,5,2018-11-11,2019-09-11,304
134805,11/1/2018,11/1/2018,1,11.424,1,2018-11-01,2018-11-01,0
134835,1/28/2018,9/8/2017,19,148.38,9,2018-01-28,2017-09-08,-142
134839,10/31/2019,6/24/2018,6,52.213,4,2019-10-31,2018-06-24,-494
134843,1/15/2017,9/29/2018,21,119.682,9,2017-01-15,2018-09-29,622
1348911,2/26/2020,9/22/2019,3,10.662,3,2020-02-26,2019-09-22,-157
1350011,6/14/2019,9/9/2019,37,507.234,15,2019-06-14,2019-09-09,87
1350361,3/24/2018,8/23/2018,2,5.447,2,2018-03-24,2018-08-23,152
1350601,11/22/2019,9/7/2019,2,25.442,2,2019-11-22,2019-09-07,-76
1352951,11/25/2017,11/25/2017,1,7.719,1,2017-11-25,2017-11-25,0
135313,10/20/2017,8/26/2017,2,13.402,2,2017-10-20,2017-08-26,-55
1353421,10/29/2019,10/29/2019,1,7.39,1,2019-10-29,2019-10-29,0
1353641,1/13/2018,8/4/2019,10,76.382,8,2018-01-13,2019-08-04,568
135373,10/13/2017,8/14/2018,8,43.479,8,2017-10-13,2018-08-14,305
1353821,4/12/2019,9/14/2019,3,15.440999999999999,2,2019-04-12,2019-09-14,155
135397,4/4/2017,4/4/2017,1,7.189,1,2017-04-04,2017-04-04,0
135405,7/11/2017,7/11/2017,1,11.528,1,2017-07-11,2017-07-11,0
1354141,12/24/2017,12/24/2017,1,5.775,1,2017-12-24,2017-12-24,0
135425,9/24/2019,9/28/2019,2,15.066,2,2019-09-24,2019-09-28,4
1354361,10/30/2018,9/3/2018,9,56.9,6,2018-10-30,2018-09-03,-57
1354711,7/7/2018,7/7/2018,1,11.315,1,2018-07-07,2018-07-07,0
1354951,3/21/2019,3/21/2019,1,13.473,1,2019-03-21,2019-03-21,0
1354971,2/11/2018,6/16/2018,6,115.58,4,2018-02-11,2018-06-16,125
135549,1/10/2017,8/23/2017,7,66.858389,3,2017-01-10,2017-08-23,225
135569,1/12/2019,1/20/2019,2,11.871,1,2019-01-12,2019-01-20,8
1355971,9/19/2020,9/19/2020,1,2.399,1,2020-09-19,2020-09-19,0
135629,11/16/2017,11/16/2017,1,16.884,1,2017-11-16,2017-11-16,0
1356951,12/22/2017,12/22/2017,1,7.201,1,2017-12-22,2017-12-22,0
1357791,4/5/2018,4/5/2018,1,0.774,1,2018-04-05,2018-04-05,0
135797,2/2/2019,2/2/2019,1,2.151,1,2019-02-02,2019-02-02,0
135809,7/24/2019,7/24/2019,1,6.766,1,2019-07-24,2019-07-24,0
1358371,6/9/2018,6/9/2018,1,1.846,1,2018-06-09,2018-06-09,0
1358471,10/17/2020,9/13/2018,10,51.083,4,2020-10-17,2018-09-13,-765
135849,12/8/2017,12/8/2017,1,3.622,1,2017-12-08,2017-12-08,0
1358511,3/7/2020,3/7/2020,1,14.592,1,2020-03-07,2020-03-07,0
135895,1/10/2017,9/7/2016,44,133.070574,11,2017-01-10,2016-09-07,-125
135919,2/12/2019,8/31/2017,5,46.934000000000005,3,2019-02-12,2017-08-31,-530
1359331,2/16/2019,9/4/2019,5,7.862,3,2019-02-16,2019-09-04,200
135959,3/2/2018,3/2/2018,1,12.876,1,2018-03-02,2018-03-02,0
135965,12/4/2018,9/20/2018,11,54.138,6,2018-12-04,2018-09-20,-75
135971,5/15/2017,5/15/2017,1,5.07,1,2017-05-15,2017-05-15,0
1360761,9/8/2018,9/8/2018,1,6.23,1,2018-09-08,2018-09-08,0
136105,8/16/2017,8/16/2017,1,0.537,1,2017-08-16,2017-08-16,0
1361281,1/7/2018,2/13/2018,7,27.977999999999998,4,2018-01-07,2018-02-13,37
136139,12/13/2020,3/19/2017,3,17.236,3,2020-12-13,2017-03-19,-1365
136175,1/12/2019,7/20/2017,3,49.791,3,2019-01-12,2017-07-20,-541
1362211,11/23/2019,11/23/2019,1,8.67,1,2019-11-23,2019-11-23,0
1362451,1/11/2020,6/7/2018,4,33.763,3,2020-01-11,2018-06-07,-583
136251,10/4/2018,4/29/2017,3,13.431000000000001,2,2018-10-04,2017-04-29,-523
136255,11/26/2019,7/24/2017,2,8.072,2,2019-11-26,2017-07-24,-855
1362811,12/7/2019,4/20/2018,2,6.297,2,2019-12-07,2018-04-20,-596
136347,11/26/2016,11/26/2016,1,10.181,1,2016-11-26,2016-11-26,0
1364111,12/23/2017,12/23/2017,1,13.076,1,2017-12-23,2017-12-23,0
1364131,1/13/2018,1/13/2018,1,1.716,1,2018-01-13,2018-01-13,0
1364281,7/15/2018,7/15/2018,1,13.409,1,2018-07-15,2018-07-15,0
1364291,7/21/2019,7/21/2019,1,1.274,1,2019-07-21,2019-07-21,0
1364801,5/3/2018,5/3/2018,1,5.454,1,2018-05-03,2018-05-03,0
1364971,6/20/2018,8/28/2018,2,10.991,2,2018-06-20,2018-08-28,69
1365111,12/7/2018,12/7/2018,1,4.872,1,2018-12-07,2018-12-07,0
1366361,11/18/2019,9/19/2018,5,33.475,2,2019-11-18,2018-09-19,-425
136639,1/8/2017,1/8/2017,1,6.355,1,2017-01-08,2017-01-08,0
136691,10/23/2016,9/13/2017,10,25.846494,5,2016-10-23,2017-09-13,325
136695,7/13/2018,8/8/2016,2,34.439696,2,2018-07-13,2016-08-08,-704
1367681,1/11/2018,1/11/2018,1,14.069,1,2018-01-11,2018-01-11,0
1367981,11/7/2018,11/7/2018,1,5.352,1,2018-11-07,2018-11-07,0
136841,2/19/2019,2/19/2019,1,0.913,1,2019-02-19,2019-02-19,0
136849,10/26/2018,10/26/2018,1,4.606,1,2018-10-26,2018-10-26,0
136853,7/22/2019,7/22/2019,1,1.497,1,2019-07-22,2019-07-22,0
136887,5/10/2019,5/10/2019,2,32.294,2,2019-05-10,2019-05-10,0
136909,1/3/2020,3/6/2019,9,6.8149999999999995,4,2020-01-03,2019-03-06,-303
1369771,1/23/2019,9/4/2018,32,396.996,5,2019-01-23,2018-09-04,-141
137011,11/29/2016,11/29/2016,1,9.029,1,2016-11-29,2016-11-29,0
137035,1/11/2019,9/28/2017,43,233.543294,12,2019-01-11,2017-09-28,-470
1370571,3/4/2018,3/4/2018,1,2.77,1,2018-03-04,2018-03-04,0
1371251,6/6/2019,6/6/2019,1,6.652,1,2019-06-06,2019-06-06,0
137131,1/15/2017,9/18/2016,11,101.283745,5,2017-01-15,2016-09-18,-119
1371531,1/13/2018,9/5/2020,66,652.336,9,2018-01-13,2020-09-05,966
137159,1/27/2019,3/17/2019,4,10.505,3,2019-01-27,2019-03-17,49
137169,1/10/2020,9/9/2019,70,976.194,18,2020-01-10,2019-09-09,-123
1371721,1/20/2018,6/21/2018,3,36.230000000000004,3,2018-01-20,2018-06-21,152
137183,10/13/2017,9/20/2020,5,24.596,4,2017-10-13,2020-09-20,1073
1372031,1/13/2019,10/9/2019,2,3.665,2,2019-01-13,2019-10-09,269
137209,10/10/2018,9/10/2019,3,6.8549999999999995,3,2018-10-10,2019-09-10,335
137237,1/10/2017,9/19/2019,15,145.067,8,2017-01-10,2019-09-19,982
137293,2/28/2018,9/18/2016,4,19.391326,4,2018-02-28,2016-09-18,-528
137365,3/2/2019,3/2/2019,1,5.187,1,2019-03-02,2019-03-02,0
137367,10/14/2017,8/31/2019,7,52.709887,5,2017-10-14,2019-08-31,686
1373961,6/22/2018,6/22/2018,1,16.103,1,2018-06-22,2018-06-22,0
137397,10/5/2018,10/5/2018,1,9.856,1,2018-10-05,2018-10-05,0
137407,1/21/2019,9/22/2017,26,104.899091,7,2019-01-21,2017-09-22,-486
137439,2/3/2018,8/28/2016,4,4.236045,2,2018-02-03,2016-08-28,-524
137473,4/12/2019,4/12/2019,1,16.972,1,2019-04-12,2019-04-12,0
137487,11/12/2019,7/3/2017,6,26.117,3,2019-11-12,2017-07-03,-862
1374891,1/10/2018,2/6/2018,32,450.528,3,2018-01-10,2018-02-06,27
1375011,1/1/2020,4/28/2019,3,3.062,2,2020-01-01,2019-04-28,-248
137503,3/14/2019,9/2/2017,4,29.313000000000002,3,2019-03-14,2017-09-02,-558
1375221,1/21/2019,9/7/2018,28,193.388,6,2019-01-21,2018-09-07,-136
1375441,2/20/2020,2/20/2020,1,2.461,1,2020-02-20,2020-02-20,0
137593,10/9/2019,8/18/2017,3,15.844000000000001,3,2019-10-09,2017-08-18,-782
1376121,8/29/2018,8/29/2018,1,16.817,1,2018-08-29,2018-08-29,0
1376231,1/24/2018,4/8/2018,2,20.88,1,2018-01-24,2018-04-08,74
1376801,9/21/2019,9/21/2019,1,10.303,1,2019-09-21,2019-09-21,0
1376861,4/1/2019,4/1/2019,1,3.809,1,2019-04-01,2019-04-01,0
1376961,1/28/2018,4/7/2018,2,7.4910000000000005,1,2018-01-28,2018-04-07,69
1376981,1/12/2020,9/26/2019,4,45.567,4,2020-01-12,2019-09-26,-108
137731,1/15/2019,9/9/2018,34,107.274,13,2019-01-15,2018-09-09,-128
1377311,6/27/2019,6/27/2019,1,0.361,1,2019-06-27,2019-06-27,0
1377961,1/16/2019,4/29/2019,2,10.96,1,2019-01-16,2019-04-29,103
1378031,12/20/2018,12/20/2018,1,6.821,1,2018-12-20,2018-12-20,0
1378161,3/23/2019,3/23/2019,1,0.964,1,2019-03-23,2019-03-23,0
137823,11/14/2018,6/7/2018,2,10.186,1,2018-11-14,2018-06-07,-160
1378621,1/22/2019,8/4/2018,11,75.455,3,2019-01-22,2018-08-04,-171
1378971,2/15/2019,2/28/2019,2,6.464,1,2019-02-15,2019-02-28,13
137991,10/22/2019,8/3/2018,3,30.063000000000002,3,2019-10-22,2018-08-03,-445
1380,11/10/2018,8/28/2020,6,25.298000000000002,3,2018-11-10,2020-08-28,657
1380421,1/30/2019,1/30/2019,1,6.448,1,2019-01-30,2019-01-30,0
138051,12/14/2019,12/14/2019,1,0.37,1,2019-12-14,2019-12-14,0
1380991,10/5/2019,9/24/2018,6,21.878999999999998,4,2019-10-05,2018-09-24,-376
1381,1/24/2019,1/24/2019,1,9.927,1,2019-01-24,2019-01-24,0
138123,6/3/2017,6/3/2017,1,0.756,1,2017-06-03,2017-06-03,0
138175,2/2/2019,2/2/2019,1,4.461,1,2019-02-02,2019-02-02,0
1382131,1/12/2018,9/22/2018,69,2148.676,18,2018-01-12,2018-09-22,253
138227,2/17/2018,2/17/2018,1,1.018,1,2018-02-17,2018-02-17,0
1382581,7/26/2018,7/26/2018,1,2.213,1,2018-07-26,2018-07-26,0
1383291,1/2/2019,8/9/2018,15,95.594,4,2019-01-02,2018-08-09,-146
1384371,12/16/2017,12/16/2017,1,6.28,1,2017-12-16,2017-12-16,0
1384761,1/10/2018,9/8/2018,448,2938.707,10,2018-01-10,2018-09-08,241
1384871,1/13/2020,12/7/2019,6,13.697,4,2020-01-13,2019-12-07,-37
138553,10/27/2016,4/1/2017,2,35.732,2,2016-10-27,2017-04-01,156
1385541,3/12/2018,3/12/2018,1,3.5,1,2018-03-12,2018-03-12,0
138555,2/1/2020,2/1/2020,2,22.025,2,2020-02-01,2020-02-01,0
138561,8/13/2016,8/13/2016,1,12.774702,1,2016-08-13,2016-08-13,0
138625,10/21/2016,8/28/2016,2,23.969588,2,2016-10-21,2016-08-28,-54
138659,12/21/2019,12/21/2019,1,5.982,1,2019-12-21,2019-12-21,0
138663,1/21/2017,3/18/2017,6,50.926,4,2017-01-21,2017-03-18,56
1386751,1/23/2019,9/2/2018,26,62.929,7,2019-01-23,2018-09-02,-143
138689,6/26/2019,6/26/2019,1,9.907,1,2019-06-26,2019-06-26,0
1386931,1/18/2018,8/19/2018,9,43.118,5,2018-01-18,2018-08-19,213
138695,12/15/2016,12/15/2016,1,7.093,1,2016-12-15,2016-12-15,0
138715,5/13/2018,6/20/2018,2,3.4030000000000005,2,2018-05-13,2018-06-20,38
13873,1/23/2020,10/4/2019,2,9.155,2,2020-01-23,2019-10-04,-111
138791,12/23/2018,12/23/2018,1,0.786,1,2018-12-23,2018-12-23,0
1388091,9/25/2018,9/25/2018,1,1.564,1,2018-09-25,2018-09-25,0
1388711,1/20/2018,1/20/2018,1,4.052,1,2018-01-20,2018-01-20,0
138889,12/6/2018,5/11/2019,3,14.623,2,2018-12-06,2019-05-11,156
138981,1/15/2019,5/13/2019,3,23.56,2,2019-01-15,2019-05-13,118
138V,9/12/2016,9/20/2017,2,5.42565,2,2016-09-12,2017-09-20,373
1390021,5/28/2018,5/28/2018,1,3.454,1,2018-05-28,2018-05-28,0
1390121,12/2/2020,12/2/2020,1,2.919,1,2020-12-02,2020-12-02,0
1390561,9/19/2018,9/19/2018,1,8.128,1,2018-09-19,2018-09-19,0
1390611,2/11/2018,2/11/2018,1,3.153,1,2018-02-11,2018-02-11,0
1390751,10/13/2018,5/1/2018,2,13.815,1,2018-10-13,2018-05-01,-165
139091,1/25/2018,1/25/2018,1,12.64,1,2018-01-25,2018-01-25,0
1390991,6/23/2019,6/23/2019,1,6.923,1,2019-06-23,2019-06-23,0
1391,10/29/2016,8/30/2016,16,77.736902,9,2016-10-29,2016-08-30,-60
1391041,3/26/2018,6/16/2019,13,40.92,5,2018-03-26,2019-06-16,447
1391201,5/20/2018,5/20/2018,1,6.106,1,2018-05-20,2018-05-20,0
139127,6/7/2019,9/20/2018,4,16.884,4,2019-06-07,2018-09-20,-260
1391271,3/17/2019,3/9/2019,3,25.323999999999998,1,2019-03-17,2019-03-09,-8
1391341,11/15/2018,9/18/2018,16,197.531,12,2018-11-15,2018-09-18,-58
1391571,12/21/2017,12/21/2017,1,8.48,1,2017-12-21,2017-12-21,0
1391631,4/8/2018,4/8/2018,1,4.424,1,2018-04-08,2018-04-08,0
1391641,2/20/2018,2/20/2018,1,8.636,1,2018-02-20,2018-02-20,0
1391951,1/7/2018,12/15/2017,2,5.776999999999999,1,2018-01-07,2017-12-15,-23
139203,11/12/2017,9/23/2017,8,13.797458,2,2017-11-12,2017-09-23,-50
1392461,2/15/2018,3/10/2018,2,7.4399999999999995,1,2018-02-15,2018-03-10,23
139287,10/26/2018,8/30/2017,6,42.601,5,2018-10-26,2017-08-30,-422
139313,7/22/2018,7/22/2018,1,2.884,1,2018-07-22,2018-07-22,0
139317,2/14/2019,2/14/2019,1,15.906,1,2019-02-14,2019-02-14,0
139347,11/21/2019,4/17/2019,3,23.656,2,2019-11-21,2019-04-17,-218
139361,1/18/2017,8/31/2016,17,106.918489,3,2017-01-18,2016-08-31,-140
139363,12/19/2019,12/19/2019,1,1.497,1,2019-12-19,2019-12-19,0
139387,10/10/2019,11/17/2016,2,29.235,1,2019-10-10,2016-11-17,-1057
1393961,1/29/2018,9/1/2020,17,109.453,4,2018-01-29,2020-09-01,946
1394131,12/16/2018,12/26/2018,5,53.266,3,2018-12-16,2018-12-26,10
1394191,1/25/2020,6/9/2018,6,33.978,3,2020-01-25,2018-06-09,-595
139425,3/2/2017,3/2/2017,1,11.261,1,2017-03-02,2017-03-02,0
139467,10/26/2017,10/26/2017,1,11.435,1,2017-10-26,2017-10-26,0
139469,4/5/2018,5/30/2018,2,14.933,2,2018-04-05,2018-05-30,55
1394861,11/16/2019,11/16/2019,1,6.546,1,2019-11-16,2019-11-16,0
1395251,1/16/2018,1/16/2018,1,8.685,1,2018-01-16,2018-01-16,0
1395391,12/9/2017,12/9/2017,1,5.007,1,2017-12-09,2017-12-09,0
139581,5/24/2017,5/24/2017,1,3.561,1,2017-05-24,2017-05-24,0
139597,10/16/2018,9/8/2017,36,488.145,10,2018-10-16,2017-09-08,-403
1396141,1/23/2018,9/29/2020,21,115.098,8,2018-01-23,2020-09-29,980
139621,11/21/2018,9/15/2016,4,16.640339,3,2018-11-21,2016-09-15,-797
1396271,3/3/2020,3/3/2020,1,1.158,1,2020-03-03,2020-03-03,0
1396531,12/21/2017,12/21/2017,1,4.584,1,2017-12-21,2017-12-21,0
1397131,6/6/2019,6/6/2019,1,5.868,1,2019-06-06,2019-06-06,0
139715,1/20/2018,1/20/2018,1,5.821,1,2018-01-20,2018-01-20,0
1397171,1/27/2020,9/17/2018,5,98.672,3,2020-01-27,2018-09-17,-497
1398041,1/20/2018,6/19/2018,8,111.522,6,2018-01-20,2018-06-19,150
139809,1/14/2019,9/10/2017,18,118.239,13,2019-01-14,2017-09-10,-491
1398231,12/5/2018,2/9/2019,2,7.292,2,2018-12-05,2019-02-09,66
139843,9/29/2019,9/29/2019,1,5.417,1,2019-09-29,2019-09-29,0
139847,1/15/2019,1/15/2019,1,11.373,1,2019-01-15,2019-01-15,0
1398631,5/17/2019,6/12/2019,2,7.366,2,2019-05-17,2019-06-12,26
1398751,1/15/2018,9/26/2018,74,1637.738,7,2018-01-15,2018-09-26,254
1398781,10/15/2019,10/15/2019,1,7.463,1,2019-10-15,2019-10-15,0
1400011,1/18/2020,1/18/2020,1,10.688,1,2020-01-18,2020-01-18,0
140015,5/25/2018,9/15/2017,3,36.272999999999996,3,2018-05-25,2017-09-15,-252
140019,11/20/2016,11/20/2016,1,5.677,1,2016-11-20,2016-11-20,0
14003,12/7/2016,12/7/2016,1,3.442,1,2016-12-07,2016-12-07,0
1400331,7/31/2018,7/31/2018,1,9.335,1,2018-07-31,2018-07-31,0
140055,1/11/2017,1/11/2017,1,2.594,1,2017-01-11,2017-01-11,0
1400561,8/17/2018,8/17/2018,1,1.533,1,2018-08-17,2018-08-17,0
140075,3/10/2017,3/10/2017,1,10.524,1,2017-03-10,2017-03-10,0
140153,6/8/2018,6/8/2018,1,6.996,1,2018-06-08,2018-06-08,0
1401661,1/17/2018,3/7/2018,5,30.205,3,2018-01-17,2018-03-07,49
1401921,5/24/2018,5/24/2018,1,3.248,1,2018-05-24,2018-05-24,0
1402081,1/27/2018,1/27/2018,1,2.754,1,2018-01-27,2018-01-27,0
140267,5/9/2018,5/9/2018,1,11.818,1,2018-05-09,2018-05-09,0
1402671,8/11/2018,8/11/2018,1,5.965,1,2018-08-11,2018-08-11,0
1402841,5/1/2018,5/5/2018,3,16.267,2,2018-05-01,2018-05-05,4
140287,6/11/2017,6/11/2017,1,8.381,1,2017-06-11,2017-06-11,0
1402911,1/13/2018,2/17/2019,4,91.346,2,2018-01-13,2019-02-17,400
140335,5/9/2018,5/9/2018,1,23.52,1,2018-05-09,2018-05-09,0
140491,2/16/2018,2/16/2018,1,3.518,1,2018-02-16,2018-02-16,0
1405011,5/3/2019,5/3/2019,1,11.44,1,2019-05-03,2019-05-03,0
140555,7/16/2017,7/16/2017,1,16.308,1,2017-07-16,2017-07-16,0
140579,10/7/2018,10/7/2018,1,8.017,1,2018-10-07,2018-10-07,0
1405801,1/3/2018,12/7/2017,7,84.327,4,2018-01-03,2017-12-07,-27
1406531,1/18/2018,9/7/2018,29,168.101,11,2018-01-18,2018-09-07,232
140717,9/14/2019,9/14/2019,1,8.605,1,2019-09-14,2019-09-14,0
140721,3/7/2018,6/27/2018,3,13.415,3,2018-03-07,2018-06-27,112
140749,2/22/2018,2/5/2020,2,16.524,2,2018-02-22,2020-02-05,713
1407611,12/22/2017,12/22/2017,1,11.433,1,2017-12-22,2017-12-22,0
140819,3/19/2017,9/23/2016,6,75.311987,4,2017-03-19,2016-09-23,-177
1408281,1/11/2019,7/8/2018,27,790.614,3,2019-01-11,2018-07-08,-187
1408851,1/8/2018,1/8/2018,1,3.875,1,2018-01-08,2018-01-08,0
1409411,4/15/2018,4/15/2018,1,4.266,1,2018-04-15,2018-04-15,0
140957,10/1/2016,4/6/2018,2,5.674761,2,2016-10-01,2018-04-06,552
140959,10/16/2020,9/17/2020,7,35.594,4,2020-10-16,2020-09-17,-29
140975,3/30/2018,8/22/2019,2,11.232,2,2018-03-30,2019-08-22,510
1409911,12/15/2017,3/30/2018,4,51.742,3,2017-12-15,2018-03-30,105
141111,11/8/2017,7/3/2018,3,28.691000000000003,2,2017-11-08,2018-07-03,237
14113,2/11/2017,2/11/2017,1,0.704,1,2017-02-11,2017-02-11,0
1411431,10/6/2018,7/27/2019,6,68.805,2,2018-10-06,2019-07-27,294
1411781,1/26/2020,9/22/2018,15,178.107,9,2020-01-26,2018-09-22,-491
141243,8/27/2018,8/27/2018,1,10.485,1,2018-08-27,2018-08-27,0
1412501,8/9/2019,8/9/2019,1,4.099,1,2019-08-09,2019-08-09,0
1412611,5/29/2019,5/29/2019,1,11.009,1,2019-05-29,2019-05-29,0
141263,7/19/2020,7/19/2020,1,3.894,1,2020-07-19,2020-07-19,0
1412661,3/7/2018,3/7/2018,1,19.259,1,2018-03-07,2018-03-07,0
141287,1/11/2018,9/30/2018,18,124.33742,6,2018-01-11,2018-09-30,262
1413021,10/22/2018,10/22/2018,1,17.768,1,2018-10-22,2018-10-22,0
141405,3/31/2018,8/15/2016,2,12.436706,1,2018-03-31,2016-08-15,-593
141437,10/29/2018,9/9/2018,4,23.262999999999998,2,2018-10-29,2018-09-09,-50
1414811,11/2/2018,11/2/2018,1,8.799,1,2018-11-02,2018-11-02,0
1415261,3/17/2018,3/17/2018,1,4.159,1,2018-03-17,2018-03-17,0
141601,1/12/2018,9/7/2017,49,257.424067,13,2018-01-12,2017-09-07,-127
1416081,1/15/2020,9/7/2019,197,4555.118,20,2020-01-15,2019-09-07,-130
1416181,2/25/2018,2/25/2018,1,3.862,1,2018-02-25,2018-02-25,0
141643,11/10/2018,9/28/2019,3,14.076162,1,2018-11-10,2019-09-28,322
141691,5/12/2018,5/12/2018,1,9.392,1,2018-05-12,2018-05-12,0
1417131,6/16/2019,7/6/2019,11,113.355,4,2019-06-16,2019-07-06,20
1417211,2/1/2019,3/21/2019,2,9.457999999999998,2,2019-02-01,2019-03-21,48
141723,4/14/2018,4/14/2018,1,26.897,1,2018-04-14,2018-04-14,0
141733,10/12/2019,10/5/2019,3,14.219000000000001,3,2019-10-12,2019-10-05,-7
1417431,2/10/2019,2/10/2019,1,1.706,1,2019-02-10,2019-02-10,0
1417461,2/24/2018,9/1/2018,10,90.903,5,2018-02-24,2018-09-01,189
141845,12/27/2016,9/7/2016,23,166.14099099999999,2,2016-12-27,2016-09-07,-111
1418621,2/5/2019,2/5/2019,1,9.552,1,2019-02-05,2019-02-05,0
141901,3/21/2019,3/21/2019,1,16.296,1,2019-03-21,2019-03-21,0
141923,10/15/2020,10/15/2020,1,4.265,1,2020-10-15,2020-10-15,0
1419831,12/10/2019,12/10/2019,1,2.464,1,2019-12-10,2019-12-10,0
142017,11/12/2019,3/3/2020,2,24.58,2,2019-11-12,2020-03-03,112
142119,5/27/2017,9/3/2016,2,20.719022,2,2017-05-27,2016-09-03,-266
142143,4/3/2017,4/3/2017,1,12.374,1,2017-04-03,2017-04-03,0
1421561,5/11/2018,7/25/2019,3,22.022,2,2018-05-11,2019-07-25,440
142181,8/15/2020,8/15/2020,1,4.896,1,2020-08-15,2020-08-15,0
1421821,1/21/2018,5/3/2018,11,82.45,5,2018-01-21,2018-05-03,102
1422011,10/7/2018,8/12/2018,4,69.068,2,2018-10-07,2018-08-12,-56
142225,7/19/2017,9/6/2017,3,11.454,2,2017-07-19,2017-09-06,49
1422251,11/20/2020,11/20/2020,1,18.835,1,2020-11-20,2020-11-20,0
1422321,10/10/2019,9/5/2019,11,151.243,4,2019-10-10,2019-09-05,-35
142247,11/2/2017,11/2/2017,1,6.893,1,2017-11-02,2017-11-02,0
142261,11/17/2016,8/1/2018,3,30.013,2,2016-11-17,2018-08-01,622
142265,1/13/2019,9/3/2018,24,229.995,11,2019-01-13,2018-09-03,-132
142359,1/2/2017,9/8/2018,19,479.594451,4,2017-01-02,2018-09-08,614
1423911,11/21/2020,11/8/2020,2,8.202,2,2020-11-21,2020-11-08,-13
1424041,1/25/2020,9/5/2019,13,241.546,6,2020-01-25,2019-09-05,-142
1424061,1/27/2020,7/10/2019,4,13.871,4,2020-01-27,2019-07-10,-201
1424141,12/2/2018,12/2/2018,1,10.902,1,2018-12-02,2018-12-02,0
142423,10/18/2016,10/4/2018,2,17.978772,2,2016-10-18,2018-10-04,716
1424491,5/12/2018,5/12/2018,1,5.36,1,2018-05-12,2018-05-12,0
142501,11/17/2017,9/23/2016,4,35.963770000000004,4,2017-11-17,2016-09-23,-420
142535,2/23/2018,4/13/2018,2,12.216999999999999,2,2018-02-23,2018-04-13,49
1425481,1/16/2018,12/13/2017,3,131.77,3,2018-01-16,2017-12-13,-34
142549,6/27/2019,8/24/2019,2,4.428,2,2019-06-27,2019-08-24,58
1425521,6/3/2018,6/3/2018,1,4.357,1,2018-06-03,2018-06-03,0
1425661,1/4/2019,1/4/2019,1,16.585,1,2019-01-04,2019-01-04,0
1425891,12/11/2017,7/24/2018,3,37.596,3,2017-12-11,2018-07-24,225
1425911,1/1/2018,1/1/2018,1,3.75,1,2018-01-01,2018-01-01,0
1425981,1/24/2020,1/27/2018,2,13.913,2,2020-01-24,2018-01-27,-727
1426031,1/7/2018,1/7/2018,1,1.851,1,2018-01-07,2018-01-07,0
1426161,10/8/2018,7/31/2018,5,42.646,3,2018-10-08,2018-07-31,-69
142617,1/14/2017,8/6/2016,2,7.903266,2,2017-01-14,2016-08-06,-161
1426341,1/13/2020,1/13/2020,1,14.129,1,2020-01-13,2020-01-13,0
1426761,12/12/2017,12/12/2017,1,19.801,1,2017-12-12,2017-12-12,0
1426831,11/17/2019,7/25/2020,4,21.878,3,2019-11-17,2020-07-25,251
142765,1/10/2018,1/10/2018,1,4.254,1,2018-01-10,2018-01-10,0
1427861,1/7/2020,5/26/2020,11,348.005,3,2020-01-07,2020-05-26,140
142839,1/10/2020,1/10/2020,1,5.021,1,2020-01-10,2020-01-10,0
142873,1/13/2020,5/19/2018,4,28.916999999999998,3,2020-01-13,2018-05-19,-604
1428871,12/21/2017,12/25/2017,2,5.583,2,2017-12-21,2017-12-25,4
142893,1/22/2017,6/1/2017,7,39.852,5,2017-01-22,2017-06-01,130
1429041,6/1/2018,6/1/2018,1,1.725,1,2018-06-01,2018-06-01,0
1429101,2/13/2018,9/25/2018,3,17.84,3,2018-02-13,2018-09-25,224
142931,5/25/2018,7/1/2017,4,46.336,2,2018-05-25,2017-07-01,-328
1429411,1/2/2018,9/15/2019,5,7.789,3,2018-01-02,2019-09-15,621
142947,11/1/2016,11/1/2016,1,4.424,1,2016-11-01,2016-11-01,0
1429551,2/6/2020,2/6/2020,1,1.393,1,2020-02-06,2020-02-06,0
142959,11/6/2020,12/18/2018,2,0.128,2,2020-11-06,2018-12-18,-689
1430121,10/28/2018,10/28/2018,1,10.049,1,2018-10-28,2018-10-28,0
1430171,1/20/2018,1/20/2018,1,6.349,1,2018-01-20,2018-01-20,0
1430231,7/8/2020,7/8/2020,1,9.802,1,2020-07-08,2020-07-08,0
143133,11/17/2017,9/15/2017,6,64.347,3,2017-11-17,2017-09-15,-63
143145,11/12/2017,12/2/2016,2,15.225999999999999,1,2017-11-12,2016-12-02,-345
1431921,5/27/2019,5/27/2019,1,2.692,1,2019-05-27,2019-05-27,0
143247,3/9/2017,3/9/2017,1,8.054,1,2017-03-09,2017-03-09,0
1432601,12/11/2019,9/1/2019,3,7.773,2,2019-12-11,2019-09-01,-101
143315,6/25/2017,6/25/2017,1,7.397,1,2017-06-25,2017-06-25,0
143325,1/24/2019,1/24/2019,1,5.456,1,2019-01-24,2019-01-24,0
143347,1/28/2017,9/30/2017,4,47.460856,3,2017-01-28,2017-09-30,245
1433701,12/13/2017,12/13/2017,1,5.603,1,2017-12-13,2017-12-13,0
1433951,5/18/2018,5/18/2018,1,15.201,1,2018-05-18,2018-05-18,0
143443,6/15/2019,6/15/2019,1,7.645,1,2019-06-15,2019-06-15,0
143475,8/3/2016,8/3/2016,1,6.585937,1,2016-08-03,2016-08-03,0
143541,11/8/2018,6/5/2018,4,12.634,4,2018-11-08,2018-06-05,-156
1435701,10/24/2018,10/24/2018,1,6.19,1,2018-10-24,2018-10-24,0
143617,11/13/2017,11/13/2017,1,1.526,1,2017-11-13,2017-11-13,0
1436241,1/24/2019,9/27/2018,4,36.938,3,2019-01-24,2018-09-27,-119
1436291,8/22/2018,8/22/2018,1,6.984,1,2018-08-22,2018-08-22,0
143647,10/7/2018,8/9/2018,5,10.526,3,2018-10-07,2018-08-09,-59
1436511,10/10/2018,9/9/2018,26,104.934,10,2018-10-10,2018-09-09,-31
1436731,4/3/2018,4/3/2018,1,7.055,1,2018-04-03,2018-04-03,0
143679,10/2/2016,7/22/2017,4,27.121144,2,2016-10-02,2017-07-22,293
143691,1/23/2017,9/28/2019,4,36.361000000000004,4,2017-01-23,2019-09-28,978
1436911,11/7/2018,9/12/2018,9,173.243,5,2018-11-07,2018-09-12,-56
143705,8/17/2019,8/17/2019,1,9.85,1,2019-08-17,2019-08-17,0
14373,11/16/2017,11/16/2017,1,2.307,1,2017-11-16,2017-11-16,0
1437321,4/7/2018,4/7/2018,1,0.346,1,2018-04-07,2018-04-07,0
143735,2/15/2018,2/15/2018,1,9.555,1,2018-02-15,2018-02-15,0
1437741,5/16/2019,8/14/2018,11,257.738,3,2019-05-16,2018-08-14,-275
143785,10/25/2017,8/22/2017,4,42.112,4,2017-10-25,2017-08-22,-64
143819,1/27/2019,8/22/2017,7,45.187,5,2019-01-27,2017-08-22,-523
143823,3/3/2019,3/3/2019,1,9.589,1,2019-03-03,2019-03-03,0
1438281,10/8/2018,10/8/2018,1,4.708,1,2018-10-08,2018-10-08,0
1438331,1/22/2018,1/22/2018,1,11.322,1,2018-01-22,2018-01-22,0
143839,1/1/2017,9/9/2016,366,9113.184403,9,2017-01-01,2016-09-09,-114
143847,1/19/2019,5/28/2017,5,56.108000000000004,3,2019-01-19,2017-05-28,-601
143869,8/25/2018,8/25/2018,1,3.83,1,2018-08-25,2018-08-25,0
1438711,10/14/2019,2/16/2020,3,12.994,2,2019-10-14,2020-02-16,125
143885,12/5/2018,12/5/2018,1,18.723,1,2018-12-05,2018-12-05,0
143897,1/10/2020,9/7/2019,250,3584.172913,6,2020-01-10,2019-09-07,-125
143903,12/13/2019,12/13/2019,1,8.211,1,2019-12-13,2019-12-13,0
1439101,2/2/2018,2/2/2018,1,0.083,1,2018-02-02,2018-02-02,0
143923,11/10/2017,7/17/2019,4,40.585,4,2017-11-10,2019-07-17,614
143937,1/11/2017,9/25/2016,6,13.433736,3,2017-01-11,2016-09-25,-108
1439431,10/26/2019,11/30/2019,3,14.943,3,2019-10-26,2019-11-30,35
143949,12/10/2019,12/10/2019,1,6.567,1,2019-12-10,2019-12-10,0
143977,3/16/2017,3/16/2017,1,3.043,1,2017-03-16,2017-03-16,0
1439801,1/17/2020,4/4/2019,7,36.849,4,2020-01-17,2019-04-04,-288
143999,9/21/2019,9/21/2019,1,6.196,1,2019-09-21,2019-09-21,0
144029,12/11/2017,8/27/2019,2,21.54,2,2017-12-11,2019-08-27,624
1440691,12/15/2017,12/15/2017,1,6.073,1,2017-12-15,2017-12-15,0
1440981,1/7/2018,1/7/2018,1,12.506,1,2018-01-07,2018-01-07,0
144133,9/29/2019,9/8/2018,2,7.963,1,2019-09-29,2018-09-08,-386
1441351,12/9/2018,12/9/2018,1,4.78,1,2018-12-09,2018-12-09,0
1441441,12/29/2018,12/29/2018,1,12.59,1,2018-12-29,2018-12-29,0
144164,8/13/2016,9/4/2016,2,3.085026,2,2016-08-13,2016-09-04,22
144171,10/18/2016,4/22/2019,2,9.889624999999999,2,2016-10-18,2019-04-22,916
1442101,6/13/2018,6/13/2018,1,6.882,1,2018-06-13,2018-06-13,0
1442601,9/29/2018,9/29/2018,1,6.782,1,2018-09-29,2018-09-29,0
144309,6/1/2017,6/1/2017,1,0.628,1,2017-06-01,2017-06-01,0
144327,1/10/2019,9/7/2018,145,1914.3990000000001,14,2019-01-10,2018-09-07,-125
144413,10/13/2019,8/4/2018,3,42.011,3,2019-10-13,2018-08-04,-435
144465,9/28/2018,9/28/2018,1,6.571,1,2018-09-28,2018-09-28,0
144481,10/4/2017,12/5/2018,4,46.132,4,2017-10-04,2018-12-05,427
144483,1/30/2017,1/30/2017,1,0.235,1,2017-01-30,2017-01-30,0
1444991,12/16/2017,12/16/2017,1,3.413,1,2017-12-16,2017-12-16,0
14453,8/17/2018,9/18/2018,2,5.354,2,2018-08-17,2018-09-18,32
144531,1/27/2017,9/9/2016,4,27.706336,3,2017-01-27,2016-09-09,-140
1445361,1/12/2018,5/4/2018,2,8.094999999999999,2,2018-01-12,2018-05-04,112
144557,3/5/2019,3/5/2019,1,1.788,1,2019-03-05,2019-03-05,0
1445821,12/19/2017,7/13/2018,3,16.116,3,2017-12-19,2018-07-13,206
1445901,1/14/2020,9/25/2020,7,9.437,3,2020-01-14,2020-09-25,255
1446,10/19/2016,10/19/2016,1,15.064518,1,2016-10-19,2016-10-19,0
144617,12/6/2018,12/6/2018,1,2.228,1,2018-12-06,2018-12-06,0
144623,7/31/2019,7/31/2019,1,3.856,1,2019-07-31,2019-07-31,0
1447011,1/29/2019,9/19/2018,8,81.992,6,2019-01-29,2018-09-19,-132
1447041,1/10/2018,9/9/2019,325,4144.756,10,2018-01-10,2019-09-09,607
144707,1/30/2019,9/30/2019,17,130.855813,7,2019-01-30,2019-09-30,243
1447401,12/18/2017,12/18/2017,1,14.055,1,2017-12-18,2017-12-18,0
1447831,10/10/2018,9/8/2019,13,102.063,8,2018-10-10,2019-09-08,333
144795,1/20/2018,1/20/2018,1,9.129,1,2018-01-20,2018-01-20,0
144841,6/11/2019,6/11/2019,1,8.249,1,2019-06-11,2019-06-11,0
1448561,1/3/2018,10/26/2018,2,4.551,2,2018-01-03,2018-10-26,296
1448811,10/6/2018,7/7/2018,2,8.026,1,2018-10-06,2018-07-07,-91
144901,4/19/2017,4/19/2017,1,0.655,1,2017-04-19,2017-04-19,0
1449261,12/17/2017,12/19/2017,2,39.686,2,2017-12-17,2017-12-19,2
144963,1/5/2017,9/29/2017,33,220.280498,2,2017-01-05,2017-09-29,267
145005,8/29/2020,8/29/2020,1,2.565,1,2020-08-29,2020-08-29,0
145065,6/16/2019,6/16/2019,1,7.191,1,2019-06-16,2019-06-16,0
1450731,1/24/2019,6/16/2020,12,113.17,4,2019-01-24,2020-06-16,509
1450761,1/1/2020,9/29/2019,40,277.947,11,2020-01-01,2019-09-29,-94
1450781,7/19/2019,7/19/2019,1,10.06,1,2019-07-19,2019-07-19,0
145091,11/25/2017,8/29/2017,5,62.394428000000005,4,2017-11-25,2017-08-29,-88
145105,7/30/2018,7/30/2018,1,2.97,1,2018-07-30,2018-07-30,0
145121,3/22/2017,3/22/2017,1,7.496,1,2017-03-22,2017-03-22,0
1451211,1/18/2020,1/18/2020,1,23.552,1,2020-01-18,2020-01-18,0
145143,10/14/2018,9/14/2016,7,24.91226,4,2018-10-14,2016-09-14,-760
1451871,9/17/2018,9/17/2018,1,10.302,1,2018-09-17,2018-09-17,0
1452211,2/7/2019,2/7/2019,1,3.092,1,2019-02-07,2019-02-07,0
1452331,1/21/2018,1/21/2018,1,5.448,1,2018-01-21,2018-01-21,0
145237,11/11/2019,11/11/2019,1,9.572,1,2019-11-11,2019-11-11,0
145241,11/16/2016,11/16/2016,1,34.517,1,2016-11-16,2016-11-16,0
1452871,1/3/2020,9/13/2019,9,180.961,2,2020-01-03,2019-09-13,-112
1452911,1/16/2019,2/15/2019,2,25.18,1,2019-01-16,2019-02-15,30
1453231,12/23/2017,12/23/2017,1,6.946,1,2017-12-23,2017-12-23,0
1453421,11/20/2019,8/26/2019,11,161.196,3,2019-11-20,2019-08-26,-86
1453661,12/29/2017,12/29/2017,1,15.485,1,2017-12-29,2017-12-29,0
145397,1/11/2018,9/14/2017,25,115.43951,4,2018-01-11,2017-09-14,-119
1454101,4/17/2018,7/5/2018,11,208.31,3,2018-04-17,2018-07-05,79
145419,10/7/2016,9/6/2016,4,16.606548,2,2016-10-07,2016-09-06,-31
1454581,1/12/2019,9/29/2018,5,17.706,3,2019-01-12,2018-09-29,-105
145485,12/13/2018,8/9/2018,21,208.353,2,2018-12-13,2018-08-09,-126
145497,1/1/2017,9/26/2016,9,40.351941,7,2017-01-01,2016-09-26,-97
145507,3/1/2017,3/1/2017,1,6.145,1,2017-03-01,2017-03-01,0
145519,5/29/2019,5/29/2019,1,3.858,1,2019-05-29,2019-05-29,0
1455861,10/3/2018,10/3/2018,1,7.349,1,2018-10-03,2018-10-03,0
145603,10/9/2016,10/9/2016,1,3.027744,1,2016-10-09,2016-10-09,0
145605,1/24/2020,6/27/2019,11,97.941,5,2020-01-24,2019-06-27,-211
145607,9/22/2017,9/25/2020,2,29.846,2,2017-09-22,2020-09-25,1099
145643,4/19/2018,4/19/2018,1,1.022,1,2018-04-19,2018-04-19,0
145673,12/22/2017,7/9/2017,27,439.33,8,2017-12-22,2017-07-09,-166
1456971,10/25/2018,10/25/2018,1,3.061,1,2018-10-25,2018-10-25,0
145713,10/17/2016,2/23/2017,2,27.479546999999997,1,2016-10-17,2017-02-23,129
1457611,1/12/2018,5/16/2018,3,12.527000000000001,2,2018-01-12,2018-05-16,124
145931,5/11/2018,5/11/2018,1,0.495,1,2018-05-11,2018-05-11,0
1459341,6/5/2018,6/5/2018,1,10.492,1,2018-06-05,2018-06-05,0
145963,1/13/2019,5/26/2018,3,3.6289999999999996,2,2019-01-13,2018-05-26,-232
145985,12/18/2018,12/18/2018,1,9.299,1,2018-12-18,2018-12-18,0
145994,6/5/2018,6/5/2018,1,2.387,1,2018-06-05,2018-06-05,0
146039,5/7/2019,5/7/2019,1,6.872,1,2019-05-07,2019-05-07,0
1460721,10/26/2019,10/26/2019,1,17.794,1,2019-10-26,2019-10-26,0
1460931,5/17/2018,5/17/2018,1,11.3,1,2018-05-17,2018-05-17,0
146101,1/10/2018,7/21/2018,9,55.059,8,2018-01-10,2018-07-21,192
1461281,1/17/2018,7/14/2020,12,109.888,6,2018-01-17,2020-07-14,909
1461841,11/15/2018,11/15/2018,1,0.607,1,2018-11-15,2018-11-15,0
146205,11/20/2019,2/17/2019,3,20.913999999999998,2,2019-11-20,2019-02-17,-276
1462811,7/17/2018,7/17/2018,1,9.012,1,2018-07-17,2018-07-17,0
146295,10/31/2016,10/31/2016,1,3.669,1,2016-10-31,2016-10-31,0
146363,10/11/2019,9/3/2016,18,91.518781,6,2019-10-11,2016-09-03,-1133
1463651,6/26/2019,6/26/2019,1,13.276,1,2019-06-26,2019-06-26,0
1463681,5/18/2018,5/18/2018,1,3.036,1,2018-05-18,2018-05-18,0
1464081,3/29/2018,4/5/2018,2,19.904,2,2018-03-29,2018-04-05,7
1464131,2/17/2018,6/9/2019,8,56.153,5,2018-02-17,2019-06-09,477
146485,1/11/2020,1/11/2020,1,4.183,1,2020-01-11,2020-01-11,0
1464881,12/10/2019,12/10/2019,1,2.421,1,2019-12-10,2019-12-10,0
146497,10/16/2018,4/17/2018,4,39.018,2,2018-10-16,2018-04-17,-182
146499,10/21/2016,12/9/2016,5,56.613506,4,2016-10-21,2016-12-09,49
146503,1/29/2017,4/23/2018,4,46.969,4,2017-01-29,2018-04-23,449
1465101,2/22/2018,2/22/2018,1,16.96,1,2018-02-22,2018-02-22,0
1465231,12/24/2017,12/24/2017,1,9.084,1,2017-12-24,2017-12-24,0
14653,10/3/2017,10/3/2017,1,6.406,1,2017-10-03,2017-10-03,0
146553,3/25/2018,3/25/2018,1,3.446,1,2018-03-25,2018-03-25,0
1465621,11/13/2019,11/13/2019,1,11.574,1,2019-11-13,2019-11-13,0
1465781,11/28/2018,11/28/2018,1,2.771,1,2018-11-28,2018-11-28,0
1465791,1/2/2019,9/22/2019,51,397.368,8,2019-01-02,2019-09-22,263
1466171,2/10/2019,9/20/2018,3,21.533,3,2019-02-10,2018-09-20,-143
146619,1/13/2018,8/7/2018,41,197.573282,10,2018-01-13,2018-08-07,206
1466361,5/19/2018,5/19/2018,1,6.769,1,2018-05-19,2018-05-19,0
1466381,11/13/2018,11/13/2018,1,0.437,1,2018-11-13,2018-11-13,0
1466401,1/18/2018,1/18/2018,2,29.055999999999997,2,2018-01-18,2018-01-18,0
146649,12/14/2018,8/6/2016,5,44.395307,5,2018-12-14,2016-08-06,-860
146659,12/4/2017,2/21/2018,4,52.266000000000005,3,2017-12-04,2018-02-21,79
146729,12/11/2018,12/11/2018,1,6.908,1,2018-12-11,2018-12-11,0
146739,9/25/2017,9/25/2017,1,7.874,1,2017-09-25,2017-09-25,0
1467661,12/21/2017,5/22/2018,2,58.804,2,2017-12-21,2018-05-22,152
146841,5/13/2017,5/13/2017,1,6.6,1,2017-05-13,2017-05-13,0
146849,9/16/2018,9/16/2018,1,4.307,1,2018-09-16,2018-09-16,0
146865,2/28/2019,2/28/2019,1,0.395,1,2019-02-28,2019-02-28,0
1468691,11/8/2018,11/8/2018,1,6.373,1,2018-11-08,2018-11-08,0
146883,10/1/2016,10/1/2016,1,1.226506,1,2016-10-01,2016-10-01,0
146911,10/8/2018,3/6/2018,3,2.5180000000000002,1,2018-10-08,2018-03-06,-216
146951,7/10/2018,7/10/2018,1,4.349,1,2018-07-10,2018-07-10,0
146981,1/17/2017,9/1/2016,6,112.94444,5,2017-01-17,2016-09-01,-138
1469901,3/22/2018,3/22/2018,1,3.82,1,2018-03-22,2018-03-22,0
1470001,12/21/2017,12/21/2017,1,14.773,1,2017-12-21,2017-12-21,0
147047,10/13/2018,7/9/2018,5,25.478,4,2018-10-13,2018-07-09,-96
1470801,8/31/2018,8/31/2018,1,13.015,1,2018-08-31,2018-08-31,0
147085,1/18/2018,9/6/2017,6,121.409202,4,2018-01-18,2017-09-06,-134
147087,4/8/2017,7/8/2017,2,8.368,2,2017-04-08,2017-07-08,91
1471041,2/28/2020,2/28/2020,1,10.155,1,2020-02-28,2020-02-28,0
1471051,1/27/2018,1/27/2018,1,3.658,1,2018-01-27,2018-01-27,0
147117,10/14/2016,10/14/2016,1,4.193571,1,2016-10-14,2016-10-14,0
1472551,6/28/2018,6/28/2018,1,14.446,1,2018-06-28,2018-06-28,0
1472591,4/14/2018,4/14/2018,1,19.965,1,2018-04-14,2018-04-14,0
147291,12/10/2016,7/28/2017,2,4.634,2,2016-12-10,2017-07-28,230
147313,11/5/2016,8/25/2019,2,13.36,2,2016-11-05,2019-08-25,1023
1473821,1/10/2019,9/22/2020,44,114.702,9,2019-01-10,2020-09-22,621
1473851,8/10/2019,8/10/2019,1,17.495,1,2019-08-10,2019-08-10,0
147403,4/14/2019,6/24/2017,2,18.678,2,2019-04-14,2017-06-24,-659
1474051,12/22/2017,12/22/2017,1,2.511,1,2017-12-22,2017-12-22,0
147417,12/6/2018,7/25/2018,4,7.414999999999999,2,2018-12-06,2018-07-25,-134
1474261,1/12/2018,5/17/2018,2,15.478,2,2018-01-12,2018-05-17,125
147441,11/15/2017,9/25/2019,3,12.009,3,2017-11-15,2019-09-25,679
147473,1/10/2017,9/9/2016,214,1756.887137,15,2017-01-10,2016-09-09,-123
1475041,3/23/2018,3/23/2018,1,18.794,1,2018-03-23,2018-03-23,0
147507,1/21/2017,9/4/2016,7,48.577562,2,2017-01-21,2016-09-04,-139
1475371,6/21/2020,7/3/2020,6,101.471,3,2020-06-21,2020-07-03,12
147547,5/15/2019,5/15/2019,1,12.538,1,2019-05-15,2019-05-15,0
1475481,4/8/2019,6/25/2018,3,27.062,3,2019-04-08,2018-06-25,-287
147579,4/28/2017,7/26/2017,15,83.74,8,2017-04-28,2017-07-26,89
1476121,1/14/2019,8/24/2019,29,268.162,8,2019-01-14,2019-08-24,222
1477141,3/16/2019,6/29/2019,3,22.336,3,2019-03-16,2019-06-29,105
1477661,2/14/2019,2/14/2019,1,3.397,1,2019-02-14,2019-02-14,0
147837,12/18/2017,2/17/2018,2,14.686,2,2017-12-18,2018-02-17,61
147893,10/8/2016,10/8/2016,1,13.981179,1,2016-10-08,2016-10-08,0
1478931,3/23/2019,3/23/2019,1,2.675,1,2019-03-23,2019-03-23,0
1479081,1/31/2019,1/31/2019,1,1.127,1,2019-01-31,2019-01-31,0
1479251,12/10/2018,2/28/2019,3,25.378999999999998,2,2018-12-10,2019-02-28,80
1479511,2/4/2018,2/4/2018,1,3.79,1,2018-02-04,2018-02-04,0
1479881,1/10/2020,9/7/2019,25,85.702,5,2020-01-10,2019-09-07,-125
1480011,2/18/2018,9/21/2019,2,6.686999999999999,2,2018-02-18,2019-09-21,580
148013,1/18/2017,9/6/2018,73,682.901,6,2017-01-18,2018-09-06,596
148023,1/28/2020,9/28/2019,36,175.18372,9,2020-01-28,2019-09-28,-122
1480231,5/4/2019,5/4/2019,1,9.723,1,2019-05-04,2019-05-04,0
148029,12/8/2019,12/8/2019,1,5.315,1,2019-12-08,2019-12-08,0
1480521,7/19/2019,7/19/2019,1,12.498,1,2019-07-19,2019-07-19,0
1480751,12/23/2017,12/23/2017,1,6.639,1,2017-12-23,2017-12-23,0
1481011,1/10/2019,8/15/2019,13,57.114,8,2019-01-10,2019-08-15,217
148129,12/2/2019,12/2/2019,1,5.842,1,2019-12-02,2019-12-02,0
148143,12/18/2019,12/18/2019,1,3.536,1,2019-12-18,2019-12-18,0
1481871,7/22/2018,7/22/2018,1,8.345,1,2018-07-22,2018-07-22,0
1482641,1/13/2020,7/16/2018,5,39.468,5,2020-01-13,2018-07-16,-546
1482731,7/21/2019,7/7/2019,2,12.8,1,2019-07-21,2019-07-07,-14
148313,1/3/2019,2/4/2017,2,9.126,2,2019-01-03,2017-02-04,-698
148340,12/12/2017,12/12/2017,1,13.915,1,2017-12-12,2017-12-12,0
1483401,7/22/2019,8/25/2018,2,9.054,2,2019-07-22,2018-08-25,-331
148341,8/1/2018,8/1/2018,1,20.008,1,2018-08-01,2018-08-01,0
148347,1/16/2018,7/28/2017,63,803.32,9,2018-01-16,2017-07-28,-172
148359,1/10/2018,1/10/2018,1,1.179,1,2018-01-10,2018-01-10,0
1483721,6/16/2019,6/16/2019,1,6.298,1,2019-06-16,2019-06-16,0
1483871,2/10/2018,2/10/2018,1,4.175,1,2018-02-10,2018-02-10,0
1483881,1/2/2018,5/17/2018,9,141.482,5,2018-01-02,2018-05-17,135
148399,11/16/2017,8/16/2019,2,1.911,2,2017-11-16,2019-08-16,638
148427,1/13/2020,9/29/2016,59,397.07203,15,2020-01-13,2016-09-29,-1201
148429,9/11/2019,9/11/2019,1,3.34,1,2019-09-11,2019-09-11,0
1484451,12/9/2018,5/6/2018,5,13.334,4,2018-12-09,2018-05-06,-217
148455,5/10/2018,5/10/2018,1,4.41,1,2018-05-10,2018-05-10,0
148483,1/7/2017,9/18/2016,5,31.376799,2,2017-01-07,2016-09-18,-111
148511,8/30/2017,8/31/2017,2,13.026,2,2017-08-30,2017-08-31,1
148518,8/11/2017,8/11/2017,1,2.944,1,2017-08-11,2017-08-11,0
148523,1/30/2018,11/22/2016,2,8.530999999999999,2,2018-01-30,2016-11-22,-434
1485441,1/4/2018,8/3/2018,6,30.259,6,2018-01-04,2018-08-03,211
148571,8/16/2018,9/12/2017,2,5.441,2,2018-08-16,2017-09-12,-338
1486021,2/24/2018,2/24/2018,1,9.671000000000001,1,2018-02-24,2018-02-24,0
148619,8/18/2017,8/18/2017,1,6.281,1,2017-08-18,2017-08-18,0
1486231,11/16/2018,9/28/2018,11,78.682,4,2018-11-16,2018-09-28,-49
1486781,7/31/2018,8/30/2018,3,13.23,3,2018-07-31,2018-08-30,30
148719,7/6/2018,7/6/2018,1,7.85,1,2018-07-06,2018-07-06,0
148725,4/16/2017,8/13/2016,2,19.604593,1,2017-04-16,2016-08-13,-246
1487291,4/19/2018,4/19/2018,1,5.616,1,2018-04-19,2018-04-19,0
1487371,6/1/2019,6/1/2019,1,4.835,1,2019-06-01,2019-06-01,0
148747,6/17/2020,6/19/2020,2,65.398,1,2020-06-17,2020-06-19,2
148751,2/19/2018,8/11/2020,2,9.152000000000001,2,2018-02-19,2020-08-11,904
148753,10/2/2017,10/2/2017,1,1.38,1,2017-10-02,2017-10-02,0
148757,9/15/2019,9/15/2019,1,7.311,1,2019-09-15,2019-09-15,0
148875,4/27/2019,4/27/2019,2,7.885999999999999,2,2019-04-27,2019-04-27,0
1488771,10/11/2020,9/8/2020,54,554.399,7,2020-10-11,2020-09-08,-33
1488991,1/14/2018,8/21/2018,3,18.455,2,2018-01-14,2018-08-21,219
148905,12/21/2017,12/21/2017,1,3.118,1,2017-12-21,2017-12-21,0
148927,2/28/2019,2/28/2019,1,17.926,1,2019-02-28,2019-02-28,0
148937,6/17/2017,8/24/2017,2,17.892,2,2017-06-17,2017-08-24,68
1489571,1/17/2018,1/17/2018,1,9.223,1,2018-01-17,2018-01-17,0
149003,12/8/2018,9/25/2017,2,7.186,2,2018-12-08,2017-09-25,-439
1490121,11/29/2018,11/29/2018,1,4.888,1,2018-11-29,2018-11-29,0
1490721,6/8/2018,6/8/2018,1,8.266,1,2018-06-08,2018-06-08,0
149077,1/19/2019,2/23/2019,2,11.603000000000002,2,2019-01-19,2019-02-23,35
149139,2/9/2019,7/12/2019,2,22.341,2,2019-02-09,2019-07-12,153
149157,11/5/2016,11/5/2016,1,1.497,1,2016-11-05,2016-11-05,0
149177,2/24/2018,8/16/2016,3,22.1817,2,2018-02-24,2016-08-16,-557
1492051,1/7/2020,9/30/2019,7,30.605999999999998,4,2020-01-07,2019-09-30,-99
149237,1/19/2019,3/25/2017,2,11.713000000000001,2,2019-01-19,2017-03-25,-665
1492541,10/27/2018,8/23/2018,4,43.046,3,2018-10-27,2018-08-23,-65
1493021,6/26/2019,6/26/2019,1,7.096,1,2019-06-26,2019-06-26,0
149321,12/10/2018,8/4/2016,3,18.921269,3,2018-12-10,2016-08-04,-858
1493641,1/1/2018,12/19/2018,3,10.696,3,2018-01-01,2018-12-19,352
1493881,2/19/2018,2/19/2018,1,17.739,1,2018-02-19,2018-02-19,0
149393,8/15/2017,8/8/2017,2,9.244,2,2017-08-15,2017-08-08,-7
149397,10/25/2016,10/25/2016,1,5.352983,1,2016-10-25,2016-10-25,0
149443,7/25/2018,7/25/2018,1,9.855,1,2018-07-25,2018-07-25,0
1494471,10/28/2018,10/28/2018,1,12.209,1,2018-10-28,2018-10-28,0
149467,5/25/2017,5/25/2017,1,6.613,1,2017-05-25,2017-05-25,0
149477,5/15/2017,6/2/2017,3,24.535,3,2017-05-15,2017-06-02,18
149495,8/28/2016,8/28/2016,1,3.338503,1,2016-08-28,2016-08-28,0
149513,11/1/2018,8/6/2016,3,25.773949,3,2018-11-01,2016-08-06,-817
149516,11/19/2017,5/13/2018,2,8.01,1,2017-11-19,2018-05-13,175
1495181,1/31/2019,1/31/2019,1,13.986,1,2019-01-31,2019-01-31,0
1496271,7/14/2018,7/14/2018,1,11.969,1,2018-07-14,2018-07-14,0
1497161,5/17/2018,8/23/2018,3,13.714,2,2018-05-17,2018-08-23,98
1498031,10/3/2019,10/3/2019,1,4.491,1,2019-10-03,2019-10-03,0
1498301,1/19/2018,3/28/2018,5,79.134,4,2018-01-19,2018-03-28,68
1498331,12/9/2018,4/14/2019,2,9.533,1,2018-12-09,2019-04-14,126
149837,8/14/2017,8/14/2017,1,15.785,1,2017-08-14,2017-08-14,0
149847,1/21/2020,8/10/2017,12,89.802,5,2020-01-21,2017-08-10,-894
1498701,1/4/2019,1/4/2019,1,4.923,1,2019-01-04,2019-01-04,0
1498761,4/12/2019,4/12/2019,1,7.469,1,2019-04-12,2019-04-12,0
149937,1/10/2017,9/9/2016,29,727.580613,7,2017-01-10,2016-09-09,-123
149943,4/2/2019,4/2/2019,1,26.954,1,2019-04-02,2019-04-02,0
149955,6/28/2019,6/28/2019,1,0.974,1,2019-06-28,2019-06-28,0
1499791,9/28/2018,9/28/2018,1,2.051,1,2018-09-28,2018-09-28,0
1499831,1/11/2019,10/4/2019,2,16.826,2,2019-01-11,2019-10-04,266
149995,3/21/2018,5/28/2019,2,9.129999999999999,2,2018-03-21,2019-05-28,433
1500321,5/20/2019,5/20/2019,1,7.382,1,2019-05-20,2019-05-20,0
150045,10/30/2016,5/27/2019,2,32.809,1,2016-10-30,2019-05-27,939
1500481,1/17/2019,1/17/2019,1,10.915,1,2019-01-17,2019-01-17,0
150051,1/13/2017,12/14/2016,2,12.868,2,2017-01-13,2016-12-14,-30
1500921,10/30/2020,9/27/2020,4,58.847,2,2020-10-30,2020-09-27,-33
150109,11/15/2017,3/23/2019,2,16.814999999999998,2,2017-11-15,2019-03-23,493
1501991,7/30/2019,7/30/2019,1,5.944,1,2019-07-30,2019-07-30,0
150241,8/19/2016,8/19/2016,1,10.802068,1,2016-08-19,2016-08-19,0
150263,11/4/2017,6/17/2017,6,61.054,3,2017-11-04,2017-06-17,-140
150351,9/19/2019,9/19/2019,1,3.146,1,2019-09-19,2019-09-19,0
150383,5/31/2018,9/7/2017,3,29.408,2,2018-05-31,2017-09-07,-266
1505671,12/30/2017,4/15/2018,2,12.048000000000002,2,2017-12-30,2018-04-15,106
150597,2/9/2017,2/9/2017,1,9.746,1,2017-02-09,2017-02-09,0
1506431,1/14/2018,7/12/2018,8,40.071,4,2018-01-14,2018-07-12,179
1506561,3/21/2018,3/9/2018,4,43.357,1,2018-03-21,2018-03-09,-12
1506851,12/4/2018,2/8/2019,3,25.654,2,2018-12-04,2019-02-08,66
1507011,2/5/2020,2/5/2020,1,6.234,1,2020-02-05,2020-02-05,0
150793,12/13/2018,12/13/2018,1,4.096,1,2018-12-13,2018-12-13,0
1507981,11/17/2019,12/30/2017,3,24.383,3,2019-11-17,2017-12-30,-687
150865,1/20/2018,9/22/2019,15,87.980236,10,2018-01-20,2019-09-22,610
1508661,1/20/2018,9/14/2019,34,98.095,11,2018-01-20,2019-09-14,602
150947,1/7/2017,9/25/2016,5,74.188654,3,2017-01-07,2016-09-25,-104
1509761,9/11/2018,9/11/2018,1,9.185,1,2018-09-11,2018-09-11,0
1509951,1/11/2018,1/13/2018,2,6.917,2,2018-01-11,2018-01-13,2
150999,12/11/2017,8/31/2017,23,33.711,6,2017-12-11,2017-08-31,-102
151,10/6/2018,8/3/2017,12,55.275,10,2018-10-06,2017-08-03,-429
1510091,6/20/2018,6/20/2018,1,21.129,1,2018-06-20,2018-06-20,0
151045,10/1/2019,8/12/2017,6,53.085,4,2019-10-01,2017-08-12,-780
1510551,1/15/2018,9/22/2020,21,85.595,6,2018-01-15,2020-09-22,981
151059,1/21/2018,9/25/2018,5,22.548,4,2018-01-21,2018-09-25,247
151189,10/12/2016,9/14/2016,11,31.46697,5,2016-10-12,2016-09-14,-28
151199,2/26/2017,2/26/2017,1,6.24,1,2017-02-26,2017-02-26,0
1512151,2/22/2018,2/22/2018,1,12.139000000000001,1,2018-02-22,2018-02-22,0
1512241,10/14/2018,10/14/2018,1,5.057,1,2018-10-14,2018-10-14,0
1512591,4/21/2018,4/21/2018,1,8.16,1,2018-04-21,2018-04-21,0
151317,11/15/2019,9/10/2019,2,10.394,2,2019-11-15,2019-09-10,-66
1513341,1/14/2019,9/28/2019,81,1483.708,14,2019-01-14,2019-09-28,257
151335,1/8/2018,9/7/2017,19,173.608429,7,2018-01-08,2017-09-07,-123
151400,4/6/2019,4/6/2019,1,6.851,1,2019-04-06,2019-04-06,0
1514291,1/7/2018,1/7/2018,1,16.98,1,2018-01-07,2018-01-07,0
151467,12/21/2017,8/3/2018,2,6.037999999999999,1,2017-12-21,2018-08-03,225
151505,1/4/2017,8/30/2016,2,2.50069,2,2017-01-04,2016-08-30,-127
1515211,2/18/2019,9/5/2020,2,11.306000000000001,1,2019-02-18,2020-09-05,565
1515341,1/27/2018,1/27/2018,1,0.596,1,2018-01-27,2018-01-27,0
151545,3/1/2018,3/1/2018,2,4.952999999999999,2,2018-03-01,2018-03-01,0
1515521,1/17/2018,3/23/2018,2,12.515,1,2018-01-17,2018-03-23,65
1515631,1/2/2018,9/20/2018,8,38.339,4,2018-01-02,2018-09-20,261
1515971,5/4/2019,9/21/2018,2,5.114,2,2019-05-04,2018-09-21,-225
1516011,4/29/2018,4/29/2018,1,4.331,1,2018-04-29,2018-04-29,0
151617,1/11/2017,9/8/2017,237,2359.233986,16,2017-01-11,2017-09-08,240
151623,5/13/2017,5/13/2017,1,2.072,1,2017-05-13,2017-05-13,0
151631,7/22/2017,7/22/2017,1,4.401,1,2017-07-22,2017-07-22,0
151643,5/28/2017,5/28/2017,1,5.395,1,2017-05-28,2017-05-28,0
1516451,6/15/2018,7/27/2018,2,21.541,2,2018-06-15,2018-07-27,42
1516891,1/10/2018,5/19/2018,2,38.253,1,2018-01-10,2018-05-19,129
151733,1/14/2018,9/24/2017,13,37.82985,3,2018-01-14,2017-09-24,-112
1518021,1/20/2018,3/25/2018,2,9.424,2,2018-01-20,2018-03-25,64
151805,3/23/2019,3/23/2019,1,10.686,1,2019-03-23,2019-03-23,0
1519701,2/20/2019,2/20/2019,1,11.4,1,2019-02-20,2019-02-20,0
1519781,4/29/2018,4/29/2018,1,11.292,1,2018-04-29,2018-04-29,0
1519841,2/18/2018,2/18/2018,1,6.678,1,2018-02-18,2018-02-18,0
15203,1/5/2018,9/20/2018,4,25.623,3,2018-01-05,2018-09-20,258
1520571,1/11/2018,12/9/2018,19,245.28300000000002,3,2018-01-11,2018-12-09,332
152099,7/3/2017,7/3/2017,1,4.127,1,2017-07-03,2017-07-03,0
1521031,1/29/2018,11/9/2019,4,7.8549999999999995,3,2018-01-29,2019-11-09,649
1521101,10/21/2020,8/6/2019,4,20.290000000000003,4,2020-10-21,2019-08-06,-442
152111,4/15/2017,4/15/2017,1,9.085,1,2017-04-15,2017-04-15,0
1521951,4/20/2018,4/20/2018,1,33.362,1,2018-04-20,2018-04-20,0
1522241,5/24/2018,5/24/2018,1,3.662,1,2018-05-24,2018-05-24,0
152225,12/15/2016,8/30/2016,3,11.318501,2,2016-12-15,2016-08-30,-107
1522391,1/14/2020,9/7/2018,103,1083.416,6,2020-01-14,2018-09-07,-494
1522511,12/11/2019,8/19/2019,4,18.313,2,2019-12-11,2019-08-19,-114
1522691,3/18/2019,3/2/2019,2,15.184000000000001,2,2019-03-18,2019-03-02,-16
152325,10/17/2018,9/8/2018,3,17.518,3,2018-10-17,2018-09-08,-39
1523281,1/15/2020,9/25/2018,43,653.832,8,2020-01-15,2018-09-25,-477
1523741,2/3/2018,2/3/2018,1,7.817,1,2018-02-03,2018-02-03,0
1523761,1/14/2018,1/14/2018,1,4.311,1,2018-01-14,2018-01-14,0
1523811,1/31/2020,1/31/2020,1,14.99,1,2020-01-31,2020-01-31,0
1523961,6/25/2018,6/25/2018,1,5.183,1,2018-06-25,2018-06-25,0
1524181,6/30/2018,6/30/2018,1,13.617,1,2018-06-30,2018-06-30,0
1524311,1/23/2018,8/30/2019,9,59.729,6,2018-01-23,2019-08-30,584
1524461,10/1/2018,9/14/2018,16,169.627,3,2018-10-01,2018-09-14,-17
152451,10/21/2016,12/20/2019,3,12.566681,2,2016-10-21,2019-12-20,1155
1525111,3/17/2018,3/17/2018,1,10.87,1,2018-03-17,2018-03-17,0
152545,1/11/2017,11/11/2016,2,24.354,2,2017-01-11,2016-11-11,-61
152547,1/31/2018,1/31/2018,1,5.007,1,2018-01-31,2018-01-31,0
152593,8/20/2016,8/20/2016,1,0.784285,1,2016-08-20,2016-08-20,0
1526091,7/28/2019,7/28/2019,1,9.104,1,2019-07-28,2019-07-28,0
1526121,11/13/2019,7/18/2020,3,13.845,2,2019-11-13,2020-07-18,248
1526281,10/6/2018,4/15/2018,4,10.075,3,2018-10-06,2018-04-15,-174
1526431,3/23/2019,8/4/2019,4,81.246,3,2019-03-23,2019-08-04,134
152673,1/1/2017,9/4/2016,66,1769.431371,6,2017-01-01,2016-09-04,-119
1527681,1/23/2018,2/7/2018,4,60.714,3,2018-01-23,2018-02-07,15
152787,8/9/2017,8/9/2017,1,2.904,1,2017-08-09,2017-08-09,0
152793,8/7/2016,8/7/2016,1,14.200884,1,2016-08-07,2016-08-07,0
152795,8/5/2016,8/5/2016,1,2.229278,1,2016-08-05,2016-08-05,0
1527971,4/29/2019,7/5/2019,2,7.345,2,2019-04-29,2019-07-05,67
152807,12/4/2019,12/4/2019,1,4.213,1,2019-12-04,2019-12-04,0
152891,11/20/2016,8/20/2016,4,32.818197999999995,3,2016-11-20,2016-08-20,-92
1529021,1/4/2020,2/8/2020,5,22.145,1,2020-01-04,2020-02-08,35
1529731,7/14/2019,7/14/2019,1,10.247,1,2019-07-14,2019-07-14,0
1529761,2/6/2018,2/6/2018,1,8.864,1,2018-02-06,2018-02-06,0
1529921,11/20/2018,2/28/2019,2,14.823,2,2018-11-20,2019-02-28,100
1530771,8/5/2018,8/5/2018,1,12.84,1,2018-08-05,2018-08-05,0
153117,1/13/2020,9/9/2019,129,1375.305,12,2020-01-13,2019-09-09,-126
153143,7/5/2018,7/5/2018,1,14.024,1,2018-07-05,2018-07-05,0
1531501,10/16/2019,9/20/2018,18,105.178,3,2019-10-16,2018-09-20,-391
1531571,4/8/2018,4/8/2018,1,6.987,1,2018-04-08,2018-04-08,0
1531651,3/2/2018,3/2/2018,1,0.381,1,2018-03-02,2018-03-02,0
1531931,1/20/2018,1/20/2018,1,8.812,1,2018-01-20,2018-01-20,0
153229,1/10/2020,9/9/2019,109,1378.836,10,2020-01-10,2019-09-09,-123
153239,12/20/2018,6/7/2017,3,13.039,3,2018-12-20,2017-06-07,-561
1533061,1/21/2020,8/22/2019,4,30.817999999999998,3,2020-01-21,2019-08-22,-152
153311,1/13/2018,5/14/2018,3,11.094999999999999,2,2018-01-13,2018-05-14,121
1533151,1/16/2020,2/13/2020,4,41.42,2,2020-01-16,2020-02-13,28
1533161,8/25/2019,9/2/2019,2,11.856000000000002,2,2019-08-25,2019-09-02,8
153325,10/5/2017,10/5/2017,1,8.329,1,2017-10-05,2017-10-05,0
1533261,10/16/2018,9/28/2018,5,23.706,3,2018-10-16,2018-09-28,-18
153351,5/18/2018,5/18/2018,1,3.43,1,2018-05-18,2018-05-18,0
1533581,7/23/2018,9/20/2018,2,10.095,1,2018-07-23,2018-09-20,59
153367,10/15/2016,4/20/2019,4,8.602775,3,2016-10-15,2019-04-20,917
153381,12/28/2016,8/18/2018,2,8.76,2,2016-12-28,2018-08-18,598
1533821,6/21/2018,6/21/2018,1,6.031,1,2018-06-21,2018-06-21,0
153395,11/15/2017,9/5/2018,4,56.562,4,2017-11-15,2018-09-05,294
1533971,4/24/2019,4/24/2019,1,1.149,1,2019-04-24,2019-04-24,0
153413,10/8/2018,9/16/2017,4,52.784,3,2018-10-08,2017-09-16,-387
153439,10/29/2016,5/13/2018,6,34.530801,4,2016-10-29,2018-05-13,561
1534441,10/19/2020,10/22/2020,2,11.689,1,2020-10-19,2020-10-22,3
1534531,2/8/2018,2/8/2018,1,1.252,1,2018-02-08,2018-02-08,0
1534741,12/1/2018,7/13/2019,4,49.315,2,2018-12-01,2019-07-13,224
153489,1/29/2017,9/4/2016,20,125.97394200000001,5,2017-01-29,2016-09-04,-147
1534981,1/11/2018,9/22/2018,24,471.91499999999996,8,2018-01-11,2018-09-22,254
1535741,1/10/2019,2/21/2019,5,22.89,3,2019-01-10,2019-02-21,42
1536111,10/22/2018,2/26/2019,5,80.20400000000001,2,2018-10-22,2019-02-26,127
153659,1/14/2019,9/6/2018,17,164.141,8,2019-01-14,2018-09-06,-130
153673,10/11/2017,9/5/2019,19,26.435,4,2017-10-11,2019-09-05,694
1536991,1/4/2018,1/4/2018,1,5.431,1,2018-01-04,2018-01-04,0
1537131,1/16/2020,9/28/2018,18,198.084,6,2020-01-16,2018-09-28,-475
153727,12/23/2017,12/23/2017,1,50.145,1,2017-12-23,2017-12-23,0
153729,1/30/2018,3/7/2019,3,15.077,3,2018-01-30,2019-03-07,401
1537391,2/2/2018,4/10/2018,2,5.848000000000001,1,2018-02-02,2018-04-10,67
153757,9/24/2019,9/24/2019,1,11.65,1,2019-09-24,2019-09-24,0
1537621,1/11/2020,9/13/2019,5,56.066,5,2020-01-11,2019-09-13,-120
1537901,11/1/2018,11/1/2018,1,24.081,1,2018-11-01,2018-11-01,0
153793,8/26/2017,9/1/2018,2,12.091000000000001,2,2017-08-26,2018-09-01,371
153797,5/4/2018,5/4/2018,1,3.411,1,2018-05-04,2018-05-04,0
153837,6/24/2019,7/21/2018,2,11.677,2,2019-06-24,2018-07-21,-338
153841,11/2/2017,11/2/2017,1,15.378,1,2017-11-02,2017-11-02,0
153879,8/24/2017,8/24/2017,1,3.752,1,2017-08-24,2017-08-24,0
1539081,10/28/2018,10/4/2018,2,6.6979999999999995,2,2018-10-28,2018-10-04,-24
153925,1/18/2020,1/18/2020,1,10.015,1,2020-01-18,2020-01-18,0
1539331,4/12/2019,7/7/2019,2,12.0,1,2019-04-12,2019-07-07,86
1539811,10/3/2020,10/3/2020,1,1.699,1,2020-10-03,2020-10-03,0
1539931,10/27/2019,3/10/2019,2,13.521,2,2019-10-27,2019-03-10,-231
154055,6/27/2019,6/27/2019,1,4.085,1,2019-06-27,2019-06-27,0
154101,1/12/2017,9/3/2016,65,476.889668,10,2017-01-12,2016-09-03,-131
1541511,1/12/2019,9/8/2020,104,1266.243,8,2019-01-12,2020-09-08,605
154171,10/6/2018,10/6/2018,1,10.664,1,2018-10-06,2018-10-06,0
154191,1/16/2019,9/24/2017,7,86.464,5,2019-01-16,2017-09-24,-479
1542071,1/18/2018,2/2/2018,2,3.364,2,2018-01-18,2018-02-02,15
1542091,12/13/2018,8/17/2019,2,29.444,2,2018-12-13,2019-08-17,247
1542211,2/12/2018,2/12/2018,1,4.388,1,2018-02-12,2018-02-12,0
154239,5/22/2019,9/28/2019,2,16.494,2,2019-05-22,2019-09-28,129
154279,1/16/2020,9/8/2016,18,397.280411,10,2020-01-16,2016-09-08,-1225
154307,9/8/2017,9/8/2017,1,5.362,1,2017-09-08,2017-09-08,0
154309,12/29/2016,4/20/2017,2,4.461,2,2016-12-29,2017-04-20,112
1543621,1/9/2019,2/27/2019,2,21.169,1,2019-01-09,2019-02-27,49
1543781,6/16/2018,6/16/2018,1,11.677,1,2018-06-16,2018-06-16,0
1544091,5/24/2019,5/24/2019,1,7.149,1,2019-05-24,2019-05-24,0
154427,10/16/2018,4/23/2019,17,199.774,4,2018-10-16,2019-04-23,189
154447,10/10/2018,10/10/2018,1,4.584,1,2018-10-10,2018-10-10,0
1544521,2/16/2018,2/16/2018,1,6.908,1,2018-02-16,2018-02-16,0
154467,12/5/2019,12/5/2019,1,11.137,1,2019-12-05,2019-12-05,0
1544691,1/24/2020,3/24/2018,3,8.694,1,2020-01-24,2018-03-24,-671
1544811,7/6/2018,7/6/2018,1,5.27,1,2018-07-06,2018-07-06,0
1544931,1/7/2020,9/15/2020,16,96.008,7,2020-01-07,2020-09-15,252
1545291,1/30/2018,4/3/2018,9,38.106,4,2018-01-30,2018-04-03,63
1545471,2/1/2020,8/18/2018,9,70.85300000000001,7,2020-02-01,2018-08-18,-532
1545501,1/19/2018,1/19/2018,1,10.914,1,2018-01-19,2018-01-19,0
154551,1/12/2017,9/5/2016,126,1297.695952,14,2017-01-12,2016-09-05,-129
1545911,1/6/2018,1/6/2018,1,6.354,1,2018-01-06,2018-01-06,0
15463,1/18/2017,2/6/2020,5,42.571,4,2017-01-18,2020-02-06,1114
1546601,1/25/2019,1/25/2019,1,11.02,1,2019-01-25,2019-01-25,0
1546771,11/3/2018,6/28/2018,3,19.689,2,2018-11-03,2018-06-28,-128
1546911,1/26/2018,9/22/2018,5,41.576,3,2018-01-26,2018-09-22,239
1547001,1/15/2018,6/7/2018,3,10.752,2,2018-01-15,2018-06-07,143
154701,2/1/2020,2/1/2020,1,1.757,1,2020-02-01,2020-02-01,0
1547191,3/7/2019,3/7/2019,1,3.2,1,2019-03-07,2019-03-07,0
154729,7/22/2017,7/22/2017,1,2.046,1,2017-07-22,2017-07-22,0
1547601,1/12/2020,9/8/2018,135,1461.475,11,2020-01-12,2018-09-08,-491
154797,2/9/2017,2/9/2017,1,1.921,1,2017-02-09,2017-02-09,0
154857,10/1/2016,4/8/2018,4,64.982048,3,2016-10-01,2018-04-08,554
1548651,3/22/2018,3/22/2018,1,5.582,1,2018-03-22,2018-03-22,0
1548871,1/28/2018,4/29/2018,6,34.478,3,2018-01-28,2018-04-29,91
1549271,12/29/2018,12/29/2018,1,3.424,1,2018-12-29,2018-12-29,0
154955,8/27/2016,8/30/2017,2,11.845210000000002,2,2016-08-27,2017-08-30,368
1549751,1/16/2020,9/25/2019,36,424.945,3,2020-01-16,2019-09-25,-113
1550051,2/19/2018,2/19/2018,1,1.656,1,2018-02-19,2018-02-19,0
155021,8/21/2016,9/3/2016,3,14.949075,3,2016-08-21,2016-09-03,13
1550261,6/21/2020,6/21/2020,1,9.788,1,2020-06-21,2020-06-21,0
1550681,1/10/2020,9/7/2018,193,1981.579,9,2020-01-10,2018-09-07,-490
155107,1/18/2018,8/3/2017,7,64.606,4,2018-01-18,2017-08-03,-168
155137,10/6/2017,8/14/2017,9,8.290000000000001,6,2017-10-06,2017-08-14,-53
1551501,5/18/2018,5/18/2018,1,5.858,1,2018-05-18,2018-05-18,0
1551751,5/13/2018,6/2/2018,2,11.263,1,2018-05-13,2018-06-02,20
155195,10/11/2017,10/11/2017,1,11.983,1,2017-10-11,2017-10-11,0
1552041,4/13/2019,4/13/2019,1,30.406,1,2019-04-13,2019-04-13,0
155213,12/11/2018,8/4/2019,8,20.965,7,2018-12-11,2019-08-04,236
155269,11/8/2018,7/7/2019,4,45.311,2,2018-11-08,2019-07-07,241
155273,2/10/2017,2/10/2017,1,7.349,1,2017-02-10,2017-02-10,0
1553371,8/30/2019,8/30/2019,1,1.163,1,2019-08-30,2019-08-30,0
155385,11/4/2017,12/29/2016,2,21.922,2,2017-11-04,2016-12-29,-310
155395,2/26/2020,3/16/2020,3,9.756,2,2020-02-26,2020-03-16,19
1554271,2/3/2018,5/15/2018,3,20.805,3,2018-02-03,2018-05-15,101
155433,8/21/2018,8/21/2018,1,2.12,1,2018-08-21,2018-08-21,0
1554761,1/26/2020,9/25/2020,59,704.888,5,2020-01-26,2020-09-25,243
155533,10/5/2017,10/5/2017,1,0.039,1,2017-10-05,2017-10-05,0
155561,5/4/2018,5/4/2018,1,7.541,1,2018-05-04,2018-05-04,0
1555891,7/16/2019,7/16/2019,1,3.946,1,2019-07-16,2019-07-16,0
155591,1/22/2017,9/25/2016,26,73.752738,5,2017-01-22,2016-09-25,-119
155593,10/24/2018,8/12/2017,5,32.789,4,2018-10-24,2017-08-12,-438
1556211,6/11/2019,6/11/2019,1,14.121,1,2019-06-11,2019-06-11,0
1556411,10/1/2019,9/9/2019,24,102.332,4,2019-10-01,2019-09-09,-22
1556661,1/22/2018,1/9/2018,3,38.613,2,2018-01-22,2018-01-09,-13
1557521,6/14/2019,6/14/2019,1,20.321,1,2019-06-14,2019-06-14,0
155761,6/6/2018,6/6/2018,1,6.924,1,2018-06-06,2018-06-06,0
155791,1/10/2017,9/9/2019,142,1228.720124,6,2017-01-10,2019-09-09,972
1558441,1/25/2020,1/25/2020,1,15.147,1,2020-01-25,2020-01-25,0
155865,1/4/2019,8/6/2016,3,9.541936,3,2019-01-04,2016-08-06,-881
155915,1/9/2017,9/14/2016,4,18.194716,3,2017-01-09,2016-09-14,-117
155917,9/11/2019,9/11/2019,1,10.391,1,2019-09-11,2019-09-11,0
1559511,6/5/2018,6/5/2018,1,2.494,1,2018-06-05,2018-06-05,0
155973,10/6/2016,8/3/2017,8,71.412043,2,2016-10-06,2017-08-03,301
1559801,1/26/2018,1/26/2018,1,1.477,1,2018-01-26,2018-01-26,0
1560521,8/24/2019,9/13/2018,2,6.047,2,2019-08-24,2018-09-13,-345
1561061,6/23/2018,6/23/2018,1,7.79,1,2018-06-23,2018-06-23,0
1561191,1/20/2018,1/20/2018,1,3.076,1,2018-01-20,2018-01-20,0
156159,3/8/2018,9/1/2017,3,12.264,3,2018-03-08,2017-09-01,-188
156163,10/20/2016,10/20/2016,1,3.33716,1,2016-10-20,2016-10-20,0
156173,6/28/2019,8/11/2018,2,9.57,1,2019-06-28,2018-08-11,-321
1561941,5/21/2018,5/21/2018,1,5.773,1,2018-05-21,2018-05-21,0
1562191,3/27/2019,4/20/2018,3,20.117,3,2019-03-27,2018-04-20,-341
156239,3/9/2019,3/9/2019,1,4.078,1,2019-03-09,2019-03-09,0
1562761,4/17/2019,4/17/2019,1,14.745,1,2019-04-17,2019-04-17,0
156311,1/13/2019,1/13/2019,1,0.048,1,2019-01-13,2019-01-13,0
156323,6/22/2020,6/22/2020,1,5.399,1,2020-06-22,2020-06-22,0
156423,6/13/2018,6/13/2018,1,4.219,1,2018-06-13,2018-06-13,0
1564331,1/17/2018,8/9/2018,47,466.362,6,2018-01-17,2018-08-09,204
1564431,2/18/2020,2/18/2020,1,3.285,1,2020-02-18,2020-02-18,0
156473,10/27/2019,9/30/2019,5,26.785,3,2019-10-27,2019-09-30,-27
156489,12/9/2019,12/9/2019,1,17.166,1,2019-12-09,2019-12-09,0
1565021,9/24/2019,9/24/2019,1,1.403,1,2019-09-24,2019-09-24,0
1565831,1/11/2018,1/11/2018,1,14.445,1,2018-01-11,2018-01-11,0
156587,1/4/2020,9/14/2019,3,20.523,2,2020-01-04,2019-09-14,-112
1566051,5/26/2018,5/26/2018,1,5.577,1,2018-05-26,2018-05-26,0
1566471,3/25/2020,9/9/2020,24,93.668,3,2020-03-25,2020-09-09,168
1567101,10/1/2018,9/7/2018,19,104.767,4,2018-10-01,2018-09-07,-24
156733,8/7/2017,8/7/2017,1,4.484,1,2017-08-07,2017-08-07,0
1567921,2/13/2019,8/10/2018,2,10.089,2,2019-02-13,2018-08-10,-187
156823,1/27/2018,9/23/2017,14,130.499479,9,2018-01-27,2017-09-23,-126
1568231,1/10/2019,5/9/2019,105,624.257,9,2019-01-10,2019-05-09,119
1568401,1/19/2019,9/8/2019,22,492.308,9,2019-01-19,2019-09-08,232
156949,2/3/2018,6/24/2017,2,3.02,1,2018-02-03,2017-06-24,-224
1569511,1/12/2018,1/12/2018,1,22.488,1,2018-01-12,2018-01-12,0
1569971,1/20/2019,7/14/2019,7,30.151,4,2019-01-20,2019-07-14,175
157041,1/15/2019,9/22/2018,13,112.582,9,2019-01-15,2018-09-22,-115
1571441,5/24/2018,5/24/2018,1,8.444,1,2018-05-24,2018-05-24,0
1571461,1/21/2018,1/21/2018,1,3.869,1,2018-01-21,2018-01-21,0
157175,2/1/2018,8/2/2018,6,12.317,4,2018-02-01,2018-08-02,182
1571761,10/4/2019,7/16/2018,6,150.162,2,2019-10-04,2018-07-16,-445
157233,1/25/2018,12/18/2017,3,34.22,3,2018-01-25,2017-12-18,-38
1572371,1/28/2018,1/28/2018,1,6.591,1,2018-01-28,2018-01-28,0
1572431,4/6/2018,4/6/2018,1,0.159,1,2018-04-06,2018-04-06,0
157269,10/21/2016,9/9/2016,5,40.139049,5,2016-10-21,2016-09-09,-42
1573851,1/15/2020,10/11/2019,2,12.486999999999998,2,2020-01-15,2019-10-11,-96
1573921,2/16/2018,6/22/2019,3,38.306,2,2018-02-16,2019-06-22,491
1574,10/28/2017,7/2/2017,4,28.3,3,2017-10-28,2017-07-02,-118
1574371,1/25/2020,4/2/2018,5,25.826999999999998,5,2020-01-25,2018-04-02,-663
157465,12/15/2018,12/15/2018,1,12.612,1,2018-12-15,2018-12-15,0
1574681,1/26/2018,1/26/2018,1,5.214,1,2018-01-26,2018-01-26,0
157477,1/11/2019,9/6/2018,31,520.616,10,2019-01-11,2018-09-06,-127
1575001,11/1/2019,11/1/2019,1,16.255,1,2019-11-01,2019-11-01,0
157511,3/6/2017,3/6/2017,1,1.483,1,2017-03-06,2017-03-06,0
157513,12/27/2017,5/27/2019,3,21.025,2,2017-12-27,2019-05-27,516
1575321,1/12/2019,9/2/2019,9,48.433,4,2019-01-12,2019-09-02,233
1575421,1/21/2018,8/8/2018,8,13.552999999999999,5,2018-01-21,2018-08-08,199
157601,7/7/2017,8/22/2018,2,4.24,2,2017-07-07,2018-08-22,411
1576061,1/12/2019,9/3/2018,11,76.726,7,2019-01-12,2018-09-03,-131
1576121,2/20/2018,2/20/2018,1,3.575,1,2018-02-20,2018-02-20,0
157641,9/28/2018,9/28/2018,1,5.258,1,2018-09-28,2018-09-28,0
1576431,3/15/2019,3/15/2019,1,0.518,1,2019-03-15,2019-03-15,0
157647,2/1/2018,7/6/2018,6,45.869,1,2018-02-01,2018-07-06,155
1576801,7/1/2018,7/1/2018,1,5.383,1,2018-07-01,2018-07-01,0
157709,2/7/2020,8/7/2020,6,26.854,4,2020-02-07,2020-08-07,182
1577971,12/26/2019,6/18/2019,2,13.064,1,2019-12-26,2019-06-18,-191
157849,10/11/2017,9/14/2018,2,18.078,2,2017-10-11,2018-09-14,338
1578561,11/4/2019,9/18/2018,36,782.587,4,2019-11-04,2018-09-18,-412
1578811,2/17/2019,5/19/2018,3,27.897,2,2019-02-17,2018-05-19,-274
1579191,10/26/2018,9/28/2018,5,15.247,2,2018-10-26,2018-09-28,-28
157955,10/15/2017,4/21/2018,5,48.496,3,2017-10-15,2018-04-21,188
1579741,2/21/2018,2/21/2018,1,9.987,1,2018-02-21,2018-02-21,0
158,10/26/2019,10/26/2019,1,8.689,1,2019-10-26,2019-10-26,0
158007,10/17/2017,9/8/2016,5,73.560456,3,2017-10-17,2016-09-08,-404
158019,10/20/2016,10/20/2016,1,8.691827,1,2016-10-20,2016-10-20,0
1580391,11/13/2018,8/15/2018,2,25.019,1,2018-11-13,2018-08-15,-90
1580411,1/14/2018,1/14/2018,1,2.7,1,2018-01-14,2018-01-14,0
1580491,6/21/2018,6/21/2018,1,5.411,1,2018-06-21,2018-06-21,0
158089,8/25/2019,8/25/2019,1,3.059,1,2019-08-25,2019-08-25,0
158157,6/16/2018,6/16/2018,1,4.062,1,2018-06-16,2018-06-16,0
158203,10/13/2016,6/22/2018,3,10.715073,3,2016-10-13,2018-06-22,617
158207,1/30/2019,9/20/2019,13,72.135,6,2019-01-30,2019-09-20,233
1582121,1/21/2018,8/8/2018,5,40.027,5,2018-01-21,2018-08-08,199
1582211,2/3/2020,7/27/2019,3,21.354,2,2020-02-03,2019-07-27,-191
1583071,4/17/2018,4/17/2018,1,0.018,1,2018-04-17,2018-04-17,0
158323,10/17/2018,10/17/2018,1,4.928,1,2018-10-17,2018-10-17,0
158353,1/21/2017,9/14/2017,16,139.754062,7,2017-01-21,2017-09-14,236
1583611,7/21/2019,7/21/2019,1,4.53,1,2019-07-21,2019-07-21,0
158375,8/2/2016,8/2/2016,1,3.617607,1,2016-08-02,2016-08-02,0
1584001,4/22/2018,6/2/2018,2,7.134,1,2018-04-22,2018-06-02,41
1584011,2/26/2018,3/8/2018,13,54.843,7,2018-02-26,2018-03-08,10
158451,1/1/2019,8/10/2017,5,47.050000000000004,5,2019-01-01,2017-08-10,-509
1585191,7/24/2018,7/24/2018,1,7.359,1,2018-07-24,2018-07-24,0
1585261,9/27/2018,9/27/2018,1,0.428,1,2018-09-27,2018-09-27,0
158551,1/13/2018,8/26/2018,14,33.103,3,2018-01-13,2018-08-26,225
1585681,1/16/2018,9/27/2018,44,453.126,7,2018-01-16,2018-09-27,254
1585951,3/27/2019,3/27/2019,1,6.89,1,2019-03-27,2019-03-27,0
1585971,1/16/2018,1/16/2018,1,5.389,1,2018-01-16,2018-01-16,0
158631,9/9/2017,9/9/2017,1,4.572,1,2017-09-09,2017-09-09,0
1586391,2/3/2018,2/3/2018,1,1.367,1,2018-02-03,2018-02-03,0
1586451,10/20/2018,10/20/2018,1,9.768,1,2018-10-20,2018-10-20,0
1586641,5/27/2019,5/27/2019,1,14.596,1,2019-05-27,2019-05-27,0
1586851,1/30/2020,9/18/2018,17,74.096,4,2020-01-30,2018-09-18,-499
1587151,1/17/2018,5/30/2018,4,46.209,2,2018-01-17,2018-05-30,133
1587231,5/5/2018,5/5/2018,1,6.49,1,2018-05-05,2018-05-05,0
1587481,10/5/2019,10/5/2019,1,12.305,1,2019-10-05,2019-10-05,0
158765,8/13/2016,8/13/2016,1,15.000981,1,2016-08-13,2016-08-13,0
1588521,10/29/2018,10/29/2018,1,21.73,1,2018-10-29,2018-10-29,0
158861,8/24/2017,8/24/2017,1,5.259,1,2017-08-24,2017-08-24,0
158867,1/26/2018,9/4/2016,19,99.95126499999999,8,2018-01-26,2016-09-04,-509
158877,1/21/2017,9/7/2016,38,126.322823,12,2017-01-21,2016-09-07,-136
1588961,1/21/2018,12/14/2018,3,29.131999999999998,3,2018-01-21,2018-12-14,327
1589361,12/22/2018,9/14/2019,3,16.797,3,2018-12-22,2019-09-14,266
158957,3/7/2018,3/7/2018,1,3.285,1,2018-03-07,2018-03-07,0
1589581,1/17/2019,9/5/2018,13,85.46300000000001,10,2019-01-17,2018-09-05,-134
1589971,1/11/2019,9/7/2018,207,1341.522,5,2019-01-11,2018-09-07,-126
159067,10/25/2017,10/25/2017,1,8.951,1,2017-10-25,2017-10-25,0
159089,10/30/2016,9/25/2016,3,20.56503,3,2016-10-30,2016-09-25,-35
1591191,10/11/2019,9/21/2018,6,48.939,6,2019-10-11,2018-09-21,-385
1591321,10/15/2018,10/15/2018,1,6.315,1,2018-10-15,2018-10-15,0
159209,10/27/2018,10/27/2018,1,15.482,1,2018-10-27,2018-10-27,0
159229,11/30/2019,9/21/2018,3,21.895,2,2019-11-30,2018-09-21,-435
1592391,12/17/2018,12/17/2018,1,1.067,1,2018-12-17,2018-12-17,0
1592421,5/9/2018,5/9/2018,1,11.275,1,2018-05-09,2018-05-09,0
159283,11/10/2016,9/26/2016,16,147.366927,9,2016-11-10,2016-09-26,-45
159305,10/29/2017,10/29/2017,1,9.512,1,2017-10-29,2017-10-29,0
159313,8/28/2018,8/28/2018,1,19.504,1,2018-08-28,2018-08-28,0
15933,10/14/2020,6/24/2019,15,10.102,13,2020-10-14,2019-06-24,-478
1594231,2/17/2020,9/9/2019,9,107.858,2,2020-02-17,2019-09-09,-161
159427,11/16/2017,11/16/2017,1,4.872,1,2017-11-16,2017-11-16,0
159433,2/22/2018,2/22/2018,1,6.881,1,2018-02-22,2018-02-22,0
1594361,6/21/2018,6/21/2018,1,15.351,1,2018-06-21,2018-06-21,0
1594431,3/30/2018,3/30/2018,1,9.041,1,2018-03-30,2018-03-30,0
1594611,5/12/2018,9/25/2018,2,11.32,2,2018-05-12,2018-09-25,136
1594771,1/21/2018,1/23/2018,3,4.127,3,2018-01-21,2018-01-23,2
159519,10/1/2016,9/21/2017,2,10.575103,2,2016-10-01,2017-09-21,355
159525,1/29/2018,7/2/2017,4,28.555,4,2018-01-29,2017-07-02,-211
1595591,2/28/2019,9/7/2018,2,11.155000000000001,1,2019-02-28,2018-09-07,-174
159599,12/11/2019,12/11/2019,1,0.053,1,2019-12-11,2019-12-11,0
159601,10/11/2018,9/4/2019,8,68.542,4,2018-10-11,2019-09-04,328
159617,7/20/2019,7/20/2019,1,10.309,1,2019-07-20,2019-07-20,0
159625,1/13/2019,9/8/2019,25,186.457089,2,2019-01-13,2019-09-08,238
15963,1/21/2017,9/29/2016,13,88.489251,5,2017-01-21,2016-09-29,-114
159647,1/2/2017,4/22/2017,2,6.017,2,2017-01-02,2017-04-22,110
159689,9/2/2017,9/2/2017,1,3.939,1,2017-09-02,2017-09-02,0
159697,9/19/2017,9/19/2017,1,11.891,1,2017-09-19,2017-09-19,0
159715,1/17/2017,9/9/2016,13,76.628136,5,2017-01-17,2016-09-09,-130
1597171,3/30/2018,3/30/2018,1,14.607,1,2018-03-30,2018-03-30,0
159723,1/3/2019,9/18/2019,7,62.718,3,2019-01-03,2019-09-18,258
159727,4/7/2019,4/7/2019,1,8.182,1,2019-04-07,2019-04-07,0
1597941,2/14/2018,3/14/2018,2,10.971,1,2018-02-14,2018-03-14,28
1597951,1/19/2019,6/13/2018,4,35.069,3,2019-01-19,2018-06-13,-220
159815,1/1/2018,8/14/2016,5,21.674691,4,2018-01-01,2016-08-14,-505
159831,8/21/2020,8/21/2020,1,16.316,1,2020-08-21,2020-08-21,0
1598591,2/14/2018,2/14/2018,1,5.019,1,2018-02-14,2018-02-14,0
1598931,1/21/2018,7/4/2018,6,18.655,5,2018-01-21,2018-07-04,164
159905,1/12/2019,2/11/2017,2,16.616999999999997,2,2019-01-12,2017-02-11,-700
159923,1/11/2017,1/11/2017,1,7.464,1,2017-01-11,2017-01-11,0
159937,10/14/2018,10/14/2018,1,0.114,1,2018-10-14,2018-10-14,0
1599731,4/6/2019,4/6/2019,1,9.361,1,2019-04-06,2019-04-06,0
159999,12/13/2016,12/13/2016,1,12.19,1,2016-12-13,2016-12-13,0
1600111,12/29/2018,2/21/2018,2,5.867,2,2018-12-29,2018-02-21,-311
1600121,1/19/2018,1/19/2018,1,12.927,1,2018-01-19,2018-01-19,0
1600161,8/4/2018,8/4/2018,1,3.157,1,2018-08-04,2018-08-04,0
1600471,4/4/2018,4/4/2018,1,4.392,1,2018-04-04,2018-04-04,0
1601231,7/13/2019,7/13/2019,1,20.857,1,2019-07-13,2019-07-13,0
160125,1/14/2017,9/24/2016,38,177.248719,12,2017-01-14,2016-09-24,-112
160163,1/9/2020,9/1/2019,5,25.81,4,2020-01-09,2019-09-01,-130
1602681,1/12/2020,8/18/2019,8,28.279999999999998,4,2020-01-12,2019-08-18,-147
1603271,1/18/2019,11/8/2018,3,30.015,3,2019-01-18,2018-11-08,-71
160335,5/4/2019,5/4/2019,1,5.146,1,2019-05-04,2019-05-04,0
160395,6/15/2017,8/23/2019,3,7.926,3,2017-06-15,2019-08-23,799
1604281,2/24/2019,2/24/2019,1,17.787,1,2019-02-24,2019-02-24,0
1604401,12/4/2018,12/4/2018,1,5.059,1,2018-12-04,2018-12-04,0
1604471,1/24/2018,1/24/2018,1,4.524,1,2018-01-24,2018-01-24,0
1604521,2/4/2019,6/19/2018,2,12.844000000000001,2,2019-02-04,2018-06-19,-230
1604591,11/17/2018,9/15/2019,7,63.946,4,2018-11-17,2019-09-15,302
1605091,1/30/2019,9/28/2019,3,16.326,2,2019-01-30,2019-09-28,241
160527,5/26/2017,9/12/2016,9,142.436788,4,2017-05-26,2016-09-12,-256
160575,7/18/2019,7/18/2019,1,22.53,1,2019-07-18,2019-07-18,0
1605781,1/24/2018,6/20/2019,15,192.822,7,2018-01-24,2019-06-20,512
1605891,1/11/2020,9/8/2018,110,464.688,4,2020-01-11,2018-09-08,-490
160591,1/14/2017,3/8/2018,3,8.9,3,2017-01-14,2018-03-08,418
160599,1/5/2019,12/11/2018,3,31.871,3,2019-01-05,2018-12-11,-25
160645,1/6/2018,7/2/2017,2,11.264,2,2018-01-06,2017-07-02,-188
1606491,1/11/2020,8/11/2019,6,65.122,5,2020-01-11,2019-08-11,-153
160671,12/14/2018,6/16/2019,2,8.246,2,2018-12-14,2019-06-16,184
160737,12/2/2016,9/22/2017,9,63.004,5,2016-12-02,2017-09-22,294
160775,12/6/2016,12/6/2016,1,5.696,1,2016-12-06,2016-12-06,0
160777,5/24/2018,5/24/2018,1,5.099,1,2018-05-24,2018-05-24,0
160795,1/1/2017,9/8/2016,199,1364.451204,21,2017-01-01,2016-09-08,-115
1608311,10/20/2019,7/6/2018,11,365.678,6,2019-10-20,2018-07-06,-471
1608331,5/4/2019,5/4/2019,1,10.1,1,2019-05-04,2019-05-04,0
160843,1/24/2019,3/27/2019,2,11.375,1,2019-01-24,2019-03-27,62
1608451,4/7/2018,4/7/2018,1,6.566,1,2018-04-07,2018-04-07,0
160851,1/16/2019,9/6/2017,50,492.481,11,2019-01-16,2017-09-06,-497
1608551,4/29/2018,4/29/2018,1,0.499,1,2018-04-29,2018-04-29,0
1608581,2/24/2018,2/24/2018,1,6.545,1,2018-02-24,2018-02-24,0
160863,10/4/2018,9/8/2017,7,27.151685,4,2018-10-04,2017-09-08,-391
160901,8/23/2019,8/23/2019,1,9.824,1,2019-08-23,2019-08-23,0
1609191,11/17/2019,11/24/2019,2,7.227,2,2019-11-17,2019-11-24,7
160943,10/7/2016,11/26/2019,2,17.375608999999997,2,2016-10-07,2019-11-26,1145
160989,10/21/2017,3/31/2018,2,11.026,1,2017-10-21,2018-03-31,161
160999,4/28/2019,5/11/2017,2,16.945,2,2019-04-28,2017-05-11,-717
161,9/29/2016,9/29/2016,1,8.212873,1,2016-09-29,2016-09-29,0
161015,12/13/2018,12/13/2018,1,14.445,1,2018-12-13,2018-12-13,0
1610181,6/7/2018,6/7/2018,1,11.902,1,2018-06-07,2018-06-07,0
161049,6/3/2018,6/3/2018,1,4.735,1,2018-06-03,2018-06-03,0
1611021,10/17/2020,8/15/2020,8,58.124,4,2020-10-17,2020-08-15,-63
1611251,10/2/2019,10/2/2019,1,3.574,1,2019-10-02,2019-10-02,0
161131,11/3/2016,11/6/2016,2,23.651999999999997,1,2016-11-03,2016-11-06,3
161133,6/24/2017,8/27/2017,4,36.401,2,2017-06-24,2017-08-27,64
1611381,6/13/2019,6/13/2019,1,8.363,1,2019-06-13,2019-06-13,0
1611581,3/9/2018,3/9/2018,1,5.819,1,2018-03-09,2018-03-09,0
1611921,7/17/2019,7/17/2019,1,4.797,1,2019-07-17,2019-07-17,0
161209,3/20/2018,8/26/2018,4,16.995,3,2018-03-20,2018-08-26,159
1613061,6/6/2018,6/6/2018,1,3.745,1,2018-06-06,2018-06-06,0
161319,2/28/2019,2/28/2019,1,0.559,1,2019-02-28,2019-02-28,0
161335,2/18/2018,8/15/2016,6,97.40122699999999,6,2018-02-18,2016-08-15,-552
1613711,3/22/2018,5/3/2018,6,19.624000000000002,3,2018-03-22,2018-05-03,42
1613751,1/13/2020,9/7/2018,102,710.627,10,2020-01-13,2018-09-07,-493
161423,2/15/2017,2/15/2017,1,4.857,1,2017-02-15,2017-02-15,0
1614481,3/9/2018,8/4/2018,2,21.585,2,2018-03-09,2018-08-04,148
1615551,5/5/2019,5/5/2019,1,2.231,1,2019-05-05,2019-05-05,0
161571,8/10/2017,8/10/2017,1,4.534,1,2017-08-10,2017-08-10,0
161591,6/2/2018,9/9/2018,4,14.439,4,2018-06-02,2018-09-09,99
1616031,1/23/2018,1/23/2018,2,4.358,2,2018-01-23,2018-01-23,0
1616331,7/11/2018,7/11/2018,1,3.804,1,2018-07-11,2018-07-11,0
161637,10/21/2017,10/21/2017,1,9.327,1,2017-10-21,2017-10-21,0
161647,2/5/2020,2/5/2020,1,0.799,1,2020-02-05,2020-02-05,0
161699,7/28/2019,7/28/2019,1,3.981,1,2019-07-28,2019-07-28,0
161811,8/11/2016,8/11/2016,1,8.842881,1,2016-08-11,2016-08-11,0
1618161,1/23/2018,11/1/2019,2,13.956,2,2018-01-23,2019-11-01,647
1618221,10/25/2018,10/25/2018,1,15.557,1,2018-10-25,2018-10-25,0
1618801,5/23/2018,5/23/2018,1,7.769,1,2018-05-23,2018-05-23,0
1618921,10/7/2019,10/7/2019,1,13.094,1,2019-10-07,2019-10-07,0
161895,8/13/2019,8/13/2019,1,10.566,1,2019-08-13,2019-08-13,0
1621031,1/4/2019,7/15/2018,8,49.394,3,2019-01-04,2018-07-15,-173
1621101,1/5/2020,1/5/2020,1,1.903,1,2020-01-05,2020-01-05,0
162137,2/21/2019,9/14/2018,3,16.024,3,2019-02-21,2018-09-14,-160
1621581,3/23/2018,4/10/2019,2,27.47,1,2018-03-23,2019-04-10,383
1621741,1/10/2020,5/11/2019,9,28.866,5,2020-01-10,2019-05-11,-244
1621901,1/30/2018,2/5/2020,2,29.777,2,2018-01-30,2020-02-05,736
16223,11/15/2016,8/29/2016,2,9.632902999999999,1,2016-11-15,2016-08-29,-78
162239,1/26/2017,1/26/2017,1,9.829,1,2017-01-26,2017-01-26,0
1623121,1/19/2019,9/9/2018,30,279.355,7,2019-01-19,2018-09-09,-132
162321,5/26/2018,9/20/2019,4,65.133461,2,2018-05-26,2019-09-20,482
1623401,1/29/2020,1/29/2020,1,6.12,1,2020-01-29,2020-01-29,0
162363,9/22/2017,9/22/2017,1,9.319,1,2017-09-22,2017-09-22,0
162417,8/18/2017,8/18/2017,1,16.995,1,2017-08-18,2017-08-18,0
1624351,8/23/2019,8/23/2019,1,12.47,1,2019-08-23,2019-08-23,0
1625031,1/16/2020,9/5/2019,26,131.018,3,2020-01-16,2019-09-05,-133
162525,11/2/2017,6/12/2017,3,7.8469999999999995,2,2017-11-02,2017-06-12,-143
162555,1/26/2020,4/3/2019,6,34.613,6,2020-01-26,2019-04-03,-298
1626241,11/9/2019,11/9/2019,1,4.459,1,2019-11-09,2019-11-09,0
162625,2/20/2018,2/22/2018,4,38.979,3,2018-02-20,2018-02-22,2
162645,6/8/2018,6/8/2018,1,2.694,1,2018-06-08,2018-06-08,0
162675,11/11/2019,7/17/2017,2,11.338000000000001,2,2019-11-11,2017-07-17,-847
1626981,3/25/2018,5/6/2018,4,11.329,4,2018-03-25,2018-05-06,42
1627211,12/11/2019,12/11/2019,1,4.602,1,2019-12-11,2019-12-11,0
162735,10/26/2017,9/12/2018,18,156.30478,6,2017-10-26,2018-09-12,321
162825,1/12/2017,9/9/2016,100,330.922914,6,2017-01-12,2016-09-09,-125
1629101,6/25/2018,6/25/2018,2,21.349,2,2018-06-25,2018-06-25,0
163063,1/15/2018,8/14/2016,11,83.316103,7,2018-01-15,2016-08-14,-519
163121,11/6/2016,9/23/2017,3,35.328,2,2016-11-06,2017-09-23,321
1632981,10/24/2019,10/24/2019,1,20.365,1,2019-10-24,2019-10-24,0
1633031,6/16/2018,6/16/2018,1,2.745,1,2018-06-16,2018-06-16,0
1633441,12/26/2020,12/26/2020,1,2.619,1,2020-12-26,2020-12-26,0
163369,4/2/2017,9/13/2020,6,22.608,4,2017-04-02,2020-09-13,1260
163383,9/21/2018,9/21/2018,1,2.503,1,2018-09-21,2018-09-21,0
1633901,10/18/2019,9/27/2019,22,377.391,7,2019-10-18,2019-09-27,-21
163413,12/27/2016,6/23/2017,4,18.762999999999998,2,2016-12-27,2017-06-23,178
163429,1/11/2020,9/4/2016,22,140.078539,7,2020-01-11,2016-09-04,-1224
1634551,1/28/2018,8/5/2018,8,98.745,5,2018-01-28,2018-08-05,189
1634681,10/6/2018,10/6/2018,1,14.979,1,2018-10-06,2018-10-06,0
1634941,2/23/2020,3/31/2018,2,13.868,2,2020-02-23,2018-03-31,-694
163497,10/17/2019,7/31/2018,8,97.358,6,2019-10-17,2018-07-31,-443
163499,1/4/2017,11/16/2017,3,47.974000000000004,3,2017-01-04,2017-11-16,316
163505,8/16/2016,8/16/2016,1,1.427139,1,2016-08-16,2016-08-16,0
163513,4/26/2019,8/10/2019,2,17.791,2,2019-04-26,2019-08-10,106
163541,1/17/2018,9/5/2017,54,149.326289,14,2018-01-17,2017-09-05,-134
1636301,10/18/2020,9/6/2020,6,29.709,4,2020-10-18,2020-09-06,-42
163635,10/9/2016,9/10/2017,3,18.674077,2,2016-10-09,2017-09-10,336
163669,2/14/2018,9/5/2018,3,15.747,3,2018-02-14,2018-09-05,203
163717,10/9/2016,10/9/2016,1,6.757675,1,2016-10-09,2016-10-09,0
1637261,3/10/2018,3/10/2018,1,2.541,1,2018-03-10,2018-03-10,0
163731,2/15/2019,2/15/2019,1,14.032,1,2019-02-15,2019-02-15,0
1637491,1/29/2018,2/16/2018,2,7.36,1,2018-01-29,2018-02-16,18
1637531,1/10/2019,9/6/2018,78,1259.793,8,2019-01-10,2018-09-06,-126
1637601,1/28/2018,5/28/2018,4,30.249000000000002,2,2018-01-28,2018-05-28,120
1637721,10/12/2020,7/11/2019,3,6.125,3,2020-10-12,2019-07-11,-459
1637781,1/28/2018,1/28/2018,1,8.362,1,2018-01-28,2018-01-28,0
163897,1/3/2019,9/20/2017,2,17.338,2,2019-01-03,2017-09-20,-470
1639281,12/28/2019,3/12/2018,2,11.172,1,2019-12-28,2018-03-12,-656
1639321,3/21/2018,3/21/2018,2,11.937999999999999,2,2018-03-21,2018-03-21,0
1639351,9/5/2019,9/5/2019,1,11.508,1,2019-09-05,2019-09-05,0
1640521,9/3/2019,9/3/2019,1,6.802,1,2019-09-03,2019-09-03,0
1640601,2/1/2018,2/20/2018,3,12.396,3,2018-02-01,2018-02-20,19
1640731,3/11/2018,4/1/2018,2,10.102,1,2018-03-11,2018-04-01,21
1640941,12/27/2018,12/27/2018,1,6.825,1,2018-12-27,2018-12-27,0
1641141,1/24/2019,1/24/2019,1,11.369,1,2019-01-24,2019-01-24,0
1641921,10/29/2019,9/20/2020,5,113.615,3,2019-10-29,2020-09-20,327
1642061,12/13/2019,12/13/2019,1,0.738,1,2019-12-13,2019-12-13,0
164213,10/24/2020,8/30/2017,4,37.817,2,2020-10-24,2017-08-30,-1151
1642651,10/14/2018,9/6/2019,39,273.951,15,2018-10-14,2019-09-06,327
1642791,1/23/2019,1/23/2019,1,4.453,1,2019-01-23,2019-01-23,0
1642951,12/19/2019,5/4/2018,2,7.115,1,2019-12-19,2018-05-04,-594
1643861,1/19/2019,1/19/2019,1,7.615,1,2019-01-19,2019-01-19,0
164395,8/12/2017,8/12/2017,1,9.132,1,2017-08-12,2017-08-12,0
1644001,5/11/2018,5/11/2018,1,1.665,1,2018-05-11,2018-05-11,0
164433,10/26/2016,7/28/2017,2,12.040074,2,2016-10-26,2017-07-28,275
164479,4/11/2017,4/11/2017,1,10.268,1,2017-04-11,2017-04-11,0
1644891,11/17/2018,9/1/2019,2,5.7989999999999995,1,2018-11-17,2019-09-01,288
164505,1/31/2017,1/31/2017,1,5.244,1,2017-01-31,2017-01-31,0
164547,12/29/2016,7/2/2018,2,17.896,2,2016-12-29,2018-07-02,550
164559,10/6/2016,2/22/2017,2,28.06706,2,2016-10-06,2017-02-22,139
1645981,3/15/2019,3/17/2019,2,23.011000000000003,2,2019-03-15,2019-03-17,2
1646021,4/10/2018,4/10/2018,1,7.319,1,2018-04-10,2018-04-10,0
1646431,3/5/2020,3/5/2020,1,7.193,1,2020-03-05,2020-03-05,0
1646481,10/30/2018,9/17/2019,17,102.83,5,2018-10-30,2019-09-17,322
164671,10/23/2016,8/25/2018,5,25.020097999999997,4,2016-10-23,2018-08-25,671
164705,10/21/2016,9/26/2016,8,84.295449,3,2016-10-21,2016-09-26,-25
164723,2/14/2017,2/14/2017,1,8.061,1,2017-02-14,2017-02-14,0
164763,2/10/2019,2/10/2019,1,8.442,1,2019-02-10,2019-02-10,0
1647691,6/18/2018,6/18/2018,1,5.706,1,2018-06-18,2018-06-18,0
164811,11/14/2018,11/14/2018,1,11.306,1,2018-11-14,2018-11-14,0
1648481,1/11/2019,11/17/2018,2,0.044,2,2019-01-11,2018-11-17,-55
1649031,1/1/2019,9/6/2018,52,305.92,6,2019-01-01,2018-09-06,-117
164911,11/25/2017,5/15/2018,2,21.157,1,2017-11-25,2018-05-15,171
164947,10/22/2016,6/22/2019,4,16.738517,1,2016-10-22,2019-06-22,973
164949,1/25/2017,8/3/2018,6,47.486,5,2017-01-25,2018-08-03,555
164973,1/14/2017,9/30/2016,53,1687.829077,6,2017-01-14,2016-09-30,-106
1649771,9/12/2018,9/12/2018,1,19.759,1,2018-09-12,2018-09-12,0
164981,10/21/2016,6/14/2019,6,84.040384,4,2016-10-21,2019-06-14,966
1649891,7/7/2019,7/7/2019,1,10.338,1,2019-07-07,2019-07-07,0
165015,1/28/2018,4/20/2019,4,22.233,3,2018-01-28,2019-04-20,447
165025,1/21/2017,8/6/2016,15,22.755403,5,2017-01-21,2016-08-06,-168
1651701,6/16/2018,6/16/2018,1,7.603,1,2018-06-16,2018-06-16,0
1651731,1/12/2019,8/23/2019,11,69.326,6,2019-01-12,2019-08-23,223
1652291,12/22/2018,12/22/2018,1,12.732,1,2018-12-22,2018-12-22,0
16523,12/21/2016,12/21/2016,1,2.709,1,2016-12-21,2016-12-21,0
1652451,8/11/2018,8/11/2018,1,5.807,1,2018-08-11,2018-08-11,0
1652471,9/8/2019,9/8/2019,1,8.18,1,2019-09-08,2019-09-08,0
165295,10/16/2020,10/16/2020,1,0.975,1,2020-10-16,2020-10-16,0
1653071,3/5/2018,3/5/2018,1,7.178,1,2018-03-05,2018-03-05,0
165311,11/4/2017,11/4/2017,1,33.947,1,2017-11-04,2017-11-04,0
1653381,6/2/2019,6/2/2019,1,8.054,1,2019-06-02,2019-06-02,0
1653821,6/17/2018,6/17/2018,1,13.18,1,2018-06-17,2018-06-17,0
165395,4/20/2017,4/20/2017,1,10.536,1,2017-04-20,2017-04-20,0
1654471,11/10/2019,4/16/2019,3,22.909,3,2019-11-10,2019-04-16,-208
165451,7/19/2017,7/19/2017,1,6.719,1,2017-07-19,2017-07-19,0
1654681,5/25/2018,9/17/2018,2,18.801000000000002,1,2018-05-25,2018-09-17,115
165493,11/19/2018,11/19/2018,1,16.394,1,2018-11-19,2018-11-19,0
165521,10/3/2016,9/6/2016,11,69.985559,3,2016-10-03,2016-09-06,-27
1656051,1/20/2020,8/7/2019,5,27.938,2,2020-01-20,2019-08-07,-166
1656131,1/4/2019,8/16/2018,9,26.665,8,2019-01-04,2018-08-16,-141
165623,10/10/2018,10/10/2018,1,7.559,1,2018-10-10,2018-10-10,0
165633,12/18/2019,12/18/2019,1,15.56,1,2019-12-18,2019-12-18,0
1656621,4/28/2018,5/8/2018,2,20.964,2,2018-04-28,2018-05-08,10
165687,12/8/2016,12/8/2016,1,3.151,1,2016-12-08,2016-12-08,0
165691,3/14/2017,3/14/2017,1,9.645,1,2017-03-14,2017-03-14,0
165729,7/12/2018,7/12/2018,1,0.041,1,2018-07-12,2018-07-12,0
165787,4/5/2019,4/5/2019,1,2.429,1,2019-04-05,2019-04-05,0
1658001,10/1/2019,7/19/2018,7,46.63,6,2019-10-01,2018-07-19,-439
1658431,2/10/2018,2/10/2018,1,3.747,1,2018-02-10,2018-02-10,0
165849,1/15/2019,1/15/2019,1,2.953,1,2019-01-15,2019-01-15,0
165851,3/27/2017,9/23/2016,4,64.508104,4,2017-03-27,2016-09-23,-185
165903,3/17/2018,3/17/2018,1,13.388,1,2018-03-17,2018-03-17,0
1659371,7/10/2018,7/19/2018,3,4.867,1,2018-07-10,2018-07-19,9
165981,1/14/2019,1/14/2019,1,10.983,1,2019-01-14,2019-01-14,0
1660421,6/12/2018,6/12/2018,1,4.063,1,2018-06-12,2018-06-12,0
1661611,6/9/2019,6/9/2019,1,13.831,1,2019-06-09,2019-06-09,0
166239,10/31/2019,7/25/2019,5,35.123,2,2019-10-31,2019-07-25,-98
1662551,2/16/2018,2/16/2018,1,10.665,1,2018-02-16,2018-02-16,0
1662561,3/11/2018,3/11/2018,1,3.201,1,2018-03-11,2018-03-11,0
166273,10/4/2018,9/24/2018,3,9.492999999999999,2,2018-10-04,2018-09-24,-10
166291,6/4/2018,6/4/2018,1,0.032,1,2018-06-04,2018-06-04,0
166299,8/5/2017,8/5/2017,1,8.641,1,2017-08-05,2017-08-05,0
1663021,6/16/2019,6/16/2019,1,0.838,1,2019-06-16,2019-06-16,0
166315,2/28/2018,2/28/2018,1,7.855,1,2018-02-28,2018-02-28,0
166323,6/23/2017,6/24/2017,2,8.42,1,2017-06-23,2017-06-24,1
1663521,12/29/2019,6/8/2018,4,8.926,3,2019-12-29,2018-06-08,-569
1663731,12/11/2018,12/11/2018,2,15.122,2,2018-12-11,2018-12-11,0
1663811,2/13/2020,4/18/2019,2,12.421,2,2020-02-13,2019-04-18,-301
1664131,12/22/2019,9/20/2019,5,23.151,2,2019-12-22,2019-09-20,-93
166423,10/22/2016,10/22/2016,1,0.742746,1,2016-10-22,2016-10-22,0
166443,1/23/2018,6/27/2018,4,23.326999999999998,4,2018-01-23,2018-06-27,155
1664481,1/27/2019,9/7/2019,16,135.76,9,2019-01-27,2019-09-07,223
1664931,12/15/2018,12/15/2018,1,6.148,1,2018-12-15,2018-12-15,0
166519,1/10/2017,2/19/2018,10,92.319,4,2017-01-10,2018-02-19,405
1665941,6/5/2019,6/5/2019,1,6.119,1,2019-06-05,2019-06-05,0
1666201,6/21/2018,6/21/2018,1,12.978,1,2018-06-21,2018-06-21,0
1666451,8/2/2018,8/2/2018,1,13.084,1,2018-08-02,2018-08-02,0
1666531,10/5/2018,10/5/2018,1,5.001,1,2018-10-05,2018-10-05,0
1666731,12/12/2018,4/20/2018,3,46.589,3,2018-12-12,2018-04-20,-236
166693,10/28/2018,8/20/2017,3,23.108,3,2018-10-28,2017-08-20,-434
166709,7/11/2017,7/26/2017,7,28.288,3,2017-07-11,2017-07-26,15
1667181,5/19/2018,5/19/2018,1,3.848,1,2018-05-19,2018-05-19,0
166741,4/12/2019,4/9/2019,2,60.848,2,2019-04-12,2019-04-09,-3
1667631,6/25/2018,6/25/2018,1,5.671,1,2018-06-25,2018-06-25,0
166781,1/11/2019,9/9/2018,132,1958.381129,12,2019-01-11,2018-09-09,-124
1667931,8/27/2018,8/27/2018,1,8.71,1,2018-08-27,2018-08-27,0
1668261,9/16/2018,9/16/2018,1,9.518,1,2018-09-16,2018-09-16,0
166835,10/4/2019,4/25/2017,3,19.972,3,2019-10-04,2017-04-25,-892
1668461,2/10/2018,2/10/2018,1,11.914,1,2018-02-10,2018-02-10,0
166879,11/2/2017,11/2/2017,1,20.957,1,2017-11-02,2017-11-02,0
166887,1/11/2017,8/23/2020,5,30.578,5,2017-01-11,2020-08-23,1320
166915,1/16/2018,9/4/2018,28,219.76,11,2018-01-16,2018-09-04,231
166921,11/19/2018,11/19/2018,1,10.482,1,2018-11-19,2018-11-19,0
166929,2/4/2018,2/4/2018,1,1.712,1,2018-02-04,2018-02-04,0
166955,4/11/2017,9/4/2017,2,13.858,2,2017-04-11,2017-09-04,146
1669841,2/12/2018,8/21/2018,5,43.955,3,2018-02-12,2018-08-21,190
1669871,5/17/2018,7/1/2018,2,12.43,1,2018-05-17,2018-07-01,45
1669961,2/13/2018,2/13/2018,1,7.497,1,2018-02-13,2018-02-13,0
1670241,10/10/2019,10/10/2019,1,7.588,1,2019-10-10,2019-10-10,0
167061,6/13/2017,8/24/2016,2,26.173504,2,2017-06-13,2016-08-24,-293
1670721,2/12/2018,6/7/2018,129,790.43,9,2018-02-12,2018-06-07,115
167111,11/1/2017,11/1/2017,1,3.284,1,2017-11-01,2017-11-01,0
1671211,3/11/2018,3/11/2018,1,6.975,1,2018-03-11,2018-03-11,0
167147,1/29/2017,9/17/2016,5,23.906156,3,2017-01-29,2016-09-17,-134
1671491,11/25/2018,8/3/2018,2,10.652999999999999,1,2018-11-25,2018-08-03,-114
1671811,11/3/2019,2/10/2018,3,26.114,3,2019-11-03,2018-02-10,-631
1671931,7/14/2018,7/14/2018,1,9.357,1,2018-07-14,2018-07-14,0
1672481,4/29/2019,4/29/2019,1,11.766,1,2019-04-29,2019-04-29,0
1672501,1/24/2019,1/24/2019,1,1.018,1,2019-01-24,2019-01-24,0
1672631,9/16/2018,9/16/2018,1,7.528,1,2018-09-16,2018-09-16,0
1673001,1/26/2019,4/7/2018,5,35.178,4,2019-01-26,2018-04-07,-294
1673081,1/15/2019,1/15/2019,1,12.169,1,2019-01-15,2019-01-15,0
167333,10/14/2018,9/16/2018,14,21.73,5,2018-10-14,2018-09-16,-28
167341,1/10/2017,9/9/2020,410,4187.206408,11,2017-01-10,2020-09-09,1338
167387,10/20/2016,10/22/2016,3,17.547169,1,2016-10-20,2016-10-22,2
167461,3/14/2019,5/30/2019,2,19.152,1,2019-03-14,2019-05-30,77
167513,10/25/2019,12/6/2019,2,5.602,2,2019-10-25,2019-12-06,42
1675211,4/28/2018,4/28/2018,2,9.673,2,2018-04-28,2018-04-28,0
1675261,11/24/2018,11/24/2018,1,2.646,1,2018-11-24,2018-11-24,0
1675761,1/11/2019,9/9/2019,179,3418.787,10,2019-01-11,2019-09-09,241
1676551,5/18/2018,7/28/2018,2,6.951,2,2018-05-18,2018-07-28,71
167743,10/2/2019,9/20/2019,16,118.35912499999999,11,2019-10-02,2019-09-20,-12
167757,1/7/2017,7/9/2017,6,21.107,4,2017-01-07,2017-07-09,183
167817,2/1/2020,9/20/2019,3,14.03,3,2020-02-01,2019-09-20,-134
167881,7/30/2017,9/18/2019,3,11.475000000000001,2,2017-07-30,2019-09-18,780
167941,4/21/2018,4/21/2018,1,6.212,1,2018-04-21,2018-04-21,0
167949,9/12/2018,9/12/2018,1,4.868,1,2018-09-12,2018-09-12,0
167955,4/27/2017,5/22/2017,2,32.851,2,2017-04-27,2017-05-22,25
1679661,5/4/2018,5/4/2018,1,29.693,1,2018-05-04,2018-05-04,0
1679721,1/13/2020,9/9/2019,63,563.241,5,2020-01-13,2019-09-09,-126
1679961,7/15/2019,7/15/2019,1,4.635,1,2019-07-15,2019-07-15,0
168009,10/24/2019,10/25/2019,2,7.5969999999999995,1,2019-10-24,2019-10-25,1
168031,9/16/2016,9/16/2016,1,6.05684,1,2016-09-16,2016-09-16,0
168093,9/26/2018,9/26/2018,1,5.458,1,2018-09-26,2018-09-26,0
1681271,10/21/2019,5/25/2018,3,31.383,2,2019-10-21,2018-05-25,-514
168165,2/22/2017,3/16/2017,3,20.153,2,2017-02-22,2017-03-16,22
168169,11/5/2016,7/25/2017,2,18.721,1,2016-11-05,2017-07-25,262
1681721,7/16/2018,7/16/2018,1,4.112,1,2018-07-16,2018-07-16,0
168187,11/15/2017,2/7/2019,2,23.716,2,2017-11-15,2019-02-07,449
1682,1/4/2020,1/4/2020,1,6.382,1,2020-01-04,2020-01-04,0
1682241,4/15/2019,4/15/2019,1,6.125,1,2019-04-15,2019-04-15,0
1682291,4/8/2018,7/21/2018,2,7.571,1,2018-04-08,2018-07-21,104
1682361,2/18/2020,2/18/2020,1,0.15,1,2020-02-18,2020-02-18,0
1683031,2/8/2018,2/8/2018,1,14.096,1,2018-02-08,2018-02-08,0
1683571,8/9/2019,8/9/2019,1,11.566,1,2019-08-09,2019-08-09,0
1683591,11/18/2019,9/4/2019,12,46.424,5,2019-11-18,2019-09-04,-75
1683631,5/2/2018,5/2/2018,1,1.505,1,2018-05-02,2018-05-02,0
168383,12/1/2016,12/1/2016,1,1.09,1,2016-12-01,2016-12-01,0
168391,11/30/2017,11/30/2017,1,4.722,1,2017-11-30,2017-11-30,0
168397,8/19/2018,8/19/2018,1,0.723,1,2018-08-19,2018-08-19,0
1684291,1/8/2020,1/8/2020,1,8.349,1,2020-01-08,2020-01-08,0
168443,7/13/2018,7/13/2018,1,13.662,1,2018-07-13,2018-07-13,0
168461,1/14/2017,9/6/2016,39,108.875589,2,2017-01-14,2016-09-06,-130
168479,1/14/2020,1/22/2020,2,5.193,1,2020-01-14,2020-01-22,8
1685361,1/10/2019,9/27/2018,142,1470.7,9,2019-01-10,2018-09-27,-105
168549,1/13/2019,9/8/2020,177,965.925188,26,2019-01-13,2020-09-08,604
1685791,11/27/2020,12/7/2020,7,107.685,2,2020-11-27,2020-12-07,10
168631,1/11/2020,9/22/2018,12,92.138,9,2020-01-11,2018-09-22,-476
1686871,1/25/2020,9/21/2019,9,45.215,3,2020-01-25,2019-09-21,-126
168753,2/12/2018,2/12/2018,1,3.94,1,2018-02-12,2018-02-12,0
168771,3/26/2017,3/26/2017,1,3.412,1,2017-03-26,2017-03-26,0
1687821,2/22/2018,4/26/2018,4,21.517,2,2018-02-22,2018-04-26,63
1687951,6/8/2018,6/8/2018,1,6.133,1,2018-06-08,2018-06-08,0
1688211,2/27/2019,7/23/2019,3,5.543,2,2019-02-27,2019-07-23,146
1688391,2/18/2020,2/18/2020,1,3.299,1,2020-02-18,2020-02-18,0
1688791,2/10/2018,5/14/2018,3,44.937,3,2018-02-10,2018-05-14,93
1688881,3/6/2019,6/28/2019,2,8.542,2,2019-03-06,2019-06-28,114
1689481,1/6/2019,6/11/2019,4,15.524,3,2019-01-06,2019-06-11,156
168949,7/10/2018,9/22/2016,3,27.380583,2,2018-07-10,2016-09-22,-656
1689721,3/8/2019,3/8/2019,1,4.041,1,2019-03-08,2019-03-08,0
168975,12/18/2016,12/18/2016,1,14.979,1,2016-12-18,2016-12-18,0
168979,10/4/2016,9/12/2017,5,24.783856,5,2016-10-04,2017-09-12,343
1690491,10/22/2019,10/6/2018,2,11.155000000000001,2,2019-10-22,2018-10-06,-381
1690601,1/26/2019,9/22/2019,19,76.699,9,2019-01-26,2019-09-22,239
1690771,8/11/2019,8/11/2019,1,6.089,1,2019-08-11,2019-08-11,0
169113,12/5/2016,12/5/2016,1,14.854,1,2016-12-05,2016-12-05,0
1691161,6/4/2018,6/4/2018,1,6.803,1,2018-06-04,2018-06-04,0
1691301,1/18/2020,9/14/2019,19,85.551,2,2020-01-18,2019-09-14,-126
1691531,2/12/2018,7/9/2018,32,644.96,6,2018-02-12,2018-07-09,147
1691741,6/29/2019,6/29/2019,1,1.3880000000000001,1,2019-06-29,2019-06-29,0
169189,7/21/2018,7/21/2018,1,2.834,1,2018-07-21,2018-07-21,0
1692011,9/21/2018,9/21/2018,1,7.127,1,2018-09-21,2018-09-21,0
169211,8/24/2016,9/4/2016,6,36.181423,4,2016-08-24,2016-09-04,11
169271,12/28/2016,5/27/2018,4,46.845,2,2016-12-28,2018-05-27,515
1692761,2/12/2018,3/2/2018,10,106.334,2,2018-02-12,2018-03-02,18
169285,12/11/2019,12/11/2019,1,0.102,1,2019-12-11,2019-12-11,0
169321,12/9/2017,8/12/2018,3,11.103,3,2017-12-09,2018-08-12,246
1693281,12/24/2018,12/24/2018,1,7.581,1,2018-12-24,2018-12-24,0
169347,10/4/2016,8/29/2020,3,26.77607,3,2016-10-04,2020-08-29,1425
169385,11/13/2016,11/6/2016,2,8.932,2,2016-11-13,2016-11-06,-7
1693961,6/10/2018,6/10/2018,1,9.112,1,2018-06-10,2018-06-10,0
1693981,6/13/2018,6/13/2018,1,6.636,1,2018-06-13,2018-06-13,0
169431,5/25/2018,9/27/2017,2,8.665,2,2018-05-25,2017-09-27,-240
1694381,5/5/2018,5/5/2018,1,6.184,1,2018-05-05,2018-05-05,0
1694971,2/11/2018,2/11/2018,1,3.684,1,2018-02-11,2018-02-11,0
1695021,6/8/2018,6/8/2018,1,7.685,1,2018-06-08,2018-06-08,0
1695391,2/14/2018,2/14/2018,1,2.47,1,2018-02-14,2018-02-14,0
169627,2/23/2018,2/23/2018,2,13.145,2,2018-02-23,2018-02-23,0
169655,8/1/2018,8/1/2018,2,9.732,2,2018-08-01,2018-08-01,0
1697231,11/2/2019,11/2/2019,1,4.446,1,2019-11-02,2019-11-02,0
1697311,8/6/2019,8/6/2019,1,4.366,1,2019-08-06,2019-08-06,0
169793,4/23/2017,7/8/2017,2,12.270999999999999,2,2017-04-23,2017-07-08,76
169797,8/25/2017,8/25/2017,1,0.762,1,2017-08-25,2017-08-25,0
1698581,3/12/2020,6/4/2019,2,13.517,1,2020-03-12,2019-06-04,-282
170045,1/10/2019,9/6/2017,172,1328.23295,15,2019-01-10,2017-09-06,-491
1701001,10/20/2018,11/10/2018,3,10.523,2,2018-10-20,2018-11-10,21
1701581,2/13/2018,5/19/2018,6,53.963,5,2018-02-13,2018-05-19,95
170181,3/14/2017,4/12/2017,2,12.774000000000001,2,2017-03-14,2017-04-12,29
1702021,1/11/2019,8/8/2019,37,424.106,7,2019-01-11,2019-08-08,209
170205,1/28/2017,1/28/2017,1,3.104,1,2017-01-28,2017-01-28,0
1702311,6/29/2018,8/13/2019,2,13.837,2,2018-06-29,2019-08-13,410
170245,1/13/2017,8/25/2017,5,23.673,4,2017-01-13,2017-08-25,224
1702651,11/17/2018,5/22/2018,2,15.422,1,2018-11-17,2018-05-22,-179
1702731,4/17/2019,9/11/2019,3,28.337,2,2019-04-17,2019-09-11,147
1702781,10/6/2019,10/6/2019,1,6.182,1,2019-10-06,2019-10-06,0
170279,12/9/2016,12/9/2016,1,7.772,1,2016-12-09,2016-12-09,0
1703011,3/21/2019,3/21/2019,1,34.04,1,2019-03-21,2019-03-21,0
170305,8/17/2016,8/17/2016,1,10.805828,1,2016-08-17,2016-08-17,0
170323,10/31/2018,10/31/2018,1,16.54,1,2018-10-31,2018-10-31,0
170353,4/12/2018,4/12/2018,1,14.095,1,2018-04-12,2018-04-12,0
170369,1/20/2017,9/28/2018,18,83.688032,9,2017-01-20,2018-09-28,616
1703741,11/2/2019,7/5/2018,4,34.433,4,2019-11-02,2018-07-05,-485
170387,1/16/2017,8/21/2019,8,67.59,3,2017-01-16,2019-08-21,947
1703881,6/20/2019,6/20/2019,1,4.243,1,2019-06-20,2019-06-20,0
1704221,1/30/2019,9/27/2018,43,1011.304,7,2019-01-30,2018-09-27,-125
170447,1/22/2018,4/13/2018,7,41.807,4,2018-01-22,2018-04-13,81
170451,1/4/2018,8/28/2016,16,75.021497,10,2018-01-04,2016-08-28,-494
170519,6/23/2018,9/6/2017,2,2.63,2,2018-06-23,2017-09-06,-290
170561,12/26/2016,7/10/2017,4,45.189,4,2016-12-26,2017-07-10,196
170563,5/9/2017,5/9/2017,1,10.021,1,2017-05-09,2017-05-09,0
1705721,12/29/2018,12/29/2018,1,10.292,1,2018-12-29,2018-12-29,0
170613,7/15/2019,8/27/2016,2,11.358091,1,2019-07-15,2016-08-27,-1052
170629,4/25/2017,7/6/2017,2,14.385000000000002,2,2017-04-25,2017-07-06,72
170687,2/6/2019,8/17/2017,6,38.483869,5,2019-02-06,2017-08-17,-538
1706991,7/7/2020,7/7/2020,1,16.263,1,2020-07-07,2020-07-07,0
170701,10/24/2016,11/28/2018,3,11.790571,3,2016-10-24,2018-11-28,765
170819,1/19/2020,9/10/2018,16,55.735,10,2020-01-19,2018-09-10,-496
170825,1/9/2017,9/4/2016,15,156.781196,5,2017-01-09,2016-09-04,-127
1708691,10/15/2019,8/20/2019,4,35.261,3,2019-10-15,2019-08-20,-56
170893,12/3/2016,9/12/2016,3,13.088655000000001,3,2016-12-03,2016-09-12,-82
1708961,10/25/2020,10/25/2020,1,11.294,1,2020-10-25,2020-10-25,0
1709011,6/17/2018,6/17/2018,1,5.034,1,2018-06-17,2018-06-17,0
170929,6/26/2018,6/26/2018,1,5.39,1,2018-06-26,2018-06-26,0
170931,1/16/2018,9/6/2016,65,690.726879,9,2018-01-16,2016-09-06,-497
1709591,2/10/2020,3/5/2020,12,124.998,3,2020-02-10,2020-03-05,24
1709971,7/27/2019,7/27/2019,1,2.862,1,2019-07-27,2019-07-27,0
1710071,2/16/2018,2/16/2018,1,6.044,1,2018-02-16,2018-02-16,0
1710331,11/10/2018,11/10/2018,1,3.004,1,2018-11-10,2018-11-10,0
171035,8/17/2018,8/17/2018,1,11.126,1,2018-08-17,2018-08-17,0
171041,10/4/2016,2/8/2018,3,17.423951000000002,2,2016-10-04,2018-02-08,492
171095,1/13/2017,9/26/2016,28,166.491627,14,2017-01-13,2016-09-26,-109
1711521,8/9/2019,8/9/2019,1,7.424,1,2019-08-09,2019-08-09,0
1711761,1/20/2020,7/7/2019,5,19.004,3,2020-01-20,2019-07-07,-197
1712161,9/21/2018,9/21/2018,1,17.715,1,2018-09-21,2018-09-21,0
1712571,4/26/2018,4/26/2018,1,5.481,1,2018-04-26,2018-04-26,0
1712651,5/5/2019,5/5/2019,1,2.927,1,2019-05-05,2019-05-05,0
1712941,10/11/2020,9/26/2020,3,21.716,3,2020-10-11,2020-09-26,-15
1712981,10/2/2019,4/9/2019,2,16.719,2,2019-10-02,2019-04-09,-176
1713041,2/16/2018,2/16/2018,3,24.929000000000002,3,2018-02-16,2018-02-16,0
171337,1/29/2017,1/29/2017,1,6.07,1,2017-01-29,2017-01-29,0
1713421,2/12/2020,3/11/2020,2,10.543,2,2020-02-12,2020-03-11,28
171401,2/8/2018,7/24/2019,2,9.05,2,2018-02-08,2019-07-24,531
171521,10/14/2019,9/25/2019,16,43.455,4,2019-10-14,2019-09-25,-19
171551,5/16/2019,5/16/2019,1,5.87,1,2019-05-16,2019-05-16,0
171553,1/1/2019,9/16/2018,22,149.351,6,2019-01-01,2018-09-16,-107
1715561,4/11/2019,9/6/2019,5,43.318,3,2019-04-11,2019-09-06,148
1715961,2/21/2019,6/19/2018,5,52.491,5,2019-02-21,2018-06-19,-247
1716071,1/12/2019,9/7/2019,70,1431.245,3,2019-01-12,2019-09-07,238
171617,11/26/2017,11/26/2017,1,6.313,1,2017-11-26,2017-11-26,0
171629,10/29/2017,10/29/2017,1,6.895,1,2017-10-29,2017-10-29,0
171657,6/17/2018,9/9/2018,2,9.832,2,2018-06-17,2018-09-09,84
171673,6/10/2019,9/5/2018,6,24.488,5,2019-06-10,2018-09-05,-278
1716791,3/26/2018,8/21/2018,5,64.858,2,2018-03-26,2018-08-21,148
171721,1/29/2020,9/28/2019,6,48.410000000000004,5,2020-01-29,2019-09-28,-123
1717451,4/15/2018,4/15/2018,1,2.741,1,2018-04-15,2018-04-15,0
171763,11/5/2016,11/5/2016,1,5.807,1,2016-11-05,2016-11-05,0
171789,2/12/2019,6/11/2019,4,23.566000000000003,4,2019-02-12,2019-06-11,119
1718261,9/27/2018,9/27/2018,1,7.564,1,2018-09-27,2018-09-27,0
171861,12/12/2016,8/9/2020,4,11.065,4,2016-12-12,2020-08-09,1336
171887,12/3/2016,12/3/2016,1,9.118,1,2016-12-03,2016-12-03,0
1718921,2/22/2019,8/17/2018,4,41.907,2,2019-02-22,2018-08-17,-189
1718971,1/13/2019,8/6/2019,6,39.117,2,2019-01-13,2019-08-06,205
1719111,12/18/2018,4/20/2018,2,30.006999999999998,2,2018-12-18,2018-04-20,-242
171929,8/16/2017,9/14/2016,2,27.915445,1,2017-08-16,2016-09-14,-336
1719711,8/12/2018,8/12/2018,1,7.214,1,2018-08-12,2018-08-12,0
171979,11/11/2017,8/17/2017,3,16.785999999999998,2,2017-11-11,2017-08-17,-86
1720201,8/4/2019,8/4/2019,1,7.713,1,2019-08-04,2019-08-04,0
1720271,1/9/2020,9/14/2018,12,38.908,7,2020-01-09,2018-09-14,-482
1720471,9/1/2019,9/1/2019,1,8.333,1,2019-09-01,2019-09-01,0
1721301,10/13/2019,9/2/2018,19,35.016,7,2019-10-13,2018-09-02,-406
1721331,1/15/2020,8/21/2019,11,51.556,3,2020-01-15,2019-08-21,-147
1721501,2/17/2020,2/24/2018,2,7.275,1,2020-02-17,2018-02-24,-723
172157,8/19/2020,8/19/2020,1,12.506,1,2020-08-19,2020-08-19,0
172169,1/21/2019,1/21/2019,1,2.757,1,2019-01-21,2019-01-21,0
1721881,12/19/2020,6/8/2019,2,7.367,2,2020-12-19,2019-06-08,-560
1722181,7/12/2018,7/12/2018,1,4.483,1,2018-07-12,2018-07-12,0
172221,6/17/2017,6/17/2017,1,6.322,1,2017-06-17,2017-06-17,0
172243,1/18/2020,7/25/2018,8,57.293,5,2020-01-18,2018-07-25,-542
1722821,12/5/2018,12/5/2018,1,7.091,1,2018-12-05,2018-12-05,0
1722911,1/10/2019,9/9/2019,67,457.254,7,2019-01-10,2019-09-09,242
172293,12/15/2017,12/15/2017,1,0.351,1,2017-12-15,2017-12-15,0
1723001,11/7/2018,7/26/2018,3,12.772,3,2018-11-07,2018-07-26,-104
1723041,3/17/2018,3/17/2018,1,8.176,1,2018-03-17,2018-03-17,0
172305,12/23/2016,12/28/2016,3,13.933,2,2016-12-23,2016-12-28,5
1723621,2/8/2020,2/8/2020,1,4.224,1,2020-02-08,2020-02-08,0
1723871,5/13/2019,5/13/2019,1,7.042,1,2019-05-13,2019-05-13,0
172397,1/23/2018,1/23/2018,1,0.425,1,2018-01-23,2018-01-23,0
1724171,7/14/2018,7/14/2018,2,13.106,2,2018-07-14,2018-07-14,0
1724531,1/18/2020,6/22/2019,11,85.689,4,2020-01-18,2019-06-22,-210
172503,12/20/2019,12/20/2019,1,0.249,1,2019-12-20,2019-12-20,0
1725081,1/14/2019,9/7/2018,45,266.693,12,2019-01-14,2018-09-07,-129
1725121,2/16/2019,9/14/2018,9,88.289,6,2019-02-16,2018-09-14,-155
1725581,5/13/2018,5/13/2018,1,7.436,1,2018-05-13,2018-05-13,0
172609,8/24/2017,9/17/2017,2,3.1660000000000004,2,2017-08-24,2017-09-17,24
172621,1/22/2018,2/8/2020,2,5.926,2,2018-01-22,2020-02-08,747
172625,11/16/2018,6/8/2018,7,30.404,2,2018-11-16,2018-06-08,-161
1726531,1/10/2020,9/9/2019,529,2895.495,11,2020-01-10,2019-09-09,-123
1726741,11/10/2018,7/6/2018,8,35.838,6,2018-11-10,2018-07-06,-127
1726911,12/5/2018,12/5/2018,1,4.208,1,2018-12-05,2018-12-05,0
1727051,2/27/2018,7/9/2018,97,555.244,6,2018-02-27,2018-07-09,132
172717,10/21/2018,10/21/2018,1,3.5,1,2018-10-21,2018-10-21,0
172771,5/24/2017,5/24/2017,1,12.132,1,2017-05-24,2017-05-24,0
172805,12/7/2018,12/7/2018,1,7.94,1,2018-12-07,2018-12-07,0
1728761,10/7/2018,10/7/2018,1,1.181,1,2018-10-07,2018-10-07,0
1728811,4/29/2019,4/29/2019,1,15.611,1,2019-04-29,2019-04-29,0
1729,1/1/2020,9/30/2017,27,114.49431,15,2020-01-01,2017-09-30,-823
172905,1/30/2019,9/12/2017,4,12.888,3,2019-01-30,2017-09-12,-505
1729051,2/2/2019,2/2/2019,1,3.485,1,2019-02-02,2019-02-02,0
172917,3/7/2018,4/17/2017,2,8.434000000000001,2,2018-03-07,2017-04-17,-324
1729221,3/13/2019,3/9/2019,6,96.235,2,2019-03-13,2019-03-09,-4
172933,8/29/2018,8/29/2018,1,14.629,1,2018-08-29,2018-08-29,0
172943,3/31/2017,7/9/2017,62,851.104,8,2017-03-31,2017-07-09,100
1729531,3/11/2018,3/11/2018,1,1.851,1,2018-03-11,2018-03-11,0
173011,8/10/2016,8/10/2016,1,5.385229,1,2016-08-10,2016-08-10,0
1730441,2/13/2020,9/4/2019,6,29.567,3,2020-02-13,2019-09-04,-162
173045,11/18/2019,11/18/2019,1,14.505,1,2019-11-18,2019-11-18,0
173077,11/4/2016,11/4/2016,1,1.373,1,2016-11-04,2016-11-04,0
1730881,6/6/2019,6/6/2019,1,6.677,1,2019-06-06,2019-06-06,0
173089,11/13/2016,9/4/2016,9,79.746512,5,2016-11-13,2016-09-04,-70
1730901,6/28/2018,6/28/2018,1,0.1,1,2018-06-28,2018-06-28,0
173105,3/12/2019,8/13/2016,6,16.339992,3,2019-03-12,2016-08-13,-941
1731291,12/5/2019,12/5/2019,1,3.074,1,2019-12-05,2019-12-05,0
1731321,6/14/2019,6/14/2019,1,2.456,1,2019-06-14,2019-06-14,0
1731351,1/11/2019,9/6/2019,20,71.246,7,2019-01-11,2019-09-06,238
173187,1/10/2019,9/5/2018,73,618.91196,19,2019-01-10,2018-09-05,-127
173189,1/28/2019,3/30/2017,7,59.873000000000005,4,2019-01-28,2017-03-30,-669
173205,3/6/2017,3/6/2017,1,5.128,1,2017-03-06,2017-03-06,0
1732091,1/4/2020,1/4/2020,1,6.359,1,2020-01-04,2020-01-04,0
173215,12/19/2018,8/2/2017,4,20.186999999999998,3,2018-12-19,2017-08-02,-504
173233,1/12/2020,9/7/2019,15,50.292414,7,2020-01-12,2019-09-07,-127
173273,5/2/2019,5/2/2019,1,8.994,1,2019-05-02,2019-05-02,0
173311,1/12/2018,8/10/2016,17,70.824454,6,2018-01-12,2016-08-10,-520
173407,4/7/2018,8/20/2017,3,15.552,2,2018-04-07,2017-08-20,-230
1734391,4/6/2019,4/6/2019,1,3.226,1,2019-04-06,2019-04-06,0
173457,11/17/2017,3/6/2017,3,34.705,3,2017-11-17,2017-03-06,-256
1735031,10/7/2018,4/21/2018,2,9.967,2,2018-10-07,2018-04-21,-169
1735041,10/11/2018,7/24/2018,26,553.344,3,2018-10-11,2018-07-24,-79
1735341,1/12/2019,10/28/2019,2,17.816,2,2019-01-12,2019-10-28,289
173537,10/13/2016,9/2/2019,2,15.904775999999998,2,2016-10-13,2019-09-02,1054
1735501,3/17/2018,3/17/2018,1,7.287,1,2018-03-17,2018-03-17,0
173627,10/13/2016,9/16/2016,21,319.572549,3,2016-10-13,2016-09-16,-27
173673,12/13/2016,9/21/2017,2,15.851,1,2016-12-13,2017-09-21,282
173677,6/18/2017,6/18/2017,1,2.08,1,2017-06-18,2017-06-18,0
1737451,1/30/2020,9/5/2019,30,149.324,15,2020-01-30,2019-09-05,-147
1737491,3/21/2018,9/28/2018,3,15.988,3,2018-03-21,2018-09-28,191
173787,2/17/2017,2/17/2017,1,1.374,1,2017-02-17,2017-02-17,0
1738151,6/20/2019,6/20/2019,1,3.663,1,2019-06-20,2019-06-20,0
173819,12/22/2019,12/22/2019,1,6.998,1,2019-12-22,2019-12-22,0
1738551,11/26/2018,11/26/2018,1,3.399,1,2018-11-26,2018-11-26,0
1738661,11/23/2019,11/23/2019,1,6.004,1,2019-11-23,2019-11-23,0
173961,10/27/2019,8/6/2017,8,96.42999999999999,2,2019-10-27,2017-08-06,-812
174015,9/17/2017,9/25/2017,2,13.773,2,2017-09-17,2017-09-25,8
174059,1/1/2017,9/30/2016,222,2395.829678,15,2017-01-01,2016-09-30,-93
174075,2/13/2017,8/5/2018,5,22.41,3,2017-02-13,2018-08-05,538
174083,1/13/2018,9/22/2018,37,105.898368,10,2018-01-13,2018-09-22,252
1741511,4/12/2019,4/12/2019,1,11.752,1,2019-04-12,2019-04-12,0
1742841,12/21/2019,4/24/2019,2,3.558,1,2019-12-21,2019-04-24,-241
1743691,7/23/2018,7/23/2018,1,14.729,1,2018-07-23,2018-07-23,0
174379,1/23/2019,9/8/2017,28,79.874226,15,2019-01-23,2017-09-08,-502
17443,8/3/2017,8/3/2017,1,1.18,1,2017-08-03,2017-08-03,0
174433,1/22/2017,9/15/2017,7,12.761000000000001,3,2017-01-22,2017-09-15,236
174521,1/21/2019,8/27/2016,5,45.318844,4,2019-01-21,2016-08-27,-877
1745271,12/25/2018,7/28/2019,13,49.783,7,2018-12-25,2019-07-28,215
1746091,2/23/2018,2/23/2018,1,13.191,1,2018-02-23,2018-02-23,0
1746401,3/12/2019,9/27/2018,2,13.773,2,2019-03-12,2018-09-27,-166
1746441,2/23/2018,2/23/2018,1,11.469,1,2018-02-23,2018-02-23,0
174657,4/28/2017,6/1/2017,2,19.333,2,2017-04-28,2017-06-01,34
174659,1/24/2017,8/7/2017,20,166.564446,3,2017-01-24,2017-08-07,195
1746701,8/21/2019,8/21/2019,1,6.926,1,2019-08-21,2019-08-21,0
174671,3/2/2019,3/2/2019,1,6.081,1,2019-03-02,2019-03-02,0
174805,10/8/2016,10/8/2016,1,3.521631,1,2016-10-08,2016-10-08,0
1748821,6/10/2018,6/10/2018,1,3.46,1,2018-06-10,2018-06-10,0
174891,1/8/2017,9/9/2017,57,565.511501,5,2017-01-08,2017-09-09,244
1749031,12/10/2018,9/2/2018,10,237.244,5,2018-12-10,2018-09-02,-99
1749271,9/1/2019,9/1/2019,1,5.906,1,2019-09-01,2019-09-01,0
1749471,1/4/2019,2/24/2018,2,6.918,2,2019-01-04,2018-02-24,-314
174973,5/2/2017,8/19/2018,3,10.784,3,2017-05-02,2018-08-19,474
1749731,12/8/2019,12/8/2019,1,3.395,1,2019-12-08,2019-12-08,0
175009,1/11/2017,8/5/2017,7,10.922635,6,2017-01-11,2017-08-05,206
1750191,1/18/2020,8/13/2019,30,118.17,15,2020-01-18,2019-08-13,-158
1750411,3/4/2018,8/19/2018,2,12.084,2,2018-03-04,2018-08-19,168
1750591,3/16/2018,6/15/2018,2,11.387,2,2018-03-16,2018-06-15,91
175083,7/6/2019,7/6/2019,1,8.171,1,2019-07-06,2019-07-06,0
1751091,6/22/2018,6/22/2018,1,11.199,1,2018-06-22,2018-06-22,0
175115,6/26/2017,9/17/2018,2,17.637,2,2017-06-26,2018-09-17,448
1751621,1/31/2020,9/21/2018,14,87.265,6,2020-01-31,2018-09-21,-497
1751801,1/17/2019,9/7/2018,19,123.996,12,2019-01-17,2018-09-07,-132
175187,1/7/2017,8/9/2016,7,58.904598,5,2017-01-07,2016-08-09,-151
175279,1/4/2020,8/6/2019,7,27.262,6,2020-01-04,2019-08-06,-151
1753011,1/19/2019,8/5/2018,4,10.534,3,2019-01-19,2018-08-05,-167
175313,7/24/2018,8/2/2017,3,10.501000000000001,1,2018-07-24,2017-08-02,-356
175391,10/24/2018,5/26/2017,2,25.48,2,2018-10-24,2017-05-26,-516
1754151,1/26/2019,9/8/2018,9,118.631,5,2019-01-26,2018-09-08,-140
175449,10/1/2016,10/1/2016,1,5.693797,1,2016-10-01,2016-10-01,0
175541,12/17/2018,3/3/2018,3,21.479,2,2018-12-17,2018-03-03,-289
1755541,1/2/2020,9/6/2018,71,2809.722,8,2020-01-02,2018-09-06,-483
175555,6/1/2018,6/1/2018,1,11.953,1,2018-06-01,2018-06-01,0
1755851,3/15/2018,3/15/2018,1,14.196,1,2018-03-15,2018-03-15,0
1756041,12/15/2018,12/7/2018,2,5.938000000000001,2,2018-12-15,2018-12-07,-8
1756101,1/16/2020,9/8/2019,19,32.458,9,2020-01-16,2019-09-08,-130
1756551,10/21/2018,3/25/2018,2,20.944000000000003,1,2018-10-21,2018-03-25,-210
175691,4/19/2017,7/26/2018,5,25.287,3,2017-04-19,2018-07-26,463
1756961,4/13/2019,9/19/2019,6,53.482,3,2019-04-13,2019-09-19,159
1757091,11/24/2019,11/24/2019,1,1.089,1,2019-11-24,2019-11-24,0
1757101,11/2/2019,8/15/2019,11,188.739,4,2019-11-02,2019-08-15,-79
175717,11/28/2018,8/24/2017,5,20.407999999999998,4,2018-11-28,2017-08-24,-461
175727,8/12/2018,8/12/2018,1,1.806,1,2018-08-12,2018-08-12,0
1757291,12/13/2019,12/13/2019,1,11.165,1,2019-12-13,2019-12-13,0
175737,1/10/2017,9/8/2016,353,3323.799731,3,2017-01-10,2016-09-08,-124
1757641,3/10/2020,3/10/2020,1,6.194,1,2020-03-10,2020-03-10,0
1757751,5/29/2018,5/29/2018,1,5.117,1,2018-05-29,2018-05-29,0
175781,1/29/2019,8/27/2017,2,18.658,2,2019-01-29,2017-08-27,-520
1757891,4/2/2018,4/2/2018,1,1.67,1,2018-04-02,2018-04-02,0
1758311,10/13/2019,9/19/2018,13,66.953,9,2019-10-13,2018-09-19,-389
1758391,11/20/2019,11/20/2019,1,16.253,1,2019-11-20,2019-11-20,0
175853,11/29/2020,11/29/2020,1,10.183,1,2020-11-29,2020-11-29,0
1758551,12/12/2019,12/12/2019,1,13.268,1,2019-12-12,2019-12-12,0
175867,1/22/2019,8/23/2018,5,9.59,5,2019-01-22,2018-08-23,-152
1758931,12/8/2019,7/4/2019,2,22.223,2,2019-12-08,2019-07-04,-157
1759171,1/13/2020,8/29/2018,44,515.57,11,2020-01-13,2018-08-29,-502
1759361,1/23/2019,8/31/2018,4,28.965,3,2019-01-23,2018-08-31,-145
1759371,1/21/2019,5/23/2018,2,19.945,2,2019-01-21,2018-05-23,-243
1760021,10/12/2019,7/13/2019,2,44.307,2,2019-10-12,2019-07-13,-91
1760111,4/28/2018,6/24/2018,2,17.72,1,2018-04-28,2018-06-24,57
1760181,12/16/2019,12/16/2019,1,16.49,1,2019-12-16,2019-12-16,0
176037,12/12/2017,12/12/2017,1,4.778,1,2017-12-12,2017-12-12,0
176043,3/23/2018,4/20/2018,3,41.692,3,2018-03-23,2018-04-20,28
176051,1/31/2017,9/28/2018,9,80.888,4,2017-01-31,2018-09-28,605
1760991,9/22/2018,9/22/2018,1,3.971,1,2018-09-22,2018-09-22,0
1761361,11/18/2018,7/5/2019,2,6.3629999999999995,2,2018-11-18,2019-07-05,229
1761411,6/2/2018,7/6/2018,2,35.107,1,2018-06-02,2018-07-06,34
1761501,11/25/2019,11/25/2019,1,4.45,1,2019-11-25,2019-11-25,0
176185,1/1/2017,9/4/2016,36,251.80719,6,2017-01-01,2016-09-04,-119
1761851,12/20/2018,7/30/2018,11,62.786,3,2018-12-20,2018-07-30,-143
1762091,5/18/2018,5/18/2018,1,2.403,1,2018-05-18,2018-05-18,0
1762101,2/9/2020,2/9/2020,1,6.25,1,2020-02-09,2020-02-09,0
176225,12/13/2017,8/15/2019,6,64.905,3,2017-12-13,2019-08-15,610
176253,12/9/2016,9/2/2018,5,28.785737,3,2016-12-09,2018-09-02,632
1762731,8/13/2018,8/13/2018,1,3.396,1,2018-08-13,2018-08-13,0
1762871,2/17/2019,5/4/2019,2,4.639,2,2019-02-17,2019-05-04,76
1763151,10/23/2019,4/17/2019,7,47.978,4,2019-10-23,2019-04-17,-189
176381,6/16/2017,6/16/2017,1,7.214,1,2017-06-16,2017-06-16,0
176401,1/8/2017,9/14/2018,8,48.526707,3,2017-01-08,2018-09-14,614
1764581,3/16/2019,3/16/2019,1,1.6,1,2019-03-16,2019-03-16,0
1765211,9/20/2020,9/20/2020,1,13.505,1,2020-09-20,2020-09-20,0
176529,11/4/2017,11/4/2017,1,1.591,1,2017-11-04,2017-11-04,0
1765671,3/27/2018,5/28/2018,6,35.896,3,2018-03-27,2018-05-28,62
1766051,7/6/2018,7/6/2018,1,2.084,1,2018-07-06,2018-07-06,0
176611,12/30/2019,8/11/2016,2,2.626677,2,2019-12-30,2016-08-11,-1236
1766151,3/3/2020,9/16/2018,5,28.906,3,2020-03-03,2018-09-16,-534
17663,11/27/2018,4/29/2018,5,15.565999999999999,5,2018-11-27,2018-04-29,-212
176673,1/19/2019,9/8/2016,8,68.527213,5,2019-01-19,2016-09-08,-863
1767071,4/30/2018,9/22/2018,3,12.67,3,2018-04-30,2018-09-22,145
1767241,3/13/2018,3/13/2018,1,1.535,1,2018-03-13,2018-03-13,0
1767551,8/10/2018,8/10/2018,1,7.558,1,2018-08-10,2018-08-10,0
176759,1/9/2017,9/8/2016,8,148.966672,5,2017-01-09,2016-09-08,-123
176767,11/1/2016,11/1/2016,1,2.785,1,2016-11-01,2016-11-01,0
176791,3/10/2017,3/9/2018,2,19.127,2,2017-03-10,2018-03-09,364
1768391,2/28/2018,9/18/2018,5,19.504,3,2018-02-28,2018-09-18,202
1768951,10/15/2018,9/7/2018,19,774.722,4,2018-10-15,2018-09-07,-38
176903,10/1/2016,8/18/2018,10,16.801811999999998,6,2016-10-01,2018-08-18,686
1769281,8/26/2018,8/26/2018,1,1.37,1,2018-08-26,2018-08-26,0
1770581,6/11/2019,6/11/2019,1,5.937,1,2019-06-11,2019-06-11,0
1770931,10/11/2018,10/11/2018,1,6.839,1,2018-10-11,2018-10-11,0
177101,11/11/2017,5/15/2019,3,24.765,3,2017-11-11,2019-05-15,550
1771061,1/16/2020,8/18/2018,14,90.093,3,2020-01-16,2018-08-18,-516
17713,2/23/2017,2/23/2017,1,5.264,1,2017-02-23,2017-02-23,0
177133,8/13/2020,8/13/2020,1,10.141,1,2020-08-13,2020-08-13,0
177135,2/27/2019,2/27/2019,1,6.313,1,2019-02-27,2019-02-27,0
1772081,1/14/2019,9/30/2018,38,383.51,7,2019-01-14,2018-09-30,-106
1772171,7/6/2018,7/6/2018,1,6.617,1,2018-07-06,2018-07-06,0
177235,4/11/2019,4/11/2019,1,12.091,1,2019-04-11,2019-04-11,0
177291,5/4/2019,5/4/2019,1,8.852,1,2019-05-04,2019-05-04,0
177345,9/13/2019,9/13/2019,1,3.06,1,2019-09-13,2019-09-13,0
1774121,8/14/2018,8/14/2018,1,7.978,1,2018-08-14,2018-08-14,0
177499,1/10/2018,9/25/2019,37,283.45799999999997,13,2018-01-10,2019-09-25,623
1775291,5/20/2018,5/23/2018,2,18.969,2,2018-05-20,2018-05-23,3
177541,1/25/2017,11/28/2016,2,12.607,2,2017-01-25,2016-11-28,-58
177611,2/1/2020,2/1/2020,1,8.515,1,2020-02-01,2020-02-01,0
177657,6/17/2018,6/17/2018,1,2.686,1,2018-06-17,2018-06-17,0
177667,9/22/2019,9/22/2019,1,7.456,1,2019-09-22,2019-09-22,0
177669,10/24/2019,10/24/2019,1,19.3,1,2019-10-24,2019-10-24,0
1776861,1/15/2019,8/12/2018,14,184.3,8,2019-01-15,2018-08-12,-156
177741,1/27/2017,7/23/2017,5,26.657,5,2017-01-27,2017-07-23,177
1777641,3/13/2018,3/13/2018,1,15.193,1,2018-03-13,2018-03-13,0
177813,6/19/2019,9/13/2018,4,3.423,2,2019-06-19,2018-09-13,-279
1778271,4/7/2019,4/7/2019,1,7.033,1,2019-04-07,2019-04-07,0
1778461,3/2/2020,3/2/2020,1,0.296,1,2020-03-02,2020-03-02,0
177861,10/12/2018,9/9/2018,2,10.373000000000001,2,2018-10-12,2018-09-09,-33
1779191,1/2/2020,6/5/2019,17,312.082,5,2020-01-02,2019-06-05,-211
1779351,4/3/2019,4/3/2019,1,3.958,1,2019-04-03,2019-04-03,0
177937,10/15/2016,9/24/2016,2,6.955954999999999,2,2016-10-15,2016-09-24,-21
1779461,3/3/2018,3/3/2018,1,9.626,1,2018-03-03,2018-03-03,0
177955,1/11/2018,9/12/2017,7,80.171,5,2018-01-11,2017-09-12,-121
1779971,7/15/2019,7/15/2019,1,3.864,1,2019-07-15,2019-07-15,0
178039,2/25/2020,2/25/2020,1,7.031,1,2020-02-25,2020-02-25,0
1780891,2/13/2020,2/13/2020,1,10.539,1,2020-02-13,2020-02-13,0
1781271,2/13/2020,3/11/2020,2,35.836000000000006,2,2020-02-13,2020-03-11,27
178173,1/18/2019,1/18/2019,1,6.097,1,2019-01-18,2019-01-18,0
1781901,5/31/2018,5/31/2018,1,8.006,1,2018-05-31,2018-05-31,0
1782151,9/5/2018,9/5/2018,1,5.389,1,2018-09-05,2018-09-05,0
178227,2/1/2020,2/1/2020,1,16.381,1,2020-02-01,2020-02-01,0
178293,12/18/2018,8/22/2019,2,20.721,2,2018-12-18,2019-08-22,247
1783991,5/25/2019,8/16/2018,2,21.762,2,2019-05-25,2018-08-16,-282
178407,4/30/2019,4/30/2019,1,11.331,1,2019-04-30,2019-04-30,0
178433,10/21/2017,9/24/2019,7,24.936,5,2017-10-21,2019-09-24,703
178447,1/2/2020,9/9/2016,54,340.569454,12,2020-01-02,2016-09-09,-1210
1784781,9/6/2018,9/6/2018,1,5.934,1,2018-09-06,2018-09-06,0
1784881,1/25/2019,3/15/2018,2,17.583,2,2019-01-25,2018-03-15,-316
178497,1/18/2020,1/18/2020,1,10.128,1,2020-01-18,2020-01-18,0
1785201,2/8/2019,2/8/2019,1,5.589,1,2019-02-08,2019-02-08,0
1785391,9/1/2019,9/1/2019,1,3.822,1,2019-09-01,2019-09-01,0
178543,12/1/2016,12/1/2016,1,13.131,1,2016-12-01,2016-12-01,0
1786101,8/23/2018,8/23/2018,1,1.095,1,2018-08-23,2018-08-23,0
1786421,12/6/2018,8/19/2018,3,11.727,3,2018-12-06,2018-08-19,-109
1786901,10/18/2019,10/18/2019,1,6.537,1,2019-10-18,2019-10-18,0
178691,1/27/2019,5/19/2019,5,10.454,4,2019-01-27,2019-05-19,112
1787591,6/22/2018,6/22/2018,1,3.351,1,2018-06-22,2018-06-22,0
178767,1/2/2020,8/3/2020,13,235.126,4,2020-01-02,2020-08-03,214
178793,1/10/2020,8/22/2019,7,67.16358,4,2020-01-10,2019-08-22,-141
1787961,1/15/2020,9/18/2019,5,35.766,1,2020-01-15,2019-09-18,-119
1788641,1/19/2020,9/20/2020,11,56.533,6,2020-01-19,2020-09-20,245
1788771,11/30/2018,11/30/2018,1,10.146,1,2018-11-30,2018-11-30,0
1789651,10/8/2018,10/8/2018,1,3.586,1,2018-10-08,2018-10-08,0
1789691,4/15/2018,4/15/2018,1,2.054,1,2018-04-15,2018-04-15,0
1789831,8/2/2018,8/2/2018,1,8.884,1,2018-08-02,2018-08-02,0
1790131,11/16/2018,9/8/2018,69,679.761,14,2018-11-16,2018-09-08,-69
1790661,1/4/2020,5/5/2018,11,52.854,8,2020-01-04,2018-05-05,-609
1791941,10/3/2019,8/26/2019,2,23.86,2,2019-10-03,2019-08-26,-38
1792001,1/12/2019,9/29/2019,33,363.271,7,2019-01-12,2019-09-29,260
17923,1/13/2020,9/9/2019,74,304.769,14,2020-01-13,2019-09-09,-126
1792401,6/1/2019,8/24/2019,2,9.254,2,2019-06-01,2019-08-24,84
179271,1/9/2020,10/27/2019,2,15.584,2,2020-01-09,2019-10-27,-74
179273,1/16/2020,9/16/2018,20,303.443,7,2020-01-16,2018-09-16,-487
179289,3/13/2017,3/13/2017,1,7.516,1,2017-03-13,2017-03-13,0
1793161,2/14/2019,2/14/2019,1,5.784,1,2019-02-14,2019-02-14,0
179323,1/17/2018,1/17/2018,1,1.223,1,2018-01-17,2018-01-17,0
17933,3/22/2019,3/22/2019,1,4.154,1,2019-03-22,2019-03-22,0
179349,10/1/2016,10/1/2016,1,2.25625,1,2016-10-01,2016-10-01,0
1793641,10/22/2020,9/7/2019,5,41.418,1,2020-10-22,2019-09-07,-411
1793721,6/5/2019,6/5/2019,1,6.638,1,2019-06-05,2019-06-05,0
1793981,3/28/2018,3/6/2018,2,12.646,2,2018-03-28,2018-03-06,-22
1794261,3/7/2020,3/7/2020,1,3.647,1,2020-03-07,2020-03-07,0
179455,7/10/2019,7/10/2019,1,1.546,1,2019-07-10,2019-07-10,0
1794651,12/12/2018,9/17/2019,4,38.288000000000004,2,2018-12-12,2019-09-17,279
1794821,6/15/2018,6/15/2018,1,3.379,1,2018-06-15,2018-06-15,0
1794911,1/18/2020,7/22/2019,9,51.302,3,2020-01-18,2019-07-22,-180
179603,11/4/2016,5/12/2019,2,11.105,2,2016-11-04,2019-05-12,919
179667,4/10/2018,6/7/2018,2,12.942,2,2018-04-10,2018-06-07,58
1796731,2/9/2019,3/31/2018,2,8.154,2,2019-02-09,2018-03-31,-315
179675,1/11/2017,9/5/2019,9,38.400805,2,2017-01-11,2019-09-05,967
179735,9/3/2016,9/3/2016,1,11.155891,1,2016-09-03,2016-09-03,0
179823,1/10/2019,9/4/2018,35,543.301,4,2019-01-10,2018-09-04,-128
179827,1/13/2017,8/19/2016,3,22.306286999999998,3,2017-01-13,2016-08-19,-147
1798321,9/25/2020,9/25/2020,1,5.097,1,2020-09-25,2020-09-25,0
1798361,4/11/2019,8/10/2019,2,8.586,2,2019-04-11,2019-08-10,121
179855,10/6/2017,10/6/2017,1,12.803,1,2017-10-06,2017-10-06,0
1798701,7/15/2018,7/15/2018,1,2.095,1,2018-07-15,2018-07-15,0
179871,6/16/2018,9/1/2019,2,13.41,2,2018-06-16,2019-09-01,442
1799501,8/24/2019,9/28/2019,2,11.097999999999999,1,2019-08-24,2019-09-28,35
1799651,3/30/2018,3/30/2018,1,2.475,1,2018-03-30,2018-03-30,0
1799931,6/25/2019,6/25/2019,1,5.484,1,2019-06-25,2019-06-25,0
1800031,3/7/2018,3/7/2018,1,3.93,1,2018-03-07,2018-03-07,0
180013,1/2/2017,9/6/2019,111,1032.606923,9,2017-01-02,2019-09-06,977
1800941,1/27/2019,9/12/2018,10,57.668,8,2019-01-27,2018-09-12,-137
180141,1/27/2017,11/9/2019,2,8.011,2,2017-01-27,2019-11-09,1016
180153,4/16/2017,9/25/2016,5,24.739213,3,2017-04-16,2016-09-25,-203
180185,4/24/2018,4/24/2018,1,2.432,1,2018-04-24,2018-04-24,0
1802241,4/18/2019,4/18/2019,1,7.267,1,2019-04-18,2019-04-18,0
1802821,6/20/2019,6/20/2019,1,5.05,1,2019-06-20,2019-06-20,0
180305,2/14/2020,9/26/2020,2,7.086,2,2020-02-14,2020-09-26,225
1803361,7/16/2019,7/16/2019,1,6.096,1,2019-07-16,2019-07-16,0
1803371,2/28/2019,2/28/2019,1,6.104,1,2019-02-28,2019-02-28,0
180371,1/6/2019,9/26/2018,7,73.899,5,2019-01-06,2018-09-26,-102
180405,1/18/2018,9/5/2019,26,305.667,6,2018-01-18,2019-09-05,595
1804051,3/10/2018,3/10/2018,1,9.097,1,2018-03-10,2018-03-10,0
180421,10/26/2016,9/30/2016,6,10.472581,5,2016-10-26,2016-09-30,-26
1804281,3/8/2018,3/8/2018,1,10.672,1,2018-03-08,2018-03-08,0
1804461,11/30/2018,8/6/2018,14,2.839,2,2018-11-30,2018-08-06,-116
180453,1/8/2019,1/8/2019,1,4.86,1,2019-01-08,2019-01-08,0
1804791,2/20/2020,7/7/2018,3,17.782,3,2020-02-20,2018-07-07,-593
180581,9/9/2017,9/9/2017,1,10.714,1,2017-09-09,2017-09-09,0
1807551,2/21/2019,5/3/2018,2,19.130000000000003,2,2019-02-21,2018-05-03,-294
1807891,3/23/2018,9/1/2018,4,27.636,2,2018-03-23,2018-09-01,162
1808901,5/15/2019,5/15/2019,1,1.93,1,2019-05-15,2019-05-15,0
1809061,3/28/2018,9/28/2018,8,26.321,4,2018-03-28,2018-09-28,184
180909,7/22/2018,9/23/2016,3,7.305256,2,2018-07-22,2016-09-23,-667
181003,9/29/2018,9/29/2018,1,9.654,1,2018-09-29,2018-09-29,0
181019,10/13/2017,7/7/2018,4,27.8,4,2017-10-13,2018-07-07,267
181027,2/11/2017,9/30/2018,3,17.076,2,2017-02-11,2018-09-30,596
181097,7/25/2017,7/25/2017,1,8.182,1,2017-07-25,2017-07-25,0
1811501,3/10/2018,3/10/2018,1,1.73,1,2018-03-10,2018-03-10,0
1812261,7/15/2018,7/15/2018,1,7.511,1,2018-07-15,2018-07-15,0
181259,11/22/2019,11/22/2019,1,10.095,1,2019-11-22,2019-11-22,0
181295,10/19/2019,10/19/2019,1,7.132,1,2019-10-19,2019-10-19,0
1812971,7/20/2019,7/20/2019,1,5.797,1,2019-07-20,2019-07-20,0
181325,8/16/2016,9/30/2016,2,9.361640000000001,2,2016-08-16,2016-09-30,45
18133,11/9/2016,8/20/2016,6,41.199061,5,2016-11-09,2016-08-20,-81
181363,1/5/2019,7/5/2019,7,40.085,2,2019-01-05,2019-07-05,181
181459,1/14/2017,1/22/2017,2,22.697,2,2017-01-14,2017-01-22,8
1814631,3/17/2018,3/17/2018,1,13.444,1,2018-03-17,2018-03-17,0
181549,2/23/2020,2/23/2020,1,7.461,1,2020-02-23,2020-02-23,0
181591,5/11/2018,6/22/2018,4,23.986,4,2018-05-11,2018-06-22,42
1816321,1/10/2019,8/30/2019,6,23.12,4,2019-01-10,2019-08-30,232
181647,7/17/2018,7/17/2018,1,15.796,1,2018-07-17,2018-07-17,0
1817341,4/25/2018,4/25/2018,1,10.1,1,2018-04-25,2018-04-25,0
1817551,1/10/2020,9/25/2019,42,422.037,6,2020-01-10,2019-09-25,-107
1817661,3/11/2018,3/11/2018,1,1.84,1,2018-03-11,2018-03-11,0
181767,1/17/2017,9/9/2016,21,210.708572,7,2017-01-17,2016-09-09,-130
1817741,10/27/2018,7/12/2018,4,57.835,4,2018-10-27,2018-07-12,-107
1818461,5/9/2018,5/9/2018,1,4.402,1,2018-05-09,2018-05-09,0
1819111,1/2/2020,9/24/2020,30,142.016,5,2020-01-02,2020-09-24,266
1819281,8/29/2019,8/29/2019,1,1.669,1,2019-08-29,2019-08-29,0
1820311,3/12/2018,3/12/2018,1,10.502,1,2018-03-12,2018-03-12,0
1820811,1/1/2019,9/29/2018,72,337.115,10,2019-01-01,2018-09-29,-94
182115,2/4/2017,2/4/2017,1,6.663,1,2017-02-04,2017-02-04,0
182131,10/15/2019,9/23/2019,4,14.207,3,2019-10-15,2019-09-23,-22
182141,8/5/2016,8/5/2016,1,0.716321,1,2016-08-05,2016-08-05,0
182143,10/6/2016,9/2/2016,10,38.007066,5,2016-10-06,2016-09-02,-34
1821871,2/25/2019,2/25/2019,1,2.039,1,2019-02-25,2019-02-25,0
182191,8/2/2016,8/2/2016,1,3.869313,1,2016-08-02,2016-08-02,0
182239,6/21/2017,6/21/2017,1,3.682,1,2017-06-21,2017-06-21,0
1822401,2/20/2019,5/7/2019,9,79.845,7,2019-02-20,2019-05-07,76
1822911,3/12/2018,9/23/2019,4,15.844000000000001,2,2018-03-12,2019-09-23,560
1822951,3/13/2018,6/8/2019,4,23.401,3,2018-03-13,2019-06-08,452
182301,3/23/2017,3/23/2017,1,2.584,1,2017-03-23,2017-03-23,0
182303,1/25/2019,1/25/2019,1,3.366,1,2019-01-25,2019-01-25,0
182311,11/18/2017,4/8/2019,3,11.058,3,2017-11-18,2019-04-08,506
182317,3/14/2018,6/17/2018,2,22.461,2,2018-03-14,2018-06-17,95
182325,8/16/2019,9/2/2019,2,0.207,2,2019-08-16,2019-09-02,17
1823501,10/12/2018,10/12/2018,1,11.351,1,2018-10-12,2018-10-12,0
182355,11/14/2019,11/14/2019,1,7.152,1,2019-11-14,2019-11-14,0
1824001,6/9/2018,6/9/2018,1,3.94,1,2018-06-09,2018-06-09,0
1824111,9/4/2020,9/4/2020,1,2.556,1,2020-09-04,2020-09-04,0
182413,12/27/2016,2/16/2017,2,5.973,1,2016-12-27,2017-02-16,51
1824281,3/17/2018,4/10/2019,2,15.390999999999998,2,2018-03-17,2019-04-10,389
182529,12/20/2019,9/15/2019,5,65.107,1,2019-12-20,2019-09-15,-96
182551,9/30/2018,9/30/2018,1,5.337,1,2018-09-30,2018-09-30,0
1825761,1/31/2020,6/8/2019,7,42.508,5,2020-01-31,2019-06-08,-237
1826081,6/21/2018,6/21/2018,1,5.673,1,2018-06-21,2018-06-21,0
1826141,11/2/2019,6/17/2018,2,10.121,2,2019-11-02,2018-06-17,-503
182647,1/16/2017,9/5/2016,4,24.788485,3,2017-01-16,2016-09-05,-133
182657,9/19/2020,9/19/2020,1,6.021,1,2020-09-19,2020-09-19,0
1826761,1/27/2019,8/19/2019,12,59.363,9,2019-01-27,2019-08-19,204
182687,10/11/2016,10/11/2016,1,9.502187,1,2016-10-11,2016-10-11,0
1827361,6/23/2018,8/5/2018,3,11.318999999999999,3,2018-06-23,2018-08-05,43
1827451,10/20/2019,10/20/2019,1,5.697,1,2019-10-20,2019-10-20,0
1827991,1/10/2020,9/4/2019,7,23.322,3,2020-01-10,2019-09-04,-128
1828001,4/7/2018,4/7/2018,1,6.449,1,2018-04-07,2018-04-07,0
182819,3/10/2017,9/15/2017,5,53.733000000000004,3,2017-03-10,2017-09-15,189
182837,3/1/2019,3/1/2019,1,4.8,1,2019-03-01,2019-03-01,0
182861,1/5/2019,6/24/2017,6,40.547,2,2019-01-05,2017-06-24,-560
1828861,11/6/2019,6/9/2018,4,17.026,3,2019-11-06,2018-06-09,-515
182895,1/28/2017,1/28/2017,1,8.669,1,2017-01-28,2017-01-28,0
1828981,10/1/2018,9/7/2018,196,1537.106,11,2018-10-01,2018-09-07,-24
1829001,6/1/2018,6/1/2018,1,7.596,1,2018-06-01,2018-06-01,0
182907,11/16/2019,6/22/2019,3,28.303,2,2019-11-16,2019-06-22,-147
1829141,12/30/2018,12/30/2018,1,9.992,1,2018-12-30,2018-12-30,0
182917,1/10/2017,9/9/2016,162,1760.185423,6,2017-01-10,2016-09-09,-123
1829241,1/11/2020,1/11/2020,1,7.072,1,2020-01-11,2020-01-11,0
182981,8/20/2019,8/20/2019,1,9.572,1,2019-08-20,2019-08-20,0
1830371,1/20/2020,10/27/2018,2,11.85,2,2020-01-20,2018-10-27,-450
183063,12/11/2016,12/11/2016,1,2.558,1,2016-12-11,2016-12-11,0
1831041,6/13/2018,6/13/2018,1,10.542,1,2018-06-13,2018-06-13,0
183145,10/26/2016,9/17/2016,6,12.897348,5,2016-10-26,2016-09-17,-39
1831491,10/17/2019,10/17/2019,2,22.186,2,2019-10-17,2019-10-17,0
183153,1/16/2017,9/27/2016,50,98.204285,3,2017-01-16,2016-09-27,-111
183169,2/14/2020,2/14/2020,1,3.572,1,2020-02-14,2020-02-14,0
183257,10/7/2017,11/4/2017,2,10.224,2,2017-10-07,2017-11-04,28
183267,1/11/2020,1/11/2020,1,3.336,1,2020-01-11,2020-01-11,0
183271,5/25/2017,5/25/2017,1,6.645,1,2017-05-25,2017-05-25,0
183321,11/2/2018,11/2/2018,1,0.755,1,2018-11-02,2018-11-02,0
1833441,3/15/2018,7/17/2018,5,31.975,3,2018-03-15,2018-07-17,124
1833471,4/18/2018,4/18/2018,1,7.888,1,2018-04-18,2018-04-18,0
1833861,2/2/2020,2/2/2020,1,6.273,1,2020-02-02,2020-02-02,0
1834031,11/14/2018,11/14/2018,1,9.934,1,2018-11-14,2018-11-14,0
183407,12/24/2019,12/24/2019,1,10.848,1,2019-12-24,2019-12-24,0
183479,1/10/2017,7/7/2017,117,2104.739,6,2017-01-10,2017-07-07,178
183541,10/28/2017,2/26/2017,2,22.282,2,2017-10-28,2017-02-26,-244
183543,10/31/2016,8/17/2016,3,36.124145999999996,2,2016-10-31,2016-08-17,-75
1835531,11/3/2018,9/1/2018,2,24.406,2,2018-11-03,2018-09-01,-63
183583,10/9/2016,10/9/2016,1,1.131784,1,2016-10-09,2016-10-09,0
1835971,3/15/2018,3/15/2018,1,5.355,1,2018-03-15,2018-03-15,0
1836221,10/27/2019,10/27/2019,1,1.741,1,2019-10-27,2019-10-27,0
183637,12/11/2019,12/11/2019,1,10.233,1,2019-12-11,2019-12-11,0
183655,1/10/2017,9/9/2016,209,2467.080137,10,2017-01-10,2016-09-09,-123
183667,12/15/2017,4/25/2018,2,6.622,2,2017-12-15,2018-04-25,131
183719,10/1/2016,9/26/2016,11,33.937881,6,2016-10-01,2016-09-26,-5
183733,10/11/2016,6/18/2017,3,25.047431,3,2016-10-11,2017-06-18,250
183735,7/24/2017,8/1/2017,2,3.2079999999999997,2,2017-07-24,2017-08-01,8
1837841,1/29/2020,9/18/2018,25,73.264,8,2020-01-29,2018-09-18,-498
1838251,6/20/2018,6/5/2019,2,17.166,2,2018-06-20,2019-06-05,350
1838281,10/16/2019,9/26/2019,9,147.92600000000002,5,2019-10-16,2019-09-26,-20
183831,11/23/2018,3/28/2018,2,2.617,2,2018-11-23,2018-03-28,-240
183873,8/12/2016,8/12/2016,1,5.654096,1,2016-08-12,2016-08-12,0
183875,11/22/2016,8/9/2016,7,44.407053,3,2016-11-22,2016-08-09,-105
183877,1/12/2019,9/7/2016,16,553.773027,2,2019-01-12,2016-09-07,-857
1839081,5/12/2019,5/12/2019,1,2.491,1,2019-05-12,2019-05-12,0
183911,8/22/2017,8/22/2017,1,6.338,1,2017-08-22,2017-08-22,0
1839311,3/16/2018,3/16/2018,1,5.683,1,2018-03-16,2018-03-16,0
1840071,2/17/2020,2/17/2020,1,2.597,1,2020-02-17,2020-02-17,0
1840721,3/17/2018,3/17/2018,1,14.795,1,2018-03-17,2018-03-17,0
184101,5/1/2018,5/1/2018,1,0.653,1,2018-05-01,2018-05-01,0
1841161,8/24/2018,9/21/2019,2,20.372,2,2018-08-24,2019-09-21,393
184125,1/15/2020,7/29/2019,5,22.108,4,2020-01-15,2019-07-29,-170
184145,1/18/2017,1/18/2017,1,11.66,1,2017-01-18,2017-01-18,0
184201,12/2/2017,5/12/2019,5,38.445,4,2017-12-02,2019-05-12,526
184259,10/26/2016,8/28/2016,5,47.061044,4,2016-10-26,2016-08-28,-59
1842811,3/17/2018,3/17/2018,2,17.512999999999998,2,2018-03-17,2018-03-17,0
184285,1/10/2018,9/5/2018,32,75.556,17,2018-01-10,2018-09-05,238
184315,12/15/2019,9/2/2018,8,32.301,4,2019-12-15,2018-09-02,-469
184331,7/12/2019,7/12/2019,1,3.999,1,2019-07-12,2019-07-12,0
1843381,10/10/2020,10/10/2020,1,6.459,1,2020-10-10,2020-10-10,0
184367,1/19/2020,7/31/2019,5,13.216,4,2020-01-19,2019-07-31,-172
1843671,12/19/2018,9/24/2019,3,10.035,2,2018-12-19,2019-09-24,279
184439,10/3/2016,10/3/2016,1,2.099719,1,2016-10-03,2016-10-03,0
1844431,3/18/2018,3/24/2018,2,12.573,2,2018-03-18,2018-03-24,6
184445,1/16/2019,9/9/2016,168,1570.301053,14,2019-01-16,2016-09-09,-859
184493,1/6/2019,9/5/2018,34,427.201,5,2019-01-06,2018-09-05,-123
1845111,4/27/2018,4/27/2018,1,9.481,1,2018-04-27,2018-04-27,0
1845191,1/4/2019,9/26/2018,4,29.348,3,2019-01-04,2018-09-26,-100
1845421,5/26/2018,5/26/2018,1,2.257,1,2018-05-26,2018-05-26,0
1845461,7/24/2018,7/24/2018,1,5.476,1,2018-07-24,2018-07-24,0
184557,1/19/2018,8/10/2018,7,18.928,4,2018-01-19,2018-08-10,203
184565,10/29/2018,7/13/2018,4,34.17,3,2018-10-29,2018-07-13,-108
1845741,11/14/2019,7/18/2018,5,28.231,1,2019-11-14,2018-07-18,-484
1845991,12/6/2019,12/6/2019,1,6.525,1,2019-12-06,2019-12-06,0
1846181,5/10/2019,6/2/2018,2,10.427,1,2019-05-10,2018-06-02,-342
184701,8/28/2016,8/28/2016,1,1.543511,1,2016-08-28,2016-08-28,0
1847531,7/22/2018,7/22/2018,1,15.343,1,2018-07-22,2018-07-22,0
1847931,1/10/2020,9/6/2019,24,183.622,5,2020-01-10,2019-09-06,-126
1848001,3/19/2018,3/19/2018,1,3.774,1,2018-03-19,2018-03-19,0
184837,8/18/2017,8/18/2017,1,1.707,1,2017-08-18,2017-08-18,0
184841,1/11/2020,9/25/2019,20,41.229,4,2020-01-11,2019-09-25,-108
184871,11/16/2016,9/25/2018,15,65.028,9,2016-11-16,2018-09-25,678
1848761,11/19/2019,11/19/2019,1,3.31,1,2019-11-19,2019-11-19,0
184881,2/10/2017,3/21/2019,2,6.035,2,2017-02-10,2019-03-21,769
184901,1/24/2017,1/24/2017,1,2.507,1,2017-01-24,2017-01-24,0
184915,8/1/2016,8/2/2016,2,62.339899,1,2016-08-01,2016-08-02,1
184977,11/13/2016,8/18/2016,4,27.639479,4,2016-11-13,2016-08-18,-87
184995,3/9/2020,3/9/2020,1,0.422,1,2020-03-09,2020-03-09,0
185015,5/13/2018,9/9/2016,2,2.591786,1,2018-05-13,2016-09-09,-611
18503,12/23/2017,7/9/2018,3,26.915,2,2017-12-23,2018-07-09,198
185043,2/13/2018,8/30/2018,3,10.0,3,2018-02-13,2018-08-30,198
185045,11/20/2017,9/17/2017,4,12.789,2,2017-11-20,2017-09-17,-64
1850771,8/22/2018,8/22/2018,1,8.98,1,2018-08-22,2018-08-22,0
1850781,8/9/2019,9/28/2018,2,9.649999999999999,2,2019-08-09,2018-09-28,-315
1851011,3/26/2018,8/13/2018,4,28.421,4,2018-03-26,2018-08-13,140
18513,4/24/2019,4/24/2019,1,4.046,1,2019-04-24,2019-04-24,0
1851471,1/15/2019,9/18/2019,26,467.281,5,2019-01-15,2019-09-18,246
185199,3/11/2017,3/11/2017,1,3.981,1,2017-03-11,2017-03-11,0
185215,12/31/2017,12/31/2017,1,9.541,1,2017-12-31,2017-12-31,0
185231,1/18/2020,9/9/2019,53,402.339,17,2020-01-18,2019-09-09,-131
1852611,9/27/2019,9/27/2019,1,11.059,1,2019-09-27,2019-09-27,0
1852821,5/21/2018,5/21/2018,1,0.583,1,2018-05-21,2018-05-21,0
185287,11/3/2016,11/3/2016,1,7.37,1,2016-11-03,2016-11-03,0
1852901,6/2/2018,6/2/2018,1,7.229,1,2018-06-02,2018-06-02,0
1852951,4/8/2018,4/8/2018,1,14.893,1,2018-04-08,2018-04-08,0
1853001,1/10/2019,9/6/2019,165,1736.195,22,2019-01-10,2019-09-06,239
1854141,2/12/2020,6/6/2020,2,15.046000000000001,1,2020-02-12,2020-06-06,115
185419,7/18/2018,9/21/2017,3,26.630000000000003,3,2018-07-18,2017-09-21,-300
185487,1/9/2017,1/9/2017,1,2.541,1,2017-01-09,2017-01-09,0
1855091,12/12/2019,6/30/2019,3,20.799,3,2019-12-12,2019-06-30,-165
185527,8/13/2016,8/13/2016,1,10.090419,1,2016-08-13,2016-08-13,0
1856151,8/18/2018,8/18/2018,1,4.907,1,2018-08-18,2018-08-18,0
185659,9/16/2016,9/16/2016,1,2.849667,1,2016-09-16,2016-09-16,0
1857041,1/30/2020,1/30/2020,1,9.05,1,2020-01-30,2020-01-30,0
185705,11/28/2018,9/25/2018,9,10.861,4,2018-11-28,2018-09-25,-64
185739,10/26/2019,7/20/2019,4,21.998,4,2019-10-26,2019-07-20,-98
185769,1/23/2018,9/8/2017,9,24.268,4,2018-01-23,2017-09-08,-137
1857781,1/18/2019,9/29/2020,66,306.745,10,2019-01-18,2020-09-29,620
185781,11/4/2018,3/21/2017,4,21.919,4,2018-11-04,2017-03-21,-593
185791,1/10/2020,9/5/2018,171,1111.883,9,2020-01-10,2018-09-05,-492
1858091,7/22/2020,7/22/2020,1,10.328,1,2020-07-22,2020-07-22,0
185843,10/5/2019,6/13/2019,3,22.721,3,2019-10-05,2019-06-13,-114
185847,1/15/2017,9/6/2018,21,73.054586,11,2017-01-15,2018-09-06,599
185857,11/14/2019,5/14/2019,3,18.849999999999998,2,2019-11-14,2019-05-14,-184
1858891,6/4/2019,6/4/2019,1,10.016,1,2019-06-04,2019-06-04,0
185939,4/4/2017,4/4/2017,1,5.607,1,2017-04-04,2017-04-04,0
1859641,5/30/2019,5/30/2019,1,2.77,1,2019-05-30,2019-05-30,0
185981,3/9/2019,3/9/2019,1,6.187,1,2019-03-09,2019-03-09,0
1859811,1/24/2020,6/3/2018,8,29.665,5,2020-01-24,2018-06-03,-600
1859861,5/31/2018,5/31/2018,1,6.485,1,2018-05-31,2018-05-31,0
185993,1/4/2019,1/4/2019,1,8.346,1,2019-01-04,2019-01-04,0
185999,3/2/2019,3/2/2019,1,2.845,1,2019-03-02,2019-03-02,0
1860001,12/8/2019,7/19/2018,2,18.492,2,2019-12-08,2018-07-19,-507
186033,12/8/2016,12/8/2016,1,2.887,1,2016-12-08,2016-12-08,0
186069,4/4/2018,4/4/2018,1,8.163,1,2018-04-04,2018-04-04,0
1860931,4/15/2018,5/24/2018,4,9.59,3,2018-04-15,2018-05-24,39
186099,10/30/2016,8/6/2017,3,6.218999999999999,2,2016-10-30,2017-08-06,280
186107,8/19/2016,8/19/2016,1,2.581216,1,2016-08-19,2016-08-19,0
186113,1/13/2017,12/9/2016,15,112.54299999999999,3,2017-01-13,2016-12-09,-35
186145,12/28/2019,7/31/2018,3,51.3,3,2019-12-28,2018-07-31,-515
1861511,1/26/2020,5/29/2019,3,32.666,3,2020-01-26,2019-05-29,-242
186247,1/8/2019,8/6/2019,4,18.376,4,2019-01-08,2019-08-06,210
186255,3/11/2017,3/11/2017,1,3.825,1,2017-03-11,2017-03-11,0
186257,10/6/2019,8/1/2018,4,16.781,3,2019-10-06,2018-08-01,-431
186299,5/24/2018,5/24/2018,1,9.756,1,2018-05-24,2018-05-24,0
1863371,11/17/2018,11/17/2018,1,2.777,1,2018-11-17,2018-11-17,0
1863541,1/15/2020,8/7/2019,16,64.174,3,2020-01-15,2019-08-07,-161
186363,5/14/2019,5/14/2019,1,2.541,1,2019-05-14,2019-05-14,0
186367,12/2/2017,12/2/2017,1,2.344,1,2017-12-02,2017-12-02,0
186371,6/19/2019,6/19/2019,1,4.391,1,2019-06-19,2019-06-19,0
186425,1/11/2020,9/26/2019,3,9.792,3,2020-01-11,2019-09-26,-107
186511,10/13/2016,9/22/2016,10,156.35866099999998,4,2016-10-13,2016-09-22,-21
1865171,4/15/2018,4/15/2018,1,6.39,1,2018-04-15,2018-04-15,0
1865231,1/11/2019,4/9/2018,2,17.883000000000003,2,2019-01-11,2018-04-09,-277
1865381,4/29/2018,7/28/2018,2,10.238,2,2018-04-29,2018-07-28,90
1865671,11/15/2019,11/16/2019,2,27.967,2,2019-11-15,2019-11-16,1
1865881,3/2/2019,8/3/2019,4,24.838,4,2019-03-02,2019-08-03,154
1866241,7/17/2018,7/17/2018,1,5.147,1,2018-07-17,2018-07-17,0
186633,11/11/2017,7/13/2019,4,38.698,4,2017-11-11,2019-07-13,609
186637,11/14/2017,8/11/2017,25,358.95,4,2017-11-14,2017-08-11,-95
186693,11/8/2019,11/8/2019,1,11.733,1,2019-11-08,2019-11-08,0
186749,1/11/2018,9/23/2017,16,135.902366,10,2018-01-11,2017-09-23,-110
1867521,5/1/2018,5/1/2018,1,5.025,1,2018-05-01,2018-05-01,0
186763,9/8/2016,9/8/2016,1,23.264292,1,2016-09-08,2016-09-08,0
1867901,9/5/2019,9/5/2019,1,12.676,1,2019-09-05,2019-09-05,0
1868451,6/14/2018,6/14/2018,1,4.459,1,2018-06-14,2018-06-14,0
186871,12/4/2017,9/26/2019,7,78.17174299999999,5,2017-12-04,2019-09-26,661
186889,10/11/2017,10/11/2017,1,10.068,1,2017-10-11,2017-10-11,0
186901,11/11/2017,8/22/2018,5,12.225,2,2017-11-11,2018-08-22,284
1869441,3/24/2018,3/24/2018,1,9.692,1,2018-03-24,2018-03-24,0
1869791,6/30/2020,6/30/2020,1,5.19,1,2020-06-30,2020-06-30,0
187041,10/2/2016,9/15/2016,19,37.477676,9,2016-10-02,2016-09-15,-17
1870501,1/16/2019,9/10/2018,10,67.772,6,2019-01-16,2018-09-10,-128
1870711,4/17/2018,7/3/2018,7,81.693,2,2018-04-17,2018-07-03,77
1870931,10/25/2019,10/25/2019,1,7.558,1,2019-10-25,2019-10-25,0
1871091,8/6/2018,8/6/2018,1,23.219,1,2018-08-06,2018-08-06,0
187115,1/13/2019,11/24/2018,4,18.602,3,2019-01-13,2018-11-24,-50
187161,7/12/2019,8/8/2019,2,4.28,1,2019-07-12,2019-08-08,27
1871641,1/28/2019,9/29/2018,8,33.577,4,2019-01-28,2018-09-29,-121
1872281,3/23/2018,3/23/2018,1,1.506,1,2018-03-23,2018-03-23,0
187259,11/21/2016,11/21/2016,1,5.844,1,2016-11-21,2016-11-21,0
187331,1/17/2017,1/17/2017,1,16.074,1,2017-01-17,2017-01-17,0
1873511,9/3/2018,9/3/2018,1,2.753,1,2018-09-03,2018-09-03,0
1873521,3/23/2018,3/23/2018,1,5.492,1,2018-03-23,2018-03-23,0
187353,5/24/2018,5/24/2018,1,6.824,1,2018-05-24,2018-05-24,0
1873891,3/23/2018,3/23/2018,1,3.914,1,2018-03-23,2018-03-23,0
1873991,1/19/2019,1/19/2019,1,10.183,1,2019-01-19,2019-01-19,0
187577,2/4/2020,2/8/2019,3,16.576,3,2020-02-04,2019-02-08,-361
187587,8/5/2019,8/5/2019,1,11.58,1,2019-08-05,2019-08-05,0
1875881,8/26/2018,8/26/2018,1,4.693,1,2018-08-26,2018-08-26,0
1876361,10/23/2020,8/21/2019,14,198.212,5,2020-10-23,2019-08-21,-429
1876581,1/12/2020,1/26/2020,2,2.189,2,2020-01-12,2020-01-26,14
187695,11/25/2018,11/25/2018,1,11.253,1,2018-11-25,2018-11-25,0
187699,1/19/2017,9/30/2019,17,270.91768,7,2017-01-19,2019-09-30,984
187729,12/9/2017,12/9/2017,1,3.943,1,2017-12-09,2017-12-09,0
1877351,12/20/2018,12/20/2018,1,7.23,1,2018-12-20,2018-12-20,0
1877831,4/14/2018,4/14/2018,1,12.896,1,2018-04-14,2018-04-14,0
187785,1/17/2020,6/9/2020,21,34.286,3,2020-01-17,2020-06-09,144
187873,10/12/2016,9/16/2017,6,21.397996,5,2016-10-12,2017-09-16,339
1878811,12/8/2018,9/25/2020,3,12.283,3,2018-12-08,2020-09-25,657
1878841,2/7/2019,2/7/2019,1,4.917,1,2019-02-07,2019-02-07,0
187919,10/13/2020,9/6/2019,22,114.708,5,2020-10-13,2019-09-06,-403
1879841,1/1/2019,9/30/2018,32,219.102,5,2019-01-01,2018-09-30,-93
188009,1/10/2018,9/6/2018,32,154.279,9,2018-01-10,2018-09-06,239
188015,11/11/2016,8/8/2019,2,16.5,2,2016-11-11,2019-08-08,1000
1880161,11/13/2018,9/18/2018,3,27.926,2,2018-11-13,2018-09-18,-56
188163,1/13/2018,9/9/2017,129,571.775167,4,2018-01-13,2017-09-09,-126
188185,3/21/2017,3/21/2017,1,7.001,1,2017-03-21,2017-03-21,0
1882171,3/28/2018,7/17/2018,2,9.575,2,2018-03-28,2018-07-17,111
188257,11/3/2017,9/7/2017,18,136.56799999999998,5,2017-11-03,2017-09-07,-57
1882621,10/18/2019,7/30/2018,6,53.668,3,2019-10-18,2018-07-30,-445
188289,1/23/2017,1/23/2017,1,3.522,1,2017-01-23,2017-01-23,0
1883251,3/30/2018,3/30/2018,1,1.674,1,2018-03-30,2018-03-30,0
1883601,1/24/2020,11/9/2018,2,15.922,2,2020-01-24,2018-11-09,-441
188403,8/10/2017,8/10/2017,1,0.449,1,2017-08-10,2017-08-10,0
1884161,6/6/2019,6/6/2019,1,7.42,1,2019-06-06,2019-06-06,0
188425,11/12/2016,9/16/2016,28,257.820614,3,2016-11-12,2016-09-16,-57
1884391,9/21/2019,9/21/2019,1,7.855,1,2019-09-21,2019-09-21,0
1884501,1/5/2019,8/4/2018,10,38.829,6,2019-01-05,2018-08-04,-154
1884511,2/20/2020,9/4/2019,2,13.343,2,2020-02-20,2019-09-04,-169
188455,12/18/2018,7/9/2019,5,35.143,2,2018-12-18,2019-07-09,203
1884731,3/28/2018,3/28/2018,1,5.344,1,2018-03-28,2018-03-28,0
1884741,11/12/2019,11/12/2019,1,6.596,1,2019-11-12,2019-11-12,0
188499,1/29/2017,12/31/2016,2,17.649,1,2017-01-29,2016-12-31,-29
1885531,8/3/2019,8/3/2019,1,5.944,1,2019-08-03,2019-08-03,0
1885661,9/29/2018,9/29/2018,1,8.756,1,2018-09-29,2018-09-29,0
1885701,11/15/2018,4/2/2019,5,98.595,3,2018-11-15,2019-04-02,138
1885891,7/11/2020,7/11/2020,1,8.863,1,2020-07-11,2020-07-11,0
1885941,11/15/2019,11/15/2019,1,9.256,1,2019-11-15,2019-11-15,0
1886381,3/28/2018,3/28/2018,1,5.343,1,2018-03-28,2018-03-28,0
1886441,10/20/2019,9/7/2018,4,6.99,3,2019-10-20,2018-09-07,-408
1886951,10/10/2019,10/10/2019,1,5.689,1,2019-10-10,2019-10-10,0
1887251,1/5/2020,1/5/2020,1,4.642,1,2020-01-05,2020-01-05,0
1887491,1/4/2019,9/25/2018,13,64.338,7,2019-01-04,2018-09-25,-101
188795,2/12/2019,2/12/2019,1,0.015,1,2019-02-12,2019-02-12,0
1887971,1/4/2020,2/29/2020,3,30.449,2,2020-01-04,2020-02-29,56
1887981,5/3/2018,5/3/2018,1,9.057,1,2018-05-03,2018-05-03,0
1888141,7/26/2019,7/26/2019,1,5.356,1,2019-07-26,2019-07-26,0
188851,10/29/2019,6/6/2018,5,47.243,5,2019-10-29,2018-06-06,-510
1888781,9/26/2020,9/26/2020,1,10.934,1,2020-09-26,2020-09-26,0
188881,6/30/2019,6/30/2019,1,2.187,1,2019-06-30,2019-06-30,0
1889061,12/22/2018,12/22/2018,1,9.461,1,2018-12-22,2018-12-22,0
188917,9/13/2018,9/13/2018,1,2.297,1,2018-09-13,2018-09-13,0
1889411,12/2/2019,12/7/2018,3,30.785,2,2019-12-02,2018-12-07,-360
188945,6/14/2018,6/14/2018,1,4.016,1,2018-06-14,2018-06-14,0
1889481,4/8/2019,4/8/2019,1,2.943,1,2019-04-08,2019-04-08,0
1889501,4/10/2018,6/29/2018,3,26.488,2,2018-04-10,2018-06-29,80
188957,9/29/2019,9/29/2019,1,4.94,1,2019-09-29,2019-09-29,0
1889621,4/2/2018,4/2/2018,1,5.902,1,2018-04-02,2018-04-02,0
189005,7/31/2019,8/29/2018,4,37.805,4,2019-07-31,2018-08-29,-336
189007,10/1/2020,6/16/2017,5,11.754999999999999,4,2020-10-01,2017-06-16,-1203
189045,10/18/2018,10/18/2018,1,8.788,1,2018-10-18,2018-10-18,0
1890661,1/14/2020,1/14/2020,1,2.056,1,2020-01-14,2020-01-14,0
1891081,7/29/2018,9/2/2018,3,35.144,3,2018-07-29,2018-09-02,35
189113,6/26/2018,6/26/2018,1,4.613,1,2018-06-26,2018-06-26,0
1891131,2/27/2020,3/12/2020,2,38.745999999999995,1,2020-02-27,2020-03-12,14
189157,2/11/2017,7/18/2018,2,14.702,2,2017-02-11,2018-07-18,522
1891691,3/23/2019,6/16/2019,2,21.318,1,2019-03-23,2019-06-16,85
1891731,8/22/2019,8/22/2019,1,8.546,1,2019-08-22,2019-08-22,0
1892551,10/6/2019,6/29/2020,8,212.215,5,2019-10-06,2020-06-29,267
1893011,3/27/2018,4/10/2018,2,38.543,1,2018-03-27,2018-04-10,14
189319,9/13/2018,9/13/2018,1,3.152,1,2018-09-13,2018-09-13,0
189351,9/19/2016,9/19/2016,1,13.969242,1,2016-09-19,2016-09-19,0
189359,3/14/2018,3/14/2018,1,10.855,1,2018-03-14,2018-03-14,0
189379,8/10/2016,8/10/2016,1,7.553858,1,2016-08-10,2016-08-10,0
1894851,5/25/2018,5/25/2018,1,27.0,1,2018-05-25,2018-05-25,0
1895281,2/18/2019,2/18/2019,1,27.739,1,2019-02-18,2019-02-18,0
189603,3/28/2019,3/28/2019,1,5.387,1,2019-03-28,2019-03-28,0
189621,1/23/2019,9/8/2018,4,20.29,3,2019-01-23,2018-09-08,-137
189733,2/1/2019,2/1/2019,1,9.171,1,2019-02-01,2019-02-01,0
1897371,1/21/2019,9/26/2018,17,110.685,7,2019-01-21,2018-09-26,-117
189801,6/22/2018,6/22/2018,1,10.29,1,2018-06-22,2018-06-22,0
189803,3/15/2017,3/15/2017,1,3.964,1,2017-03-15,2017-03-15,0
1899121,8/30/2019,8/30/2019,1,5.741,1,2019-08-30,2019-08-30,0
1899431,11/11/2018,9/1/2018,4,41.128,1,2018-11-11,2018-09-01,-71
190009,8/1/2018,8/1/2018,1,3.832,1,2018-08-01,2018-08-01,0
1900161,10/30/2019,9/13/2018,4,8.375,4,2019-10-30,2018-09-13,-412
1900261,2/11/2019,9/12/2018,5,25.808999999999997,4,2019-02-11,2018-09-12,-152
190091,9/3/2016,9/3/2016,1,2.454018,1,2016-09-03,2016-09-03,0
190111,11/19/2017,5/17/2018,3,7.05,2,2017-11-19,2018-05-17,179
190185,1/5/2020,8/5/2018,12,56.854,3,2020-01-05,2018-08-05,-518
190189,1/31/2017,1/31/2017,1,9.685,1,2017-01-31,2017-01-31,0
190215,1/11/2017,9/3/2019,14,61.61453,4,2017-01-11,2019-09-03,965
190301,5/5/2018,9/1/2019,2,11.343,1,2018-05-05,2019-09-01,484
1903361,8/31/2018,8/31/2018,1,2.748,1,2018-08-31,2018-08-31,0
190339,10/29/2018,6/17/2019,2,3.71,2,2018-10-29,2019-06-17,231
1903391,12/11/2018,12/11/2018,1,7.843,1,2018-12-11,2018-12-11,0
190347,4/19/2018,4/19/2018,1,3.322,1,2018-04-19,2018-04-19,0
190357,1/19/2018,9/20/2018,79,2408.718924,10,2018-01-19,2018-09-20,244
190377,1/27/2018,9/8/2018,31,282.433,7,2018-01-27,2018-09-08,224
1904091,11/8/2020,11/8/2020,1,7.52,1,2020-11-08,2020-11-08,0
190447,11/7/2017,8/2/2017,4,58.611000000000004,2,2017-11-07,2017-08-02,-97
1904821,12/8/2018,12/8/2018,1,1.624,1,2018-12-08,2018-12-08,0
1905011,1/30/2019,9/9/2018,23,64.746,3,2019-01-30,2018-09-09,-143
1905521,1/12/2020,1/12/2020,1,17.001,1,2020-01-12,2020-01-12,0
1905701,11/24/2019,8/4/2018,7,55.943,3,2019-11-24,2018-08-04,-477
1905941,9/27/2019,9/27/2019,1,5.213,1,2019-09-27,2019-09-27,0
1906,1/24/2019,5/30/2018,10,78.569,4,2019-01-24,2018-05-30,-239
190627,9/10/2016,9/10/2016,1,5.665006,1,2016-09-10,2016-09-10,0
1906591,10/11/2018,9/26/2019,20,118.512,5,2018-10-11,2019-09-26,350
190703,1/15/2017,9/4/2016,28,189.384498,11,2017-01-15,2016-09-04,-133
1907101,11/6/2019,8/2/2018,2,6.493,2,2019-11-06,2018-08-02,-461
190779,9/22/2016,9/22/2016,1,3.513715,1,2016-09-22,2016-09-22,0
190803,9/22/2019,9/22/2019,1,7.823,1,2019-09-22,2019-09-22,0
190825,10/4/2017,9/7/2016,6,40.234943,5,2017-10-04,2016-09-07,-392
190829,1/27/2017,9/23/2016,12,114.212404,5,2017-01-27,2016-09-23,-126
190835,7/17/2018,7/17/2018,1,2.641,1,2018-07-17,2018-07-17,0
1908731,1/16/2019,5/24/2019,5,23.149,4,2019-01-16,2019-05-24,128
1909221,9/25/2018,9/25/2018,1,10.011,1,2018-09-25,2018-09-25,0
1909241,1/18/2019,7/18/2019,4,42.856,4,2019-01-18,2019-07-18,181
190943,11/3/2016,4/12/2018,2,26.451,2,2016-11-03,2018-04-12,525
190961,6/30/2018,6/30/2018,1,7.452,1,2018-06-30,2018-06-30,0
190975,9/22/2018,9/22/2018,1,13.119,1,2018-09-22,2018-09-22,0
1909971,8/19/2020,8/19/2020,1,7.482,1,2020-08-19,2020-08-19,0
191011,10/2/2016,9/25/2016,2,5.345325,1,2016-10-02,2016-09-25,-7
1910381,1/25/2019,3/7/2019,3,39.092,2,2019-01-25,2019-03-07,41
1910771,1/2/2019,9/8/2019,12,209.594,7,2019-01-02,2019-09-08,249
1910801,1/10/2019,9/7/2019,112,365.98199999999997,12,2019-01-10,2019-09-07,240
1910881,3/6/2019,3/6/2019,1,12.589,1,2019-03-06,2019-03-06,0
1910911,8/11/2018,8/11/2018,1,11.658,1,2018-08-11,2018-08-11,0
1910991,8/20/2019,8/20/2019,1,12.141,1,2019-08-20,2019-08-20,0
191199,2/8/2017,2/8/2017,1,2.061,1,2017-02-08,2017-02-08,0
191205,1/27/2017,9/2/2016,9,58.682111,6,2017-01-27,2016-09-02,-147
191311,12/9/2016,3/16/2018,2,21.208,2,2016-12-09,2018-03-16,462
1913421,2/20/2019,2/20/2019,1,4.497,1,2019-02-20,2019-02-20,0
1913471,2/14/2020,2/14/2020,1,15.138,1,2020-02-14,2020-02-14,0
191351,3/16/2019,9/2/2017,3,29.012,2,2019-03-16,2017-09-02,-560
1913681,4/16/2019,4/16/2019,1,4.707,1,2019-04-16,2019-04-16,0
191383,12/7/2019,12/7/2019,1,9.374,1,2019-12-07,2019-12-07,0
1913941,4/22/2018,4/22/2018,1,2.42,1,2018-04-22,2018-04-22,0
1914171,1/15/2019,7/9/2019,3,27.905,2,2019-01-15,2019-07-09,175
1914451,7/18/2018,7/18/2018,1,20.247,1,2018-07-18,2018-07-18,0
1914551,9/18/2018,9/18/2018,1,4.688,1,2018-09-18,2018-09-18,0
191469,10/7/2018,10/7/2018,1,3.552,1,2018-10-07,2018-10-07,0
191489,1/15/2017,9/7/2017,54,122.764141,3,2017-01-15,2017-09-07,235
191495,1/21/2017,8/4/2017,13,16.041,3,2017-01-21,2017-08-04,195
1914971,11/11/2019,4/17/2019,3,32.841,3,2019-11-11,2019-04-17,-208
1915241,12/31/2018,9/21/2019,4,15.307,3,2018-12-31,2019-09-21,264
1915301,10/15/2019,4/13/2018,4,29.599,2,2019-10-15,2018-04-13,-550
1915661,6/8/2019,6/8/2019,1,9.697,1,2019-06-08,2019-06-08,0
191583,3/5/2020,9/13/2016,4,5.638917999999999,3,2020-03-05,2016-09-13,-1269
1915881,11/10/2018,9/3/2018,2,18.506,2,2018-11-10,2018-09-03,-68
1915891,3/29/2019,3/29/2019,1,13.344,1,2019-03-29,2019-03-29,0
1916001,10/2/2018,3/14/2019,2,17.707,2,2018-10-02,2019-03-14,163
1916031,1/24/2020,4/6/2019,5,45.589,3,2020-01-24,2019-04-06,-293
191629,1/17/2019,9/15/2016,9,48.011434,3,2019-01-17,2016-09-15,-854
1916391,3/31/2018,3/31/2018,1,7.624,1,2018-03-31,2018-03-31,0
1916471,4/28/2018,7/3/2018,4,12.52,3,2018-04-28,2018-07-03,66
1917411,9/22/2018,9/22/2018,1,4.381,1,2018-09-22,2018-09-22,0
191743,1/13/2017,9/9/2016,131,1676.711577,10,2017-01-13,2016-09-09,-126
191815,6/3/2018,8/7/2019,2,9.003,2,2018-06-03,2019-08-07,430
191843,10/9/2017,10/9/2017,1,11.33,1,2017-10-09,2017-10-09,0
191845,1/6/2018,1/6/2018,1,6.189,1,2018-01-06,2018-01-06,0
1918721,8/20/2020,8/20/2020,1,0.963,1,2020-08-20,2020-08-20,0
1918751,11/22/2019,11/22/2019,1,2.928,1,2019-11-22,2019-11-22,0
191915,1/26/2018,1/26/2018,1,2.746,1,2018-01-26,2018-01-26,0
191919,10/11/2016,9/9/2016,39,377.110614,3,2016-10-11,2016-09-09,-32
191921,7/12/2018,7/12/2018,1,1.329,1,2018-07-12,2018-07-12,0
191931,10/5/2019,10/5/2019,1,6.334,1,2019-10-05,2019-10-05,0
191941,2/11/2018,5/20/2018,4,4.7,2,2018-02-11,2018-05-20,98
1920161,7/14/2018,7/14/2018,1,7.616,1,2018-07-14,2018-07-14,0
192019,1/17/2019,9/9/2018,23,147.912657,10,2019-01-17,2018-09-09,-130
1920341,12/10/2019,12/10/2019,1,9.073,1,2019-12-10,2019-12-10,0
1920451,1/22/2019,1/22/2019,1,17.397,1,2019-01-22,2019-01-22,0
1920491,2/22/2020,2/22/2020,1,1.4,1,2020-02-22,2020-02-22,0
192061,3/25/2017,7/28/2017,3,17.072,3,2017-03-25,2017-07-28,125
1920751,10/14/2018,9/16/2018,9,52.419,3,2018-10-14,2018-09-16,-28
1921081,4/5/2019,6/25/2019,2,7.353999999999999,2,2019-04-05,2019-06-25,81
192129,1/17/2018,8/7/2018,23,53.787,5,2018-01-17,2018-08-07,202
1921491,4/1/2018,9/5/2019,3,10.040000000000001,2,2018-04-01,2019-09-05,522
192191,11/25/2019,8/7/2019,11,61.427,6,2019-11-25,2019-08-07,-110
1922021,3/8/2019,3/8/2019,1,5.664,1,2019-03-08,2019-03-08,0
1922061,3/9/2019,3/9/2019,1,6.09,1,2019-03-09,2019-03-09,0
1922501,10/21/2019,10/21/2019,1,0.292,1,2019-10-21,2019-10-21,0
192279,7/20/2018,9/27/2019,2,23.019,1,2018-07-20,2019-09-27,434
192285,9/11/2016,9/11/2016,1,6.915732,1,2016-09-11,2016-09-11,0
192293,12/26/2020,12/3/2020,2,9.097,2,2020-12-26,2020-12-03,-23
192303,5/16/2018,5/16/2018,1,4.87,1,2018-05-16,2018-05-16,0
192355,1/30/2017,8/6/2018,10,26.2,6,2017-01-30,2018-08-06,553
192419,1/10/2019,9/14/2019,11,87.15547,8,2019-01-10,2019-09-14,247
192425,12/7/2017,12/7/2017,1,8.116,1,2017-12-07,2017-12-07,0
1924591,1/17/2019,1/17/2019,1,5.509,1,2019-01-17,2019-01-17,0
192461,11/10/2016,11/10/2016,1,6.112,1,2016-11-10,2016-11-10,0
1925091,4/2/2018,6/14/2018,2,1.153,2,2018-04-02,2018-06-14,73
1925131,6/10/2018,6/10/2018,1,13.99,1,2018-06-10,2018-06-10,0
1925671,10/15/2018,9/7/2018,46,312.993,4,2018-10-15,2018-09-07,-38
192579,2/22/2019,9/6/2019,2,11.96,2,2019-02-22,2019-09-06,196
192635,6/25/2019,6/25/2019,1,11.66,1,2019-06-25,2019-06-25,0
1926551,11/2/2019,9/21/2019,3,24.866,3,2019-11-02,2019-09-21,-42
192673,1/26/2018,9/5/2016,14,41.322559,6,2018-01-26,2016-09-05,-508
1927081,1/27/2019,12/15/2018,3,20.893,1,2019-01-27,2018-12-15,-43
1927351,6/5/2019,6/5/2019,1,7.098,1,2019-06-05,2019-06-05,0
1927941,1/12/2020,7/29/2018,2,12.814,1,2020-01-12,2018-07-29,-532
1928081,8/3/2018,8/3/2018,1,6.997999999999999,1,2018-08-03,2018-08-03,0
192851,1/14/2020,9/3/2019,29,123.746,8,2020-01-14,2019-09-03,-133
192857,3/1/2017,5/16/2017,2,16.734,2,2017-03-01,2017-05-16,76
1928711,8/25/2019,8/25/2019,1,18.439,1,2019-08-25,2019-08-25,0
192909,4/13/2017,7/26/2017,2,11.413,1,2017-04-13,2017-07-26,104
1930091,1/12/2019,9/25/2019,31,90.182,7,2019-01-12,2019-09-25,256
193031,12/6/2019,7/30/2017,2,23.04,2,2019-12-06,2017-07-30,-859
1930931,4/13/2018,9/20/2019,5,29.027,3,2018-04-13,2019-09-20,525
1931201,8/4/2018,8/4/2018,1,3.726,1,2018-08-04,2018-08-04,0
193157,11/23/2018,9/22/2016,5,6.936234,4,2018-11-23,2016-09-22,-792
193159,8/22/2016,8/22/2016,1,7.084304,1,2016-08-22,2016-08-22,0
193203,1/26/2019,9/4/2017,42,249.25858,14,2019-01-26,2017-09-04,-509
1932121,6/6/2018,6/6/2018,1,0.835,1,2018-06-06,2018-06-06,0
1932151,9/7/2018,9/7/2018,1,6.79,1,2018-09-07,2018-09-07,0
1932611,10/21/2018,6/10/2018,5,11.322,4,2018-10-21,2018-06-10,-133
1932971,1/10/2020,9/26/2018,16,201.21099999999998,3,2020-01-10,2018-09-26,-471
1933101,11/11/2019,11/11/2019,1,2.388,1,2019-11-11,2019-11-11,0
1933611,6/25/2018,6/25/2018,1,6.771,1,2018-06-25,2018-06-25,0
193411,11/22/2016,9/23/2016,3,5.0828050000000005,3,2016-11-22,2016-09-23,-60
1934121,4/8/2018,4/8/2018,1,4.153,1,2018-04-08,2018-04-08,0
1934581,1/20/2019,1/20/2019,1,11.765,1,2019-01-20,2019-01-20,0
193459,9/3/2017,9/3/2017,1,2.769,1,2017-09-03,2017-09-03,0
193481,10/6/2018,12/30/2018,2,2.827,1,2018-10-06,2018-12-30,85
1935541,6/21/2019,8/5/2018,2,9.426,2,2019-06-21,2018-08-05,-320
1935921,4/14/2018,4/14/2018,1,3.598,1,2018-04-14,2018-04-14,0
193623,10/11/2016,9/9/2016,20,181.643101,4,2016-10-11,2016-09-09,-32
1936251,11/14/2018,11/14/2018,1,12.691,1,2018-11-14,2018-11-14,0
193687,12/31/2016,12/31/2016,1,2.97,1,2016-12-31,2016-12-31,0
1937101,10/29/2018,9/21/2018,22,251.598,6,2018-10-29,2018-09-21,-38
193761,11/7/2018,11/7/2018,1,14.194,1,2018-11-07,2018-11-07,0
1937631,9/27/2018,9/27/2018,1,2.923,1,2018-09-27,2018-09-27,0
1937691,6/18/2019,6/3/2019,2,11.780000000000001,2,2019-06-18,2019-06-03,-15
193801,1/14/2020,9/6/2017,21,128.954185,3,2020-01-14,2017-09-06,-860
193813,1/24/2018,1/24/2018,1,13.466,1,2018-01-24,2018-01-24,0
1938581,11/11/2018,8/20/2019,3,8.292,3,2018-11-11,2019-08-20,282
193867,11/8/2018,11/8/2018,1,3.042,1,2018-11-08,2018-11-08,0
193873,10/3/2018,10/3/2018,1,4.748,1,2018-10-03,2018-10-03,0
1938741,2/16/2019,2/16/2019,1,5.838,1,2019-02-16,2019-02-16,0
1939151,4/26/2019,4/26/2019,1,8.317,1,2019-04-26,2019-04-26,0
1939711,9/21/2018,9/24/2018,2,7.298,1,2018-09-21,2018-09-24,3
194,10/8/2019,9/30/2016,7,51.327102,5,2019-10-08,2016-09-30,-1103
194047,2/2/2019,2/2/2019,1,7.469,1,2019-02-02,2019-02-02,0
194063,9/27/2019,9/27/2019,1,10.783,1,2019-09-27,2019-09-27,0
1941181,3/12/2020,3/12/2020,1,10.613,1,2020-03-12,2020-03-12,0
194137,12/8/2018,9/16/2017,4,3.792,4,2018-12-08,2017-09-16,-448
194149,2/21/2020,8/18/2017,5,49.451,4,2020-02-21,2017-08-18,-917
194211,7/20/2018,8/7/2018,2,1.326,2,2018-07-20,2018-08-07,18
1942781,9/7/2019,9/7/2019,1,5.045,1,2019-09-07,2019-09-07,0
1943121,10/25/2019,2/5/2019,2,29.738999999999997,2,2019-10-25,2019-02-05,-262
194327,6/22/2018,6/22/2018,1,10.104,1,2018-06-22,2018-06-22,0
194375,8/11/2017,8/11/2017,1,4.509,1,2017-08-11,2017-08-11,0
194379,11/11/2016,6/3/2018,4,12.894,3,2016-11-11,2018-06-03,569
1944031,2/24/2019,6/15/2019,3,22.009,3,2019-02-24,2019-06-15,111
1944111,6/29/2019,6/29/2019,1,8.976,1,2019-06-29,2019-06-29,0
194425,1/18/2017,9/28/2016,20,86.067829,5,2017-01-18,2016-09-28,-112
194463,1/13/2017,7/19/2018,2,3.864,2,2017-01-13,2018-07-19,552
1944961,4/27/2019,9/21/2018,5,40.016,3,2019-04-27,2018-09-21,-218
194503,1/15/2018,3/17/2018,2,23.479,2,2018-01-15,2018-03-17,61
1945261,1/29/2019,7/14/2018,5,51.326,4,2019-01-29,2018-07-14,-199
194541,9/21/2018,9/21/2018,1,4.427,1,2018-09-21,2018-09-21,0
1945491,2/1/2019,6/6/2019,18,43.305,6,2019-02-01,2019-06-06,125
194619,10/10/2018,7/19/2019,4,13.523,4,2018-10-10,2019-07-19,282
1946491,11/14/2019,4/7/2018,4,5.471,3,2019-11-14,2018-04-07,-586
194655,1/30/2019,7/23/2019,3,21.974,2,2019-01-30,2019-07-23,174
194665,8/15/2017,8/15/2017,1,6.164,1,2017-08-15,2017-08-15,0
1946911,7/25/2019,7/25/2019,1,8.505,1,2019-07-25,2019-07-25,0
194757,11/5/2016,11/5/2016,1,4.982,1,2016-11-05,2016-11-05,0
194771,10/16/2018,8/2/2018,6,9.849,4,2018-10-16,2018-08-02,-75
194823,1/23/2019,9/7/2017,22,82.24,16,2019-01-23,2017-09-07,-503
194865,10/16/2017,8/9/2018,12,37.085,5,2017-10-16,2018-08-09,297
194903,9/27/2016,9/27/2016,1,6.00227,1,2016-09-27,2016-09-27,0
194915,1/11/2017,9/4/2018,203,1361.376,16,2017-01-11,2018-09-04,601
194951,11/21/2020,8/31/2019,5,30.378,2,2020-11-21,2019-08-31,-448
195001,1/30/2018,5/26/2018,2,9.136,1,2018-01-30,2018-05-26,116
195005,11/16/2016,8/4/2018,6,51.694,3,2016-11-16,2018-08-04,626
195007,11/13/2018,11/13/2018,1,7.012,1,2018-11-13,2018-11-13,0
1950071,8/28/2018,8/28/2018,1,6.435,1,2018-08-28,2018-08-28,0
195043,4/17/2019,4/17/2019,1,4.945,1,2019-04-17,2019-04-17,0
195063,11/2/2019,12/16/2017,11,97.895,4,2019-11-02,2017-12-16,-686
1950991,6/30/2018,6/30/2018,1,5.479,1,2018-06-30,2018-06-30,0
1951071,10/29/2019,11/7/2019,5,0.13799999999999998,3,2019-10-29,2019-11-07,9
195167,1/14/2020,9/22/2019,14,127.806479,6,2020-01-14,2019-09-22,-114
195191,1/25/2019,3/31/2018,3,17.14,3,2019-01-25,2018-03-31,-300
1952071,1/14/2020,9/10/2019,34,277.575,11,2020-01-14,2019-09-10,-126
195255,1/14/2018,9/4/2017,22,229.928629,4,2018-01-14,2017-09-04,-132
1953091,11/11/2018,7/19/2020,8,10.502,4,2018-11-11,2020-07-19,616
195319,12/11/2018,9/15/2016,4,15.450551,4,2018-12-11,2016-09-15,-817
1953281,1/16/2020,8/28/2019,26,277.512,6,2020-01-16,2019-08-28,-141
1953841,2/6/2020,2/6/2020,1,3.922,1,2020-02-06,2020-02-06,0
1953971,10/21/2019,12/10/2019,2,11.681000000000001,2,2019-10-21,2019-12-10,50
1955491,4/27/2019,8/9/2018,9,42.948,6,2019-04-27,2018-08-09,-261
195561,2/10/2017,7/11/2017,5,65.204,3,2017-02-10,2017-07-11,151
195621,1/14/2018,7/27/2017,4,43.744,3,2018-01-14,2017-07-27,-171
195623,1/11/2020,9/9/2018,120,362.443736,13,2020-01-11,2018-09-09,-489
195633,1/10/2017,9/8/2016,68,401.909075,12,2017-01-10,2016-09-08,-124
195651,11/12/2016,11/12/2016,1,6.39,1,2016-11-12,2016-11-12,0
19567201,9/25/2020,9/25/2020,1,13.534,1,2020-09-25,2020-09-25,0
1956861,6/29/2019,6/29/2019,1,2.44,1,2019-06-29,2019-06-29,0
195687,6/18/2019,6/18/2019,1,3.427,1,2019-06-18,2019-06-18,0
19569351,6/10/2019,8/4/2019,3,26.104,1,2019-06-10,2019-08-04,55
195703,5/31/2018,5/31/2018,1,1.328,1,2018-05-31,2018-05-31,0
19572551,7/12/2019,9/20/2019,2,17.833,1,2019-07-12,2019-09-20,70
19572691,6/9/2019,6/9/2019,1,25.495,1,2019-06-09,2019-06-09,0
19572711,2/10/2020,2/10/2020,1,20.423,1,2020-02-10,2020-02-10,0
19572741,6/10/2019,6/10/2019,1,4.894,1,2019-06-10,2019-06-10,0
19574231,1/23/2020,1/23/2020,1,5.785,1,2020-01-23,2020-01-23,0
19576421,1/20/2020,9/9/2020,225,1888.523,9,2020-01-20,2020-09-09,233
19577051,11/21/2019,6/15/2019,3,16.442,3,2019-11-21,2019-06-15,-159
1957741,12/13/2019,12/13/2019,1,2.385,1,2019-12-13,2019-12-13,0
19578031,7/24/2019,7/24/2019,1,8.919,1,2019-07-24,2019-07-24,0
1957811,7/25/2018,7/27/2018,2,2.097,1,2018-07-25,2018-07-27,2
19580181,10/29/2019,9/6/2019,23,143.78,5,2019-10-29,2019-09-06,-53
195809,1/26/2018,9/7/2018,79,496.226,10,2018-01-26,2018-09-07,224
19582261,10/13/2019,7/2/2019,3,5.945,2,2019-10-13,2019-07-02,-103
19583851,10/2/2019,6/11/2019,3,11.592,3,2019-10-02,2019-06-11,-113
19584241,5/6/2020,5/6/2020,1,1.207,1,2020-05-06,2020-05-06,0
195871,1/29/2017,8/19/2017,9,55.603067,6,2017-01-29,2017-08-19,202
19589431,12/13/2019,12/13/2019,1,3.496,1,2019-12-13,2019-12-13,0
19590101,6/11/2019,6/11/2019,1,4.832,1,2019-06-11,2019-06-11,0
19590431,6/11/2019,6/11/2019,1,1.882,1,2019-06-11,2019-06-11,0
19591301,6/25/2019,6/25/2019,1,5.988,1,2019-06-25,2019-06-25,0
19591411,10/5/2019,10/5/2019,1,22.621,1,2019-10-05,2019-10-05,0
19591571,11/3/2019,11/3/2019,1,22.888,1,2019-11-03,2019-11-03,0
19591731,11/10/2019,11/26/2019,7,105.071,2,2019-11-10,2019-11-26,16
195921,9/4/2016,9/4/2016,1,6.480994,1,2016-09-04,2016-09-04,0
1959221,7/14/2018,7/14/2018,1,5.686,1,2018-07-14,2018-07-14,0
1959311,10/31/2020,7/11/2020,2,5.44,2,2020-10-31,2020-07-11,-112
19594111,6/23/2019,6/23/2019,1,8.638,1,2019-06-23,2019-06-23,0
19596391,10/19/2019,10/19/2019,1,8.297,1,2019-10-19,2019-10-19,0
19596921,9/6/2019,9/6/2019,1,5.04,1,2019-09-06,2019-09-06,0
1959701,1/15/2020,8/2/2019,20,107.07600000000001,4,2020-01-15,2019-08-02,-166
19599261,6/12/2019,6/13/2019,2,23.039,1,2019-06-12,2019-06-13,1
195997,8/14/2016,9/2/2016,2,2.367611,1,2016-08-14,2016-09-02,19
19599981,1/26/2020,9/14/2019,2,19.441,2,2020-01-26,2019-09-14,-134
1960,10/23/2018,9/23/2018,3,28.586288,3,2018-10-23,2018-09-23,-30
19600611,9/1/2019,9/1/2019,1,0.121,1,2019-09-01,2019-09-01,0
1960301,10/4/2019,6/30/2018,7,50.657000000000004,4,2019-10-04,2018-06-30,-461
19603231,10/10/2019,9/27/2019,47,614.529,5,2019-10-10,2019-09-27,-13
19605391,6/13/2019,6/13/2019,1,10.278,1,2019-06-13,2019-06-13,0
196071,7/5/2019,7/5/2019,1,0.782,1,2019-07-05,2019-07-05,0
19607421,6/13/2019,9/5/2019,2,9.054,2,2019-06-13,2019-09-05,84
1960761,1/5/2019,1/5/2019,1,3.495,1,2019-01-05,2019-01-05,0
19607931,1/23/2020,9/5/2019,15,32.551,3,2020-01-23,2019-09-05,-140
196081,7/9/2017,7/9/2017,1,0.86,1,2017-07-09,2017-07-09,0
19608321,11/7/2019,12/10/2019,2,33.787,2,2019-11-07,2019-12-10,33
19608551,6/18/2019,6/18/2019,1,6.533,1,2019-06-18,2019-06-18,0
19611721,11/10/2019,7/28/2019,3,14.155999999999999,2,2019-11-10,2019-07-28,-105
19612011,11/21/2019,8/5/2019,11,47.201,5,2019-11-21,2019-08-05,-108
19612071,7/26/2019,7/5/2019,2,18.875999999999998,2,2019-07-26,2019-07-05,-21
19612321,2/22/2020,2/22/2020,1,7.94,1,2020-02-22,2020-02-22,0
19612661,4/27/2020,7/14/2019,3,17.346,3,2020-04-27,2019-07-14,-288
19613871,12/6/2019,12/6/2019,1,6.882,1,2019-12-06,2019-12-06,0
19615821,1/20/2020,1/20/2020,1,3.02,1,2020-01-20,2020-01-20,0
19616801,12/20/2019,8/27/2019,4,16.984,2,2019-12-20,2019-08-27,-115
19617191,8/21/2020,8/21/2020,1,12.214,1,2020-08-21,2020-08-21,0
1961831,2/2/2019,2/2/2019,1,2.133,1,2019-02-02,2019-02-02,0
19619231,1/15/2020,9/3/2019,28,284.154,4,2020-01-15,2019-09-03,-134
1961941,2/24/2019,4/30/2019,4,14.565,1,2019-02-24,2019-04-30,65
19619421,7/13/2019,8/25/2019,2,14.381,1,2019-07-13,2019-08-25,43
19621791,6/16/2019,7/15/2019,2,4.191,1,2019-06-16,2019-07-15,29
19621971,11/14/2020,11/14/2020,1,5.327,1,2020-11-14,2020-11-14,0
19625311,10/12/2019,10/12/2019,1,15.242,1,2019-10-12,2019-10-12,0
19626671,2/23/2020,9/14/2019,6,138.802,5,2020-02-23,2019-09-14,-162
19626831,7/15/2019,7/15/2019,1,8.935,1,2019-07-15,2019-07-15,0
19626851,6/15/2019,6/15/2019,1,2.737,1,2019-06-15,2019-06-15,0
19628001,10/1/2019,9/7/2019,81,516.961,4,2019-10-01,2019-09-07,-24
19631071,6/16/2019,6/16/2019,1,7.745,1,2019-06-16,2019-06-16,0
19631271,6/16/2019,8/10/2019,2,29.006999999999998,1,2019-06-16,2019-08-10,55
196315,2/8/2018,2/8/2018,1,8.246,1,2018-02-08,2018-02-08,0
1963211,9/23/2018,9/23/2018,1,13.723,1,2018-09-23,2018-09-23,0
19634531,10/12/2019,6/29/2019,2,2.3280000000000003,2,2019-10-12,2019-06-29,-105
19634781,6/16/2019,6/16/2019,1,3.05,1,2019-06-16,2019-06-16,0
19635471,10/11/2019,9/27/2019,6,53.286,4,2019-10-11,2019-09-27,-14
19636811,10/6/2019,10/6/2019,1,33.159,1,2019-10-06,2019-10-06,0
19637781,1/12/2020,9/28/2019,47,310.477,8,2020-01-12,2019-09-28,-106
19638721,1/11/2020,9/8/2019,69,231.39,19,2020-01-11,2019-09-08,-125
19639591,12/9/2019,12/9/2019,1,1.177,1,2019-12-09,2019-12-09,0
19640081,10/2/2019,9/24/2019,2,7.241,1,2019-10-02,2019-09-24,-8
19640151,6/17/2019,6/17/2019,1,17.31,1,2019-06-17,2019-06-17,0
19640621,9/25/2019,9/25/2019,1,14.029,1,2019-09-25,2019-09-25,0
196411,11/18/2017,11/18/2017,1,3.411,1,2017-11-18,2017-11-18,0
19641951,10/25/2019,7/13/2019,3,24.703,2,2019-10-25,2019-07-13,-104
19641991,7/2/2019,7/2/2019,1,7.561,1,2019-07-02,2019-07-02,0
19643231,12/7/2019,12/7/2019,1,5.979,1,2019-12-07,2019-12-07,0
19643261,1/12/2020,3/21/2020,4,28.5,3,2020-01-12,2020-03-21,69
19643361,6/29/2019,6/30/2019,2,18.712,2,2019-06-29,2019-06-30,1
19643961,7/19/2019,7/19/2019,1,1.236,1,2019-07-19,2019-07-19,0
19644341,11/22/2020,11/22/2020,1,0.137,1,2020-11-22,2020-11-22,0
19644561,7/26/2019,9/12/2019,2,23.623,2,2019-07-26,2019-09-12,48
19645531,1/13/2020,9/9/2019,59,508.847,12,2020-01-13,2019-09-09,-126
1964711,7/22/2018,7/22/2018,1,18.744,1,2018-07-22,2018-07-22,0
19647301,1/14/2020,9/3/2019,25,205.041,4,2020-01-14,2019-09-03,-133
1964771,1/13/2019,9/4/2018,9,433.605,2,2019-01-13,2018-09-04,-131
19648731,10/25/2019,10/25/2019,1,12.075,1,2019-10-25,2019-10-25,0
19648931,6/18/2019,6/18/2019,2,30.305999999999997,2,2019-06-18,2019-06-18,0
19648981,1/26/2020,1/26/2020,1,3.753,1,2020-01-26,2020-01-26,0
1964981,7/28/2018,7/28/2018,1,1.384,1,2018-07-28,2018-07-28,0
19650321,10/24/2020,8/24/2019,6,51.578,4,2020-10-24,2019-08-24,-427
19650351,6/28/2020,6/28/2020,1,1.247,1,2020-06-28,2020-06-28,0
19651801,6/18/2019,6/18/2019,1,4.108,1,2019-06-18,2019-06-18,0
19653871,10/6/2019,10/6/2019,1,3.66,1,2019-10-06,2019-10-06,0
1965461,5/2/2018,5/2/2018,1,1.833,1,2018-05-02,2018-05-02,0
196573,10/24/2019,8/26/2019,2,14.003,2,2019-10-24,2019-08-26,-59
19657721,1/6/2020,12/6/2019,5,40.034,3,2020-01-06,2019-12-06,-31
19657831,1/17/2020,9/25/2019,19,263.189,5,2020-01-17,2019-09-25,-114
19657861,6/30/2019,6/30/2019,1,15.069,1,2019-06-30,2019-06-30,0
19658011,10/2/2019,10/7/2019,3,11.427,3,2019-10-02,2019-10-07,5
19659061,7/15/2019,9/18/2019,4,24.695999999999998,3,2019-07-15,2019-09-18,65
19661451,1/13/2020,1/13/2020,1,8.089,1,2020-01-13,2020-01-13,0
196633,2/2/2018,2/2/2018,1,1.973,1,2018-02-02,2018-02-02,0
196645,10/9/2019,10/9/2019,1,10.62,1,2019-10-09,2019-10-09,0
1966521,10/7/2018,8/26/2020,4,25.947,2,2018-10-07,2020-08-26,689
19666861,10/10/2019,10/10/2019,1,5.112,1,2019-10-10,2019-10-10,0
19667521,3/14/2020,3/14/2020,1,5.951,1,2020-03-14,2020-03-14,0
19668341,8/9/2019,8/9/2019,1,8.927,1,2019-08-09,2019-08-09,0
19668781,1/4/2020,9/27/2019,63,324.473,5,2020-01-04,2019-09-27,-99
196691,1/10/2017,9/9/2016,509,2720.709679,13,2017-01-10,2016-09-09,-123
196723,1/20/2018,9/7/2016,10,98.33577100000001,9,2018-01-20,2016-09-07,-500
19673131,11/14/2019,11/14/2019,1,5.908,1,2019-11-14,2019-11-14,0
19673711,6/21/2019,6/21/2019,1,14.046,1,2019-06-21,2019-06-21,0
1967411,4/21/2019,5/11/2018,2,16.329,1,2019-04-21,2018-05-11,-345
1967421,1/15/2019,9/6/2018,124,1722.343,4,2019-01-15,2018-09-06,-131
19675461,8/5/2019,8/5/2019,1,7.44,1,2019-08-05,2019-08-05,0
19676011,10/29/2020,6/29/2019,3,23.761,2,2020-10-29,2019-06-29,-488
19676111,7/18/2019,7/18/2019,1,12.195,1,2019-07-18,2019-07-18,0
1967701,5/9/2018,5/9/2018,1,0.018,1,2018-05-09,2018-05-09,0
19677711,10/26/2019,10/26/2019,1,0.473,1,2019-10-26,2019-10-26,0
19679721,7/5/2019,7/5/2019,1,8.816,1,2019-07-05,2019-07-05,0
19682471,10/4/2020,10/4/2020,1,5.432,1,2020-10-04,2020-10-04,0
19682601,11/24/2019,11/24/2019,1,11.307,1,2019-11-24,2019-11-24,0
19683421,1/1/2020,1/1/2020,1,4.882,1,2020-01-01,2020-01-01,0
19683851,1/16/2020,9/23/2019,17,45.224,6,2020-01-16,2019-09-23,-115
19686081,12/11/2019,12/11/2019,1,3.825,1,2019-12-11,2019-12-11,0
19686531,9/14/2019,9/14/2019,1,8.379,1,2019-09-14,2019-09-14,0
1968761,5/24/2018,8/19/2018,2,8.783000000000001,2,2018-05-24,2018-08-19,87
19688421,1/16/2020,1/16/2020,1,7.167,1,2020-01-16,2020-01-16,0
19688761,12/21/2019,12/9/2019,2,12.052,1,2019-12-21,2019-12-09,-12
1968921,9/2/2019,9/2/2019,1,5.139,1,2019-09-02,2019-09-02,0
19689571,8/1/2019,8/1/2019,1,10.112,1,2019-08-01,2019-08-01,0
19690421,6/23/2019,6/23/2019,1,10.368,1,2019-06-23,2019-06-23,0
19690631,1/22/2020,9/5/2019,78,1504.395,4,2020-01-22,2019-09-05,-139
19693151,11/16/2019,11/16/2019,1,9.97,1,2019-11-16,2019-11-16,0
19693331,6/23/2019,6/23/2019,1,3.6229999999999998,1,2019-06-23,2019-06-23,0
19694141,1/22/2020,9/5/2019,26,354.863,2,2020-01-22,2019-09-05,-139
19694451,2/15/2020,2/15/2020,1,10.98,1,2020-02-15,2020-02-15,0
19695111,12/6/2019,12/6/2019,1,2.463,1,2019-12-06,2019-12-06,0
19696271,3/6/2020,3/6/2020,1,4.092,1,2020-03-06,2020-03-06,0
19696871,6/29/2019,9/25/2019,4,18.392,1,2019-06-29,2019-09-25,88
19697701,11/9/2019,11/9/2019,1,4.248,1,2019-11-09,2019-11-09,0
19698021,2/25/2020,2/25/2020,1,4.33,1,2020-02-25,2020-02-25,0
19698291,12/30/2019,12/30/2019,1,6.136,1,2019-12-30,2019-12-30,0
19698451,6/30/2019,6/30/2019,1,11.383,1,2019-06-30,2019-06-30,0
19698731,1/23/2020,9/5/2019,39,844.869,4,2020-01-23,2019-09-05,-140
1969881,3/4/2019,3/4/2019,1,37.21,1,2019-03-04,2019-03-04,0
19698991,2/23/2020,2/23/2020,1,11.78,1,2020-02-23,2020-02-23,0
19700291,7/14/2019,7/14/2019,1,4.636,1,2019-07-14,2019-07-14,0
197009,1/20/2020,11/16/2019,3,13.743,2,2020-01-20,2019-11-16,-65
1970121,4/11/2018,5/18/2018,2,36.735,2,2018-04-11,2018-05-18,37
19701491,11/24/2020,11/24/2020,1,4.517,1,2020-11-24,2020-11-24,0
19702051,1/31/2020,9/12/2019,6,63.926,3,2020-01-31,2019-09-12,-141
19703311,8/2/2019,8/2/2019,1,11.902,1,2019-08-02,2019-08-02,0
19703631,11/23/2019,11/23/2019,1,4.921,1,2019-11-23,2019-11-23,0
19704701,1/19/2020,1/19/2020,1,8.461,1,2020-01-19,2020-01-19,0
19706581,7/13/2019,7/6/2019,6,18.716,4,2019-07-13,2019-07-06,-7
19707541,10/7/2019,8/15/2019,3,27.458000000000002,3,2019-10-07,2019-08-15,-53
197081,10/13/2016,9/11/2016,2,17.062975,1,2016-10-13,2016-09-11,-32
19710441,1/24/2020,9/11/2019,7,91.667,3,2020-01-24,2019-09-11,-135
19710741,10/1/2019,9/3/2019,18,261.831,3,2019-10-01,2019-09-03,-28
1971101,1/10/2019,9/30/2019,73,614.03,16,2019-01-10,2019-09-30,263
19711311,1/10/2020,9/7/2019,121,239.189,21,2020-01-10,2019-09-07,-125
19712781,1/25/2020,2/3/2020,5,44.264,4,2020-01-25,2020-02-03,9
1971311,4/11/2018,5/22/2018,2,30.596,2,2018-04-11,2018-05-22,41
19713281,1/31/2020,12/6/2019,3,39.504999999999995,2,2020-01-31,2019-12-06,-56
19713661,10/13/2020,7/30/2020,16,124.015,3,2020-10-13,2020-07-30,-75
19715071,8/10/2019,8/10/2019,1,6.479,1,2019-08-10,2019-08-10,0
19718151,11/22/2019,11/22/2019,1,6.254,1,2019-11-22,2019-11-22,0
19718261,10/28/2020,12/28/2019,2,17.258,2,2020-10-28,2019-12-28,-305
19718401,9/24/2019,9/24/2019,1,19.557,1,2019-09-24,2019-09-24,0
19720311,6/26/2019,9/24/2019,2,9.008,2,2019-06-26,2019-09-24,90
19720991,8/20/2019,8/20/2019,1,2.368,1,2019-08-20,2019-08-20,0
19721021,12/17/2019,7/8/2019,2,19.544,2,2019-12-17,2019-07-08,-162
19721311,6/29/2019,6/29/2019,1,8.311,1,2019-06-29,2019-06-29,0
197217,1/14/2017,9/3/2017,27,247.630899,7,2017-01-14,2017-09-03,232
197223,11/14/2020,8/9/2018,10,23.554,9,2020-11-14,2018-08-09,-828
1972261,10/22/2019,10/22/2019,1,6.83,1,2019-10-22,2019-10-22,0
1972301,3/12/2019,3/12/2019,1,7.792,1,2019-03-12,2019-03-12,0
19723191,7/12/2019,7/12/2019,1,4.351,1,2019-07-12,2019-07-12,0
19723391,10/11/2019,7/12/2019,4,49.205999999999996,2,2019-10-11,2019-07-12,-91
19727841,6/29/2019,7/6/2019,2,13.155000000000001,1,2019-06-29,2019-07-06,7
1973041,1/6/2019,2/16/2020,4,17.852,1,2019-01-06,2020-02-16,406
19730671,10/5/2019,7/8/2019,3,25.836,3,2019-10-05,2019-07-08,-89
19731171,7/2/2019,7/3/2019,2,10.415,2,2019-07-02,2019-07-03,1
19732291,11/26/2019,9/12/2019,10,229.04399999999998,6,2019-11-26,2019-09-12,-75
19733651,2/24/2020,9/1/2019,2,5.33,2,2020-02-24,2019-09-01,-176
19734101,7/27/2019,9/21/2019,3,30.629,1,2019-07-27,2019-09-21,56
19734701,11/21/2019,11/21/2019,1,13.764,1,2019-11-21,2019-11-21,0
19735811,8/4/2019,8/4/2019,1,6.481,1,2019-08-04,2019-08-04,0
19735961,6/28/2019,7/9/2019,4,0.9319999999999999,3,2019-06-28,2019-07-09,11
197401,1/26/2017,9/30/2020,6,25.339,5,2017-01-26,2020-09-30,1343
19741151,7/20/2019,7/20/2019,1,11.545,1,2019-07-20,2019-07-20,0
1974161,5/13/2018,5/13/2018,1,7.302,1,2018-05-13,2018-05-13,0
197453,2/24/2019,7/31/2018,5,34.906,5,2019-02-24,2018-07-31,-208
19746231,6/29/2019,6/29/2019,1,1.318,1,2019-06-29,2019-06-29,0
19747071,6/29/2019,6/29/2019,1,8.379,1,2019-06-29,2019-06-29,0
19748061,1/21/2020,9/24/2019,27,477.802,4,2020-01-21,2019-09-24,-119
197493,1/21/2019,9/6/2017,17,97.591,4,2019-01-21,2017-09-06,-502
1975021,12/21/2019,12/21/2019,1,7.346,1,2019-12-21,2019-12-21,0
197503,11/24/2018,11/24/2018,1,8.724,1,2018-11-24,2018-11-24,0
19751071,12/1/2019,12/1/2019,1,7.642,1,2019-12-01,2019-12-01,0
19751131,2/23/2020,2/23/2020,1,6.594,1,2020-02-23,2020-02-23,0
19751691,6/30/2019,6/30/2019,1,2.066,1,2019-06-30,2019-06-30,0
197523,11/21/2016,5/26/2017,4,13.489999999999998,4,2016-11-21,2017-05-26,186
19752611,3/8/2020,7/27/2019,2,7.795999999999999,2,2020-03-08,2019-07-27,-225
1975271,12/8/2019,12/8/2019,1,3.252,1,2019-12-08,2019-12-08,0
19753471,8/28/2019,8/28/2019,1,12.092,1,2019-08-28,2019-08-28,0
19753711,12/18/2019,8/9/2019,2,25.046999999999997,2,2019-12-18,2019-08-09,-131
19754571,6/30/2019,6/30/2019,1,16.261,1,2019-06-30,2019-06-30,0
19754751,10/5/2019,10/5/2019,1,3.787,1,2019-10-05,2019-10-05,0
19754951,7/18/2019,7/18/2019,1,12.358,1,2019-07-18,2019-07-18,0
19755701,12/28/2019,12/28/2019,1,18.572,1,2019-12-28,2019-12-28,0
1975571,6/1/2019,9/14/2018,3,12.266,3,2019-06-01,2018-09-14,-260
19756121,2/16/2020,2/16/2020,1,13.483,1,2020-02-16,2020-02-16,0
197563,1/14/2020,9/8/2018,7,33.778999999999996,3,2020-01-14,2018-09-08,-493
19756741,7/27/2019,7/7/2019,3,9.405,2,2019-07-27,2019-07-07,-20
19757731,7/25/2019,7/25/2019,1,20.206,1,2019-07-25,2019-07-25,0
19758141,10/30/2020,6/19/2020,7,21.54,3,2020-10-30,2020-06-19,-133
19758481,1/10/2020,1/10/2020,1,23.362,1,2020-01-10,2020-01-10,0
19758601,7/30/2020,7/30/2020,1,6.915,1,2020-07-30,2020-07-30,0
19758811,12/14/2019,7/20/2019,2,14.330000000000002,2,2019-12-14,2019-07-20,-147
19759091,12/24/2019,7/18/2019,2,11.399,2,2019-12-24,2019-07-18,-159
19760571,7/6/2019,7/6/2019,1,13.467,1,2019-07-06,2019-07-06,0
19760661,2/1/2020,2/1/2020,1,1.323,1,2020-02-01,2020-02-01,0
1976191,7/31/2019,7/31/2019,1,9.974,1,2019-07-31,2019-07-31,0
19762071,7/27/2019,7/27/2019,1,5.459,1,2019-07-27,2019-07-27,0
19762261,11/20/2020,8/11/2019,7,36.556,4,2020-11-20,2019-08-11,-467
197629,9/19/2018,9/30/2016,2,10.415877,2,2018-09-19,2016-09-30,-719
197635,12/3/2016,4/13/2018,3,22.439,2,2016-12-03,2018-04-13,496
19763501,12/19/2019,8/15/2019,2,10.083,1,2019-12-19,2019-08-15,-126
19764001,1/25/2020,1/25/2020,1,3.827,1,2020-01-25,2020-01-25,0
19764541,10/5/2019,10/5/2019,1,10.64,1,2019-10-05,2019-10-05,0
197651,8/21/2016,8/21/2016,1,7.393807,1,2016-08-21,2016-08-21,0
19765821,3/4/2020,3/4/2020,1,12.667,1,2020-03-04,2020-03-04,0
1976631,9/14/2019,9/14/2019,1,11.45,1,2019-09-14,2019-09-14,0
19766821,10/17/2020,10/7/2020,2,16.373,1,2020-10-17,2020-10-07,-10
19766861,2/29/2020,2/29/2020,1,20.841,1,2020-02-29,2020-02-29,0
1976741,1/8/2020,1/8/2020,1,4.843,1,2020-01-08,2020-01-08,0
1976771,11/6/2018,4/12/2018,3,24.969,1,2018-11-06,2018-04-12,-208
19772271,3/5/2020,9/7/2019,6,137.122,2,2020-03-05,2019-09-07,-180
19773221,1/10/2020,11/23/2019,2,32.317,1,2020-01-10,2019-11-23,-48
197733,5/23/2018,5/23/2018,1,7.229,1,2018-05-23,2018-05-23,0
1977371,1/4/2020,12/21/2019,2,14.242,1,2020-01-04,2019-12-21,-14
19773821,12/2/2019,8/20/2019,5,38.058,3,2019-12-02,2019-08-20,-104
197739,2/19/2017,3/5/2017,2,41.259,2,2017-02-19,2017-03-05,14
19775011,11/13/2019,8/19/2019,6,157.18099999999998,3,2019-11-13,2019-08-19,-86
19775061,11/2/2019,9/6/2019,11,100.128,7,2019-11-02,2019-09-06,-57
19775401,3/8/2020,3/8/2020,1,7.937,1,2020-03-08,2020-03-08,0
19776001,2/17/2020,2/17/2020,1,6.557,1,2020-02-17,2020-02-17,0
19778131,7/19/2019,7/19/2019,1,1.23,1,2019-07-19,2019-07-19,0
19778211,7/12/2019,7/12/2019,1,2.308,1,2019-07-12,2019-07-12,0
19778311,7/26/2019,7/26/2019,1,8.431,1,2019-07-26,2019-07-26,0
19778851,7/3/2019,9/21/2020,2,17.029,2,2019-07-03,2020-09-21,446
197793,9/18/2017,9/18/2017,1,7.44,1,2017-09-18,2017-09-18,0
19779361,10/1/2019,9/13/2019,3,11.927,3,2019-10-01,2019-09-13,-18
19780061,8/1/2019,9/11/2019,2,24.567,2,2019-08-01,2019-09-11,41
197801,12/1/2016,2/18/2019,2,3.836,2,2016-12-01,2019-02-18,809
19781441,1/2/2020,1/2/2020,1,7.405,1,2020-01-02,2020-01-02,0
19781461,7/25/2019,7/25/2019,1,6.711,1,2019-07-25,2019-07-25,0
19781951,1/28/2020,9/4/2019,25,314.11,8,2020-01-28,2019-09-04,-146
19782831,1/22/2020,1/22/2020,1,5.454,1,2020-01-22,2020-01-22,0
19783261,9/6/2019,9/6/2019,1,3.125,1,2019-09-06,2019-09-06,0
197841,2/28/2018,2/28/2018,1,11.727,1,2018-02-28,2018-02-28,0
19784481,7/24/2019,7/24/2019,1,2.268,1,2019-07-24,2019-07-24,0
19786381,10/27/2019,10/5/2019,2,17.34,1,2019-10-27,2019-10-05,-22
19787411,7/20/2019,7/20/2019,1,15.052,1,2019-07-20,2019-07-20,0
19788321,1/25/2020,9/22/2019,7,75.105,3,2020-01-25,2019-09-22,-125
1978841,12/19/2018,9/26/2018,5,14.34,4,2018-12-19,2018-09-26,-84
19789831,7/4/2019,7/7/2019,2,53.077,2,2019-07-04,2019-07-07,3
197905,1/31/2019,6/4/2019,8,62.422,3,2019-01-31,2019-06-04,124
19792061,7/5/2019,7/5/2019,1,14.08,1,2019-07-05,2019-07-05,0
19792981,11/20/2019,11/20/2019,1,11.837,1,2019-11-20,2019-11-20,0
1979351,1/19/2020,9/5/2019,92,1470.251,17,2020-01-19,2019-09-05,-136
197953,1/1/2017,9/5/2016,60,243.708056,11,2017-01-01,2016-09-05,-118
19795781,11/30/2019,11/30/2019,1,6.327,1,2019-11-30,2019-11-30,0
19796091,1/14/2020,12/6/2019,4,16.338,3,2020-01-14,2019-12-06,-39
19796671,10/31/2019,10/31/2019,1,0.557,1,2019-10-31,2019-10-31,0
19797351,7/7/2019,7/7/2019,1,2.305,1,2019-07-07,2019-07-07,0
19797661,9/20/2020,9/20/2020,1,12.044,1,2020-09-20,2020-09-20,0
19798541,1/11/2020,2/16/2020,3,17.456,2,2020-01-11,2020-02-16,36
19798571,10/7/2019,10/7/2019,1,6.713,1,2019-10-07,2019-10-07,0
19798781,10/14/2019,11/4/2019,7,32.074,3,2019-10-14,2019-11-04,21
1979951,6/2/2018,6/2/2018,1,2.326,1,2018-06-02,2018-06-02,0
1980131,5/30/2019,5/30/2019,1,3.235,1,2019-05-30,2019-05-30,0
19803791,7/8/2019,7/8/2019,1,4.006,1,2019-07-08,2019-07-08,0
19804091,12/15/2019,12/15/2019,1,12.473,1,2019-12-15,2019-12-15,0
1980621,1/22/2020,5/1/2019,6,55.085,4,2020-01-22,2019-05-01,-266
19806481,10/16/2019,9/14/2019,28,260.563,4,2019-10-16,2019-09-14,-32
19807921,6/11/2020,7/17/2020,10,131.677,3,2020-06-11,2020-07-17,36
1980831,5/23/2018,7/31/2018,3,8.768,3,2018-05-23,2018-07-31,69
19809051,10/5/2019,8/18/2019,2,23.076,2,2019-10-05,2019-08-18,-48
1981071,12/17/2018,12/17/2018,1,11.932,1,2018-12-17,2018-12-17,0
19811651,10/10/2019,10/10/2019,1,5.467,1,2019-10-10,2019-10-10,0
19813401,1/6/2020,9/21/2019,15,136.778,7,2020-01-06,2019-09-21,-107
19813631,8/10/2019,8/10/2019,1,10.61,1,2019-08-10,2019-08-10,0
19813681,7/7/2019,7/9/2019,2,57.518,2,2019-07-07,2019-07-09,2
1981371,6/16/2019,6/16/2019,1,0.262,1,2019-06-16,2019-06-16,0
19813951,1/14/2020,8/27/2019,13,10.262,4,2020-01-14,2019-08-27,-140
198151,10/1/2018,9/4/2018,52,386.986,4,2018-10-01,2018-09-04,-27
19815571,11/16/2019,11/16/2019,1,5.081,1,2019-11-16,2019-11-16,0
19816821,7/10/2019,9/4/2019,12,214.812,4,2019-07-10,2019-09-04,56
19816961,6/14/2020,6/27/2020,3,29.377,3,2020-06-14,2020-06-27,13
19817641,8/23/2019,8/31/2019,2,13.696,2,2019-08-23,2019-08-31,8
198177,8/4/2018,8/4/2018,1,17.15,1,2018-08-04,2018-08-04,0
19819231,10/10/2020,10/2/2020,2,59.790000000000006,1,2020-10-10,2020-10-02,-8
19819911,9/6/2019,9/6/2019,1,2.942,1,2019-09-06,2019-09-06,0
19820161,7/8/2019,7/8/2019,1,8.758,1,2019-07-08,2019-07-08,0
198213,8/9/2020,8/9/2020,1,1.177,1,2020-08-09,2020-08-09,0
19822601,11/24/2019,7/16/2019,2,68.554,2,2019-11-24,2019-07-16,-131
198231,10/5/2017,6/2/2017,2,5.696,2,2017-10-05,2017-06-02,-125
19824491,12/11/2019,12/5/2019,2,12.621,1,2019-12-11,2019-12-05,-6
1982631,1/10/2020,8/14/2019,23,254.868,10,2020-01-10,2019-08-14,-149
19826671,10/15/2019,9/27/2019,24,417.417,4,2019-10-15,2019-09-27,-18
19828921,7/9/2019,9/17/2019,2,11.909,2,2019-07-09,2019-09-17,70
198295,10/10/2018,3/14/2018,2,13.482000000000001,2,2018-10-10,2018-03-14,-210
19830021,1/31/2020,1/31/2020,1,0.878,1,2020-01-31,2020-01-31,0
19830121,7/11/2019,7/15/2020,2,12.479,2,2019-07-11,2020-07-15,370
1983021,5/26/2018,5/26/2018,1,5.831,1,2018-05-26,2018-05-26,0
198303,5/13/2017,5/28/2017,2,10.854,1,2017-05-13,2017-05-28,15
19830541,12/26/2019,9/29/2019,3,104.276,3,2019-12-26,2019-09-29,-88
19833911,1/11/2020,1/11/2020,1,13.714,1,2020-01-11,2020-01-11,0
19834521,12/4/2019,12/4/2019,1,8.83,1,2019-12-04,2019-12-04,0
19834601,7/27/2019,7/27/2019,1,4.97,1,2019-07-27,2019-07-27,0
19834661,1/23/2020,1/23/2020,1,7.497,1,2020-01-23,2020-01-23,0
19835731,10/4/2020,9/27/2020,4,96.196,1,2020-10-04,2020-09-27,-7
1983721,1/26/2020,4/28/2019,4,40.192,3,2020-01-26,2019-04-28,-273
19838371,10/19/2019,8/24/2019,2,11.574,1,2019-10-19,2019-08-24,-56
1983861,10/22/2019,10/22/2019,1,4.299,1,2019-10-22,2019-10-22,0
1984,5/14/2017,8/20/2016,2,12.655406000000001,2,2017-05-14,2016-08-20,-267
19840061,2/21/2020,9/30/2019,3,18.518,3,2020-02-21,2019-09-30,-144
198413,10/21/2018,8/17/2016,3,14.493347,2,2018-10-21,2016-08-17,-795
19841651,10/17/2019,8/26/2019,6,34.192,4,2019-10-17,2019-08-26,-52
19841911,11/2/2019,8/31/2019,5,64.626,4,2019-11-02,2019-08-31,-63
19844891,11/10/2019,7/14/2019,2,21.641,2,2019-11-10,2019-07-14,-119
19845061,2/28/2020,2/28/2020,1,23.957,1,2020-02-28,2020-02-28,0
19848681,3/11/2020,7/28/2019,4,11.899000000000001,4,2020-03-11,2019-07-28,-227
19849481,7/13/2019,7/13/2019,1,4.12,1,2019-07-13,2019-07-13,0
19850731,10/23/2019,10/23/2019,1,0.356,1,2019-10-23,2019-10-23,0
19850951,7/12/2019,8/26/2019,3,51.218,3,2019-07-12,2019-08-26,45
19852581,8/11/2019,8/3/2019,2,10.237,1,2019-08-11,2019-08-03,-8
19853321,11/12/2019,8/11/2019,5,11.513,5,2019-11-12,2019-08-11,-93
19853481,7/16/2019,7/16/2019,1,7.433,1,2019-07-16,2019-07-16,0
198559,7/27/2017,7/27/2017,1,17.807,1,2017-07-27,2017-07-27,0
19857191,10/26/2019,12/21/2019,6,157.16,5,2019-10-26,2019-12-21,56
19857211,2/16/2020,3/12/2020,3,32.646,2,2020-02-16,2020-03-12,25
19857931,10/4/2019,12/12/2019,2,30.817999999999998,2,2019-10-04,2019-12-12,69
19859951,3/7/2020,8/30/2020,2,15.219,1,2020-03-07,2020-08-30,176
19861821,12/2/2019,12/2/2019,1,25.924,1,2019-12-02,2019-12-02,0
19865181,10/15/2019,9/27/2019,42,702.016,6,2019-10-15,2019-09-27,-18
198661,5/7/2019,5/7/2019,1,17.349,1,2019-05-07,2019-05-07,0
19867261,11/30/2019,9/21/2019,3,31.014,3,2019-11-30,2019-09-21,-70
19867791,10/3/2019,10/3/2019,1,10.23,1,2019-10-03,2019-10-03,0
19868691,1/22/2020,9/13/2019,6,19.359,4,2020-01-22,2019-09-13,-131
1987011,11/22/2018,6/17/2018,3,6.373,3,2018-11-22,2018-06-17,-158
19871061,8/6/2019,8/6/2019,1,6.598,1,2019-08-06,2019-08-06,0
1987131,10/20/2018,10/27/2018,2,15.406,2,2018-10-20,2018-10-27,7
198721,8/18/2016,9/1/2016,3,5.666045,3,2016-08-18,2016-09-01,14
19872471,7/17/2019,7/17/2019,1,1.316,1,2019-07-17,2019-07-17,0
19872781,10/14/2019,10/14/2019,1,5.253,1,2019-10-14,2019-10-14,0
198749,1/15/2020,2/5/2020,4,51.479000000000006,4,2020-01-15,2020-02-05,21
19876081,1/10/2020,9/4/2019,67,569.221,4,2020-01-10,2019-09-04,-128
19877921,10/11/2019,9/25/2019,19,262.456,1,2019-10-11,2019-09-25,-16
19878131,11/16/2019,12/8/2019,2,9.89,2,2019-11-16,2019-12-08,22
19878471,10/26/2019,8/24/2019,3,16.106,2,2019-10-26,2019-08-24,-63
19879511,10/18/2019,9/6/2020,17,78.282,9,2019-10-18,2020-09-06,324
19879981,1/26/2020,1/26/2020,1,6.19,1,2020-01-26,2020-01-26,0
19880081,7/19/2019,7/19/2019,1,2.19,1,2019-07-19,2019-07-19,0
19880251,7/27/2019,8/3/2019,5,9.643,4,2019-07-27,2019-08-03,7
1988051,5/6/2018,5/6/2018,1,7.483,1,2018-05-06,2018-05-06,0
19881421,1/23/2020,2/11/2020,5,29.424,5,2020-01-23,2020-02-11,19
1988191,8/2/2018,8/2/2018,1,6.659,1,2018-08-02,2018-08-02,0
198835,1/12/2019,8/9/2019,20,116.966,8,2019-01-12,2019-08-09,209
19883821,9/19/2019,9/19/2019,1,2.498,1,2019-09-19,2019-09-19,0
19884851,11/2/2019,8/21/2020,2,5.073,2,2019-11-02,2020-08-21,293
19886901,10/17/2020,10/17/2020,1,3.922,1,2020-10-17,2020-10-17,0
19886961,11/18/2019,9/20/2019,6,81.303,2,2019-11-18,2019-09-20,-59
19886981,10/3/2019,9/7/2019,3,17.505000000000003,2,2019-10-03,2019-09-07,-26
19888981,1/12/2020,12/28/2019,7,16.218,5,2020-01-12,2019-12-28,-15
19889041,11/16/2019,11/16/2019,1,3.168,1,2019-11-16,2019-11-16,0
19889231,3/6/2020,9/15/2019,5,28.459,5,2020-03-06,2019-09-15,-173
19889561,2/23/2020,6/13/2020,2,4.011,2,2020-02-23,2020-06-13,111
198899,4/7/2018,4/7/2018,1,9.761,1,2018-04-07,2018-04-07,0
19892501,12/16/2019,9/13/2019,3,27.709000000000003,2,2019-12-16,2019-09-13,-94
19894121,10/8/2019,2/13/2020,3,41.244,2,2019-10-08,2020-02-13,128
198947,12/20/2017,3/9/2018,6,37.799,3,2017-12-20,2018-03-09,79
19895011,7/18/2019,7/18/2019,1,17.659,1,2019-07-18,2019-07-18,0
19895091,11/16/2019,7/18/2019,2,11.722999999999999,2,2019-11-16,2019-07-18,-121
19895451,1/12/2020,9/15/2019,5,31.927,2,2020-01-12,2019-09-15,-119
19896401,7/26/2019,8/9/2019,15,217.726,7,2019-07-26,2019-08-09,14
19897351,1/8/2020,1/8/2020,1,21.524,1,2020-01-08,2020-01-08,0
19898561,7/21/2019,7/21/2019,1,6.581,1,2019-07-21,2019-07-21,0
198989,10/27/2017,6/17/2017,3,7.896,1,2017-10-27,2017-06-17,-132
19899011,2/7/2020,2/7/2020,1,9.942,1,2020-02-07,2020-02-07,0
198995,1/12/2020,12/18/2016,2,16.796,2,2020-01-12,2016-12-18,-1120
19899641,10/6/2019,8/17/2019,3,29.956000000000003,3,2019-10-06,2019-08-17,-50
1990011,4/15/2018,4/15/2018,1,7.824,1,2018-04-15,2018-04-15,0
19900391,1/25/2020,9/8/2019,4,46.625,3,2020-01-25,2019-09-08,-139
19900481,7/24/2019,7/24/2019,1,9.012,1,2019-07-24,2019-07-24,0
19901171,7/19/2019,8/12/2019,2,24.528,2,2019-07-19,2019-08-12,24
19901401,12/12/2019,12/12/2019,1,8.323,1,2019-12-12,2019-12-12,0
19901981,11/17/2019,11/17/2019,1,8.811,1,2019-11-17,2019-11-17,0
19902111,2/13/2020,9/29/2020,3,30.141,3,2020-02-13,2020-09-29,229
19902521,9/20/2020,9/20/2020,1,18.737,1,2020-09-20,2020-09-20,0
19903241,5/2/2020,6/14/2020,3,14.408999999999999,2,2020-05-02,2020-06-14,43
19903821,7/19/2019,7/19/2019,1,5.663,1,2019-07-19,2019-07-19,0
19904531,1/10/2020,9/5/2019,30,138.263,7,2020-01-10,2019-09-05,-127
19904541,1/25/2020,9/3/2019,3,13.245,2,2020-01-25,2019-09-03,-144
19904561,7/19/2019,7/19/2019,1,13.756,1,2019-07-19,2019-07-19,0
199071,1/15/2017,8/31/2019,24,139.888693,6,2017-01-15,2019-08-31,958
199127,11/5/2017,12/14/2016,2,14.866,2,2017-11-05,2016-12-14,-326
19913441,7/20/2019,7/20/2019,1,6.082,1,2019-07-20,2019-07-20,0
19914131,8/16/2019,8/16/2019,1,3.159,1,2019-08-16,2019-08-16,0
19914861,7/21/2019,7/21/2019,1,13.215,1,2019-07-21,2019-07-21,0
1991671,1/13/2019,5/31/2019,2,10.698,2,2019-01-13,2019-05-31,138
1991701,8/21/2019,8/21/2019,1,1.779,1,2019-08-21,2019-08-21,0
199175,11/16/2016,9/25/2016,2,8.604168,2,2016-11-16,2016-09-25,-52
19917511,1/31/2020,4/19/2020,3,21.383,3,2020-01-31,2020-04-19,79
199177,1/19/2020,6/11/2018,3,10.625,3,2020-01-19,2018-06-11,-587
1992181,6/12/2019,6/9/2019,2,22.776,2,2019-06-12,2019-06-09,-3
1992201,3/26/2019,8/17/2019,2,10.461,2,2019-03-26,2019-08-17,144
1992211,8/16/2018,8/16/2018,1,14.626,1,2018-08-16,2018-08-16,0
19922191,7/21/2019,7/21/2019,1,5.357,1,2019-07-21,2019-07-21,0
1992221,9/2/2018,9/2/2018,1,5.003,1,2018-09-02,2018-09-02,0
19922241,10/25/2020,10/25/2020,1,7.15,1,2020-10-25,2020-10-25,0
19922721,7/28/2019,8/14/2019,4,51.689,3,2019-07-28,2019-08-14,17
199241,8/30/2017,8/30/2017,1,7.041,1,2017-08-30,2017-08-30,0
199243,11/24/2018,11/9/2017,2,20.771,2,2018-11-24,2017-11-09,-380
19926761,1/27/2020,8/17/2019,10,392.644,3,2020-01-27,2019-08-17,-163
1992701,10/4/2020,10/4/2020,1,7.825,1,2020-10-04,2020-10-04,0
19927131,8/20/2019,8/20/2019,1,8.494,1,2019-08-20,2019-08-20,0
19930011,11/6/2019,6/18/2020,4,18.375,3,2019-11-06,2020-06-18,225
19930631,3/1/2020,3/1/2020,1,8.283999999999999,1,2020-03-01,2020-03-01,0
19930701,11/7/2019,9/8/2019,3,21.255,3,2019-11-07,2019-09-08,-60
19932381,10/15/2019,8/9/2019,6,46.0,3,2019-10-15,2019-08-09,-67
1993451,1/9/2020,12/12/2019,3,12.807,3,2020-01-09,2019-12-12,-28
19935741,12/6/2019,12/6/2019,1,0.69,1,2019-12-06,2019-12-06,0
1993601,11/16/2018,11/16/2018,1,7.923,1,2018-11-16,2018-11-16,0
19936581,3/5/2020,3/5/2020,1,2.801,1,2020-03-05,2020-03-05,0
19936731,10/25/2020,9/19/2019,6,17.759999999999998,5,2020-10-25,2019-09-19,-402
19937071,2/11/2020,2/11/2020,1,7.652,1,2020-02-11,2020-02-11,0
19938911,12/12/2019,12/12/2019,1,6.918,1,2019-12-12,2019-12-12,0
1994081,4/13/2019,4/13/2019,1,8.68,1,2019-04-13,2019-04-13,0
19943411,1/4/2020,3/8/2020,5,88.32600000000001,3,2020-01-04,2020-03-08,64
19944261,8/21/2019,8/3/2019,2,9.926,2,2019-08-21,2019-08-03,-18
199459,9/24/2016,9/24/2016,1,8.561472,1,2016-09-24,2016-09-24,0
19946241,9/15/2019,9/15/2019,1,3.581,1,2019-09-15,2019-09-15,0
19946321,11/7/2019,8/10/2019,5,73.957,4,2019-11-07,2019-08-10,-89
19947131,8/24/2019,9/27/2019,2,11.213999999999999,2,2019-08-24,2019-09-27,34
19947161,10/21/2019,10/21/2019,1,11.802,1,2019-10-21,2019-10-21,0
19947581,8/19/2019,8/19/2019,1,9.559,1,2019-08-19,2019-08-19,0
19947621,10/29/2019,10/29/2019,1,7.82,1,2019-10-29,2019-10-29,0
19947891,11/6/2019,8/25/2020,11,51.550000000000004,6,2019-11-06,2020-08-25,293
199479,10/13/2016,9/27/2016,3,4.143455,1,2016-10-13,2016-09-27,-16
19947901,1/25/2020,7/27/2019,4,21.969,3,2020-01-25,2019-07-27,-182
19950101,7/25/2019,7/25/2019,1,15.034,1,2019-07-25,2019-07-25,0
19950111,8/2/2019,8/2/2019,1,12.255,1,2019-08-02,2019-08-02,0
19950581,7/25/2019,7/25/2019,1,9.32,1,2019-07-25,2019-07-25,0
19951491,11/1/2019,11/1/2019,1,36.651,1,2019-11-01,2019-11-01,0
19951741,7/29/2019,9/13/2019,2,7.414,2,2019-07-29,2019-09-13,46
19952151,1/10/2020,1/10/2020,1,1.175,1,2020-01-10,2020-01-10,0
19952501,1/12/2020,12/22/2019,5,28.423000000000002,3,2020-01-12,2019-12-22,-21
199529,4/14/2017,4/8/2017,2,7.1450000000000005,1,2017-04-14,2017-04-08,-6
19954071,10/10/2019,9/8/2019,16,99.2,4,2019-10-10,2019-09-08,-32
19954681,9/23/2019,9/23/2019,1,1.448,1,2019-09-23,2019-09-23,0
19954751,7/25/2019,7/25/2019,1,12.195,1,2019-07-25,2019-07-25,0
19958081,9/23/2019,9/23/2019,1,1.885,1,2019-09-23,2019-09-23,0
199581,8/9/2016,9/8/2016,5,16.334147,4,2016-08-09,2016-09-08,30
19958421,7/30/2019,7/30/2019,1,14.013,1,2019-07-30,2019-07-30,0
1995931,10/13/2018,6/23/2018,4,14.262,2,2018-10-13,2018-06-23,-112
1995991,4/29/2018,9/16/2018,2,8.702,2,2018-04-29,2018-09-16,140
199615,1/11/2020,6/19/2020,8,37.974000000000004,7,2020-01-11,2020-06-19,160
1996151,12/10/2019,12/10/2019,1,33.007,1,2019-12-10,2019-12-10,0
19963401,1/10/2020,1/10/2020,1,8.132,1,2020-01-10,2020-01-10,0
19963921,10/3/2020,9/19/2020,6,78.009,2,2020-10-03,2020-09-19,-14
19964311,12/31/2019,2/8/2020,2,6.145,2,2019-12-31,2020-02-08,39
19964401,1/18/2020,8/31/2019,3,18.279,3,2020-01-18,2019-08-31,-140
199655,10/11/2018,10/11/2018,1,14.796,1,2018-10-11,2018-10-11,0
19966381,7/30/2019,7/30/2019,1,11.59,1,2019-07-30,2019-07-30,0
19967561,8/29/2019,8/29/2019,1,11.4,1,2019-08-29,2019-08-29,0
19968131,1/29/2020,11/25/2019,2,19.491,2,2020-01-29,2019-11-25,-65
19968831,9/5/2020,9/5/2020,1,14.422,1,2020-09-05,2020-09-05,0
199691,10/2/2016,10/2/2016,1,16.40966,1,2016-10-02,2016-10-02,0
19969291,7/27/2019,7/27/2019,1,1.908,1,2019-07-27,2019-07-27,0
19970291,1/26/2020,1/26/2020,1,14.316,1,2020-01-26,2020-01-26,0
19971721,11/2/2019,11/2/2019,1,16.923,1,2019-11-02,2019-11-02,0
1997381,4/25/2018,5/8/2018,7,106.947,4,2018-04-25,2018-05-08,13
1997591,12/8/2019,9/28/2019,2,10.427,2,2019-12-08,2019-09-28,-71
1997651,2/2/2019,3/30/2019,2,10.865,2,2019-02-02,2019-03-30,56
1997671,11/17/2018,5/1/2018,2,10.998999999999999,2,2018-11-17,2018-05-01,-200
19977961,1/14/2020,2/4/2020,23,301.841,2,2020-01-14,2020-02-04,21
19978501,10/25/2020,9/7/2019,16,61.061,7,2020-10-25,2019-09-07,-414
19978721,7/28/2019,7/28/2019,1,5.406,1,2019-07-28,2019-07-28,0
19979801,11/2/2019,11/2/2019,1,2.124,1,2019-11-02,2019-11-02,0
19979981,1/25/2020,9/20/2020,10,153.176,7,2020-01-25,2020-09-20,239
199809,8/12/2016,8/12/2016,1,2.465218,1,2016-08-12,2016-08-12,0
19984481,10/4/2019,8/5/2019,10,194.015,3,2019-10-04,2019-08-05,-60
19985231,1/5/2020,8/24/2019,4,20.589,4,2020-01-05,2019-08-24,-134
19985331,10/1/2019,2/21/2020,2,21.809,2,2019-10-01,2020-02-21,143
19986741,1/13/2020,9/14/2020,7,66.461,4,2020-01-13,2020-09-14,245
19987531,11/11/2019,9/24/2019,3,33.104,2,2019-11-11,2019-09-24,-48
19989721,1/10/2020,3/5/2020,8,182.03,4,2020-01-10,2020-03-05,55
19989961,10/14/2019,9/22/2019,3,29.731,2,2019-10-14,2019-09-22,-22
19990141,10/7/2019,9/9/2019,8,132.679,5,2019-10-07,2019-09-09,-28
199903,9/11/2016,9/16/2016,4,28.357054,4,2016-09-11,2016-09-16,5
199937,10/1/2020,8/17/2019,18,49.471,6,2020-10-01,2019-08-17,-411
1999391,8/2/2019,8/2/2019,1,17.367,1,2019-08-02,2019-08-02,0
19994891,8/1/2019,8/7/2019,5,27.549,2,2019-08-01,2019-08-07,6
19995021,9/8/2019,9/8/2019,1,2.095,1,2019-09-08,2019-09-08,0
19996091,1/8/2020,9/30/2019,33,303.952,3,2020-01-08,2019-09-30,-100
19996471,10/18/2019,9/27/2019,6,17.0,3,2019-10-18,2019-09-27,-21
1999881,8/23/2018,8/23/2018,1,1.157,1,2018-08-23,2018-08-23,0
19998861,12/27/2019,2/13/2020,2,6.309,2,2019-12-27,2020-02-13,48
19998871,9/5/2020,9/5/2020,1,12.932,1,2020-09-05,2020-09-05,0
200003,5/23/2019,8/13/2019,4,41.289,4,2019-05-23,2019-08-13,82
2000221,5/20/2018,5/20/2018,1,7.95,1,2018-05-20,2018-05-20,0
20003551,10/28/2019,10/28/2019,1,10.979,1,2019-10-28,2019-10-28,0
200037,6/30/2017,6/30/2017,1,13.714,1,2017-06-30,2017-06-30,0
20003971,10/13/2019,10/13/2019,1,4.909,1,2019-10-13,2019-10-13,0
200043,11/5/2016,11/5/2016,1,4.187,1,2016-11-05,2016-11-05,0
20005061,8/18/2019,8/18/2019,1,9.245,1,2019-08-18,2019-08-18,0
2000561,1/13/2019,9/9/2018,27,125.05799999999999,10,2019-01-13,2018-09-09,-126
2000581,12/21/2019,12/21/2019,1,0.958,1,2019-12-21,2019-12-21,0
200059,4/25/2019,4/25/2019,1,7.572,1,2019-04-25,2019-04-25,0
2000621,7/20/2018,7/21/2018,2,15.437,2,2018-07-20,2018-07-21,1
20007571,12/23/2019,12/23/2019,1,14.758,1,2019-12-23,2019-12-23,0
20007741,12/4/2019,12/4/2019,1,2.457,1,2019-12-04,2019-12-04,0
20007771,1/28/2020,9/5/2019,10,100.245,8,2020-01-28,2019-09-05,-145
2000791,9/14/2018,9/14/2018,1,8.206,1,2018-09-14,2018-09-14,0
20011371,1/12/2020,8/25/2019,5,44.024,3,2020-01-12,2019-08-25,-140
20011401,12/11/2019,12/11/2019,1,1.571,1,2019-12-11,2019-12-11,0
2001191,12/26/2019,8/14/2018,14,76.129,5,2019-12-26,2018-08-14,-499
20012431,6/13/2020,6/13/2020,1,3.91,1,2020-06-13,2020-06-13,0
20012881,10/6/2019,3/8/2020,3,8.376000000000001,2,2019-10-06,2020-03-08,154
20012991,1/10/2020,3/3/2020,15,309.361,2,2020-01-10,2020-03-03,53
200139,6/28/2017,6/28/2017,1,7.302,1,2017-06-28,2017-06-28,0
20014231,12/6/2019,12/6/2019,1,7.024,1,2019-12-06,2019-12-06,0
20015961,8/4/2019,8/4/2019,1,7.934,1,2019-08-04,2019-08-04,0
200167,12/23/2018,12/23/2018,1,3.307,1,2018-12-23,2018-12-23,0
20020061,1/18/2020,12/31/2019,5,27.237000000000002,2,2020-01-18,2019-12-31,-18
20020281,8/29/2020,8/29/2020,1,9.242,1,2020-08-29,2020-08-29,0
20020461,12/3/2019,8/20/2019,3,57.762,2,2019-12-03,2019-08-20,-105
20021591,2/19/2020,2/19/2020,1,7.344,1,2020-02-19,2020-02-19,0
20022491,11/15/2019,11/15/2019,1,3.262,1,2019-11-15,2019-11-15,0
20023461,8/2/2019,8/2/2019,1,14.393,1,2019-08-02,2019-08-02,0
20024051,8/2/2019,8/2/2019,1,3.305,1,2019-08-02,2019-08-02,0
20024631,1/10/2020,9/6/2020,139,2656.464,17,2020-01-10,2020-09-06,240
20025411,12/31/2019,2/1/2020,3,17.365000000000002,3,2019-12-31,2020-02-01,32
20027281,11/11/2019,11/11/2019,1,12.884,1,2019-11-11,2019-11-11,0
20027291,10/15/2019,11/21/2019,2,10.386,2,2019-10-15,2019-11-21,37
20030791,8/18/2019,8/18/2019,1,5.535,1,2019-08-18,2019-08-18,0
20031801,1/17/2020,9/27/2019,4,8.486,3,2020-01-17,2019-09-27,-112
20032291,10/26/2019,9/22/2019,6,61.986999999999995,2,2019-10-26,2019-09-22,-34
20033381,2/7/2020,2/7/2020,1,3.182,1,2020-02-07,2020-02-07,0
20034961,1/29/2020,2/15/2020,4,15.749,3,2020-01-29,2020-02-15,17
20035891,8/24/2019,8/24/2019,1,9.019,1,2019-08-24,2019-08-24,0
20036511,10/6/2019,9/9/2019,6,27.195,4,2019-10-06,2019-09-09,-27
20036591,8/10/2019,9/29/2020,2,11.573,2,2019-08-10,2020-09-29,416
20037351,2/11/2020,2/11/2020,1,7.274,1,2020-02-11,2020-02-11,0
20037931,1/17/2020,11/2/2019,2,12.968,2,2020-01-17,2019-11-02,-76
20038071,11/28/2020,12/28/2020,5,25.049999999999997,3,2020-11-28,2020-12-28,30
20040981,1/27/2020,11/4/2019,2,10.564,1,2020-01-27,2019-11-04,-84
20041741,11/12/2019,11/12/2019,1,5.9910000000000005,1,2019-11-12,2019-11-12,0
20041821,12/21/2019,9/13/2019,4,38.958,4,2019-12-21,2019-09-13,-99
20042351,10/11/2020,10/23/2020,2,7.125,2,2020-10-11,2020-10-23,12
20043251,11/29/2020,11/29/2020,1,14.589,1,2020-11-29,2020-11-29,0
200435,8/1/2018,9/20/2018,2,34.165,2,2018-08-01,2018-09-20,50
20043941,10/9/2019,8/27/2019,2,12.271,1,2019-10-09,2019-08-27,-43
20044001,10/29/2019,10/29/2019,1,11.119,1,2019-10-29,2019-10-29,0
20044521,2/5/2020,2/5/2020,1,20.55,1,2020-02-05,2020-02-05,0
2004561,1/9/2019,9/7/2019,39,412.955,11,2019-01-09,2019-09-07,241
200459,6/6/2020,7/9/2017,2,18.396,2,2020-06-06,2017-07-09,-1063
20046211,10/29/2019,8/26/2019,2,15.657,2,2019-10-29,2019-08-26,-64
20047791,12/23/2019,12/23/2019,1,2.716,1,2019-12-23,2019-12-23,0
20047961,1/13/2020,9/9/2019,29,432.605,7,2020-01-13,2019-09-09,-126
20048721,7/11/2020,7/9/2020,2,7.372,1,2020-07-11,2020-07-09,-2
2004881,1/14/2019,1/14/2019,1,4.353,1,2019-01-14,2019-01-14,0
20049881,10/29/2019,10/29/2019,1,17.635,1,2019-10-29,2019-10-29,0
200507,1/18/2017,9/7/2017,14,42.927,6,2017-01-18,2017-09-07,232
20052581,8/6/2019,8/6/2019,1,9.126,1,2019-08-06,2019-08-06,0
20052691,10/5/2019,10/5/2019,1,0.967,1,2019-10-05,2019-10-05,0
20053081,8/6/2019,8/6/2019,1,5.793,1,2019-08-06,2019-08-06,0
20053341,11/14/2019,8/19/2019,3,59.108000000000004,2,2019-11-14,2019-08-19,-87
200541,5/29/2019,5/29/2019,1,1.673,1,2019-05-29,2019-05-29,0
20054371,11/9/2019,11/9/2019,1,1.568,1,2019-11-09,2019-11-09,0
20054551,10/3/2019,10/3/2019,1,3.077,1,2019-10-03,2019-10-03,0
200549,12/21/2017,12/21/2017,1,3.777,1,2017-12-21,2017-12-21,0
20058251,12/19/2019,8/8/2019,4,68.81,3,2019-12-19,2019-08-08,-133
20059461,10/23/2019,10/23/2019,1,1.959,1,2019-10-23,2019-10-23,0
20061271,8/7/2019,8/7/2019,1,11.044,1,2019-08-07,2019-08-07,0
20062261,8/21/2019,8/21/2019,1,6.556,1,2019-08-21,2019-08-21,0
200637,1/4/2020,8/27/2017,7,282.579,3,2020-01-04,2017-08-27,-860
200679,8/5/2019,8/5/2019,1,5.121,1,2019-08-05,2019-08-05,0
20068501,1/10/2020,9/9/2019,51,960.118,9,2020-01-10,2019-09-09,-123
20069761,9/3/2019,9/3/2019,1,3.159,1,2019-09-03,2019-09-03,0
20070141,10/4/2020,10/6/2020,2,21.83,2,2020-10-04,2020-10-06,2
200721,4/19/2017,4/19/2017,1,8.669,1,2017-04-19,2017-04-19,0
20073511,12/19/2019,9/23/2019,2,46.197,2,2019-12-19,2019-09-23,-87
20075321,10/14/2019,10/14/2019,1,13.226,1,2019-10-14,2019-10-14,0
20076641,10/8/2020,8/22/2020,2,10.545,2,2020-10-08,2020-08-22,-47
20078991,10/17/2019,9/28/2019,5,26.956,5,2019-10-17,2019-09-28,-19
20079221,8/23/2019,8/23/2019,1,14.979,1,2019-08-23,2019-08-23,0
200793,3/8/2018,3/8/2018,1,3.518,1,2018-03-08,2018-03-08,0
20080141,1/18/2020,8/17/2019,7,90.792,5,2020-01-18,2019-08-17,-154
20080391,2/7/2020,2/7/2020,1,15.087,1,2020-02-07,2020-02-07,0
20081111,8/9/2019,8/9/2019,1,3.48,1,2019-08-09,2019-08-09,0
20082141,11/10/2019,9/8/2019,4,56.336999999999996,2,2019-11-10,2019-09-08,-63
2008421,5/31/2018,5/31/2018,1,6.453,1,2018-05-31,2018-05-31,0
20084501,10/10/2019,10/12/2019,3,74.89800000000001,3,2019-10-10,2019-10-12,2
20085151,12/27/2019,12/27/2019,1,4.113,1,2019-12-27,2019-12-27,0
2008601,1/26/2019,9/29/2019,19,68.717,5,2019-01-26,2019-09-29,246
20086541,11/7/2019,8/16/2019,2,17.153,2,2019-11-07,2019-08-16,-83
20087671,1/7/2020,9/6/2019,10,56.489000000000004,7,2020-01-07,2019-09-06,-123
20087681,11/15/2019,8/27/2019,6,42.172,2,2019-11-15,2019-08-27,-80
2009101,10/13/2018,11/8/2020,3,23.556,3,2018-10-13,2020-11-08,757
20093851,1/12/2020,9/4/2019,9,71.458,5,2020-01-12,2019-09-04,-130
200939,3/25/2017,5/21/2017,2,20.991999999999997,2,2017-03-25,2017-05-21,57
20094121,11/10/2019,11/10/2019,1,10.918,1,2019-11-10,2019-11-10,0
20094401,12/7/2019,12/7/2019,1,10.487,1,2019-12-07,2019-12-07,0
20096721,11/9/2019,11/9/2019,1,3.112,1,2019-11-09,2019-11-09,0
20097041,8/16/2019,8/16/2019,1,4.371,1,2019-08-16,2019-08-16,0
2009721,11/22/2018,11/22/2018,1,12.164,1,2018-11-22,2018-11-22,0
20097991,9/7/2020,9/7/2020,1,11.871,1,2020-09-07,2020-09-07,0
200981,3/20/2017,9/5/2017,4,49.544,1,2017-03-20,2017-09-05,169
20099161,1/20/2020,8/30/2019,15,154.889,5,2020-01-20,2019-08-30,-143
20101661,8/12/2019,8/12/2019,1,5.138,1,2019-08-12,2019-08-12,0
20101811,9/12/2019,9/12/2019,1,0.781,1,2019-09-12,2019-09-12,0
20102241,8/12/2019,8/12/2019,1,6.024,1,2019-08-12,2019-08-12,0
201025,3/13/2018,3/13/2018,1,6.521,1,2018-03-13,2018-03-13,0
20102711,11/12/2019,9/11/2019,2,10.519,2,2019-11-12,2019-09-11,-62
201033,11/29/2018,11/29/2018,1,5.276,1,2018-11-29,2018-11-29,0
2010331,5/25/2019,6/30/2018,2,14.655000000000001,2,2019-05-25,2018-06-30,-329
20103871,10/1/2019,9/15/2019,8,59.745,4,2019-10-01,2019-09-15,-16
201039,11/5/2017,6/29/2018,3,6.295,2,2017-11-05,2018-06-29,236
20104151,1/20/2020,9/8/2020,17,59.031,9,2020-01-20,2020-09-08,232
20104861,12/19/2019,2/1/2020,4,11.285,3,2019-12-19,2020-02-01,44
2010571,11/25/2019,11/25/2019,1,4.88,1,2019-11-25,2019-11-25,0
20105781,8/28/2019,8/28/2019,1,9.766,1,2019-08-28,2019-08-28,0
2010631,7/13/2019,7/13/2019,1,7.213,1,2019-07-13,2019-07-13,0
2010641,6/2/2018,6/2/2018,1,3.415,1,2018-06-02,2018-06-02,0
20106501,12/26/2019,12/26/2019,1,12.946,1,2019-12-26,2019-12-26,0
2010651,5/2/2018,5/2/2018,1,6.372,1,2018-05-02,2018-05-02,0
20106741,8/12/2019,8/12/2019,1,0.086,1,2019-08-12,2019-08-12,0
20106891,9/10/2019,9/10/2019,1,4.954,1,2019-09-10,2019-09-10,0
20106941,9/14/2019,9/14/2019,1,3.645,1,2019-09-14,2019-09-14,0
2010811,1/5/2020,6/14/2018,4,14.702,2,2020-01-05,2018-06-14,-570
201099,1/29/2018,4/25/2018,3,29.93,2,2018-01-29,2018-04-25,86
201113,6/11/2017,6/11/2017,1,33.718,1,2017-06-11,2017-06-11,0
20111821,8/15/2019,8/15/2019,1,3.239,1,2019-08-15,2019-08-15,0
20112871,10/19/2019,10/19/2019,1,6.045,1,2019-10-19,2019-10-19,0
20112881,8/17/2019,8/17/2019,1,7.018,1,2019-08-17,2019-08-17,0
201129,10/4/2019,10/4/2019,1,10.046,1,2019-10-04,2019-10-04,0
20113921,8/13/2019,8/13/2019,1,8.07,1,2019-08-13,2019-08-13,0
20114481,8/14/2019,8/14/2019,1,9.011,1,2019-08-14,2019-08-14,0
2011451,1/4/2020,6/26/2018,4,22.991,3,2020-01-04,2018-06-26,-557
20114861,8/1/2020,8/1/2020,1,3.074,1,2020-08-01,2020-08-01,0
2011711,12/28/2018,6/4/2019,7,37.04,6,2018-12-28,2019-06-04,158
20119861,1/19/2020,9/27/2020,18,652.75,1,2020-01-19,2020-09-27,252
201217,10/10/2016,8/29/2016,9,80.07785200000001,5,2016-10-10,2016-08-29,-42
20122071,8/19/2019,8/19/2019,1,8.751,1,2019-08-19,2019-08-19,0
20123231,12/18/2019,12/18/2019,1,15.528,1,2019-12-18,2019-12-18,0
2012351,6/28/2019,8/5/2018,5,23.193,4,2019-06-28,2018-08-05,-327
20125671,9/6/2019,9/6/2019,1,15.092,1,2019-09-06,2019-09-06,0
2012591,10/16/2018,10/16/2018,1,5.084,1,2018-10-16,2018-10-16,0
20127051,8/15/2019,8/15/2019,1,2.951,1,2019-08-15,2019-08-15,0
20127191,12/5/2019,2/18/2020,2,23.113,1,2019-12-05,2020-02-18,75
20127761,8/15/2019,8/15/2019,2,81.24,2,2019-08-15,2019-08-15,0
20128911,5/4/2020,7/4/2020,6,36.607,3,2020-05-04,2020-07-04,61
20128971,2/29/2020,2/29/2020,1,7.129,1,2020-02-29,2020-02-29,0
20129601,10/14/2019,9/9/2020,36,752.126,3,2019-10-14,2020-09-09,331
201307,10/20/2016,9/9/2016,2,27.407703,1,2016-10-20,2016-09-09,-41
20132601,8/16/2019,8/22/2019,2,18.955,2,2019-08-16,2019-08-22,6
20134611,1/10/2020,9/9/2020,254,1354.707,9,2020-01-10,2020-09-09,243
2013671,5/10/2018,7/5/2018,5,35.572,3,2018-05-10,2018-07-05,56
2013761,11/4/2019,11/4/2019,1,4.136,1,2019-11-04,2019-11-04,0
20138201,1/1/2020,2/29/2020,5,55.444,2,2020-01-01,2020-02-29,59
20139451,8/17/2019,8/17/2019,1,4.819,1,2019-08-17,2019-08-17,0
2014101,4/20/2018,6/6/2018,12,58.665,4,2018-04-20,2018-06-06,47
20144811,12/28/2019,9/22/2019,2,20.609,2,2019-12-28,2019-09-22,-97
20148031,10/20/2019,10/20/2019,1,4.317,1,2019-10-20,2019-10-20,0
20148181,9/3/2019,9/3/2019,1,4.649,1,2019-09-03,2019-09-03,0
20148601,1/28/2020,9/9/2019,32,184.679,5,2020-01-28,2019-09-09,-141
20148631,10/27/2020,11/3/2020,2,11.579,1,2020-10-27,2020-11-03,7
20148891,12/6/2019,12/6/2019,1,1.773,1,2019-12-06,2019-12-06,0
2014901,1/14/2019,7/26/2018,14,69.515,10,2019-01-14,2018-07-26,-172
20153141,1/7/2020,1/7/2020,1,6.558,1,2020-01-07,2020-01-07,0
201545,10/31/2018,10/31/2018,1,6.425,1,2018-10-31,2018-10-31,0
20154831,8/18/2019,8/31/2019,5,44.55,3,2019-08-18,2019-08-31,13
201559,1/27/2020,9/20/2018,16,113.471,9,2020-01-27,2018-09-20,-494
20156491,10/11/2019,10/4/2019,2,1.859,1,2019-10-11,2019-10-04,-7
2015991,12/31/2018,12/31/2018,1,11.639,1,2018-12-31,2018-12-31,0
20161691,1/16/2020,8/20/2019,7,22.046,3,2020-01-16,2019-08-20,-149
20162761,1/18/2020,9/16/2020,13,222.494,5,2020-01-18,2020-09-16,242
20163111,11/1/2019,11/1/2019,1,26.254,1,2019-11-01,2019-11-01,0
20166731,1/25/2020,11/24/2019,2,16.121000000000002,2,2020-01-25,2019-11-24,-62
20168671,10/18/2020,10/18/2020,1,5.996,1,2020-10-18,2020-10-18,0
201709,9/16/2019,9/16/2019,1,1.391,1,2019-09-16,2019-09-16,0
20171841,11/1/2019,11/1/2019,1,2.79,1,2019-11-01,2019-11-01,0
20173961,12/11/2019,12/11/2019,1,8.738,1,2019-12-11,2019-12-11,0
20174211,8/20/2019,8/20/2019,1,6.776,1,2019-08-20,2019-08-20,0
2017441,2/14/2019,2/14/2019,1,15.269,1,2019-02-14,2019-02-14,0
2017451,9/25/2019,9/25/2019,1,11.437,1,2019-09-25,2019-09-25,0
20174531,1/11/2020,1/11/2020,1,2.371,1,2020-01-11,2020-01-11,0
20176031,7/1/2020,7/1/2020,1,7.81,1,2020-07-01,2020-07-01,0
20178271,10/9/2019,8/26/2019,3,36.966,2,2019-10-09,2019-08-26,-44
20179801,1/2/2020,3/6/2020,5,59.217,3,2020-01-02,2020-03-06,64
201799,10/21/2018,4/15/2018,4,37.689,2,2018-10-21,2018-04-15,-189
2018061,1/17/2019,6/8/2019,15,243.045,4,2019-01-17,2019-06-08,142
20183021,2/15/2020,2/15/2020,1,3.01,1,2020-02-15,2020-02-15,0
20183101,10/17/2019,10/17/2019,1,6.336,1,2019-10-17,2019-10-17,0
20183191,1/23/2020,1/23/2020,1,13.129,1,2020-01-23,2020-01-23,0
20183541,1/13/2020,9/4/2019,43,818.355,8,2020-01-13,2019-09-04,-131
20185541,8/22/2019,8/22/2019,1,18.668,1,2019-08-22,2019-08-22,0
20185661,9/13/2019,9/13/2019,1,4.253,1,2019-09-13,2019-09-13,0
20189211,10/30/2020,10/30/2020,1,12.231,1,2020-10-30,2020-10-30,0
20190641,2/11/2020,2/11/2020,1,20.998,1,2020-02-11,2020-02-11,0
20190861,1/25/2020,9/4/2019,2,12.642999999999999,2,2020-01-25,2019-09-04,-143
20191341,1/13/2020,9/16/2020,74,1547.039,3,2020-01-13,2020-09-16,247
2019141,10/11/2020,9/6/2018,47,214.547,9,2020-10-11,2018-09-06,-766
20194261,12/22/2019,12/22/2019,1,8.852,1,2019-12-22,2019-12-22,0
20194371,11/27/2019,11/27/2019,1,6.68,1,2019-11-27,2019-11-27,0
201951,1/31/2020,2/5/2019,3,52.307,2,2020-01-31,2019-02-05,-360
201957,1/15/2019,9/9/2019,45,236.315,6,2019-01-15,2019-09-09,237
201963,1/22/2020,8/15/2017,70,1178.05,11,2020-01-22,2017-08-15,-890
20197141,10/30/2019,11/6/2019,5,174.552,1,2019-10-30,2019-11-06,7
20197451,11/1/2020,8/16/2020,5,20.83,3,2020-11-01,2020-08-16,-77
20197731,8/23/2019,8/23/2019,1,22.27,1,2019-08-23,2019-08-23,0
201987,1/15/2017,8/6/2016,28,112.086939,5,2017-01-15,2016-08-06,-162
201993,1/16/2020,9/7/2017,43,353.682007,19,2020-01-16,2017-09-07,-861
20201291,3/30/2020,8/24/2019,2,11.337,2,2020-03-30,2019-08-24,-219
20203161,7/14/2020,7/14/2020,1,8.807,1,2020-07-14,2020-07-14,0
2020341,5/2/2018,9/8/2019,2,21.429000000000002,2,2018-05-02,2019-09-08,494
2020411,1/11/2020,8/3/2019,20,468.479,6,2020-01-11,2019-08-03,-161
20204151,2/17/2020,2/17/2020,1,4.447,1,2020-02-17,2020-02-17,0
202045,1/11/2020,9/6/2019,52,263.359576,17,2020-01-11,2019-09-06,-127
20205971,7/2/2020,8/10/2020,3,18.127,1,2020-07-02,2020-08-10,39
20206651,10/20/2019,10/20/2019,1,8.132,1,2019-10-20,2019-10-20,0
2020811,9/7/2018,9/7/2018,1,1.797,1,2018-09-07,2018-09-07,0
20209131,2/22/2020,2/22/2020,1,1.487,1,2020-02-22,2020-02-22,0
202121,1/11/2019,9/9/2019,108,1722.919,20,2019-01-11,2019-09-09,241
20212711,8/25/2019,8/25/2019,1,8.056,1,2019-08-25,2019-08-25,0
20213211,1/11/2020,9/28/2019,42,407.054,5,2020-01-11,2019-09-28,-105
20213481,11/12/2020,8/25/2019,3,6.022,3,2020-11-12,2019-08-25,-445
2021361,12/27/2019,2/9/2020,2,15.638,2,2019-12-27,2020-02-09,44
20213801,11/18/2019,8/25/2019,2,6.839,2,2019-11-18,2019-08-25,-85
20214331,11/14/2019,11/14/2019,1,6.223,1,2019-11-14,2019-11-14,0
2021491,8/1/2019,8/1/2019,1,16.287,1,2019-08-01,2019-08-01,0
20215221,5/6/2020,5/6/2020,1,4.616,1,2020-05-06,2020-05-06,0
20215661,1/20/2020,9/29/2019,6,60.733999999999995,5,2020-01-20,2019-09-29,-113
20215791,1/10/2020,9/6/2019,103,626.694,3,2020-01-10,2019-09-06,-126
20216481,12/17/2019,12/17/2019,1,6.191,1,2019-12-17,2019-12-17,0
20218251,10/1/2019,10/28/2019,2,12.163,2,2019-10-01,2019-10-28,27
20219051,10/19/2019,10/19/2019,1,8.333,1,2019-10-19,2019-10-19,0
202191,3/18/2017,3/18/2017,1,9.838,1,2017-03-18,2017-03-18,0
2022091,8/6/2019,8/6/2019,1,3.267,1,2019-08-06,2019-08-06,0
20221091,1/18/2020,3/8/2020,15,152.038,4,2020-01-18,2020-03-08,50
20221281,8/26/2019,8/26/2019,1,13.467,1,2019-08-26,2019-08-26,0
20222721,11/6/2019,9/23/2019,3,18.814,2,2019-11-06,2019-09-23,-44
20224381,11/21/2020,8/13/2020,8,66.748,3,2020-11-21,2020-08-13,-100
20224441,1/31/2020,9/27/2019,22,124.836,6,2020-01-31,2019-09-27,-126
2022481,5/22/2018,5/22/2018,1,6.109,1,2018-05-22,2018-05-22,0
20224921,8/26/2019,8/26/2019,1,5.995,1,2019-08-26,2019-08-26,0
2022501,1/1/2019,7/9/2018,8,95.92,3,2019-01-01,2018-07-09,-176
20225521,11/24/2019,9/28/2019,2,16.491,2,2019-11-24,2019-09-28,-57
20225531,9/2/2019,9/2/2019,1,5.752,1,2019-09-02,2019-09-02,0
2022651,1/11/2019,9/5/2020,20,33.243,7,2019-01-11,2020-09-05,603
2022711,1/30/2020,1/30/2020,1,4.678,1,2020-01-30,2020-01-30,0
20227751,10/10/2019,11/15/2019,2,8.23,2,2019-10-10,2019-11-15,36
20228111,11/2/2019,7/25/2020,2,19.202,1,2019-11-02,2020-07-25,266
202285,3/7/2017,3/7/2017,1,11.709,1,2017-03-07,2017-03-07,0
2022911,8/15/2019,8/15/2019,1,9.732,1,2019-08-15,2019-08-15,0
20229301,1/1/2020,9/28/2019,30,857.544,5,2020-01-01,2019-09-28,-95
20230611,3/14/2020,3/14/2020,1,6.122,1,2020-03-14,2020-03-14,0
20231821,10/25/2019,9/19/2019,6,152.659,3,2019-10-25,2019-09-19,-36
20233011,10/4/2019,10/4/2019,1,11.596,1,2019-10-04,2019-10-04,0
20233051,1/9/2020,3/7/2020,3,13.265,2,2020-01-09,2020-03-07,58
20234021,2/10/2020,9/13/2019,2,12.135,2,2020-02-10,2019-09-13,-150
202359,1/29/2017,1/29/2017,1,6.618,1,2017-01-29,2017-01-29,0
20236751,1/13/2020,9/3/2019,7,133.809,1,2020-01-13,2019-09-03,-132
20237271,1/10/2020,9/6/2019,83,1801.027,10,2020-01-10,2019-09-06,-126
20238811,1/7/2020,9/26/2019,4,26.299,1,2020-01-07,2019-09-26,-103
20239851,1/31/2020,1/31/2020,1,17.373,1,2020-01-31,2020-01-31,0
202399,1/25/2019,8/3/2018,2,16.205,2,2019-01-25,2018-08-03,-175
2024201,1/1/2019,9/9/2019,432,1860.338,25,2019-01-01,2019-09-09,251
20244221,8/29/2019,9/10/2019,3,10.138,3,2019-08-29,2019-09-10,12
20245231,1/3/2020,3/5/2020,5,30.156,3,2020-01-03,2020-03-05,62
202463,3/7/2020,8/10/2019,3,13.749,2,2020-03-07,2019-08-10,-210
202477,6/11/2017,7/30/2017,5,48.678000000000004,3,2017-06-11,2017-07-30,49
20248181,8/29/2019,8/29/2019,1,7.176,1,2019-08-29,2019-08-29,0
20248381,1/22/2020,2/19/2020,3,25.647,1,2020-01-22,2020-02-19,28
20250291,11/17/2019,12/28/2019,3,9.804,2,2019-11-17,2019-12-28,41
20250531,10/24/2019,10/24/2019,1,7.638,1,2019-10-24,2019-10-24,0
20252601,10/18/2019,9/13/2019,5,9.764,3,2019-10-18,2019-09-13,-35
2025291,11/14/2020,9/19/2020,4,36.425,2,2020-11-14,2020-09-19,-56
20253271,10/30/2019,10/30/2019,1,5.605,1,2019-10-30,2019-10-30,0
20253461,11/10/2019,11/10/2019,1,6.357,1,2019-11-10,2019-11-10,0
20255661,9/16/2019,9/16/2019,1,14.847,1,2019-09-16,2019-09-16,0
20258041,1/10/2020,9/2/2019,3,34.876000000000005,2,2020-01-10,2019-09-02,-130
20258381,10/19/2019,12/26/2019,5,26.606,3,2019-10-19,2019-12-26,68
202589,4/2/2019,4/2/2019,1,4.923,1,2019-04-02,2019-04-02,0
2026311,8/29/2019,8/29/2019,1,7.298,1,2019-08-29,2019-08-29,0
20263151,10/24/2019,10/24/2019,1,10.051,1,2019-10-24,2019-10-24,0
20265041,10/28/2019,10/28/2019,1,18.664,1,2019-10-28,2019-10-28,0
20266141,9/8/2019,9/8/2019,1,3.671,1,2019-09-08,2019-09-08,0
20266671,10/14/2019,9/26/2019,4,51.348,2,2019-10-14,2019-09-26,-18
20267621,9/21/2019,9/21/2019,1,6.271,1,2019-09-21,2019-09-21,0
202687,1/9/2020,1/9/2020,1,1.361,1,2020-01-09,2020-01-09,0
202729,12/1/2017,5/7/2017,3,25.172,2,2017-12-01,2017-05-07,-208
2027401,11/17/2018,8/24/2019,15,58.124,5,2018-11-17,2019-08-24,280
202751,4/22/2019,8/29/2019,2,26.915999999999997,2,2019-04-22,2019-08-29,129
20276021,1/5/2020,1/5/2020,1,9.158,1,2020-01-05,2020-01-05,0
2027661,1/17/2020,1/17/2020,1,1.469,1,2020-01-17,2020-01-17,0
2027911,5/27/2018,5/27/2018,1,1.611,1,2018-05-27,2018-05-27,0
20279191,12/30/2019,12/30/2019,1,8.164,1,2019-12-30,2019-12-30,0
2028151,6/30/2019,8/4/2018,3,17.513,2,2019-06-30,2018-08-04,-330
202823,1/31/2018,9/18/2020,13,98.55799999999999,5,2018-01-31,2020-09-18,961
20283051,1/10/2020,9/7/2020,29,325.555,5,2020-01-10,2020-09-07,241
20286991,9/4/2019,9/6/2019,2,54.665,2,2019-09-04,2019-09-06,2
20288101,9/10/2019,9/10/2019,1,6.86,1,2019-09-10,2019-09-10,0
20288491,11/30/2019,11/30/2019,1,6.311,1,2019-11-30,2019-11-30,0
20289001,11/9/2019,11/9/2019,1,3.682,1,2019-11-09,2019-11-09,0
202901,3/3/2017,8/20/2016,2,23.543945,2,2017-03-03,2016-08-20,-195
20290221,9/15/2019,9/15/2019,1,0.791,1,2019-09-15,2019-09-15,0
20291131,11/24/2019,11/24/2019,1,4.549,1,2019-11-24,2019-11-24,0
2029121,1/20/2019,7/26/2019,23,96.414,7,2019-01-20,2019-07-26,187
202939,10/26/2016,8/18/2016,3,11.394174,3,2016-10-26,2016-08-18,-69
20294241,9/24/2019,9/25/2019,2,3.5700000000000003,1,2019-09-24,2019-09-25,1
20295361,11/21/2019,12/3/2019,2,25.573,2,2019-11-21,2019-12-03,12
2029561,11/27/2018,8/12/2018,3,17.357,3,2018-11-27,2018-08-12,-107
20296011,9/28/2019,9/28/2019,1,13.063,1,2019-09-28,2019-09-28,0
2029771,5/17/2019,5/17/2019,1,6.778,1,2019-05-17,2019-05-17,0
202997,8/26/2017,8/26/2017,1,1.954,1,2017-08-26,2017-08-26,0
20299891,9/4/2019,9/4/2019,1,2.226,1,2019-09-04,2019-09-04,0
2030051,12/14/2018,12/14/2018,1,12.505,1,2018-12-14,2018-12-14,0
20303481,10/24/2019,10/24/2019,1,3.345,1,2019-10-24,2019-10-24,0
20303501,9/20/2019,9/20/2019,1,8.866,1,2019-09-20,2019-09-20,0
203053,3/13/2018,3/13/2018,1,4.01,1,2018-03-13,2018-03-13,0
2030621,12/29/2018,6/4/2018,3,16.724,1,2018-12-29,2018-06-04,-208
20306461,1/12/2020,11/25/2019,2,8.734,2,2020-01-12,2019-11-25,-48
20306521,4/1/2020,4/6/2020,2,22.201,2,2020-04-01,2020-04-06,5
20306961,9/5/2019,9/5/2019,1,12.964,1,2019-09-05,2019-09-05,0
2030791,1/22/2019,1/22/2019,1,8.092,1,2019-01-22,2019-01-22,0
203091,3/7/2019,3/7/2019,1,11.733,1,2019-03-07,2019-03-07,0
203103,1/16/2018,1/16/2018,1,0.791,1,2018-01-16,2018-01-16,0
20312121,9/14/2019,9/14/2019,1,0.756,1,2019-09-14,2019-09-14,0
20313,1/3/2017,2/6/2017,9,35.932384,3,2017-01-03,2017-02-06,34
20313391,9/6/2019,9/6/2019,1,11.769,1,2019-09-06,2019-09-06,0
2031521,6/15/2018,6/15/2018,1,4.044,1,2018-06-15,2018-06-15,0
20316301,11/13/2019,11/13/2019,1,13.322,1,2019-11-13,2019-11-13,0
20317201,1/22/2020,9/29/2019,29,153.061,10,2020-01-22,2019-09-29,-115
2031901,6/18/2019,8/5/2019,2,7.461,2,2019-06-18,2019-08-05,48
20319381,9/8/2019,9/8/2019,1,4.222,1,2019-09-08,2019-09-08,0
203201,1/7/2017,1/7/2017,1,8.362,1,2017-01-07,2017-01-07,0
2032071,8/3/2018,8/3/2018,1,1.096,1,2018-08-03,2018-08-03,0
203239,1/13/2019,7/22/2018,25,185.457,8,2019-01-13,2018-07-22,-175
203245,11/12/2016,11/12/2016,1,13.792,1,2016-11-12,2016-11-12,0
20325751,9/7/2019,9/7/2019,1,1.975,1,2019-09-07,2019-09-07,0
203273,10/13/2019,9/9/2017,22,172.279,8,2019-10-13,2017-09-09,-764
2033111,12/24/2019,3/16/2019,3,8.448,1,2019-12-24,2019-03-16,-283
20331381,9/10/2019,9/10/2019,1,3.72,1,2019-09-10,2019-09-10,0
20331441,7/10/2020,7/6/2020,3,21.796,2,2020-07-10,2020-07-06,-4
203315,1/11/2017,1/22/2018,3,16.618,3,2017-01-11,2018-01-22,376
20332601,2/8/2020,2/8/2020,1,9.268,1,2020-02-08,2020-02-08,0
2033331,8/12/2018,8/12/2018,1,6.165,1,2018-08-12,2018-08-12,0
2033381,1/26/2019,9/28/2018,6,23.889,3,2019-01-26,2018-09-28,-120
20334821,12/15/2019,12/15/2019,1,5.913,1,2019-12-15,2019-12-15,0
2033521,6/20/2018,6/20/2018,1,0.01,1,2018-06-20,2018-06-20,0
20335891,9/9/2019,9/9/2019,1,6.412,1,2019-09-09,2019-09-09,0
2033641,4/23/2019,6/28/2019,3,23.483,1,2019-04-23,2019-06-28,66
20336501,11/26/2019,11/26/2019,1,6.732,1,2019-11-26,2019-11-26,0
20337071,7/2/2020,7/2/2020,1,1.71,1,2020-07-02,2020-07-02,0
2033781,1/2/2019,1/2/2019,1,11.147,1,2019-01-02,2019-01-02,0
2033821,12/19/2019,9/7/2018,7,70.425,4,2019-12-19,2018-09-07,-468
20338461,10/15/2019,9/28/2019,9,47.584,3,2019-10-15,2019-09-28,-17
20338471,3/8/2020,3/8/2020,1,8.748,1,2020-03-08,2020-03-08,0
20338661,12/4/2019,12/4/2019,1,10.303,1,2019-12-04,2019-12-04,0
20339091,1/30/2020,1/30/2020,2,15.645,2,2020-01-30,2020-01-30,0
203393,5/15/2017,5/15/2017,1,2.575,1,2017-05-15,2017-05-15,0
20339621,11/16/2019,11/16/2019,1,5.817,1,2019-11-16,2019-11-16,0
20340741,1/2/2020,3/1/2020,3,12.782,2,2020-01-02,2020-03-01,59
20342401,9/10/2019,9/10/2019,1,22.673,1,2019-09-10,2019-09-10,0
20343651,1/13/2020,1/13/2020,1,11.105,1,2020-01-13,2020-01-13,0
2034491,6/22/2018,9/29/2018,6,29.064,3,2018-06-22,2018-09-29,99
20346001,12/1/2019,12/1/2019,1,2.698,1,2019-12-01,2019-12-01,0
203465,10/11/2016,9/7/2016,31,236.964262,5,2016-10-11,2016-09-07,-34
2034651,1/16/2020,1/16/2020,1,3.483,1,2020-01-16,2020-01-16,0
203471,9/1/2019,9/1/2019,1,6.479,1,2019-09-01,2019-09-01,0
2034731,7/27/2018,9/20/2018,2,19.65,2,2018-07-27,2018-09-20,55
20348141,7/25/2020,9/14/2019,3,22.330000000000002,3,2020-07-25,2019-09-14,-315
2034851,12/12/2018,6/18/2019,2,7.983,2,2018-12-12,2019-06-18,188
2034871,9/18/2018,9/18/2018,1,7.851,1,2018-09-18,2018-09-18,0
203489,1/14/2017,9/26/2018,11,12.179,4,2017-01-14,2018-09-26,620
2035291,2/21/2020,2/29/2020,2,8.533,2,2020-02-21,2020-02-29,8
20354091,12/27/2019,12/27/2019,1,2.421,1,2019-12-27,2019-12-27,0
2035451,10/5/2020,9/9/2019,14,195.32,3,2020-10-05,2019-09-09,-392
20354681,9/23/2020,9/23/2020,1,32.03,1,2020-09-23,2020-09-23,0
2035631,1/2/2019,9/21/2018,46,818.208,7,2019-01-02,2018-09-21,-103
2035791,10/21/2019,10/27/2019,2,13.940999999999999,2,2019-10-21,2019-10-27,6
2035861,3/11/2020,3/11/2020,1,14.719,1,2020-03-11,2020-03-11,0
203587,3/27/2017,3/27/2017,1,3.307,1,2017-03-27,2017-03-27,0
20359181,1/8/2020,12/11/2019,2,27.759999999999998,1,2020-01-08,2019-12-11,-28
203595,10/10/2016,9/9/2016,64,539.921711,6,2016-10-10,2016-09-09,-31
203603,10/10/2016,9/29/2016,33,149.56494,2,2016-10-10,2016-09-29,-11
203607,10/10/2018,9/7/2018,25,87.453,3,2018-10-10,2018-09-07,-33
20361531,10/17/2019,10/17/2019,1,10.368,1,2019-10-17,2019-10-17,0
203617,7/17/2019,7/17/2019,1,4.651,1,2019-07-17,2019-07-17,0
203625,5/4/2019,5/4/2019,1,7.499,1,2019-05-04,2019-05-04,0
20362581,10/1/2019,9/18/2019,9,107.628,3,2019-10-01,2019-09-18,-13
2036331,11/17/2019,9/7/2019,2,23.847,2,2019-11-17,2019-09-07,-71
2036421,4/24/2018,6/19/2018,2,28.003,1,2018-04-24,2018-06-19,56
20365311,1/14/2020,2/4/2020,5,55.459,3,2020-01-14,2020-02-04,21
20367261,9/13/2019,9/13/2019,1,10.919,1,2019-09-13,2019-09-13,0
20368251,10/8/2019,10/8/2019,1,5.641,1,2019-10-08,2019-10-08,0
20368321,2/13/2020,2/13/2020,1,1.344,1,2020-02-13,2020-02-13,0
20368981,10/16/2019,9/18/2019,4,19.439,4,2019-10-16,2019-09-18,-28
2036991,6/25/2020,6/25/2020,1,5.729,1,2020-06-25,2020-06-25,0
2037001,5/22/2019,5/22/2019,1,6.249,1,2019-05-22,2019-05-22,0
203705,1/11/2017,9/9/2019,94,1287.002964,6,2017-01-11,2019-09-09,971
20371121,9/13/2019,9/13/2019,1,15.353,1,2019-09-13,2019-09-13,0
2037501,9/11/2018,9/11/2018,1,10.411,1,2018-09-11,2018-09-11,0
2037511,10/15/2018,9/19/2018,21,232.479,8,2018-10-15,2018-09-19,-26
20377381,11/13/2019,9/20/2019,4,7.979,3,2019-11-13,2019-09-20,-54
20378221,9/22/2019,9/22/2019,1,2.461,1,2019-09-22,2019-09-22,0
20379271,12/21/2019,12/21/2019,1,7.621,1,2019-12-21,2019-12-21,0
20379421,2/22/2020,9/14/2019,2,12.405000000000001,2,2020-02-22,2019-09-14,-161
20380621,9/16/2019,9/16/2019,1,1.317,1,2019-09-16,2019-09-16,0
2038221,11/15/2018,6/4/2018,2,6.715,2,2018-11-15,2018-06-04,-164
20383641,9/7/2020,9/7/2020,1,17.77,1,2020-09-07,2020-09-07,0
203891,9/14/2019,9/14/2019,1,8.336,1,2019-09-14,2019-09-14,0
20389411,10/11/2019,10/11/2019,1,7.625,1,2019-10-11,2019-10-11,0
2039091,1/5/2019,9/8/2019,21,98.363,7,2019-01-05,2019-09-08,246
20391901,1/2/2020,9/30/2019,44,336.717,7,2020-01-02,2019-09-30,-94
203923,5/25/2017,8/24/2017,3,41.826,2,2017-05-25,2017-08-24,91
2039251,5/10/2019,5/10/2019,1,3.612,1,2019-05-10,2019-05-10,0
20392571,2/26/2020,3/11/2020,2,11.309,2,2020-02-26,2020-03-11,14
20393171,8/26/2020,8/26/2020,1,4.059,1,2020-08-26,2020-08-26,0
20394611,1/19/2020,9/30/2019,18,59.458,9,2020-01-19,2019-09-30,-111
2039511,5/31/2018,5/31/2018,1,4.283,1,2018-05-31,2018-05-31,0
20395171,7/26/2020,7/26/2020,1,1.317,1,2020-07-26,2020-07-26,0
20396101,3/7/2020,3/7/2020,1,5.116,1,2020-03-07,2020-03-07,0
20398651,1/17/2020,1/17/2020,1,20.79,1,2020-01-17,2020-01-17,0
20399451,10/11/2020,9/19/2020,13,147.933,4,2020-10-11,2020-09-19,-22
2040011,7/28/2018,7/28/2018,1,6.676,1,2018-07-28,2018-07-28,0
204039,11/22/2016,3/8/2018,2,5.898,2,2016-11-22,2018-03-08,471
204055,7/8/2017,7/8/2017,1,0.054,1,2017-07-08,2017-07-08,0
2041001,3/19/2019,8/21/2018,2,22.788,2,2019-03-19,2018-08-21,-210
20410851,11/4/2019,11/4/2019,1,2.243,1,2019-11-04,2019-11-04,0
204117,1/2/2017,9/2/2016,10,47.168207,6,2017-01-02,2016-09-02,-122
2041181,6/19/2020,6/20/2020,2,9.431,1,2020-06-19,2020-06-20,1
2041221,11/30/2018,11/30/2018,1,11.518,1,2018-11-30,2018-11-30,0
20412311,12/5/2019,12/5/2019,1,6.564,1,2019-12-05,2019-12-05,0
2041281,4/25/2018,4/25/2018,1,2.351,1,2018-04-25,2018-04-25,0
20414331,10/1/2019,9/27/2019,4,83.149,2,2019-10-01,2019-09-27,-4
20414861,10/13/2019,10/6/2019,2,13.075,2,2019-10-13,2019-10-06,-7
2041491,5/5/2018,5/5/2018,1,13.287,1,2018-05-05,2018-05-05,0
20415231,1/8/2020,1/8/2020,1,8.717,1,2020-01-08,2020-01-08,0
2041541,1/10/2019,9/8/2018,98,553.772,16,2019-01-10,2018-09-08,-124
20415871,10/21/2019,10/21/2019,1,10.803,1,2019-10-21,2019-10-21,0
20416001,9/28/2019,9/28/2019,1,4.624,1,2019-09-28,2019-09-28,0
20416571,10/1/2019,10/1/2019,1,1.599,1,2019-10-01,2019-10-01,0
20416831,11/14/2019,3/13/2020,6,91.366,2,2019-11-14,2020-03-13,120
204169,1/20/2018,8/19/2016,3,13.585702000000001,2,2018-01-20,2016-08-19,-519
20417981,9/20/2019,9/20/2019,1,11.788,1,2019-09-20,2019-09-20,0
20419851,1/10/2020,2/4/2020,9,19.431,5,2020-01-10,2020-02-04,25
20420081,10/10/2020,10/10/2020,1,22.437,1,2020-10-10,2020-10-10,0
20422111,10/18/2019,10/18/2019,1,14.329,1,2019-10-18,2019-10-18,0
20423111,2/22/2020,2/22/2020,1,6.653,1,2020-02-22,2020-02-22,0
2042581,5/14/2018,7/13/2018,10,132.362,2,2018-05-14,2018-07-13,60
20426521,9/20/2019,9/20/2019,1,8.089,1,2019-09-20,2019-09-20,0
20426791,11/18/2019,11/18/2019,1,14.548,1,2019-11-18,2019-11-18,0
2042701,8/20/2018,8/20/2018,1,6.294,1,2018-08-20,2018-08-20,0
20427251,6/9/2020,6/9/2020,1,2.117,1,2020-06-09,2020-06-09,0
20427641,9/28/2019,9/28/2019,1,11.926,1,2019-09-28,2019-09-28,0
20430091,12/7/2019,9/15/2020,2,7.073,2,2019-12-07,2020-09-15,283
20430891,9/21/2019,9/21/2019,1,3.561,1,2019-09-21,2019-09-21,0
20431391,1/29/2020,11/17/2019,2,9.367999999999999,1,2020-01-29,2019-11-17,-73
20433061,1/23/2020,11/6/2019,3,5.838,3,2020-01-23,2019-11-06,-78
20433681,10/24/2020,7/11/2020,2,10.748000000000001,1,2020-10-24,2020-07-11,-105
20434081,11/6/2019,11/6/2019,1,6.73,1,2019-11-06,2019-11-06,0
204351,1/18/2017,1/18/2017,1,0.01,1,2017-01-18,2017-01-18,0
204361,9/24/2016,9/24/2016,1,14.094393,1,2016-09-24,2016-09-24,0
204363,1/11/2019,9/9/2020,227,593.717539,18,2019-01-11,2020-09-09,607
204365,10/4/2018,10/4/2018,1,2.979,1,2018-10-04,2018-10-04,0
2043701,6/16/2019,6/16/2019,1,14.847,1,2019-06-16,2019-06-16,0
2043721,1/17/2019,9/29/2019,5,21.526,4,2019-01-17,2019-09-29,255
20437251,2/6/2020,2/6/2020,1,5.068,1,2020-02-06,2020-02-06,0
20437971,9/18/2020,9/18/2020,1,4.441,1,2020-09-18,2020-09-18,0
204393,9/19/2020,9/19/2020,1,4.546,1,2020-09-19,2020-09-19,0
204403,7/3/2019,7/3/2019,1,4.92,1,2019-07-03,2019-07-03,0
20440911,2/19/2020,2/19/2020,1,7.002,1,2020-02-19,2020-02-19,0
20441321,11/16/2019,11/16/2019,1,5.299,1,2019-11-16,2019-11-16,0
2044221,10/2/2018,10/2/2018,1,1.928,1,2018-10-02,2018-10-02,0
20442741,10/18/2019,10/18/2019,1,2.314,1,2019-10-18,2019-10-18,0
20445741,10/2/2019,9/23/2019,2,68.276,1,2019-10-02,2019-09-23,-9
204459,1/23/2019,8/21/2019,2,6.269,2,2019-01-23,2019-08-21,210
2044591,10/9/2019,9/6/2018,4,42.079,3,2019-10-09,2018-09-06,-398
20446061,10/18/2019,2/8/2020,8,80.032,8,2019-10-18,2020-02-08,113
20446281,7/14/2020,7/14/2020,1,7.328,1,2020-07-14,2020-07-14,0
20446811,1/10/2020,9/23/2019,49,585.803,4,2020-01-10,2019-09-23,-109
204473,2/26/2017,5/7/2017,2,4.466,1,2017-02-26,2017-05-07,70
20448701,11/25/2019,12/22/2019,5,180.287,2,2019-11-25,2019-12-22,27
20448711,1/11/2020,1/11/2020,1,6.19,1,2020-01-11,2020-01-11,0
20450491,1/20/2020,2/1/2020,5,16.273,3,2020-01-20,2020-02-01,12
20452491,10/11/2019,9/27/2019,10,257.755,4,2019-10-11,2019-09-27,-14
20453561,1/31/2020,2/25/2020,4,69.66,2,2020-01-31,2020-02-25,25
204549,10/19/2018,10/19/2018,1,6.638,1,2018-10-19,2018-10-19,0
20456021,11/7/2019,9/26/2019,4,72.461,2,2019-11-07,2019-09-26,-42
20456121,2/1/2020,2/1/2020,1,0.613,1,2020-02-01,2020-02-01,0
20458681,10/1/2020,10/1/2020,1,1.436,1,2020-10-01,2020-10-01,0
20458851,3/1/2020,3/1/2020,1,9.234,1,2020-03-01,2020-03-01,0
20458991,10/18/2020,10/18/2020,1,3.49,1,2020-10-18,2020-10-18,0
20459311,10/27/2019,10/27/2019,1,13.897,1,2019-10-27,2019-10-27,0
20459461,11/8/2019,11/8/2019,1,10.545,1,2019-11-08,2019-11-08,0
204629,10/22/2019,9/9/2019,18,104.226,7,2019-10-22,2019-09-09,-43
20463041,9/28/2019,9/29/2019,2,16.241,2,2019-09-28,2019-09-29,1
20464051,12/16/2019,12/2/2019,2,13.346,2,2019-12-16,2019-12-02,-14
2046451,1/17/2020,3/28/2019,2,9.879999999999999,2,2020-01-17,2019-03-28,-295
2046541,3/20/2019,3/20/2019,1,6.422,1,2019-03-20,2019-03-20,0
20466291,9/25/2019,9/25/2019,1,11.869,1,2019-09-25,2019-09-25,0
204671,2/3/2017,2/3/2017,1,8.358,1,2017-02-03,2017-02-03,0
20467851,10/13/2019,9/29/2019,5,119.86,3,2019-10-13,2019-09-29,-14
20468211,11/21/2019,11/21/2019,1,12.606,1,2019-11-21,2019-11-21,0
204699,10/26/2019,7/26/2018,15,141.026,11,2019-10-26,2018-07-26,-457
204707,7/2/2017,7/2/2017,1,2.234,1,2017-07-02,2017-07-02,0
20471221,2/23/2020,2/23/2020,1,6.301,1,2020-02-23,2020-02-23,0
20472271,9/25/2019,9/25/2019,1,3.778,1,2019-09-25,2019-09-25,0
20472661,2/5/2020,2/5/2020,1,1.07,1,2020-02-05,2020-02-05,0
20475011,10/12/2019,10/12/2019,1,6.27,1,2019-10-12,2019-10-12,0
2047521,10/15/2019,5/28/2019,4,36.748,4,2019-10-15,2019-05-28,-140
20476031,12/4/2019,12/4/2019,1,21.148,1,2019-12-04,2019-12-04,0
204763,3/14/2017,3/14/2017,1,4.517,1,2017-03-14,2017-03-14,0
2047771,2/4/2020,2/4/2020,1,11.258,1,2020-02-04,2020-02-04,0
2048321,4/28/2018,4/28/2018,1,18.015,1,2018-04-28,2018-04-28,0
20486441,2/11/2020,2/11/2020,1,15.334,1,2020-02-11,2020-02-11,0
20486821,9/27/2019,9/27/2019,1,7.658,1,2019-09-27,2019-09-27,0
20486921,1/31/2020,10/31/2019,2,12.133,2,2020-01-31,2019-10-31,-92
2048811,3/1/2019,8/8/2019,22,136.819,7,2019-03-01,2019-08-08,160
204895,1/13/2017,1/13/2017,1,5.48,1,2017-01-13,2017-01-13,0
20490171,11/1/2020,9/27/2019,2,18.811,2,2020-11-01,2019-09-27,-401
20491811,2/26/2020,2/4/2020,2,21.109,2,2020-02-26,2020-02-04,-22
2049301,10/16/2018,10/24/2019,2,31.331000000000003,2,2018-10-16,2019-10-24,373
20493511,1/14/2020,10/3/2019,3,13.583,2,2020-01-14,2019-10-03,-103
20494441,11/8/2019,11/8/2019,1,17.87,1,2019-11-08,2019-11-08,0
20496301,10/24/2019,10/24/2019,1,5.251,1,2019-10-24,2019-10-24,0
20497711,10/24/2019,10/24/2019,1,6.395,1,2019-10-24,2019-10-24,0
204979,10/7/2017,8/6/2017,4,17.149,1,2017-10-07,2017-08-06,-62
2049871,1/27/2020,2/6/2020,4,48.081,4,2020-01-27,2020-02-06,10
20501251,10/3/2019,10/3/2019,1,5.232,1,2019-10-03,2019-10-03,0
20501521,10/10/2019,10/10/2019,1,10.999,1,2019-10-10,2019-10-10,0
20504101,2/25/2020,2/25/2020,1,1.233,1,2020-02-25,2020-02-25,0
205045,8/15/2019,8/15/2019,1,3.058,1,2019-08-15,2019-08-15,0
20504651,1/13/2020,9/8/2020,71,1425.901,10,2020-01-13,2020-09-08,239
20505541,1/17/2020,12/9/2019,21,132.365,6,2020-01-17,2019-12-09,-39
20506261,11/15/2019,11/15/2019,1,6.815,1,2019-11-15,2019-11-15,0
20506341,1/12/2020,12/8/2019,4,22.264,3,2020-01-12,2019-12-08,-35
20509021,9/29/2019,9/29/2019,1,3.2110000000000003,1,2019-09-29,2019-09-29,0
205105,11/21/2016,11/21/2016,1,5.71,1,2016-11-21,2016-11-21,0
2051321,10/25/2019,9/6/2019,3,16.691,2,2019-10-25,2019-09-06,-49
2051361,6/1/2019,6/2/2019,2,26.774,2,2019-06-01,2019-06-02,1
20514601,1/14/2020,3/6/2020,22,436.91700000000003,7,2020-01-14,2020-03-06,52
205147,7/15/2019,7/15/2019,1,5.431,1,2019-07-15,2019-07-15,0
2051491,1/15/2020,8/11/2018,6,94.336,5,2020-01-15,2018-08-11,-522
20515381,11/3/2019,11/3/2019,1,3.016,1,2019-11-03,2019-11-03,0
20515941,12/10/2019,12/10/2019,1,2.253,1,2019-12-10,2019-12-10,0
20518511,5/18/2020,5/18/2020,1,54.822,1,2020-05-18,2020-05-18,0
20519221,11/3/2019,11/3/2019,1,7.153,1,2019-11-03,2019-11-03,0
20519321,9/30/2019,9/30/2019,1,9.305000000000001,1,2019-09-30,2019-09-30,0
20520061,5/17/2020,6/11/2020,2,12.19,2,2020-05-17,2020-06-11,25
20520871,1/4/2020,1/4/2020,1,6.739,1,2020-01-04,2020-01-04,0
20521091,12/2/2019,3/3/2020,2,14.341,2,2019-12-02,2020-03-03,92
20521891,10/19/2019,11/22/2019,2,11.882,2,2019-10-19,2019-11-22,34
20522181,12/26/2019,12/26/2019,1,1.146,1,2019-12-26,2019-12-26,0
20522301,5/2/2020,8/16/2020,3,21.483999999999998,2,2020-05-02,2020-08-16,106
20522621,8/19/2020,8/19/2020,1,2.746,1,2020-08-19,2020-08-19,0
205229,12/21/2016,7/23/2017,3,23.183,2,2016-12-21,2017-07-23,214
20523,2/1/2020,5/3/2019,2,15.786999999999999,2,2020-02-01,2019-05-03,-274
20523211,10/3/2019,10/3/2019,1,4.545,1,2019-10-03,2019-10-03,0
20524571,11/18/2019,12/22/2019,2,13.785,2,2019-11-18,2019-12-22,34
205247,8/10/2017,8/10/2017,1,15.753,1,2017-08-10,2017-08-10,0
20525511,2/7/2020,2/7/2020,1,9.7,1,2020-02-07,2020-02-07,0
2052611,1/29/2020,8/18/2018,4,32.253,4,2020-01-29,2018-08-18,-529
20526761,1/29/2020,1/29/2020,1,4.234,1,2020-01-29,2020-01-29,0
20527381,10/20/2019,2/3/2020,12,110.601,6,2019-10-20,2020-02-03,106
20527801,11/5/2019,11/5/2019,1,1.702,1,2019-11-05,2019-11-05,0
2052781,6/14/2018,7/20/2019,2,8.822000000000001,2,2018-06-14,2019-07-20,401
2052791,11/10/2018,11/10/2018,1,3.818,1,2018-11-10,2018-11-10,0
20527981,10/1/2019,10/1/2019,1,9.98,1,2019-10-01,2019-10-01,0
20529181,1/26/2020,2/29/2020,3,17.611,3,2020-01-26,2020-02-29,34
20531911,10/2/2019,10/2/2019,1,2.457,1,2019-10-02,2019-10-02,0
20532991,10/7/2019,10/9/2019,2,4.809,1,2019-10-07,2019-10-09,2
20533001,10/31/2019,10/31/2019,1,0.197,1,2019-10-31,2019-10-31,0
20533221,10/7/2019,10/7/2019,1,3.19,1,2019-10-07,2019-10-07,0
20534581,1/5/2020,1/5/2020,1,0.597,1,2020-01-05,2020-01-05,0
2053551,10/10/2018,9/29/2018,10,34.193,4,2018-10-10,2018-09-29,-11
20535561,10/16/2019,10/9/2019,5,26.748,3,2019-10-16,2019-10-09,-7
20535691,10/2/2019,10/2/2019,1,16.608,1,2019-10-02,2019-10-02,0
20535931,1/26/2020,2/22/2020,2,7.875,2,2020-01-26,2020-02-22,27
20538221,11/29/2019,11/29/2019,1,0.844,1,2019-11-29,2019-11-29,0
20540901,11/1/2019,11/1/2019,1,4.599,1,2019-11-01,2019-11-01,0
20541761,7/26/2020,7/26/2020,1,5.204,1,2020-07-26,2020-07-26,0
205425,7/18/2017,7/18/2017,1,7.505,1,2017-07-18,2017-07-18,0
20544671,1/11/2020,3/16/2020,3,22.703,3,2020-01-11,2020-03-16,65
205457,1/20/2017,9/22/2016,68,484.722226,5,2017-01-20,2016-09-22,-120
205477,4/15/2017,9/18/2016,3,24.62723,2,2017-04-15,2016-09-18,-209
205481,1/17/2019,9/9/2018,68,2615.143,9,2019-01-17,2018-09-09,-130
205493,2/7/2019,9/24/2019,6,27.783,4,2019-02-07,2019-09-24,229
2054961,10/11/2019,10/11/2019,1,3.081,1,2019-10-11,2019-10-11,0
20551991,10/11/2019,10/4/2019,2,41.782,2,2019-10-11,2019-10-04,-7
20552631,1/2/2020,2/22/2020,8,104.964,3,2020-01-02,2020-02-22,51
20553051,12/26/2020,12/8/2019,2,4.045,2,2020-12-26,2019-12-08,-384
20555991,10/31/2019,10/31/2019,1,7.15,1,2019-10-31,2019-10-31,0
20557631,10/12/2019,10/12/2019,1,7.436,1,2019-10-12,2019-10-12,0
20557691,10/4/2019,10/4/2019,1,6.364,1,2019-10-04,2019-10-04,0
20558961,1/12/2020,1/12/2020,1,8.144,1,2020-01-12,2020-01-12,0
20562921,2/3/2020,2/3/2020,1,18.506,1,2020-02-03,2020-02-03,0
2056301,12/27/2018,5/23/2018,3,32.665,3,2018-12-27,2018-05-23,-218
20564021,10/12/2019,10/12/2019,1,6.962,1,2019-10-12,2019-10-12,0
20564121,2/15/2020,2/15/2020,1,7.001,1,2020-02-15,2020-02-15,0
20564561,12/17/2019,2/4/2020,2,12.151,2,2019-12-17,2020-02-04,49
20565591,1/17/2020,10/25/2019,3,19.433,2,2020-01-17,2019-10-25,-84
2056661,3/24/2019,3/24/2019,1,3.942,1,2019-03-24,2019-03-24,0
205669,1/16/2019,12/23/2018,2,6.207,2,2019-01-16,2018-12-23,-24
20567771,1/21/2020,4/28/2020,2,16.147,1,2020-01-21,2020-04-28,98
205691,9/23/2019,9/23/2019,1,16.5,1,2019-09-23,2019-09-23,0
205713,3/28/2017,3/28/2017,1,7.868,1,2017-03-28,2017-03-28,0
20572881,11/1/2019,9/18/2020,6,56.049,4,2019-11-01,2020-09-18,322
20573291,10/16/2020,7/4/2020,34,318.691,12,2020-10-16,2020-07-04,-104
20574631,11/17/2019,12/2/2019,2,24.569,1,2019-11-17,2019-12-02,15
20575651,8/18/2020,8/18/2020,1,7.616,1,2020-08-18,2020-08-18,0
20577471,2/11/2020,2/11/2020,1,2.814,1,2020-02-11,2020-02-11,0
20577551,1/27/2020,1/27/2020,1,0.244,1,2020-01-27,2020-01-27,0
20577721,10/7/2019,10/7/2019,1,10.947,1,2019-10-07,2019-10-07,0
205791,10/20/2018,10/20/2018,1,6.944,1,2018-10-20,2018-10-20,0
20579431,11/30/2019,11/30/2019,1,6.465,1,2019-11-30,2019-11-30,0
20579601,2/16/2020,2/9/2020,2,20.598,2,2020-02-16,2020-02-09,-7
20579951,10/7/2019,10/7/2019,1,2.748,1,2019-10-07,2019-10-07,0
20580301,10/15/2019,10/7/2019,2,8.953,1,2019-10-15,2019-10-07,-8
20580881,10/7/2019,10/7/2019,1,4.726,1,2019-10-07,2019-10-07,0
20581231,10/17/2019,10/17/2019,1,8.839,1,2019-10-17,2019-10-17,0
20582051,1/4/2020,1/4/2020,1,10.393,1,2020-01-04,2020-01-04,0
20583371,12/9/2019,12/9/2019,1,8.189,1,2019-12-09,2019-12-09,0
20583391,10/2/2020,10/4/2020,3,21.945,2,2020-10-02,2020-10-04,2
20585381,10/24/2019,10/24/2019,1,7.383,1,2019-10-24,2019-10-24,0
20586351,9/7/2020,9/7/2020,1,2.576,1,2020-09-07,2020-09-07,0
205873,11/2/2018,8/8/2019,5,4.501,5,2018-11-02,2019-08-08,279
20587981,10/8/2019,11/23/2019,2,20.697000000000003,2,2019-10-08,2019-11-23,46
20588471,12/22/2019,9/26/2020,3,17.552,3,2019-12-22,2020-09-26,279
2058871,5/2/2018,5/2/2018,1,4.705,1,2018-05-02,2018-05-02,0
20589931,11/18/2020,11/18/2020,1,0.868,1,2020-11-18,2020-11-18,0
20590931,1/15/2020,10/16/2019,3,60.745999999999995,3,2020-01-15,2019-10-16,-91
2059301,1/27/2019,9/8/2019,7,37.657000000000004,5,2019-01-27,2019-09-08,224
20593251,10/19/2019,10/19/2019,1,3.685,1,2019-10-19,2019-10-19,0
2059351,11/8/2019,11/8/2019,1,11.939,1,2019-11-08,2019-11-08,0
20594181,12/14/2019,12/14/2019,1,17.332,1,2019-12-14,2019-12-14,0
20596121,10/9/2019,10/9/2019,1,6.46,1,2019-10-09,2019-10-09,0
20597151,10/10/2019,12/9/2019,20,384.065,9,2019-10-10,2019-12-09,60
20597241,11/29/2019,2/2/2020,2,8.013,2,2019-11-29,2020-02-02,65
20598931,10/9/2019,10/9/2019,1,10.100999999999999,1,2019-10-09,2019-10-09,0
20600581,11/13/2019,11/13/2019,1,2.146,1,2019-11-13,2019-11-13,0
20603991,1/18/2020,9/21/2020,26,914.77,4,2020-01-18,2020-09-21,247
20604281,11/10/2019,11/10/2019,1,5.691,1,2019-11-10,2019-11-10,0
20604971,2/19/2020,2/19/2020,1,3.694,1,2020-02-19,2020-02-19,0
206067,10/5/2016,7/25/2018,2,22.481349,2,2016-10-05,2018-07-25,658
206071,6/17/2017,6/17/2017,1,12.239,1,2017-06-17,2017-06-17,0
20615161,10/21/2019,3/9/2020,4,19.438,3,2019-10-21,2020-03-09,140
20617251,10/13/2019,10/13/2019,1,0.993,1,2019-10-13,2019-10-13,0
20619551,10/26/2019,10/26/2019,1,17.496,1,2019-10-26,2019-10-26,0
20619611,11/9/2019,11/9/2019,1,12.604,1,2019-11-09,2019-11-09,0
2062271,7/26/2018,7/26/2018,1,15.016,1,2018-07-26,2018-07-26,0
20623171,3/2/2020,3/2/2020,1,0.056,1,2020-03-02,2020-03-02,0
20623811,1/21/2020,3/6/2020,11,114.913,6,2020-01-21,2020-03-06,45
20625781,11/14/2020,11/14/2020,1,10.32,1,2020-11-14,2020-11-14,0
20626531,10/20/2019,11/9/2019,3,47.397999999999996,3,2019-10-20,2019-11-09,20
206281,2/25/2020,7/9/2017,4,43.99,4,2020-02-25,2017-07-09,-961
20628341,2/17/2020,5/29/2020,3,112.013,2,2020-02-17,2020-05-29,102
20629041,10/13/2019,10/13/2019,1,7.413,1,2019-10-13,2019-10-13,0
20629791,11/19/2019,11/19/2019,1,11.193,1,2019-11-19,2019-11-19,0
20631411,3/1/2020,3/1/2020,1,2.407,1,2020-03-01,2020-03-01,0
20632751,11/5/2020,11/5/2020,1,6.446,1,2020-11-05,2020-11-05,0
20633661,10/14/2019,10/14/2019,1,5.941,1,2019-10-14,2019-10-14,0
20634341,1/11/2020,3/7/2020,4,40.495999999999995,2,2020-01-11,2020-03-07,56
20634441,1/25/2020,1/25/2020,1,7.831,1,2020-01-25,2020-01-25,0
20635381,11/11/2019,11/11/2019,1,15.014,1,2019-11-11,2019-11-11,0
20635901,1/1/2020,6/20/2020,2,3.152,2,2020-01-01,2020-06-20,171
20637131,1/17/2020,11/8/2019,4,36.907,2,2020-01-17,2019-11-08,-70
20638011,10/18/2020,6/21/2020,4,12.696,3,2020-10-18,2020-06-21,-119
2063871,2/8/2019,2/8/2019,1,20.644,1,2019-02-08,2019-02-08,0
2064011,11/8/2018,6/1/2018,3,10.138,3,2018-11-08,2018-06-01,-160
20641021,10/17/2019,2/28/2020,9,89.209,3,2019-10-17,2020-02-28,134
2064111,3/10/2020,3/10/2020,1,1.507,1,2020-03-10,2020-03-10,0
2064161,8/30/2019,8/30/2019,1,2.184,1,2019-08-30,2019-08-30,0
2064251,6/10/2018,6/10/2018,1,9.391,1,2018-06-10,2018-06-10,0
20643101,10/26/2019,10/26/2019,1,12.222,1,2019-10-26,2019-10-26,0
2064631,1/10/2020,3/6/2020,41,757.735,5,2020-01-10,2020-03-06,56
20647121,1/17/2020,1/17/2020,1,4.031,1,2020-01-17,2020-01-17,0
20647891,10/23/2019,10/23/2019,1,5.763,1,2019-10-23,2019-10-23,0
20649441,10/23/2019,10/23/2019,1,5.562,1,2019-10-23,2019-10-23,0
20650161,12/22/2019,12/22/2019,1,5.387,1,2019-12-22,2019-12-22,0
2065091,12/19/2018,7/27/2018,3,20.195999999999998,2,2018-12-19,2018-07-27,-145
20651011,3/3/2020,3/3/2020,1,0.382,1,2020-03-03,2020-03-03,0
2065201,1/6/2019,9/23/2018,10,31.474,5,2019-01-06,2018-09-23,-105
20653631,11/1/2019,7/23/2020,2,11.495,2,2019-11-01,2020-07-23,265
206537,2/23/2019,2/23/2019,1,2.6999999999999997,1,2019-02-23,2019-02-23,0
20653741,10/18/2019,10/19/2019,2,44.571999999999996,1,2019-10-18,2019-10-19,1
2065401,1/27/2020,9/9/2018,50,350.363,11,2020-01-27,2018-09-09,-505
206543,11/21/2018,7/4/2017,4,43.403,4,2018-11-21,2017-07-04,-505
20655241,10/19/2019,11/6/2019,6,52.698,1,2019-10-19,2019-11-06,18
20655431,11/15/2019,11/8/2019,2,2.045,2,2019-11-15,2019-11-08,-7
20655851,1/22/2020,8/24/2020,4,37.708999999999996,3,2020-01-22,2020-08-24,215
2065631,8/1/2019,8/1/2019,1,7.09,1,2019-08-01,2019-08-01,0
206571,11/7/2018,11/7/2018,1,3.981,1,2018-11-07,2018-11-07,0
20657721,3/1/2020,3/1/2020,1,4.661,1,2020-03-01,2020-03-01,0
20657741,10/29/2019,11/4/2019,2,40.42,2,2019-10-29,2019-11-04,6
2065881,1/30/2020,1/30/2020,1,13.539,1,2020-01-30,2020-01-30,0
20659301,10/17/2019,10/17/2019,1,2.308,1,2019-10-17,2019-10-17,0
20662291,1/28/2020,8/7/2020,19,274.635,4,2020-01-28,2020-08-07,192
206623,2/12/2018,8/12/2019,2,11.229,2,2018-02-12,2019-08-12,546
20662501,1/1/2020,7/19/2020,12,47.135999999999996,4,2020-01-01,2020-07-19,200
206635,10/6/2016,10/6/2016,1,3.492803,1,2016-10-06,2016-10-06,0
20664041,11/23/2019,11/23/2019,1,11.631,1,2019-11-23,2019-11-23,0
20664741,11/11/2019,11/11/2019,1,11.08,1,2019-11-11,2019-11-11,0
20665271,10/25/2019,10/25/2019,1,4.497,1,2019-10-25,2019-10-25,0
20668811,2/14/2020,2/14/2020,1,0.595,1,2020-02-14,2020-02-14,0
20671361,12/28/2019,12/28/2019,1,4.159,1,2019-12-28,2019-12-28,0
2067371,12/12/2019,5/2/2019,3,78.229,2,2019-12-12,2019-05-02,-224
20674331,1/13/2020,3/9/2020,7,29.59,2,2020-01-13,2020-03-09,56
20674531,11/10/2019,3/1/2020,2,11.643,2,2019-11-10,2020-03-01,112
20675471,11/1/2019,11/1/2019,1,3.069,1,2019-11-01,2019-11-01,0
2067601,2/11/2020,2/11/2020,1,11.604,1,2020-02-11,2020-02-11,0
2067691,11/2/2019,9/8/2018,2,13.379999999999999,2,2019-11-02,2018-09-08,-420
206789,2/17/2018,2/17/2018,1,4.572,1,2018-02-17,2018-02-17,0
20679551,10/28/2019,10/28/2019,1,8.288,1,2019-10-28,2019-10-28,0
206799,7/10/2017,7/10/2017,1,20.918,1,2017-07-10,2017-07-10,0
20681751,9/26/2020,9/26/2020,1,4.111,1,2020-09-26,2020-09-26,0
20683111,11/29/2019,11/29/2019,1,13.473,1,2019-11-29,2019-11-29,0
20683681,12/14/2020,9/25/2020,2,21.594,2,2020-12-14,2020-09-25,-80
20684441,10/20/2019,10/20/2019,1,5.102,1,2019-10-20,2019-10-20,0
2068521,12/28/2018,6/11/2018,4,28.839,3,2018-12-28,2018-06-11,-200
206867,9/15/2017,9/15/2017,1,0.021,1,2017-09-15,2017-09-15,0
2068741,11/22/2019,11/22/2019,1,6.824,1,2019-11-22,2019-11-22,0
20688211,3/1/2020,3/1/2020,1,0.09,1,2020-03-01,2020-03-01,0
20691141,10/25/2020,10/25/2020,1,3.632,1,2020-10-25,2020-10-25,0
2069361,5/9/2018,5/9/2018,1,3.734,1,2018-05-09,2018-05-09,0
20695191,2/13/2020,2/13/2020,1,5.95,1,2020-02-13,2020-02-13,0
206959,3/5/2017,3/5/2017,1,2.223,1,2017-03-05,2017-03-05,0
206965,1/24/2019,9/6/2020,9,51.995,5,2019-01-24,2020-09-06,591
20696521,1/18/2020,2/16/2020,2,17.216,2,2020-01-18,2020-02-16,29
20701511,7/24/2020,7/24/2020,1,16.308,1,2020-07-24,2020-07-24,0
20703,5/19/2019,5/19/2019,1,16.77,1,2019-05-19,2019-05-19,0
20704321,1/10/2020,3/3/2020,13,215.036,4,2020-01-10,2020-03-03,53
20707271,10/23/2019,10/23/2019,1,70.113,1,2019-10-23,2019-10-23,0
20708901,1/24/2020,9/26/2020,9,116.419,7,2020-01-24,2020-09-26,246
2070921,7/29/2020,7/29/2020,1,7.213,1,2020-07-29,2020-07-29,0
20709501,2/29/2020,2/29/2020,1,1.202,1,2020-02-29,2020-02-29,0
20710321,2/8/2020,2/8/2020,1,11.375,1,2020-02-08,2020-02-08,0
207113,2/10/2018,2/10/2018,1,10.208,1,2018-02-10,2018-02-10,0
20712811,6/7/2020,9/30/2020,12,153.154,2,2020-06-07,2020-09-30,115
20714931,12/31/2019,12/31/2019,1,10.01,1,2019-12-31,2019-12-31,0
207195,10/21/2016,8/26/2018,3,20.987572999999998,3,2016-10-21,2018-08-26,674
20719991,12/18/2019,12/18/2019,1,19.980999999999998,1,2019-12-18,2019-12-18,0
20722391,1/14/2020,3/4/2020,9,88.562,5,2020-01-14,2020-03-04,50
2072271,1/20/2019,11/4/2018,2,6.203,2,2019-01-20,2018-11-04,-77
20722841,1/3/2020,1/3/2020,1,13.399,1,2020-01-03,2020-01-03,0
20723181,2/13/2020,2/27/2020,2,13.466999999999999,2,2020-02-13,2020-02-27,14
20723241,10/25/2019,10/25/2019,1,16.937,1,2019-10-25,2019-10-25,0
207259,12/23/2017,4/12/2019,2,27.756,2,2017-12-23,2019-04-12,475
2072681,10/23/2019,10/23/2019,1,20.129,1,2019-10-23,2019-10-23,0
20727141,1/31/2020,1/31/2020,1,4.157,1,2020-01-31,2020-01-31,0
20729451,11/9/2019,12/16/2019,2,18.211,1,2019-11-09,2019-12-16,37
2072961,1/11/2020,4/23/2019,4,11.129999999999999,3,2020-01-11,2019-04-23,-263
2073031,5/2/2018,5/2/2018,1,11.256,1,2018-05-02,2018-05-02,0
207317,8/1/2017,8/1/2017,1,2.53,1,2017-08-01,2017-08-01,0
2073261,1/14/2020,9/5/2018,100,675.486,5,2020-01-14,2018-09-05,-496
2073291,11/13/2018,11/13/2018,1,6.118,1,2018-11-13,2018-11-13,0
207355,11/3/2016,9/8/2018,4,18.648,3,2016-11-03,2018-09-08,674
20736181,10/2/2020,10/20/2020,2,21.784999999999997,2,2020-10-02,2020-10-20,18
20739301,11/22/2020,11/22/2020,1,9.018,1,2020-11-22,2020-11-22,0
2073961,10/6/2019,12/28/2019,2,17.778,1,2019-10-06,2019-12-28,83
20739691,7/30/2020,8/29/2020,3,21.388,3,2020-07-30,2020-08-29,30
207441,12/29/2017,6/25/2017,2,39.101,1,2017-12-29,2017-06-25,-187
20744211,2/1/2020,2/1/2020,1,9.461,1,2020-02-01,2020-02-01,0
2074571,3/14/2019,9/28/2020,2,12.064,1,2019-03-14,2020-09-28,564
20745851,10/28/2019,10/28/2019,1,10.466,1,2019-10-28,2019-10-28,0
20746451,12/7/2019,12/7/2019,1,2.046,1,2019-12-07,2019-12-07,0
20746721,11/19/2019,11/19/2019,1,8.988,1,2019-11-19,2019-11-19,0
20747051,11/14/2019,12/5/2019,8,111.465,6,2019-11-14,2019-12-05,21
20748421,1/13/2020,9/28/2020,13,26.996,4,2020-01-13,2020-09-28,259
20748531,11/2/2019,11/2/2019,1,1.89,1,2019-11-02,2019-11-02,0
2075031,6/7/2018,6/7/2018,1,2.7760000000000002,1,2018-06-07,2018-06-07,0
20751181,10/29/2019,10/29/2019,1,1.124,1,2019-10-29,2019-10-29,0
20752341,11/21/2019,11/21/2019,1,2.694,1,2019-11-21,2019-11-21,0
2075421,1/11/2019,9/30/2019,10,69.57000000000001,5,2019-01-11,2019-09-30,262
20755181,10/10/2020,10/10/2020,1,8.727,1,2020-10-10,2020-10-10,0
20755781,11/18/2019,11/18/2019,1,8.888,1,2019-11-18,2019-11-18,0
2075721,6/13/2020,6/13/2020,1,5.331,1,2020-06-13,2020-06-13,0
20758441,11/9/2019,11/9/2019,1,2.871,1,2019-11-09,2019-11-09,0
20759151,10/30/2019,12/18/2019,5,26.391000000000002,2,2019-10-30,2019-12-18,49
207597,12/7/2017,8/24/2019,2,10.832,1,2017-12-07,2019-08-24,625
207605,12/4/2019,12/4/2019,1,9.284,1,2019-12-04,2019-12-04,0
2076121,6/24/2018,6/24/2018,1,2.708,1,2018-06-24,2018-06-24,0
20762541,1/2/2020,12/4/2019,8,52.077,4,2020-01-02,2019-12-04,-29
20762911,1/20/2020,1/20/2020,1,2.673,1,2020-01-20,2020-01-20,0
207637,1/19/2020,1/19/2020,1,15.093,1,2020-01-19,2020-01-19,0
207667,8/2/2018,9/28/2016,2,7.604643,2,2018-08-02,2016-09-28,-673
20767551,1/10/2020,8/29/2020,48,366.333,6,2020-01-10,2020-08-29,232
2076821,1/12/2019,1/12/2019,1,6.817,1,2019-01-12,2019-01-12,0
207689,1/22/2017,1/22/2017,1,13.405,1,2017-01-22,2017-01-22,0
2076911,1/11/2019,5/4/2019,3,16.786,3,2019-01-11,2019-05-04,113
207693,2/24/2018,4/22/2017,2,17.144,2,2018-02-24,2017-04-22,-308
2076941,11/1/2018,11/17/2018,2,8.756,1,2018-11-01,2018-11-17,16
2076961,11/4/2018,11/4/2018,1,18.009,1,2018-11-04,2018-11-04,0
20773181,6/13/2020,7/1/2020,2,34.382000000000005,2,2020-06-13,2020-07-01,18
207737,7/26/2017,7/26/2017,1,6.954,1,2017-07-26,2017-07-26,0
20774511,11/1/2019,11/1/2019,1,3.366,1,2019-11-01,2019-11-01,0
20774791,1/10/2020,9/20/2020,43,967.606,4,2020-01-10,2020-09-20,254
20775481,8/16/2020,8/16/2020,1,10.496,1,2020-08-16,2020-08-16,0
20775891,11/1/2019,11/1/2019,1,19.372,1,2019-11-01,2019-11-01,0
20776791,11/1/2019,11/1/2019,1,6.006,1,2019-11-01,2019-11-01,0
20776831,11/19/2019,11/23/2019,2,13.495000000000001,1,2019-11-19,2019-11-23,4
20780851,12/15/2019,12/15/2019,2,3.966,2,2019-12-15,2019-12-15,0
207821,12/18/2018,12/18/2018,1,10.632,1,2018-12-18,2018-12-18,0
207865,10/10/2018,6/28/2019,8,33.653999999999996,7,2018-10-10,2019-06-28,261
20786741,12/4/2019,12/4/2019,1,3.626,1,2019-12-04,2019-12-04,0
20788181,12/5/2019,12/5/2019,1,2.419,1,2019-12-05,2019-12-05,0
20789531,9/27/2020,9/27/2020,1,11.855,1,2020-09-27,2020-09-27,0
207897,1/15/2017,9/10/2019,16,59.912226000000004,4,2017-01-15,2019-09-10,968
2079091,9/1/2018,9/1/2018,1,4.243,1,2018-09-01,2018-09-01,0
20791771,11/24/2019,12/16/2019,2,17.311,2,2019-11-24,2019-12-16,22
20792231,11/22/2019,11/22/2019,1,3.837,1,2019-11-22,2019-11-22,0
20793241,11/21/2019,8/9/2020,4,21.278,4,2019-11-21,2020-08-09,262
20794451,12/21/2019,12/21/2019,1,11.176,1,2019-12-21,2019-12-21,0
20795041,1/20/2020,3/6/2020,9,54.376,3,2020-01-20,2020-03-06,46
20795191,11/4/2019,12/16/2019,3,12.007,1,2019-11-04,2019-12-16,42
207953,6/14/2018,6/14/2018,1,3.356,1,2018-06-14,2018-06-14,0
2079651,11/1/2019,8/19/2019,5,51.068999999999996,2,2019-11-01,2019-08-19,-74
2079771,11/5/2019,11/5/2019,1,9.364,1,2019-11-05,2019-11-05,0
20797711,3/5/2020,3/5/2020,1,16.231,1,2020-03-05,2020-03-05,0
207979,11/14/2019,11/14/2019,1,16.157,1,2019-11-14,2019-11-14,0
20798651,12/30/2019,2/4/2020,4,66.78999999999999,4,2019-12-30,2020-02-04,36
20799081,1/21/2020,12/3/2019,5,37.386,3,2020-01-21,2019-12-03,-49
20799781,12/22/2019,12/22/2019,1,7.752,1,2019-12-22,2019-12-22,0
2080041,1/24/2020,11/30/2019,2,6.418,2,2020-01-24,2019-11-30,-55
208029,3/19/2019,8/12/2019,2,10.484,2,2019-03-19,2019-08-12,146
2080361,1/10/2019,9/9/2019,255,1906.776,7,2019-01-10,2019-09-09,242
208039,7/8/2017,7/8/2017,1,16.958,1,2017-07-08,2017-07-08,0
2080431,11/24/2018,7/30/2018,4,14.72,3,2018-11-24,2018-07-30,-117
20805961,9/26/2020,9/26/2020,1,11.03,1,2020-09-26,2020-09-26,0
20806021,1/25/2020,2/19/2020,3,14.003,2,2020-01-25,2020-02-19,25
208075,8/31/2018,8/31/2018,1,15.43,1,2018-08-31,2018-08-31,0
208107,10/11/2016,5/6/2017,2,11.531082000000001,2,2016-10-11,2017-05-06,207
2081101,5/2/2018,5/2/2018,1,0.09,1,2018-05-02,2018-05-02,0
20817681,3/4/2020,3/4/2020,1,16.135,1,2020-03-04,2020-03-04,0
20817721,1/4/2020,1/4/2020,1,22.118,1,2020-01-04,2020-01-04,0
2081841,1/10/2020,9/9/2019,75,711.199,5,2020-01-10,2019-09-09,-123
208185,1/11/2020,9/28/2019,46,230.016,3,2020-01-11,2019-09-28,-105
2082131,6/19/2020,6/19/2020,1,10.874,1,2020-06-19,2020-06-19,0
20822241,9/18/2020,9/18/2020,1,3.591,1,2020-09-18,2020-09-18,0
2082231,5/5/2018,7/3/2019,2,9.107,2,2018-05-05,2019-07-03,424
20827451,2/14/2020,2/14/2020,1,1.379,1,2020-02-14,2020-02-14,0
20828131,11/25/2019,11/25/2019,1,3.86,1,2019-11-25,2019-11-25,0
208299,11/12/2016,11/24/2019,2,6.162,1,2016-11-12,2019-11-24,1107
2083001,1/26/2019,8/7/2018,16,158.826,7,2019-01-26,2018-08-07,-172
208307,1/11/2019,9/9/2019,152,1461.309033,16,2019-01-11,2019-09-09,241
20832291,11/29/2019,11/29/2019,1,3.332,1,2019-11-29,2019-11-29,0
20833441,11/10/2019,11/10/2019,1,20.57,1,2019-11-10,2019-11-10,0
20833661,2/8/2020,2/8/2020,1,2.531,1,2020-02-08,2020-02-08,0
20834181,1/3/2020,12/23/2019,2,5.919,2,2020-01-03,2019-12-23,-11
208355,10/10/2017,2/21/2018,8,20.868000000000002,3,2017-10-10,2018-02-21,134
2083611,11/9/2019,5/7/2019,4,23.607,3,2019-11-09,2019-05-07,-186
20837041,11/14/2019,12/8/2019,2,17.601,2,2019-11-14,2019-12-08,24
2083741,5/11/2018,6/8/2018,33,216.072,4,2018-05-11,2018-06-08,28
208381,4/5/2018,4/5/2018,1,2.672,1,2018-04-05,2018-04-05,0
20838811,12/6/2019,12/6/2019,1,3.568,1,2019-12-06,2019-12-06,0
20839241,1/11/2020,1/11/2020,1,2.682,1,2020-01-11,2020-01-11,0
20840691,11/10/2019,11/10/2019,1,14.637,1,2019-11-10,2019-11-10,0
20841051,12/10/2019,12/10/2019,1,10.85,1,2019-12-10,2019-12-10,0
20842241,2/7/2020,2/7/2020,1,7.804,1,2020-02-07,2020-02-07,0
20843811,11/10/2019,11/10/2019,1,3.156,1,2019-11-10,2019-11-10,0
2084611,5/3/2018,5/3/2018,1,0.024,1,2018-05-03,2018-05-03,0
208469,1/18/2018,9/28/2020,32,232.286067,8,2018-01-18,2020-09-28,984
2084881,11/19/2018,5/17/2018,2,8.021,2,2018-11-19,2018-05-17,-186
2084891,11/26/2018,8/30/2018,7,27.526,5,2018-11-26,2018-08-30,-88
20851351,11/19/2019,11/19/2019,1,6.737,1,2019-11-19,2019-11-19,0
208549,6/12/2018,6/12/2018,1,2.792,1,2018-06-12,2018-06-12,0
208551,10/28/2018,10/28/2018,1,5.932,1,2018-10-28,2018-10-28,0
2085741,8/15/2020,8/15/2020,1,48.216,1,2020-08-15,2020-08-15,0
20859031,7/10/2020,7/17/2020,2,5.689,2,2020-07-10,2020-07-17,7
2086211,8/31/2018,8/31/2018,1,3.844,1,2018-08-31,2018-08-31,0
20864161,1/15/2020,2/7/2020,11,134.52,4,2020-01-15,2020-02-07,23
20865161,12/20/2019,12/20/2019,1,10.595,1,2019-12-20,2019-12-20,0
20866021,11/15/2019,11/21/2019,3,25.354,1,2019-11-15,2019-11-21,6
20866161,11/16/2019,11/16/2019,1,10.269,1,2019-11-16,2019-11-16,0
20867891,11/14/2019,2/23/2020,12,169.305,6,2019-11-14,2020-02-23,101
20873661,2/1/2020,2/1/2020,1,2.596,1,2020-02-01,2020-02-01,0
20873721,11/16/2019,11/16/2019,1,15.297,1,2019-11-16,2019-11-16,0
20874011,12/28/2019,12/28/2019,1,19.376,1,2019-12-28,2019-12-28,0
208773,11/19/2016,11/19/2016,1,3.028,1,2016-11-19,2016-11-19,0
20879461,1/17/2020,1/17/2020,1,16.993,1,2020-01-17,2020-01-17,0
20879561,11/15/2019,11/15/2019,1,12.987,1,2019-11-15,2019-11-15,0
20882381,1/14/2020,1/14/2020,1,0.131,1,2020-01-14,2020-01-14,0
20883341,11/24/2019,11/24/2019,1,7.572,1,2019-11-24,2019-11-24,0
20884541,2/15/2020,3/6/2020,2,9.719999999999999,2,2020-02-15,2020-03-06,20
208847,8/7/2016,8/7/2016,1,27.396796000000002,1,2016-08-07,2016-08-07,0
20885361,1/29/2020,7/18/2020,13,48.074,6,2020-01-29,2020-07-18,171
20886481,1/28/2020,2/14/2020,4,33.854,3,2020-01-28,2020-02-14,17
20886781,11/16/2019,11/16/2019,1,2.552,1,2019-11-16,2019-11-16,0
20887881,1/19/2020,9/29/2020,11,38.425,4,2020-01-19,2020-09-29,254
2088861,6/20/2019,6/20/2019,1,8.523,1,2019-06-20,2019-06-20,0
208901,1/13/2018,9/5/2017,22,158.23746500000001,9,2018-01-13,2017-09-05,-130
20891491,12/21/2019,12/21/2019,1,9.616,1,2019-12-21,2019-12-21,0
2089221,7/31/2018,7/31/2018,1,3.994,1,2018-07-31,2018-07-31,0
20893251,2/17/2020,2/17/2020,1,5.75,1,2020-02-17,2020-02-17,0
2089371,10/11/2018,9/22/2018,7,29.425,6,2018-10-11,2018-09-22,-19
20897221,7/31/2020,7/31/2020,1,1.44,1,2020-07-31,2020-07-31,0
20897911,10/17/2020,9/5/2020,2,38.915,2,2020-10-17,2020-09-05,-42
2089981,7/21/2018,7/28/2018,2,4.843,1,2018-07-21,2018-07-28,7
20899861,10/17/2020,10/17/2020,1,6.832,1,2020-10-17,2020-10-17,0
20901381,11/18/2019,11/18/2019,1,19.241,1,2019-11-18,2019-11-18,0
2090431,11/14/2018,8/19/2018,4,37.123999999999995,4,2018-11-14,2018-08-19,-87
2090721,7/27/2018,7/27/2018,1,7.39,1,2018-07-27,2018-07-27,0
20907711,11/21/2019,7/14/2020,2,20.32,2,2019-11-21,2020-07-14,236
20909671,9/26/2020,9/26/2020,1,3.971,1,2020-09-26,2020-09-26,0
2091031,10/16/2018,5/4/2018,2,10.729,1,2018-10-16,2018-05-04,-165
209125,2/9/2019,2/9/2019,1,7.7,1,2019-02-09,2019-02-09,0
2091291,1/2/2020,9/27/2019,18,61.076,7,2020-01-02,2019-09-27,-97
209169,1/27/2018,1/27/2018,1,5.704,1,2018-01-27,2018-01-27,0
20917141,11/21/2019,11/21/2019,1,8.92,1,2019-11-21,2019-11-21,0
20918681,1/1/2020,3/20/2020,7,25.721,4,2020-01-01,2020-03-20,79
209197,10/18/2016,6/30/2018,2,11.39219,2,2016-10-18,2018-06-30,620
2092081,12/5/2018,7/25/2019,6,66.601,6,2018-12-05,2019-07-25,232
2092191,1/4/2020,1/4/2020,1,2.841,1,2020-01-04,2020-01-04,0
209247,6/3/2017,6/3/2017,1,6.356,1,2017-06-03,2017-06-03,0
20924721,11/22/2019,11/22/2019,1,5.381,1,2019-11-22,2019-11-22,0
209255,1/10/2019,12/9/2019,5,27.939999999999998,2,2019-01-10,2019-12-09,333
20926081,2/23/2020,2/23/2020,1,4.923,1,2020-02-23,2020-02-23,0
20928161,12/13/2019,12/13/2019,1,3.081,1,2019-12-13,2019-12-13,0
20928221,10/19/2020,10/19/2020,1,5.993,1,2020-10-19,2020-10-19,0
20930941,12/22/2019,12/22/2019,1,6.343,1,2019-12-22,2019-12-22,0
2093161,5/5/2018,5/5/2018,1,10.574,1,2018-05-05,2018-05-05,0
209319,11/2/2016,11/2/2016,1,3.161,1,2016-11-02,2016-11-02,0
20934561,1/20/2020,8/9/2020,7,27.256999999999998,6,2020-01-20,2020-08-09,202
20938361,2/1/2020,2/1/2020,1,8.386,1,2020-02-01,2020-02-01,0
20938671,11/28/2019,11/28/2019,1,6.168,1,2019-11-28,2019-11-28,0
2094301,6/12/2019,6/12/2019,1,3.28,1,2019-06-12,2019-06-12,0
20943581,10/8/2020,10/8/2020,1,2.335,1,2020-10-08,2020-10-08,0
20943631,12/18/2019,12/18/2019,1,22.138,1,2019-12-18,2019-12-18,0
20944791,1/13/2020,2/13/2020,11,245.224,3,2020-01-13,2020-02-13,31
20946881,2/29/2020,2/29/2020,1,1.587,1,2020-02-29,2020-02-29,0
20947821,1/18/2020,9/4/2020,46,850.405,6,2020-01-18,2020-09-04,230
20949041,12/22/2019,12/22/2019,1,10.701,1,2019-12-22,2019-12-22,0
20950581,1/6/2020,1/6/2020,1,5.11,1,2020-01-06,2020-01-06,0
20952851,1/14/2020,12/26/2019,2,15.737,2,2020-01-14,2019-12-26,-19
209535,10/4/2019,12/17/2017,3,15.138000000000002,2,2019-10-04,2017-12-17,-656
20953761,11/26/2019,8/14/2020,2,3.47,1,2019-11-26,2020-08-14,262
20955561,1/10/2020,9/8/2020,142,159.1,11,2020-01-10,2020-09-08,242
20957311,12/4/2019,12/4/2019,1,5.786,1,2019-12-04,2019-12-04,0
20957501,1/23/2020,12/19/2019,3,12.007,3,2020-01-23,2019-12-19,-35
209597,2/6/2020,2/6/2020,1,9.704,1,2020-02-06,2020-02-06,0
20964271,1/15/2020,9/6/2020,21,60.351,8,2020-01-15,2020-09-06,235
20967881,1/31/2020,3/6/2020,3,16.639,1,2020-01-31,2020-03-06,35
2097081,10/25/2019,11/4/2019,2,12.860000000000001,1,2019-10-25,2019-11-04,10
209709,8/23/2017,8/3/2017,2,7.438,2,2017-08-23,2017-08-03,-20
2097101,12/29/2018,9/15/2018,3,8.417,2,2018-12-29,2018-09-15,-105
20972331,11/29/2019,11/29/2019,1,2.266,1,2019-11-29,2019-11-29,0
20972411,1/3/2020,1/3/2020,1,14.444,1,2020-01-03,2020-01-03,0
209731,9/10/2017,9/10/2017,1,4.709,1,2017-09-10,2017-09-10,0
20974411,1/19/2020,6/14/2020,6,26.766000000000002,5,2020-01-19,2020-06-14,147
209771,1/12/2020,1/12/2020,1,0.564,1,2020-01-12,2020-01-12,0
20978641,12/21/2019,2/9/2020,2,8.155,2,2019-12-21,2020-02-09,50
2097891,10/11/2020,10/11/2020,1,1.036,1,2020-10-11,2020-10-11,0
20979381,12/13/2019,2/8/2020,5,10.456,3,2019-12-13,2020-02-08,57
20980181,11/15/2020,11/15/2020,1,1.35,1,2020-11-15,2020-11-15,0
20981071,10/11/2020,9/9/2020,71,1050.741,3,2020-10-11,2020-09-09,-32
20981791,1/1/2020,9/26/2020,29,135.604,11,2020-01-01,2020-09-26,269
209823,10/31/2018,10/31/2018,1,7.175,1,2018-10-31,2018-10-31,0
209829,12/22/2019,8/31/2018,3,26.11,2,2019-12-22,2018-08-31,-478
2098331,6/7/2018,6/7/2018,1,6.46,1,2018-06-07,2018-06-07,0
20984281,3/10/2020,3/10/2020,1,7.813,1,2020-03-10,2020-03-10,0
2098521,5/18/2018,9/4/2018,3,38.368,3,2018-05-18,2018-09-04,109
20985561,1/11/2020,1/11/2020,1,5.937,1,2020-01-11,2020-01-11,0
20986801,1/11/2020,1/11/2020,1,21.465,1,2020-01-11,2020-01-11,0
20988171,12/1/2019,12/1/2019,1,5.624,1,2019-12-01,2019-12-01,0
20989061,4/18/2020,4/18/2020,1,5.619,1,2020-04-18,2020-04-18,0
20989141,11/22/2020,7/1/2020,4,56.751,3,2020-11-22,2020-07-01,-144
20990501,3/12/2020,3/12/2020,1,5.777,1,2020-03-12,2020-03-12,0
209923,10/20/2020,5/22/2020,8,29.599,2,2020-10-20,2020-05-22,-151
20993751,1/10/2020,1/10/2020,1,9.27,1,2020-01-10,2020-01-10,0
20998301,12/12/2019,12/12/2019,1,10.491,1,2019-12-12,2019-12-12,0
210019,11/12/2019,9/7/2019,8,16.559831,3,2019-11-12,2019-09-07,-66
21004561,2/21/2020,2/22/2020,2,37.414,2,2020-02-21,2020-02-22,1
210047,4/25/2018,7/12/2018,2,7.727,2,2018-04-25,2018-07-12,78
21004701,12/3/2019,12/3/2019,1,7.558,1,2019-12-03,2019-12-03,0
21005011,12/19/2019,12/19/2019,1,9.651,1,2019-12-19,2019-12-19,0
21005111,1/4/2020,1/4/2020,1,5.432,1,2020-01-04,2020-01-04,0
2100591,3/31/2019,6/12/2018,2,29.222,1,2019-03-31,2018-06-12,-292
21009091,12/4/2019,12/4/2019,1,7.595,1,2019-12-04,2019-12-04,0
21009401,1/22/2020,1/22/2020,1,7.155,1,2020-01-22,2020-01-22,0
21011961,12/4/2019,12/4/2019,1,15.112,1,2019-12-04,2019-12-04,0
21012101,1/12/2020,3/1/2020,4,63.706,3,2020-01-12,2020-03-01,49
2101241,1/30/2019,5/7/2018,3,66.056,2,2019-01-30,2018-05-07,-268
2101551,10/29/2020,10/29/2020,1,1.624,1,2020-10-29,2020-10-29,0
2101901,9/22/2018,9/22/2018,1,7.373,1,2018-09-22,2018-09-22,0
21019301,1/26/2020,12/6/2019,2,11.247,2,2020-01-26,2019-12-06,-51
21019951,12/12/2019,12/9/2019,2,4.1579999999999995,1,2019-12-12,2019-12-09,-3
2102161,3/30/2019,4/11/2019,2,11.258,1,2019-03-30,2019-04-11,12
210231,11/29/2016,8/7/2016,5,9.314017,3,2016-11-29,2016-08-07,-114
21024851,12/7/2019,3/1/2020,2,16.856,2,2019-12-07,2020-03-01,85
21025331,2/9/2020,2/9/2020,2,16.674,2,2020-02-09,2020-02-09,0
210261,2/25/2017,2/25/2017,1,9.615,1,2017-02-25,2017-02-25,0
2102671,2/2/2019,2/2/2019,1,12.336,1,2019-02-02,2019-02-02,0
210289,8/24/2016,8/24/2016,1,4.619669,1,2016-08-24,2016-08-24,0
2102921,4/8/2019,7/18/2018,2,3.2640000000000002,1,2019-04-08,2018-07-18,-264
21029431,10/16/2020,3/6/2020,2,6.971,2,2020-10-16,2020-03-06,-224
2102961,3/24/2019,3/24/2019,1,16.548,1,2019-03-24,2019-03-24,0
2103321,7/8/2018,8/12/2018,2,5.912,1,2018-07-08,2018-08-12,35
21034811,1/25/2020,1/25/2020,2,9.081,2,2020-01-25,2020-01-25,0
210351,3/11/2019,8/23/2020,9,35.105,8,2019-03-11,2020-08-23,531
21036761,12/20/2019,12/20/2019,1,4.74,1,2019-12-20,2019-12-20,0
21037251,1/12/2020,1/12/2020,1,9.005,1,2020-01-12,2020-01-12,0
21037481,12/8/2019,12/8/2019,1,17.197,1,2019-12-08,2019-12-08,0
21039821,1/30/2020,1/30/2020,1,12.847,1,2020-01-30,2020-01-30,0
21041291,1/11/2020,1/11/2020,1,3.705,1,2020-01-11,2020-01-11,0
210413,10/25/2017,2/8/2019,3,20.985,3,2017-10-25,2019-02-08,471
21041371,8/21/2020,8/21/2020,1,9.517,1,2020-08-21,2020-08-21,0
2104161,5/10/2018,6/4/2018,2,23.589,2,2018-05-10,2018-06-04,25
210435,1/21/2017,8/5/2017,10,98.504,2,2017-01-21,2017-08-05,196
210443,3/21/2019,4/22/2018,4,45.998,2,2019-03-21,2018-04-22,-333
21044371,10/15/2020,3/12/2020,2,7.005,2,2020-10-15,2020-03-12,-217
21044421,2/13/2020,2/13/2020,1,0.474,1,2020-02-13,2020-02-13,0
21045911,10/8/2020,2/3/2020,3,47.701,2,2020-10-08,2020-02-03,-248
21046261,10/22/2020,10/22/2020,1,6.633,1,2020-10-22,2020-10-22,0
210463,5/8/2017,5/8/2017,1,2.836,1,2017-05-08,2017-05-08,0
2104821,1/25/2019,11/20/2018,2,7.389,2,2019-01-25,2018-11-20,-66
21048791,8/28/2020,8/28/2020,1,10.161,1,2020-08-28,2020-08-28,0
210491,10/4/2016,8/31/2017,12,79.786273,4,2016-10-04,2017-08-31,331
21050651,1/18/2020,1/18/2020,1,0.942,1,2020-01-18,2020-01-18,0
21051191,1/16/2020,2/7/2020,5,2.982,4,2020-01-16,2020-02-07,22
2105181,11/20/2018,11/20/2018,1,6.476,1,2018-11-20,2018-11-20,0
2105681,12/11/2019,12/3/2018,2,21.237000000000002,2,2019-12-11,2018-12-03,-373
210577,8/23/2019,8/23/2019,1,1.748,1,2019-08-23,2019-08-23,0
2105841,1/10/2019,9/9/2019,276,1580.665,7,2019-01-10,2019-09-09,242
21062481,9/7/2020,9/7/2020,1,6.752,1,2020-09-07,2020-09-07,0
21063081,12/22/2019,12/22/2019,1,5.619,1,2019-12-22,2019-12-22,0
21063101,12/11/2019,12/15/2019,2,5.406,2,2019-12-11,2019-12-15,4
21063941,1/24/2020,1/24/2020,1,0.766,1,2020-01-24,2020-01-24,0
21063961,12/11/2019,12/11/2019,1,3.23,1,2019-12-11,2019-12-11,0
21064141,1/17/2020,9/6/2020,32,166.362,6,2020-01-17,2020-09-06,233
21065331,12/12/2019,3/9/2020,7,46.131,3,2019-12-12,2020-03-09,88
210683,3/27/2017,4/3/2017,2,10.584,1,2017-03-27,2017-04-03,7
210703,1/2/2017,1/2/2017,1,6.829,1,2017-01-02,2017-01-02,0
210719,1/19/2019,8/18/2018,4,35.583,2,2019-01-19,2018-08-18,-154
2107241,3/11/2020,3/11/2020,1,22.991,1,2020-03-11,2020-03-11,0
2107251,6/1/2018,6/1/2018,1,5.651,1,2018-06-01,2018-06-01,0
21073,10/13/2016,9/29/2016,3,23.11235,2,2016-10-13,2016-09-29,-14
2107441,3/2/2019,8/22/2018,3,33.56,3,2019-03-02,2018-08-22,-192
21076421,1/2/2020,12/29/2019,2,9.873000000000001,2,2020-01-02,2019-12-29,-4
21077031,3/11/2020,3/11/2020,2,13.116,2,2020-03-11,2020-03-11,0
21077151,1/2/2020,1/2/2020,1,7.897,1,2020-01-02,2020-01-02,0
21078861,3/10/2020,3/9/2020,5,21.328,3,2020-03-10,2020-03-09,-1
21080001,12/19/2020,12/19/2020,1,16.765,1,2020-12-19,2020-12-19,0
21081501,12/6/2020,12/6/2020,1,5.581,1,2020-12-06,2020-12-06,0
21081681,7/25/2020,7/25/2020,1,6.074,1,2020-07-25,2020-07-25,0
210823,10/20/2016,10/20/2016,1,4.545476,1,2016-10-20,2016-10-20,0
21082921,8/24/2020,8/24/2020,1,5.683,1,2020-08-24,2020-08-24,0
21083601,2/27/2020,2/27/2020,1,10.656,1,2020-02-27,2020-02-27,0
21084981,1/15/2020,1/15/2020,1,1.176,1,2020-01-15,2020-01-15,0
2108511,9/1/2018,9/1/2018,1,13.156,1,2018-09-01,2018-09-01,0
210853,1/12/2019,9/9/2017,31,39.040429,5,2019-01-12,2017-09-09,-490
21087761,1/14/2020,5/29/2020,49,471.725,8,2020-01-14,2020-05-29,136
2109051,6/29/2019,6/29/2019,1,5.562,1,2019-06-29,2019-06-29,0
210951,1/3/2020,1/3/2020,1,4.784,1,2020-01-03,2020-01-03,0
21098351,4/3/2020,4/3/2020,1,4.064,1,2020-04-03,2020-04-03,0
21099211,12/16/2019,12/16/2019,1,11.105,1,2019-12-16,2019-12-16,0
210995,10/13/2018,12/7/2018,2,18.058,2,2018-10-13,2018-12-07,55
21100481,1/13/2020,1/13/2020,1,2.993,1,2020-01-13,2020-01-13,0
21100991,1/19/2020,1/19/2020,1,5.058,1,2020-01-19,2020-01-19,0
21101101,2/22/2020,2/22/2020,1,1.778,1,2020-02-22,2020-02-22,0
211021,6/20/2017,6/20/2017,1,5.341,1,2017-06-20,2017-06-20,0
21103641,1/11/2020,9/30/2020,38,280.982,7,2020-01-11,2020-09-30,263
21104271,10/15/2020,9/6/2020,19,77.066,5,2020-10-15,2020-09-06,-39
21105501,12/21/2019,12/21/2019,1,11.202,1,2019-12-21,2019-12-21,0
211059,3/18/2018,3/18/2018,1,7.284,1,2018-03-18,2018-03-18,0
21106201,2/26/2020,2/26/2020,1,3.628,1,2020-02-26,2020-02-26,0
21108621,3/7/2020,3/7/2020,1,5.45,1,2020-03-07,2020-03-07,0
21108931,1/30/2020,2/6/2020,2,12.17,1,2020-01-30,2020-02-06,7
211115,7/12/2017,9/2/2016,2,26.067603,2,2017-07-12,2016-09-02,-313
21111751,2/25/2020,2/25/2020,1,26.44,1,2020-02-25,2020-02-25,0
21112371,10/1/2020,11/16/2020,7,23.974,3,2020-10-01,2020-11-16,46
21114641,11/24/2020,11/24/2020,1,2.363,1,2020-11-24,2020-11-24,0
21115691,1/11/2020,6/20/2020,8,45.8,4,2020-01-11,2020-06-20,161
211191,12/5/2018,12/5/2018,1,9.558,1,2018-12-05,2018-12-05,0
211203,1/25/2019,8/11/2017,3,28.265,3,2019-01-25,2017-08-11,-532
211221,4/29/2017,8/22/2016,4,7.257085,4,2017-04-29,2016-08-22,-250
21122251,12/19/2019,12/27/2019,3,42.141999999999996,1,2019-12-19,2019-12-27,8
2112381,5/24/2019,8/8/2019,2,20.164,1,2019-05-24,2019-08-08,76
21124841,1/19/2020,1/19/2020,1,1.206,1,2020-01-19,2020-01-19,0
21127121,12/19/2019,12/19/2019,1,1.373,1,2019-12-19,2019-12-19,0
21129211,12/25/2019,12/25/2019,1,6.36,1,2019-12-25,2019-12-25,0
21131711,12/20/2019,12/20/2019,1,6.618,1,2019-12-20,2019-12-20,0
21132531,2/16/2020,6/13/2020,3,5.975,2,2020-02-16,2020-06-13,118
2113371,2/23/2020,2/23/2020,1,5.23,1,2020-02-23,2020-02-23,0
211341,1/18/2018,8/16/2019,18,109.103,13,2018-01-18,2019-08-16,575
21135961,12/28/2020,12/28/2020,1,7.605,1,2020-12-28,2020-12-28,0
2113601,8/23/2018,8/23/2018,1,6.005,1,2018-08-23,2018-08-23,0
21136861,1/4/2020,1/4/2020,1,4.596,1,2020-01-04,2020-01-04,0
21138421,1/1/2020,2/28/2020,7,17.069,5,2020-01-01,2020-02-28,58
211385,3/27/2019,3/27/2019,1,11.967,1,2019-03-27,2019-03-27,0
2114031,11/14/2019,11/14/2019,1,19.133,1,2019-11-14,2019-11-14,0
211431,10/16/2018,9/25/2017,15,76.496,5,2018-10-16,2017-09-25,-386
21147061,12/28/2019,12/28/2019,1,1.523,1,2019-12-28,2019-12-28,0
21148051,2/18/2020,2/18/2020,1,2.829,1,2020-02-18,2020-02-18,0
21148111,8/29/2020,8/29/2020,1,4.28,1,2020-08-29,2020-08-29,0
211489,1/2/2017,8/5/2016,49,528.857631,7,2017-01-02,2016-08-05,-150
2114951,9/19/2019,9/19/2019,1,11.175,1,2019-09-19,2019-09-19,0
21151881,2/17/2020,2/17/2020,1,8.361,1,2020-02-17,2020-02-17,0
2115311,10/21/2019,9/13/2019,8,49.486000000000004,4,2019-10-21,2019-09-13,-38
21154661,1/13/2020,2/7/2020,19,109.244,3,2020-01-13,2020-02-07,25
21155551,10/25/2020,7/6/2020,8,15.604,6,2020-10-25,2020-07-06,-111
211557,6/13/2020,6/13/2020,1,17.269,1,2020-06-13,2020-06-13,0
2115711,11/15/2018,11/15/2018,1,8.759,1,2018-11-15,2018-11-15,0
21160421,1/3/2020,1/3/2020,1,7.027,1,2020-01-03,2020-01-03,0
21162961,12/23/2019,12/23/2019,1,3.683,1,2019-12-23,2019-12-23,0
21163061,1/19/2020,3/10/2020,2,28.882,2,2020-01-19,2020-03-10,51
21164491,1/13/2020,3/6/2020,38,630.976,3,2020-01-13,2020-03-06,53
21167091,2/8/2020,2/8/2020,1,2.301,1,2020-02-08,2020-02-08,0
21167641,1/15/2020,9/9/2020,14,421.816,6,2020-01-15,2020-09-09,238
211699,1/10/2017,9/9/2016,222,3474.893348,9,2017-01-10,2016-09-09,-123
21171481,1/30/2020,2/25/2020,2,16.165,2,2020-01-30,2020-02-25,26
211717,1/25/2018,8/21/2018,11,39.512,4,2018-01-25,2018-08-21,208
211727,1/13/2019,9/6/2019,124,549.222895,19,2019-01-13,2019-09-06,236
211729,10/18/2019,9/24/2019,2,9.222,2,2019-10-18,2019-09-24,-24
21173561,9/14/2020,9/14/2020,1,6.309,1,2020-09-14,2020-09-14,0
211739,3/22/2017,9/27/2016,3,68.47184899999999,2,2017-03-22,2016-09-27,-176
21174111,10/4/2020,9/20/2020,9,92.559,8,2020-10-04,2020-09-20,-14
21175131,1/18/2020,2/19/2020,4,49.599999999999994,2,2020-01-18,2020-02-19,32
2117771,5/28/2018,5/28/2018,1,2.031,1,2018-05-28,2018-05-28,0
21178061,1/11/2020,1/11/2020,1,9.732,1,2020-01-11,2020-01-11,0
21178741,2/23/2020,2/23/2020,1,7.529,1,2020-02-23,2020-02-23,0
211803,8/19/2016,9/18/2018,2,11.485809,2,2016-08-19,2018-09-18,760
211811,10/4/2016,12/16/2016,2,3.285426,2,2016-10-04,2016-12-16,73
21185441,12/27/2019,12/27/2019,1,7.358,1,2019-12-27,2019-12-27,0
2118851,1/13/2019,5/26/2018,3,18.82,2,2019-01-13,2018-05-26,-232
21190491,1/12/2020,12/28/2019,2,17.128,1,2020-01-12,2019-12-28,-15
21191031,2/15/2020,2/15/2020,1,6.275,1,2020-02-15,2020-02-15,0
21194461,1/4/2020,1/7/2020,3,48.191,3,2020-01-04,2020-01-07,3
21194541,1/21/2020,6/28/2020,8,12.272,4,2020-01-21,2020-06-28,159
21195521,2/27/2020,4/4/2020,3,25.192,3,2020-02-27,2020-04-04,37
21195751,1/21/2020,1/21/2020,1,5.449,1,2020-01-21,2020-01-21,0
21199111,2/11/2020,2/11/2020,1,5.292,1,2020-02-11,2020-02-11,0
21199341,8/14/2020,8/14/2020,1,6.103,1,2020-08-14,2020-08-14,0
21201931,3/3/2020,3/3/2020,1,0.061,1,2020-03-03,2020-03-03,0
21203851,1/19/2020,8/30/2020,4,42.656000000000006,3,2020-01-19,2020-08-30,224
21204311,1/2/2020,8/20/2020,5,77.383,4,2020-01-02,2020-08-20,231
2120471,10/23/2019,9/21/2019,5,24.332,3,2019-10-23,2019-09-21,-32
21205011,1/12/2020,1/26/2020,3,25.372,3,2020-01-12,2020-01-26,14
21206141,1/5/2020,1/5/2020,1,11.926,1,2020-01-05,2020-01-05,0
2120711,11/3/2020,11/3/2020,1,5.968,1,2020-11-03,2020-11-03,0
21207751,2/27/2020,9/4/2020,3,18.823,3,2020-02-27,2020-09-04,190
21207781,12/28/2019,12/28/2019,1,0.042,1,2019-12-28,2019-12-28,0
212119,1/20/2019,9/8/2019,42,259.410405,13,2019-01-20,2019-09-08,231
21213701,12/29/2019,12/29/2019,1,3.488,1,2019-12-29,2019-12-29,0
21217131,1/21/2020,1/21/2020,1,8.421,1,2020-01-21,2020-01-21,0
21219541,9/2/2020,9/2/2020,1,5.277,1,2020-09-02,2020-09-02,0
21222501,1/20/2020,1/20/2020,1,7.025,1,2020-01-20,2020-01-20,0
21222681,12/30/2019,12/30/2019,1,2.64,1,2019-12-30,2019-12-30,0
21223351,12/30/2019,12/30/2019,1,0.523,1,2019-12-30,2019-12-30,0
21224781,2/14/2020,2/25/2020,2,16.345,2,2020-02-14,2020-02-25,11
21226841,10/13/2020,10/13/2020,1,7.809,1,2020-10-13,2020-10-13,0
21227871,1/15/2020,9/17/2020,4,30.621,3,2020-01-15,2020-09-17,246
21228281,1/10/2020,1/10/2020,1,3.14,1,2020-01-10,2020-01-10,0
21228581,10/7/2020,10/7/2020,1,12.845,1,2020-10-07,2020-10-07,0
21230841,1/11/2020,9/19/2020,7,34.29,4,2020-01-11,2020-09-19,252
21232771,12/31/2019,12/31/2019,1,5.915,1,2019-12-31,2019-12-31,0
21233591,2/1/2020,2/1/2020,1,0.54,1,2020-02-01,2020-02-01,0
212337,1/13/2018,9/3/2017,56,249.840433,9,2018-01-13,2017-09-03,-132
21235761,1/12/2020,9/28/2020,7,31.468,3,2020-01-12,2020-09-28,260
21235971,7/30/2020,7/30/2020,1,2.083,1,2020-07-30,2020-07-30,0
212361,1/24/2018,8/9/2017,11,19.861,3,2018-01-24,2017-08-09,-168
2123671,9/29/2018,9/29/2018,1,3.266,1,2018-09-29,2018-09-29,0
21237161,1/26/2020,1/26/2020,1,3.999,1,2020-01-26,2020-01-26,0
21237641,1/10/2020,9/8/2020,55,1311.331,6,2020-01-10,2020-09-08,242
21238301,1/14/2020,3/3/2020,17,274.648,3,2020-01-14,2020-03-03,49
212387,11/1/2019,8/9/2019,5,38.474000000000004,4,2019-11-01,2019-08-09,-84
21238881,1/4/2020,1/4/2020,1,3.211,1,2020-01-04,2020-01-04,0
21241161,1/9/2020,2/12/2020,2,14.48,2,2020-01-09,2020-02-12,34
21241461,1/27/2020,1/27/2020,1,6.9,1,2020-01-27,2020-01-27,0
21245381,7/28/2020,7/28/2020,1,13.255,1,2020-07-28,2020-07-28,0
21246161,11/29/2020,12/20/2020,3,20.329,2,2020-11-29,2020-12-20,21
21248541,2/3/2020,2/3/2020,1,4.284,1,2020-02-03,2020-02-03,0
2124911,3/5/2019,3/5/2019,2,2.7119999999999997,2,2019-03-05,2019-03-05,0
21249971,1/13/2020,1/13/2020,1,21.01,1,2020-01-13,2020-01-13,0
21250021,1/2/2020,1/2/2020,1,2.453,1,2020-01-02,2020-01-02,0
21250111,10/6/2020,8/5/2020,6,30.475,4,2020-10-06,2020-08-05,-62
212517,8/14/2018,8/14/2018,1,9.8,1,2018-08-14,2018-08-14,0
212519,6/15/2018,6/15/2018,1,9.972,1,2018-06-15,2018-06-15,0
21252841,1/31/2020,1/31/2020,1,5.02,1,2020-01-31,2020-01-31,0
21253021,1/15/2020,1/15/2020,1,8.001,1,2020-01-15,2020-01-15,0
21253631,1/4/2020,1/4/2020,1,8.042,1,2020-01-04,2020-01-04,0
21255391,1/2/2020,1/2/2020,1,8.022,1,2020-01-02,2020-01-02,0
212571,5/6/2017,5/6/2017,1,1.53,1,2017-05-06,2017-05-06,0
21257221,10/24/2020,9/9/2020,14,157.727,3,2020-10-24,2020-09-09,-45
21257441,1/2/2020,1/2/2020,1,6.394,1,2020-01-02,2020-01-02,0
212577,11/28/2018,3/11/2019,2,33.709,2,2018-11-28,2019-03-11,103
21257961,8/28/2020,8/28/2020,1,19.041,1,2020-08-28,2020-08-28,0
212621,1/26/2020,9/9/2017,48,331.841,8,2020-01-26,2017-09-09,-869
212655,3/4/2017,3/4/2017,1,15.711,1,2017-03-04,2017-03-04,0
21270781,1/4/2020,1/4/2020,1,6.766,1,2020-01-04,2020-01-04,0
21271071,10/10/2020,9/6/2020,61,1259.927,5,2020-10-10,2020-09-06,-34
2127111,1/10/2019,9/24/2019,29,167.737,7,2019-01-10,2019-09-24,257
21272211,1/4/2020,1/4/2020,1,11.559,1,2020-01-04,2020-01-04,0
21275431,1/24/2020,3/5/2020,12,68.343,5,2020-01-24,2020-03-05,41
21275501,1/12/2020,1/12/2020,1,7.685,1,2020-01-12,2020-01-12,0
2127641,7/11/2018,7/11/2018,1,4.483,1,2018-07-11,2018-07-11,0
21277931,1/12/2020,3/8/2020,4,24.623,2,2020-01-12,2020-03-08,56
212783,2/26/2017,2/26/2017,1,6.977,1,2017-02-26,2017-02-26,0
21279201,1/5/2020,1/5/2020,1,14.715,1,2020-01-05,2020-01-05,0
21279451,1/5/2020,1/5/2020,1,4.272,1,2020-01-05,2020-01-05,0
21280801,1/11/2020,3/15/2020,4,93.598,2,2020-01-11,2020-03-15,64
21281311,1/26/2020,2/2/2020,2,42.609,2,2020-01-26,2020-02-02,7
21282641,10/10/2020,10/10/2020,1,5.941,1,2020-10-10,2020-10-10,0
21282921,1/20/2020,1/20/2020,1,3.972,1,2020-01-20,2020-01-20,0
21283881,2/25/2020,2/25/2020,1,66.959,1,2020-02-25,2020-02-25,0
2128501,5/12/2018,5/12/2018,1,2.643,1,2018-05-12,2018-05-12,0
212851,2/13/2018,4/20/2018,3,13.589,3,2018-02-13,2018-04-20,66
21285211,1/16/2020,3/24/2020,6,26.079,2,2020-01-16,2020-03-24,68
21286231,1/26/2020,1/26/2020,1,5.283,1,2020-01-26,2020-01-26,0
212921,7/13/2018,7/13/2018,1,6.859,1,2018-07-13,2018-07-13,0
212929,10/1/2017,10/1/2017,1,6.209,1,2017-10-01,2017-10-01,0
21294151,3/4/2020,3/4/2020,1,18.258,1,2020-03-04,2020-03-04,0
2129441,1/16/2019,9/5/2018,12,69.605,2,2019-01-16,2018-09-05,-133
21294881,1/15/2020,3/9/2020,23,538.464,3,2020-01-15,2020-03-09,54
21298021,10/16/2020,10/16/2020,1,15.762,1,2020-10-16,2020-10-16,0
21299491,2/19/2020,2/19/2020,1,1.973,1,2020-02-19,2020-02-19,0
21300621,1/15/2020,1/29/2020,3,13.455,2,2020-01-15,2020-01-29,14
213015,4/7/2018,4/7/2018,1,9.016,1,2018-04-07,2018-04-07,0
21302311,1/24/2020,3/5/2020,4,253.382,2,2020-01-24,2020-03-05,41
2130271,9/9/2018,9/9/2018,1,1.859,1,2018-09-09,2018-09-09,0
213037,1/9/2017,9/6/2016,55,230.69141100000002,16,2017-01-09,2016-09-06,-125
21303711,1/10/2020,8/25/2020,49,782.407,7,2020-01-10,2020-08-25,228
21306461,1/11/2020,9/21/2020,24,141.206,5,2020-01-11,2020-09-21,254
21306571,11/20/2020,8/30/2020,3,52.077,2,2020-11-20,2020-08-30,-82
21307261,1/9/2020,1/9/2020,1,22.244,1,2020-01-09,2020-01-09,0
21308101,1/19/2020,1/19/2020,1,7.507,1,2020-01-19,2020-01-19,0
21309101,10/11/2020,8/8/2020,5,26.21,3,2020-10-11,2020-08-08,-64
213101,6/9/2019,8/3/2017,2,11.798,1,2019-06-09,2017-08-03,-675
21313171,1/11/2020,1/18/2020,2,10.532,2,2020-01-11,2020-01-18,7
21313521,1/13/2020,3/9/2020,39,603.861,5,2020-01-13,2020-03-09,56
21313661,1/11/2020,1/11/2020,1,2.73,1,2020-01-11,2020-01-11,0
21316491,7/17/2020,7/17/2020,1,3.949,1,2020-07-17,2020-07-17,0
2131691,5/3/2019,5/3/2019,1,19.691000000000003,1,2019-05-03,2019-05-03,0
2131701,1/13/2019,9/28/2018,50,518.395,4,2019-01-13,2018-09-28,-107
2131851,9/13/2018,9/13/2018,1,4.928,1,2018-09-13,2018-09-13,0
213207,10/12/2016,2/14/2017,2,10.927326,2,2016-10-12,2017-02-14,125
21323501,1/29/2020,2/27/2020,2,9.382000000000001,2,2020-01-29,2020-02-27,29
2132441,7/20/2018,7/20/2018,1,14.574,1,2018-07-20,2018-07-20,0
213255,1/10/2018,9/27/2017,40,128.444,5,2018-01-10,2017-09-27,-105
213273,11/10/2018,9/5/2018,17,218.378,5,2018-11-10,2018-09-05,-66
2132951,1/10/2019,9/9/2019,262,2613.471,11,2019-01-10,2019-09-09,242
21330921,1/13/2020,3/2/2020,8,68.579,4,2020-01-13,2020-03-02,49
213311,2/24/2018,4/6/2018,3,27.708,3,2018-02-24,2018-04-06,41
2133331,7/1/2018,7/1/2018,1,27.363,1,2018-07-01,2018-07-01,0
2133361,6/2/2018,6/2/2018,1,11.863,1,2018-06-02,2018-06-02,0
213345,6/22/2019,6/22/2019,1,6.288,1,2019-06-22,2019-06-22,0
21334841,1/12/2020,1/12/2020,1,16.326,1,2020-01-12,2020-01-12,0
21335331,1/14/2020,9/8/2020,41,748.345,4,2020-01-14,2020-09-08,238
21336631,1/15/2020,3/10/2020,5,48.215,4,2020-01-15,2020-03-10,55
21338441,1/14/2020,2/5/2020,4,18.419,4,2020-01-14,2020-02-05,22
2133951,4/11/2019,4/11/2019,1,1.872,1,2019-04-11,2019-04-11,0
21340501,1/13/2020,1/13/2020,1,12.839,1,2020-01-13,2020-01-13,0
21342311,6/27/2020,6/27/2020,1,9.307,1,2020-06-27,2020-06-27,0
21342421,1/22/2020,3/9/2020,21,135.399,5,2020-01-22,2020-03-09,47
213427,1/20/2018,1/20/2018,1,5.059,1,2018-01-20,2018-01-20,0
21344381,2/15/2020,3/14/2020,2,7.6530000000000005,1,2020-02-15,2020-03-14,28
21345051,5/25/2020,5/25/2020,1,16.187,1,2020-05-25,2020-05-25,0
213459,11/10/2020,11/10/2020,1,8.17,1,2020-11-10,2020-11-10,0
21347181,1/13/2020,1/13/2020,1,3.114,1,2020-01-13,2020-01-13,0
213485,1/21/2017,9/28/2017,36,409.047248,7,2017-01-21,2017-09-28,250
21348691,2/24/2020,2/24/2020,1,1.013,1,2020-02-24,2020-02-24,0
21352591,1/14/2020,9/2/2020,21,185.789,5,2020-01-14,2020-09-02,232
21353781,2/12/2020,2/12/2020,1,6.302,1,2020-02-12,2020-02-12,0
21354161,2/3/2020,2/3/2020,1,11.39,1,2020-02-03,2020-02-03,0
2135461,7/24/2019,7/24/2019,1,6.798,1,2019-07-24,2019-07-24,0
21358301,1/15/2020,2/7/2020,2,5.697,2,2020-01-15,2020-02-07,23
21358641,2/2/2020,2/2/2020,1,1.579,1,2020-02-02,2020-02-02,0
21361801,1/19/2020,12/19/2020,2,11.16,2,2020-01-19,2020-12-19,335
2136251,1/10/2019,8/2/2018,4,17.123,3,2019-01-10,2018-08-02,-161
21365261,2/13/2020,2/13/2020,1,7.153,1,2020-02-13,2020-02-13,0
21366661,1/26/2020,2/7/2020,5,59.069,5,2020-01-26,2020-02-07,12
21367851,3/15/2020,3/15/2020,1,9.515,1,2020-03-15,2020-03-15,0
21368691,1/16/2020,6/21/2020,5,30.75,4,2020-01-16,2020-06-21,157
21369831,1/23/2020,7/27/2020,21,257.872,6,2020-01-23,2020-07-27,186
2137041,10/27/2019,10/27/2019,1,5.291,1,2019-10-27,2019-10-27,0
21371291,1/17/2020,3/4/2020,3,20.771,3,2020-01-17,2020-03-04,47
2137231,2/4/2020,8/7/2019,4,30.216,4,2020-02-04,2019-08-07,-181
21373281,1/18/2020,1/21/2020,2,14.158,2,2020-01-18,2020-01-21,3
2137371,1/11/2019,8/14/2019,14,49.592,8,2019-01-11,2019-08-14,215
213739,1/13/2017,9/9/2016,145,1358.6611110000001,12,2017-01-13,2016-09-09,-126
21374571,1/17/2020,1/17/2020,1,28.559,1,2020-01-17,2020-01-17,0
21374631,9/17/2020,9/17/2020,1,25.444,1,2020-09-17,2020-09-17,0
21375481,7/31/2020,9/27/2020,2,5.3580000000000005,1,2020-07-31,2020-09-27,58
21377161,3/5/2020,3/5/2020,1,0.176,1,2020-03-05,2020-03-05,0
2137881,1/10/2019,9/27/2018,17,207.013,8,2019-01-10,2018-09-27,-105
213801,1/9/2017,7/5/2017,13,44.326,7,2017-01-09,2017-07-05,177
2138221,2/10/2019,8/9/2018,5,55.261,3,2019-02-10,2018-08-09,-185
21382631,1/19/2020,9/29/2020,3,14.336,2,2020-01-19,2020-09-29,254
2138351,2/26/2020,2/26/2020,1,9.934,1,2020-02-26,2020-02-26,0
2138401,10/5/2018,10/5/2018,1,3.715,1,2018-10-05,2018-10-05,0
21384961,1/20/2020,9/20/2020,19,84.142,4,2020-01-20,2020-09-20,244
21386421,7/25/2020,7/25/2020,1,3.369,1,2020-07-25,2020-07-25,0
21390461,11/22/2020,9/7/2020,10,51.986,3,2020-11-22,2020-09-07,-76
213905,10/7/2019,7/27/2018,3,29.78,2,2019-10-07,2018-07-27,-437
21391321,1/19/2020,1/19/2020,1,5.476,1,2020-01-19,2020-01-19,0
21394451,2/16/2020,3/7/2020,2,22.387999999999998,2,2020-02-16,2020-03-07,20
21396501,1/20/2020,1/20/2020,1,8.644,1,2020-01-20,2020-01-20,0
21398511,1/26/2020,2/13/2020,7,31.215,6,2020-01-26,2020-02-13,18
21399071,2/12/2020,2/7/2020,2,26.658,1,2020-02-12,2020-02-07,-5
2139911,5/25/2018,9/28/2018,3,15.353,3,2018-05-25,2018-09-28,126
214009,1/4/2018,8/14/2017,2,22.331,2,2018-01-04,2017-08-14,-143
214011,7/22/2018,7/22/2018,1,7.484,1,2018-07-22,2018-07-22,0
2140531,12/20/2018,6/22/2018,2,2.0149999999999997,2,2018-12-20,2018-06-22,-181
21406691,2/10/2020,3/5/2020,9,86.60300000000001,1,2020-02-10,2020-03-05,24
2140761,1/17/2020,9/4/2019,35,241.242,9,2020-01-17,2019-09-04,-135
2140911,11/25/2019,12/12/2019,2,34.217,2,2019-11-25,2019-12-12,17
2141491,1/9/2019,6/11/2018,3,28.92,3,2019-01-09,2018-06-11,-212
21415941,1/23/2020,1/23/2020,1,17.748,1,2020-01-23,2020-01-23,0
2141621,6/2/2018,6/2/2018,1,23.193,1,2018-06-02,2018-06-02,0
21417751,1/23/2020,1/23/2020,1,5.166,1,2020-01-23,2020-01-23,0
21418431,2/19/2020,2/19/2020,1,9.749,1,2020-02-19,2020-02-19,0
214185,10/25/2016,12/9/2016,3,26.410994,3,2016-10-25,2016-12-09,45
21418611,2/28/2020,2/28/2020,1,11.894,1,2020-02-28,2020-02-28,0
21419751,1/30/2020,1/30/2020,1,0.079,1,2020-01-30,2020-01-30,0
21420921,10/29/2020,9/8/2020,36,228.264,5,2020-10-29,2020-09-08,-51
214223,8/22/2018,9/20/2018,2,7.127000000000001,2,2018-08-22,2018-09-20,29
21423201,1/24/2020,1/24/2020,1,18.952,1,2020-01-24,2020-01-24,0
21425161,1/25/2020,1/25/2020,1,0.865,1,2020-01-25,2020-01-25,0
214259,9/18/2018,9/21/2018,3,11.925,3,2018-09-18,2018-09-21,3
2142601,12/2/2019,8/17/2019,6,46.02,3,2019-12-02,2019-08-17,-107
21426631,8/21/2020,8/21/2020,1,7.424,1,2020-08-21,2020-08-21,0
214305,10/11/2016,9/29/2016,12,118.44053,4,2016-10-11,2016-09-29,-12
21430561,1/25/2020,2/1/2020,2,31.308,2,2020-01-25,2020-02-01,7
214329,11/2/2017,9/12/2017,3,27.487214,3,2017-11-02,2017-09-12,-51
21433061,9/25/2020,9/25/2020,1,26.251,1,2020-09-25,2020-09-25,0
21433721,2/22/2020,4/29/2020,7,359.133,4,2020-02-22,2020-04-29,67
21433821,1/26/2020,6/7/2020,2,8.024000000000001,2,2020-01-26,2020-06-07,133
2143391,1/18/2019,1/18/2019,1,2.241,1,2019-01-18,2019-01-18,0
2143571,11/6/2019,11/6/2019,1,11.02,1,2019-11-06,2019-11-06,0
214373,11/11/2016,9/30/2016,6,38.563487,2,2016-11-11,2016-09-30,-42
21439181,1/26/2020,7/16/2020,2,9.682,1,2020-01-26,2020-07-16,172
21440141,5/21/2020,5/21/2020,1,3.715,1,2020-05-21,2020-05-21,0
21440241,6/26/2020,7/8/2020,2,17.433,2,2020-06-26,2020-07-08,12
21440541,3/6/2020,3/7/2020,2,7.136,2,2020-03-06,2020-03-07,1
214447,1/25/2020,9/7/2020,13,72.893,9,2020-01-25,2020-09-07,226
21444771,2/26/2020,2/26/2020,1,0.901,1,2020-02-26,2020-02-26,0
21444971,1/27/2020,2/6/2020,6,112.118,1,2020-01-27,2020-02-06,10
21446521,1/27/2020,1/27/2020,1,4.1,1,2020-01-27,2020-01-27,0
21446861,2/21/2020,2/21/2020,1,4.85,1,2020-02-21,2020-02-21,0
21447601,1/27/2020,3/5/2020,10,91.473,5,2020-01-27,2020-03-05,38
21448591,2/1/2020,2/1/2020,1,1.031,1,2020-02-01,2020-02-01,0
21455551,1/28/2020,1/28/2020,1,5.818,1,2020-01-28,2020-01-28,0
21456981,1/29/2020,2/4/2020,2,2.966,2,2020-01-29,2020-02-04,6
21457641,1/31/2020,9/9/2020,136,365.794,4,2020-01-31,2020-09-09,222
21459651,2/6/2020,8/15/2020,7,189.295,3,2020-02-06,2020-08-15,191
21467791,2/14/2020,2/14/2020,1,3.56,1,2020-02-14,2020-02-14,0
214705,8/12/2017,8/8/2017,3,13.445,2,2017-08-12,2017-08-08,-4
214711,1/26/2017,8/16/2018,11,93.304805,5,2017-01-26,2018-08-16,567
214735,9/10/2018,9/10/2018,1,10.001,1,2018-09-10,2018-09-10,0
21473551,10/23/2020,8/22/2020,2,25.738999999999997,2,2020-10-23,2020-08-22,-62
214743,8/4/2019,8/4/2019,1,4.262,1,2019-08-04,2019-08-04,0
21476071,3/8/2020,3/8/2020,1,10.277,1,2020-03-08,2020-03-08,0
21484581,2/1/2020,2/1/2020,1,11.414,1,2020-02-01,2020-02-01,0
21485181,10/12/2020,9/4/2020,168,1260.206,13,2020-10-12,2020-09-04,-38
21489161,3/14/2020,3/14/2020,1,3.337,1,2020-03-14,2020-03-14,0
21491931,8/18/2020,9/7/2020,2,5.83,1,2020-08-18,2020-09-07,20
21492231,3/7/2020,7/3/2020,2,9.007,2,2020-03-07,2020-07-03,118
21494811,6/28/2020,6/28/2020,1,17.247,1,2020-06-28,2020-06-28,0
2149541,12/11/2018,12/11/2018,1,3.472,1,2018-12-11,2018-12-11,0
2149861,1/10/2019,9/9/2018,72,379.362,11,2019-01-10,2018-09-09,-123
21498621,3/1/2020,3/2/2020,2,12.742,1,2020-03-01,2020-03-02,1
2150531,6/15/2019,9/28/2019,2,16.669,1,2019-06-15,2019-09-28,105
21506561,2/15/2020,2/15/2020,1,3.727,1,2020-02-15,2020-02-15,0
21506831,2/5/2020,2/5/2020,1,5.979,1,2020-02-05,2020-02-05,0
21509491,2/23/2020,7/30/2020,7,68.38199999999999,1,2020-02-23,2020-07-30,158
21514771,10/17/2020,12/26/2020,3,18.103,3,2020-10-17,2020-12-26,70
2151561,5/16/2018,6/6/2018,7,41.743,2,2018-05-16,2018-06-06,21
2151581,10/25/2018,9/25/2018,9,169.864,4,2018-10-25,2018-09-25,-30
215167,11/4/2018,11/6/2016,2,2.564,2,2018-11-04,2016-11-06,-728
215193,1/14/2020,9/2/2019,2,25.871,2,2020-01-14,2019-09-02,-134
2151941,6/26/2018,6/26/2018,1,2.637,1,2018-06-26,2018-06-26,0
21520291,10/12/2020,9/29/2020,28,144.30100000000002,5,2020-10-12,2020-09-29,-13
21522251,6/11/2020,6/11/2020,1,7.475,1,2020-06-11,2020-06-11,0
21523271,2/7/2020,2/7/2020,1,5.317,1,2020-02-07,2020-02-07,0
21523551,2/11/2020,2/23/2020,2,4.543,2,2020-02-11,2020-02-23,12
21524151,2/10/2020,2/10/2020,1,6.352,1,2020-02-10,2020-02-10,0
2152641,2/23/2019,9/28/2019,6,57.006,6,2019-02-23,2019-09-28,217
21528051,2/8/2020,2/8/2020,1,1.885,1,2020-02-08,2020-02-08,0
215287,12/28/2019,12/28/2019,1,7.014,1,2019-12-28,2019-12-28,0
2153031,1/7/2020,8/23/2019,3,40.461,3,2020-01-07,2019-08-23,-137
21531501,2/17/2020,3/8/2020,2,16.84,2,2020-02-17,2020-03-08,20
21531561,2/11/2020,2/8/2020,2,7.522,2,2020-02-11,2020-02-08,-3
21531981,5/15/2020,5/15/2020,1,15.218,1,2020-05-15,2020-05-15,0
21537011,3/4/2020,3/4/2020,1,2.878,1,2020-03-04,2020-03-04,0
215423,1/13/2017,9/14/2016,11,54.09896,6,2017-01-13,2016-09-14,-121
2154241,5/17/2018,5/17/2018,1,13.461,1,2018-05-17,2018-05-17,0
215461,8/17/2018,8/18/2018,2,15.559000000000001,2,2018-08-17,2018-08-18,1
215463,8/28/2016,8/28/2016,1,2.331416,1,2016-08-28,2016-08-28,0
21549221,8/28/2020,8/28/2020,1,12.304,1,2020-08-28,2020-08-28,0
21549771,2/25/2020,2/25/2020,1,6.035,1,2020-02-25,2020-02-25,0
215525,1/28/2017,9/10/2016,7,38.613808,6,2017-01-28,2016-09-10,-140
21557891,2/13/2020,2/14/2020,2,15.83,2,2020-02-13,2020-02-14,1
2155841,12/12/2018,6/7/2019,4,30.041999999999998,4,2018-12-12,2019-06-07,177
215593,5/10/2017,5/10/2017,1,7.931,1,2017-05-10,2017-05-10,0
2155941,3/6/2019,3/6/2019,1,4.417,1,2019-03-06,2019-03-06,0
21559411,10/2/2020,7/17/2020,2,8.961,2,2020-10-02,2020-07-17,-77
2156021,1/1/2019,1/1/2019,1,3.972,1,2019-01-01,2019-01-01,0
2156061,1/14/2019,9/6/2018,70,297.717,15,2019-01-14,2018-09-06,-130
21566951,2/14/2020,2/18/2020,2,51.188,1,2020-02-14,2020-02-18,4
215679,5/20/2018,6/27/2017,3,17.503,3,2018-05-20,2017-06-27,-327
21569561,3/11/2020,3/11/2020,1,2.794,1,2020-03-11,2020-03-11,0
215707,9/20/2018,9/20/2018,1,1.604,1,2018-09-20,2018-09-20,0
215713,12/17/2019,12/17/2019,1,3.232,1,2019-12-17,2019-12-17,0
21572131,2/14/2020,2/14/2020,1,8.758,1,2020-02-14,2020-02-14,0
21572231,2/14/2020,2/14/2020,1,4.047,1,2020-02-14,2020-02-14,0
215725,1/7/2017,12/9/2016,2,5.178,2,2017-01-07,2016-12-09,-29
215733,5/6/2017,5/6/2017,1,5.861,1,2017-05-06,2017-05-06,0
215785,1/12/2017,9/9/2016,68,408.878641,5,2017-01-12,2016-09-09,-125
21579341,3/11/2020,9/15/2020,3,13.844,2,2020-03-11,2020-09-15,188
21580491,2/15/2020,2/15/2020,1,4.197,1,2020-02-15,2020-02-15,0
21585051,2/16/2020,2/16/2020,1,4.096,1,2020-02-16,2020-02-16,0
215855,12/30/2016,12/30/2016,1,8.515,1,2016-12-30,2016-12-30,0
2158621,10/6/2019,9/21/2019,3,21.308,2,2019-10-06,2019-09-21,-15
21586441,2/16/2020,2/16/2020,1,2.388,1,2020-02-16,2020-02-16,0
215883,3/28/2018,3/28/2018,1,7.127,1,2018-03-28,2018-03-28,0
21588601,3/10/2020,3/11/2020,2,11.261,1,2020-03-10,2020-03-11,1
21590801,3/3/2020,3/3/2020,1,1.12,1,2020-03-03,2020-03-03,0
215913,11/22/2016,11/22/2016,1,8.283,1,2016-11-22,2016-11-22,0
215915,12/19/2017,12/19/2017,1,6.054,1,2017-12-19,2017-12-19,0
21592131,2/17/2020,2/17/2020,1,4.032,1,2020-02-17,2020-02-17,0
21593181,8/6/2020,8/6/2020,1,7.938,1,2020-08-06,2020-08-06,0
2159551,6/14/2019,6/14/2019,1,4.85,1,2019-06-14,2019-06-14,0
21597811,9/9/2020,9/9/2020,1,4.925,1,2020-09-09,2020-09-09,0
2159871,5/24/2018,5/24/2018,1,7.297,1,2018-05-24,2018-05-24,0
21598991,2/27/2020,2/27/2020,1,2.452,1,2020-02-27,2020-02-27,0
21601291,3/12/2020,7/21/2020,5,44.813,2,2020-03-12,2020-07-21,131
21603421,2/21/2020,2/21/2020,1,5.02,1,2020-02-21,2020-02-21,0
21603991,7/20/2020,9/19/2020,4,20.676000000000002,1,2020-07-20,2020-09-19,61
21604201,2/19/2020,2/19/2020,1,15.46,1,2020-02-19,2020-02-19,0
216045,1/28/2020,8/17/2016,2,14.791046000000001,2,2020-01-28,2016-08-17,-1259
21607151,2/19/2020,2/19/2020,1,11.455,1,2020-02-19,2020-02-19,0
21608381,3/7/2020,7/3/2020,5,23.217,4,2020-03-07,2020-07-03,118
216087,6/20/2018,6/20/2018,1,9.588,1,2018-06-20,2018-06-20,0
21608771,3/4/2020,6/19/2020,3,26.581000000000003,3,2020-03-04,2020-06-19,107
21610111,10/29/2020,10/29/2020,1,3.021,1,2020-10-29,2020-10-29,0
21611165,3/5/2020,3/5/2020,1,12.224,1,2020-03-05,2020-03-05,0
2161371,5/18/2018,5/18/2018,3,34.446,3,2018-05-18,2018-05-18,0
21614861,10/18/2020,2/26/2020,5,59.307,4,2020-10-18,2020-02-26,-235
216149,11/25/2018,11/25/2018,1,5.439,1,2018-11-25,2018-11-25,0
216157,12/10/2017,12/10/2017,1,14.125,1,2017-12-10,2017-12-10,0
216165,1/31/2017,7/10/2017,2,21.004,2,2017-01-31,2017-07-10,160
2161951,5/4/2019,8/24/2019,2,18.116,2,2019-05-04,2019-08-24,112
216203,11/11/2019,9/9/2016,2,4.068327,2,2019-11-11,2016-09-09,-1158
216209,11/17/2017,11/17/2017,1,2.443,1,2017-11-17,2017-11-17,0
21625541,2/23/2020,4/29/2020,2,13.629,2,2020-02-23,2020-04-29,66
216259,6/22/2018,6/22/2018,1,3.825,1,2018-06-22,2018-06-22,0
2162641,9/29/2019,9/29/2019,1,5.261,1,2019-09-29,2019-09-29,0
2163281,10/25/2018,9/15/2018,29,300.485,5,2018-10-25,2018-09-15,-40
216343,12/18/2018,2/3/2017,2,6.1419999999999995,2,2018-12-18,2017-02-03,-683
21636591,2/27/2020,2/27/2020,1,8.092,1,2020-02-27,2020-02-27,0
21637581,11/1/2020,11/1/2020,1,9.337,1,2020-11-01,2020-11-01,0
21638191,3/7/2020,3/7/2020,1,9.437,1,2020-03-07,2020-03-07,0
216409,1/2/2017,7/30/2019,7,15.508,3,2017-01-02,2019-07-30,939
21642461,3/5/2020,3/5/2020,1,13.037,1,2020-03-05,2020-03-05,0
21642831,3/8/2020,3/8/2020,1,10.894,1,2020-03-08,2020-03-08,0
21644271,3/14/2020,8/2/2020,4,54.28,4,2020-03-14,2020-08-02,141
2164461,12/14/2019,6/7/2019,4,14.956,4,2019-12-14,2019-06-07,-190
2164761,1/28/2019,4/6/2019,7,41.255,5,2019-01-28,2019-04-06,68
216485,6/26/2019,6/26/2019,1,7.144,1,2019-06-26,2019-06-26,0
216491,1/13/2017,9/26/2016,43,464.890024,8,2017-01-13,2016-09-26,-109
21649961,2/25/2020,2/25/2020,1,18.509,1,2020-02-25,2020-02-25,0
21653681,10/11/2020,10/11/2020,1,20.301,1,2020-10-11,2020-10-11,0
2165471,11/27/2018,11/27/2018,1,18.614,1,2018-11-27,2018-11-27,0
21656221,9/27/2020,9/27/2020,1,1.7,1,2020-09-27,2020-09-27,0
21657491,11/7/2020,11/7/2020,1,10.42,1,2020-11-07,2020-11-07,0
21660491,2/27/2020,2/27/2020,1,13.415,1,2020-02-27,2020-02-27,0
216625,2/3/2018,2/3/2018,1,5.719,1,2018-02-03,2018-02-03,0
21662561,9/5/2020,9/5/2020,1,7.696,1,2020-09-05,2020-09-05,0
216641,8/29/2017,8/29/2017,1,13.777,1,2017-08-29,2017-08-29,0
216663,1/29/2019,2/1/2019,4,38.42,2,2019-01-29,2019-02-01,3
2166791,1/14/2020,9/9/2019,42,453.62,10,2020-01-14,2019-09-09,-127
216733,7/21/2019,7/21/2019,1,2.452,1,2019-07-21,2019-07-21,0
2167631,2/29/2020,7/3/2020,3,17.747999999999998,2,2020-02-29,2020-07-03,125
2167691,5/19/2018,5/19/2018,1,5.999,1,2018-05-19,2018-05-19,0
21678221,3/7/2020,3/7/2020,1,0.956,1,2020-03-07,2020-03-07,0
216813,10/29/2016,8/20/2016,5,35.767518,4,2016-10-29,2016-08-20,-70
21683171,8/13/2020,8/13/2020,1,5.719,1,2020-08-13,2020-08-13,0
216835,11/4/2016,3/21/2018,2,11.826,2,2016-11-04,2018-03-21,502
21683521,6/28/2020,6/28/2020,1,10.076,1,2020-06-28,2020-06-28,0
216883,10/17/2016,10/17/2016,1,2.508841,1,2016-10-17,2016-10-17,0
2168961,8/14/2019,8/14/2019,1,6.625,1,2019-08-14,2019-08-14,0
21694561,12/19/2020,3/7/2020,3,6.309,3,2020-12-19,2020-03-07,-287
216951,7/22/2018,7/22/2018,1,8.568,1,2018-07-22,2018-07-22,0
2169621,11/4/2018,9/2/2018,2,29.666,2,2018-11-04,2018-09-02,-63
21700391,6/26/2020,6/26/2020,1,14.644,1,2020-06-26,2020-06-26,0
21704031,3/10/2020,3/6/2020,3,48.191,3,2020-03-10,2020-03-06,-4
21704071,3/4/2020,3/4/2020,1,23.0,1,2020-03-04,2020-03-04,0
217075,6/27/2018,6/27/2018,1,3.252,1,2018-06-27,2018-06-27,0
217089,10/1/2017,9/27/2018,12,43.675444,6,2017-10-01,2018-09-27,361
21713531,12/3/2020,12/3/2020,1,14.884,1,2020-12-03,2020-12-03,0
217201,12/17/2019,12/17/2019,1,8.971,1,2019-12-17,2019-12-17,0
21720271,3/8/2020,3/8/2020,1,0.316,1,2020-03-08,2020-03-08,0
21720531,11/26/2020,11/27/2020,2,35.893,1,2020-11-26,2020-11-27,1
217213,12/18/2016,12/18/2016,1,6.325,1,2016-12-18,2016-12-18,0
217227,6/17/2018,8/27/2017,3,10.824,2,2018-06-17,2017-08-27,-294
21732871,10/25/2020,8/28/2020,3,19.79,3,2020-10-25,2020-08-28,-58
217371,12/13/2016,12/13/2016,1,1.218,1,2016-12-13,2016-12-13,0
2173721,8/18/2018,8/18/2018,1,1.734,1,2018-08-18,2018-08-18,0
2173731,11/7/2019,8/22/2019,4,87.459,2,2019-11-07,2019-08-22,-77
2173791,8/17/2019,8/17/2019,1,15.407,1,2019-08-17,2019-08-17,0
2174081,9/29/2018,9/29/2018,1,4.341,1,2018-09-29,2018-09-29,0
2174271,10/13/2018,8/4/2019,9,30.077,4,2018-10-13,2019-08-04,295
217429,2/25/2017,2/25/2017,1,4.933,1,2017-02-25,2017-02-25,0
217441,1/26/2019,4/23/2017,2,11.252,1,2019-01-26,2017-04-23,-643
21744911,3/10/2020,3/10/2020,1,18.812,1,2020-03-10,2020-03-10,0
21745361,11/15/2020,8/28/2020,2,21.412,1,2020-11-15,2020-08-28,-79
217457,9/30/2017,9/30/2017,1,2.058,1,2017-09-30,2017-09-30,0
2174571,10/7/2019,10/7/2019,1,7.179,1,2019-10-07,2019-10-07,0
217469,10/14/2018,3/11/2019,4,17.474,3,2018-10-14,2019-03-11,148
217495,1/11/2017,9/13/2017,13,22.41261,2,2017-01-11,2017-09-13,245
2175091,12/18/2018,12/18/2018,1,15.605,1,2018-12-18,2018-12-18,0
21751481,11/25/2020,12/5/2020,2,9.081,1,2020-11-25,2020-12-05,10
217523,1/10/2017,9/9/2016,29,144.629029,5,2017-01-10,2016-09-09,-123
21756421,3/13/2020,3/16/2020,2,43.955,2,2020-03-13,2020-03-16,3
21757591,10/14/2020,10/22/2020,2,7.071999999999999,2,2020-10-14,2020-10-22,8
217611,10/13/2016,4/23/2017,7,25.690229,5,2016-10-13,2017-04-23,192
21766681,3/14/2020,3/14/2020,1,14.437,1,2020-03-14,2020-03-14,0
21767651,4/13/2020,7/23/2020,16,294.406,3,2020-04-13,2020-07-23,101
217693,1/10/2017,9/9/2016,140,1977.68203,11,2017-01-10,2016-09-09,-123
2177281,8/25/2018,8/25/2018,1,9.629,1,2018-08-25,2018-08-25,0
21773311,8/15/2020,8/15/2020,1,15.713,1,2020-08-15,2020-08-15,0
21773741,8/1/2020,8/1/2020,1,6.34,1,2020-08-01,2020-08-01,0
217757,11/3/2017,11/3/2017,1,6.389,1,2017-11-03,2017-11-03,0
21777601,3/29/2020,4/4/2020,4,20.825,3,2020-03-29,2020-04-04,6
217779,1/31/2017,11/16/2016,2,17.564,2,2017-01-31,2016-11-16,-76
21787431,11/1/2020,9/7/2020,7,278.125,3,2020-11-01,2020-09-07,-55
2178821,2/24/2019,2/24/2019,1,2.609,1,2019-02-24,2019-02-24,0
21788971,3/28/2020,3/28/2020,1,3.019,1,2020-03-28,2020-03-28,0
217893,10/16/2019,10/16/2019,1,9.427,1,2019-10-16,2019-10-16,0
217901,8/16/2016,8/16/2016,1,15.87736,1,2016-08-16,2016-08-16,0
2179121,4/20/2019,8/25/2018,3,10.911999999999999,3,2019-04-20,2018-08-25,-238
217935,11/2/2016,11/2/2016,1,10.127,1,2016-11-02,2016-11-02,0
21794441,12/26/2020,12/26/2020,1,16.345,1,2020-12-26,2020-12-26,0
2179461,11/20/2018,8/7/2018,5,68.347,4,2018-11-20,2018-08-07,-105
21795161,5/13/2020,5/13/2020,1,9.201,1,2020-05-13,2020-05-13,0
217987,9/19/2018,9/19/2018,1,2.859,1,2018-09-19,2018-09-19,0
2179951,7/30/2019,9/13/2019,2,11.454,2,2019-07-30,2019-09-13,45
21803,6/19/2017,6/19/2017,1,6.412,1,2017-06-19,2017-06-19,0
2180531,9/22/2018,9/22/2018,1,4.511,1,2018-09-22,2018-09-22,0
21806021,11/13/2020,6/28/2020,4,34.1,2,2020-11-13,2020-06-28,-138
21807531,7/3/2020,7/3/2020,1,4.318,1,2020-07-03,2020-07-03,0
218077,10/15/2016,9/28/2018,3,30.892141,3,2016-10-15,2018-09-28,713
21809901,8/8/2020,8/8/2020,1,6.491,1,2020-08-08,2020-08-08,0
2181011,7/6/2020,8/23/2019,2,6.833,2,2020-07-06,2019-08-23,-318
21811661,6/24/2020,6/24/2020,1,5.318,1,2020-06-24,2020-06-24,0
2181301,2/28/2019,2/28/2019,1,3.65,1,2019-02-28,2019-02-28,0
218157,12/12/2016,9/15/2020,2,19.967,2,2016-12-12,2020-09-15,1373
218165,12/4/2020,2/19/2020,3,34.604,3,2020-12-04,2020-02-19,-289
218205,1/10/2019,9/7/2018,182,2603.654,10,2019-01-10,2018-09-07,-125
2182531,5/10/2019,5/10/2019,1,10.574,1,2019-05-10,2019-05-10,0
218281,11/23/2016,11/23/2016,1,2.464,1,2016-11-23,2016-11-23,0
218293,1/10/2017,9/8/2016,168,1948.724989,15,2017-01-10,2016-09-08,-124
218309,4/11/2020,4/11/2020,1,21.374,1,2020-04-11,2020-04-11,0
21834021,8/24/2020,8/24/2020,1,5.965,1,2020-08-24,2020-08-24,0
21836591,8/13/2020,9/25/2020,3,28.645,1,2020-08-13,2020-09-25,43
2183661,9/19/2018,9/22/2018,2,13.441,2,2018-09-19,2018-09-22,3
21837361,5/25/2020,8/3/2020,2,16.218,2,2020-05-25,2020-08-03,70
218383,11/2/2019,9/27/2020,3,6.918,3,2019-11-02,2020-09-27,330
2184291,11/8/2019,9/1/2019,5,32.145,4,2019-11-08,2019-09-01,-68
218443,2/19/2020,2/19/2020,1,19.016,1,2020-02-19,2020-02-19,0
21845141,11/12/2020,6/5/2020,7,69.99,4,2020-11-12,2020-06-05,-160
21845691,8/14/2020,8/14/2020,1,5.593,1,2020-08-14,2020-08-14,0
21848261,8/8/2020,8/8/2020,1,12.414,1,2020-08-08,2020-08-08,0
2184951,1/25/2019,1/25/2019,1,12.477,1,2019-01-25,2019-01-25,0
2185141,7/13/2019,7/13/2019,1,2.066,1,2019-07-13,2019-07-13,0
2185211,10/21/2018,10/21/2018,1,6.684,1,2018-10-21,2018-10-21,0
2185291,6/15/2018,6/15/2018,1,4.387,1,2018-06-15,2018-06-15,0
21856201,6/6/2020,6/6/2020,1,5.17,1,2020-06-06,2020-06-06,0
2185681,7/5/2019,7/5/2019,1,3.139,1,2019-07-05,2019-07-05,0
2186311,10/24/2018,10/24/2018,1,5.43,1,2018-10-24,2018-10-24,0
21863771,6/26/2020,6/26/2020,1,4.19,1,2020-06-26,2020-06-26,0
21864971,5/29/2020,5/29/2020,1,6.489,1,2020-05-29,2020-05-29,0
2186641,2/21/2019,4/5/2019,2,19.808,2,2019-02-21,2019-04-05,43
2187751,3/5/2019,3/5/2019,1,2.344,1,2019-03-05,2019-03-05,0
2187991,5/23/2018,5/23/2018,1,6.933,1,2018-05-23,2018-05-23,0
21881991,5/14/2020,6/22/2020,6,70.857,2,2020-05-14,2020-06-22,39
218843,10/14/2017,5/20/2017,7,51.721000000000004,6,2017-10-14,2017-05-20,-147
21886871,10/14/2020,10/6/2020,5,35.028,1,2020-10-14,2020-10-06,-8
218871,6/1/2019,7/15/2018,2,9.963999999999999,1,2019-06-01,2018-07-15,-321
21887181,5/13/2020,5/26/2020,3,36.533,1,2020-05-13,2020-05-26,13
21887191,8/30/2020,8/30/2020,1,7.707,1,2020-08-30,2020-08-30,0
21889821,10/17/2020,10/17/2020,1,4.165,1,2020-10-17,2020-10-17,0
21893621,5/14/2020,5/14/2020,1,14.599,1,2020-05-14,2020-05-14,0
2189481,1/22/2020,1/22/2020,1,7.283,1,2020-01-22,2020-01-22,0
21899541,11/29/2020,12/5/2020,2,6.368,2,2020-11-29,2020-12-05,6
219001,2/19/2017,6/29/2018,2,8.985,2,2017-02-19,2018-06-29,495
21900191,10/12/2020,9/9/2020,46,799.803,8,2020-10-12,2020-09-09,-33
2190081,1/22/2019,8/3/2018,7,41.882,4,2019-01-22,2018-08-03,-172
219011,10/10/2019,4/25/2019,6,29.442,5,2019-10-10,2019-04-25,-168
21901861,5/17/2020,6/7/2020,13,75.397,3,2020-05-17,2020-06-07,21
21907111,5/19/2020,5/19/2020,1,3.063,1,2020-05-19,2020-05-19,0
21907781,10/14/2020,9/6/2020,42,209.446,6,2020-10-14,2020-09-06,-38
219097,12/15/2017,6/29/2017,2,5.035,2,2017-12-15,2017-06-29,-169
21911351,6/21/2020,6/21/2020,1,3.833,1,2020-06-21,2020-06-21,0
21917011,5/23/2020,5/23/2020,1,1.869,1,2020-05-23,2020-05-23,0
21918991,8/8/2020,8/8/2020,1,7.955,1,2020-08-08,2020-08-08,0
219191,4/26/2017,4/26/2017,1,2.568,1,2017-04-26,2017-04-26,0
219203,10/20/2018,10/20/2018,1,5.48,1,2018-10-20,2018-10-20,0
21928061,9/22/2020,9/22/2020,1,3.811,1,2020-09-22,2020-09-22,0
2192861,1/29/2019,11/3/2018,3,44.914,3,2019-01-29,2018-11-03,-87
21929821,10/2/2020,8/8/2020,5,47.065,4,2020-10-02,2020-08-08,-55
21931761,5/28/2020,7/2/2020,5,55.385,2,2020-05-28,2020-07-02,35
21933121,7/2/2020,7/2/2020,1,6.804,1,2020-07-02,2020-07-02,0
21933441,6/26/2020,7/25/2020,2,10.190999999999999,2,2020-06-26,2020-07-25,29
21936281,7/3/2020,7/3/2020,1,16.137,1,2020-07-03,2020-07-03,0
2193631,5/4/2019,8/31/2019,2,5.675,2,2019-05-04,2019-08-31,119
2193851,11/24/2018,11/24/2018,1,3.438,1,2018-11-24,2018-11-24,0
219401,3/15/2017,5/7/2018,2,2.258,2,2017-03-15,2018-05-07,418
21940941,10/17/2020,8/8/2020,12,316.62,2,2020-10-17,2020-08-08,-70
2194141,12/13/2019,7/14/2019,4,54.112,3,2019-12-13,2019-07-14,-152
2194271,6/21/2018,6/21/2018,1,9.975,1,2018-06-21,2018-06-21,0
219487,5/30/2018,5/30/2018,1,7.532,1,2018-05-30,2018-05-30,0
219503,10/5/2018,10/5/2018,1,15.8,1,2018-10-05,2018-10-05,0
2195201,10/30/2018,10/30/2019,2,24.61,2,2018-10-30,2019-10-30,365
2195401,11/24/2020,3/9/2019,2,23.084,2,2020-11-24,2019-03-09,-626
2195451,1/19/2020,9/2/2020,14,142.269,2,2020-01-19,2020-09-02,227
21956231,6/22/2020,6/22/2020,1,4.7,1,2020-06-22,2020-06-22,0
2195871,9/1/2018,9/1/2018,1,4.206,1,2018-09-01,2018-09-01,0
21960121,6/6/2020,6/6/2020,1,7.227,1,2020-06-06,2020-06-06,0
21960601,6/14/2020,6/14/2020,1,9.581,1,2020-06-14,2020-06-14,0
21961401,6/10/2020,6/9/2020,6,44.551,2,2020-06-10,2020-06-09,-1
21965891,6/16/2020,6/8/2020,2,64.709,1,2020-06-16,2020-06-08,-8
21967721,6/30/2020,6/30/2020,1,0.802,1,2020-06-30,2020-06-30,0
219703,5/2/2017,8/31/2016,2,9.246971,2,2017-05-02,2016-08-31,-244
2197191,10/5/2019,6/9/2018,5,17.1,2,2019-10-05,2018-06-09,-483
21973971,10/17/2020,9/26/2020,9,64.647,1,2020-10-17,2020-09-26,-21
2197681,11/21/2018,7/28/2018,2,6.744,2,2018-11-21,2018-07-28,-116
2197701,9/16/2018,9/16/2018,1,12.925,1,2018-09-16,2018-09-16,0
21978551,9/19/2020,9/19/2020,1,8.012,1,2020-09-19,2020-09-19,0
21979921,8/17/2020,8/27/2020,2,1.729,1,2020-08-17,2020-08-27,10
2198421,12/8/2019,12/8/2019,1,3.668,1,2019-12-08,2019-12-08,0
21986311,11/27/2020,11/27/2020,1,5.804,1,2020-11-27,2020-11-27,0
2198971,2/10/2019,9/28/2019,2,15.5,2,2019-02-10,2019-09-28,230
21994301,8/27/2020,8/27/2020,1,1.118,1,2020-08-27,2020-08-27,0
219959,1/17/2019,8/2/2018,2,7.3260000000000005,1,2019-01-17,2018-08-02,-168
2199911,11/2/2018,7/20/2019,3,16.557,3,2018-11-02,2019-07-20,260
219997,10/24/2019,11/29/2018,2,8.936,2,2019-10-24,2018-11-29,-329
2200171,6/1/2018,6/1/2018,1,11.397,1,2018-06-01,2018-06-01,0
22004141,12/17/2020,12/17/2020,1,0.169,1,2020-12-17,2020-12-17,0
220077,9/30/2016,9/30/2016,1,6.083429,1,2016-09-30,2016-09-30,0
2200781,5/3/2019,5/3/2019,1,10.616,1,2019-05-03,2019-05-03,0
2201051,10/2/2020,9/25/2020,6,69.789,2,2020-10-02,2020-09-25,-7
22011451,6/19/2020,6/19/2020,1,1.13,1,2020-06-19,2020-06-19,0
22011741,6/19/2020,6/19/2020,1,2.989,1,2020-06-19,2020-06-19,0
2201321,2/23/2020,3/3/2020,2,20.641,2,2020-02-23,2020-03-03,9
22013441,10/11/2020,10/7/2020,9,31.323,4,2020-10-11,2020-10-07,-4
22016371,6/24/2020,7/2/2020,2,20.999000000000002,2,2020-06-24,2020-07-02,8
2202191,11/5/2019,8/31/2018,3,51.705,3,2019-11-05,2018-08-31,-431
22023,1/16/2019,9/9/2016,5,19.738391,4,2019-01-16,2016-09-09,-859
22023721,10/24/2020,11/1/2020,2,16.991,2,2020-10-24,2020-11-01,8
2202881,11/2/2018,8/18/2018,2,11.11,1,2018-11-02,2018-08-18,-76
22029841,6/23/2020,6/23/2020,1,1.993,1,2020-06-23,2020-06-23,0
2203281,10/12/2018,3/17/2019,4,7.612,3,2018-10-12,2019-03-17,156
22034741,10/1/2020,9/6/2020,28,546.462,6,2020-10-01,2020-09-06,-25
220351,9/6/2016,9/6/2016,1,3.789984,1,2016-09-06,2016-09-06,0
2203581,1/27/2019,9/22/2019,5,26.627,5,2019-01-27,2019-09-22,238
22036151,10/17/2020,9/29/2020,2,17.387999999999998,2,2020-10-17,2020-09-29,-18
2203671,4/14/2019,6/9/2019,2,29.126,1,2019-04-14,2019-06-09,56
2203691,3/12/2020,3/12/2020,1,12.162,1,2020-03-12,2020-03-12,0
22040411,6/25/2020,6/25/2020,1,8.889,1,2020-06-25,2020-06-25,0
2204641,10/12/2018,10/12/2018,1,13.895,1,2018-10-12,2018-10-12,0
22047351,10/11/2020,10/11/2020,1,12.464,1,2020-10-11,2020-10-11,0
220487,6/12/2018,6/12/2018,1,6.576,1,2018-06-12,2018-06-12,0
220593,12/23/2019,6/23/2018,2,37.899,1,2019-12-23,2018-06-23,-548
220603,8/6/2016,8/6/2016,1,5.635465,1,2016-08-06,2016-08-06,0
220611,1/20/2018,6/3/2017,6,59.149,3,2018-01-20,2017-06-03,-231
2206191,8/6/2018,8/9/2018,2,44.748000000000005,2,2018-08-06,2018-08-09,3
22062141,7/18/2020,7/18/2020,1,11.56,1,2020-07-18,2020-07-18,0
2206301,6/18/2018,6/20/2018,2,23.349000000000004,2,2018-06-18,2018-06-20,2
220651,9/25/2017,9/25/2017,1,2.502,1,2017-09-25,2017-09-25,0
220661,12/4/2018,12/4/2018,1,3.548,1,2018-12-04,2018-12-04,0
220679,6/27/2018,6/27/2018,1,2.99,1,2018-06-27,2018-06-27,0
2206971,6/18/2019,7/3/2019,2,7.909000000000001,1,2019-06-18,2019-07-03,15
2207051,4/17/2019,6/1/2018,3,36.632,3,2019-04-17,2018-06-01,-320
220725,8/31/2019,8/31/2019,1,5.16,1,2019-08-31,2019-08-31,0
2207261,1/25/2019,9/7/2018,26,292.434,6,2019-01-25,2018-09-07,-140
2207581,9/3/2018,9/3/2018,1,6.871,1,2018-09-03,2018-09-03,0
220763,10/29/2016,10/29/2016,1,4.682,1,2016-10-29,2016-10-29,0
22077341,8/22/2020,9/19/2020,2,21.522,2,2020-08-22,2020-09-19,28
220791,1/10/2018,3/25/2017,7,23.21,5,2018-01-10,2017-03-25,-291
220811,10/18/2017,9/17/2018,12,83.456,6,2017-10-18,2018-09-17,334
2208451,6/18/2018,6/18/2018,1,10.526,1,2018-06-18,2018-06-18,0
22085131,9/16/2020,9/20/2020,2,13.369,2,2020-09-16,2020-09-20,4
2208551,10/24/2019,9/30/2018,4,38.236000000000004,3,2019-10-24,2018-09-30,-389
220907,1/14/2020,6/9/2019,11,73.573,4,2020-01-14,2019-06-09,-219
22092981,11/19/2020,11/19/2020,1,12.62,1,2020-11-19,2020-11-19,0
22096681,9/19/2020,9/19/2020,1,3.942,1,2020-09-19,2020-09-19,0
22100561,12/1/2020,9/10/2020,3,30.862000000000002,2,2020-12-01,2020-09-10,-82
2210091,6/12/2018,6/12/2018,1,6.703,1,2018-06-12,2018-06-12,0
22100971,7/6/2020,8/10/2020,2,11.343,1,2020-07-06,2020-08-10,35
2210111,8/4/2018,8/4/2018,1,6.339,1,2018-08-04,2018-08-04,0
221023,11/10/2017,8/23/2018,19,38.129776,9,2017-11-10,2018-08-23,286
22102311,7/6/2020,7/6/2020,1,0.955,1,2020-07-06,2020-07-06,0
22103291,7/7/2020,7/7/2020,1,7.251,1,2020-07-07,2020-07-07,0
2210691,9/30/2018,9/30/2018,1,15.715,1,2018-09-30,2018-09-30,0
2210741,2/20/2020,2/6/2020,2,8.167,2,2020-02-20,2020-02-06,-14
221081,1/2/2018,9/9/2017,26,217.266878,7,2018-01-02,2017-09-09,-115
2210881,6/10/2018,6/30/2018,2,8.074,2,2018-06-10,2018-06-30,20
2211251,4/11/2020,9/28/2020,12,273.5,7,2020-04-11,2020-09-28,170
221129,1/29/2019,9/11/2018,4,21.561999999999998,3,2019-01-29,2018-09-11,-140
2211441,7/8/2019,7/8/2019,1,0.855,1,2019-07-08,2019-07-08,0
221159,1/2/2017,1/2/2017,1,6.675,1,2017-01-02,2017-01-02,0
22116441,8/26/2020,8/26/2020,1,9.336,1,2020-08-26,2020-08-26,0
221189,12/5/2017,12/5/2017,1,7.27,1,2017-12-05,2017-12-05,0
22124061,10/13/2020,9/30/2020,56,290.436,3,2020-10-13,2020-09-30,-13
221249,1/12/2018,8/2/2017,3,18.374000000000002,2,2018-01-12,2017-08-02,-163
2212531,11/17/2018,11/20/2018,2,14.987,2,2018-11-17,2018-11-20,3
22125311,7/11/2020,9/19/2020,2,12.463000000000001,1,2020-07-11,2020-09-19,70
2212581,9/9/2018,9/9/2018,1,3.321,1,2018-09-09,2018-09-09,0
22126231,7/11/2020,7/11/2020,1,12.034,1,2020-07-11,2020-07-11,0
2212701,12/24/2019,12/24/2019,1,10.523,1,2019-12-24,2019-12-24,0
221281,11/27/2016,11/27/2016,1,4.811,1,2016-11-27,2016-11-27,0
2212911,8/17/2018,8/17/2018,1,2.679,1,2018-08-17,2018-08-17,0
221301,2/26/2019,2/26/2019,1,8.634,1,2019-02-26,2019-02-26,0
2213131,11/12/2019,9/21/2019,4,44.513,3,2019-11-12,2019-09-21,-52
2213551,9/11/2019,9/11/2019,1,12.998,1,2019-09-11,2019-09-11,0
22140271,9/28/2020,9/28/2020,1,2.15,1,2020-09-28,2020-09-28,0
2214081,4/22/2019,4/22/2019,1,0.63,1,2019-04-22,2019-04-22,0
221433,10/1/2016,8/15/2016,5,5.46336,4,2016-10-01,2016-08-15,-47
22143771,7/28/2020,7/28/2020,1,1.249,1,2020-07-28,2020-07-28,0
22145141,10/1/2020,9/24/2020,2,25.59,2,2020-10-01,2020-09-24,-7
2214631,8/2/2019,8/2/2019,1,1.597,1,2019-08-02,2019-08-02,0
22146671,10/10/2020,8/7/2020,22,173.93800000000002,3,2020-10-10,2020-08-07,-64
2214721,1/11/2019,9/4/2018,37,406.499,11,2019-01-11,2018-09-04,-129
22150171,10/17/2020,9/7/2020,2,29.842,1,2020-10-17,2020-09-07,-40
2215141,10/27/2018,6/19/2018,2,14.321,2,2018-10-27,2018-06-19,-130
2215231,1/26/2020,4/20/2019,4,21.355,3,2020-01-26,2019-04-20,-281
221587,1/2/2017,12/14/2017,4,40.08,4,2017-01-02,2017-12-14,346
22160571,9/6/2020,9/6/2020,1,12.671,1,2020-09-06,2020-09-06,0
22163601,7/19/2020,7/19/2020,1,8.487,1,2020-07-19,2020-07-19,0
22173641,12/20/2020,9/3/2020,4,32.545,2,2020-12-20,2020-09-03,-108
2217421,8/17/2020,8/17/2020,1,2.424,1,2020-08-17,2020-08-17,0
221763,7/24/2017,7/24/2017,1,2.217,1,2017-07-24,2017-07-24,0
22177581,8/13/2020,8/13/2020,1,2.103,1,2020-08-13,2020-08-13,0
2217791,10/1/2018,7/28/2019,9,46.873,6,2018-10-01,2019-07-28,300
221835,12/13/2016,12/13/2016,1,2.311,1,2016-12-13,2016-12-13,0
2218601,12/16/2019,12/16/2019,1,12.913,1,2019-12-16,2019-12-16,0
22187171,7/30/2020,7/30/2020,1,1.727,1,2020-07-30,2020-07-30,0
22189341,9/18/2020,9/18/2020,1,3.856,1,2020-09-18,2020-09-18,0
22189641,7/24/2020,7/24/2020,1,21.712,1,2020-07-24,2020-07-24,0
221919,1/3/2018,4/21/2019,5,26.240472,3,2018-01-03,2019-04-21,473
22192131,9/7/2020,9/7/2020,1,8.461,1,2020-09-07,2020-09-07,0
221935,3/8/2018,3/8/2018,1,1.863,1,2018-03-08,2018-03-08,0
221987,10/5/2017,9/7/2017,2,8.634,2,2017-10-05,2017-09-07,-28
22199431,8/12/2020,8/12/2020,1,4.011,1,2020-08-12,2020-08-12,0
2219991,11/3/2018,11/3/2018,1,3.879,1,2018-11-03,2018-11-03,0
2220151,1/31/2020,2/4/2020,2,27.355,2,2020-01-31,2020-02-04,4
2220211,5/28/2018,5/28/2018,1,7.314,1,2018-05-28,2018-05-28,0
2220241,6/19/2018,7/5/2018,3,17.391,3,2018-06-19,2018-07-05,16
22208101,10/12/2020,9/4/2020,26,258.058,5,2020-10-12,2020-09-04,-38
2220891,10/1/2019,5/3/2019,2,41.372,1,2019-10-01,2019-05-03,-151
22210431,9/7/2020,9/7/2020,1,25.149,1,2020-09-07,2020-09-07,0
222133,6/11/2017,6/11/2017,1,3.896,1,2017-06-11,2017-06-11,0
2221831,10/12/2019,9/15/2018,2,16.865000000000002,2,2019-10-12,2018-09-15,-392
222185,6/23/2019,6/23/2019,1,6.986,1,2019-06-23,2019-06-23,0
2221921,12/21/2018,7/16/2018,5,65.985,2,2018-12-21,2018-07-16,-158
2222351,1/4/2019,9/28/2019,5,14.655000000000001,2,2019-01-04,2019-09-28,267
2222791,10/14/2019,6/8/2018,8,44.085,6,2019-10-14,2018-06-08,-493
222289,6/9/2017,8/10/2016,3,5.8370750000000005,3,2017-06-09,2016-08-10,-303
222301,12/6/2018,12/6/2018,1,15.903,1,2018-12-06,2018-12-06,0
22230531,8/25/2020,8/5/2020,2,23.517000000000003,2,2020-08-25,2020-08-05,-20
22233331,10/8/2020,8/25/2020,3,78.47800000000001,2,2020-10-08,2020-08-25,-44
2223831,1/21/2019,9/7/2019,26,130.294,3,2019-01-21,2019-09-07,229
2224031,11/1/2018,8/2/2019,6,20.279,5,2018-11-01,2019-08-02,274
22240561,8/6/2020,9/16/2020,3,9.145,3,2020-08-06,2020-09-16,41
22242681,10/12/2020,9/20/2020,4,81.071,1,2020-10-12,2020-09-20,-22
22243151,11/21/2020,11/21/2020,1,4.304,1,2020-11-21,2020-11-21,0
2224371,1/3/2020,1/3/2020,1,1.875,1,2020-01-03,2020-01-03,0
2224561,10/31/2018,9/20/2018,4,31.785,4,2018-10-31,2018-09-20,-41
222463,10/18/2018,8/13/2019,6,35.773,4,2018-10-18,2019-08-13,299
222481,9/2/2019,9/2/2019,1,9.958,1,2019-09-02,2019-09-02,0
22250221,8/5/2020,9/20/2020,4,29.087,3,2020-08-05,2020-09-20,46
2225621,8/7/2019,8/7/2019,1,6.001,1,2019-08-07,2019-08-07,0
22256751,8/6/2020,8/6/2020,1,13.116999999999999,1,2020-08-06,2020-08-06,0
222581,10/13/2016,11/3/2016,3,20.292067000000003,3,2016-10-13,2016-11-03,21
222637,10/10/2019,10/10/2019,1,23.718,1,2019-10-10,2019-10-10,0
222651,10/6/2016,10/6/2016,1,6.471711,1,2016-10-06,2016-10-06,0
22266181,8/8/2020,8/8/2020,1,18.594,1,2020-08-08,2020-08-08,0
2226731,6/23/2018,6/23/2018,1,3.695,1,2018-06-23,2018-06-23,0
222693,11/11/2017,9/15/2016,2,2.258256,2,2017-11-11,2016-09-15,-422
22273991,10/9/2020,9/11/2020,4,23.628999999999998,2,2020-10-09,2020-09-11,-28
2227481,4/19/2019,4/19/2019,1,9.008,1,2019-04-19,2019-04-19,0
22278271,8/21/2020,8/21/2020,1,12.532,1,2020-08-21,2020-08-21,0
222819,10/5/2016,9/27/2016,8,93.493005,4,2016-10-05,2016-09-27,-8
222831,10/23/2019,10/23/2019,1,9.94,1,2019-10-23,2019-10-23,0
2228361,2/20/2019,2/23/2020,2,11.697999999999999,2,2019-02-20,2020-02-23,368
2228431,8/29/2018,8/29/2018,1,7.935,1,2018-08-29,2018-08-29,0
2228461,6/30/2018,6/30/2018,1,4.475,1,2018-06-30,2018-06-30,0
22289081,8/15/2020,9/19/2020,2,9.959,2,2020-08-15,2020-09-19,35
22292991,8/13/2020,9/6/2020,4,29.587,1,2020-08-13,2020-09-06,24
222941,9/5/2016,9/5/2016,1,8.619156,1,2016-09-05,2016-09-05,0
22295961,12/24/2020,12/24/2020,1,1.451,1,2020-12-24,2020-12-24,0
2229821,7/10/2018,7/30/2018,4,58.754999999999995,4,2018-07-10,2018-07-30,20
22300051,10/18/2020,10/18/2020,1,17.093,1,2020-10-18,2020-10-18,0
223051,8/11/2016,9/16/2020,4,85.49973899999999,4,2016-08-11,2020-09-16,1497
223069,1/16/2017,1/20/2017,3,23.682000000000002,2,2017-01-16,2017-01-20,4
22311841,10/13/2020,9/30/2020,5,72.76,2,2020-10-13,2020-09-30,-13
2231251,8/21/2019,8/21/2019,1,11.911,1,2019-08-21,2019-08-21,0
2231321,1/7/2019,1/7/2019,1,1.992,1,2019-01-07,2019-01-07,0
2231641,7/7/2018,7/7/2018,1,6.717,1,2018-07-07,2018-07-07,0
2232151,1/18/2019,9/7/2018,70,338.246,8,2019-01-18,2018-09-07,-133
223229,10/9/2017,2/3/2018,4,29.453,4,2017-10-09,2018-02-03,117
22324321,11/6/2020,11/6/2020,1,2.006,1,2020-11-06,2020-11-06,0
2232521,10/27/2018,9/8/2018,15,64.55,3,2018-10-27,2018-09-08,-49
22325221,8/19/2020,9/30/2020,3,61.099999999999994,2,2020-08-19,2020-09-30,42
223255,10/11/2016,10/13/2016,2,11.781040999999998,2,2016-10-11,2016-10-13,2
2232761,10/20/2019,10/20/2019,1,9.106,1,2019-10-20,2019-10-20,0
22330031,12/16/2020,12/2/2020,2,12.722999999999999,2,2020-12-16,2020-12-02,-14
223315,7/18/2018,7/18/2018,1,7.675,1,2018-07-18,2018-07-18,0
223331,2/23/2019,2/23/2019,1,5.799,1,2019-02-23,2019-02-23,0
2233491,9/29/2018,9/29/2018,1,2.808,1,2018-09-29,2018-09-29,0
22335481,10/4/2020,9/20/2020,2,2.5119999999999996,2,2020-10-04,2020-09-20,-14
2233581,11/3/2018,5/11/2019,2,16.64,2,2018-11-03,2019-05-11,189
22341031,10/10/2020,9/4/2020,11,20.739,3,2020-10-10,2020-09-04,-36
22341111,10/16/2020,12/16/2020,2,20.798000000000002,2,2020-10-16,2020-12-16,61
2234121,10/11/2018,9/24/2018,2,27.886000000000003,1,2018-10-11,2018-09-24,-17
22341291,10/1/2020,12/3/2020,24,275.042,3,2020-10-01,2020-12-03,63
22341491,10/10/2020,9/6/2020,14,105.35,3,2020-10-10,2020-09-06,-34
22342331,11/13/2020,11/13/2020,1,7.053,1,2020-11-13,2020-11-13,0
2234241,5/1/2019,5/1/2019,1,7.343,1,2019-05-01,2019-05-01,0
22349431,10/10/2020,11/14/2020,3,92.713,2,2020-10-10,2020-11-14,35
223537,11/27/2018,9/23/2019,2,33.648,2,2018-11-27,2019-09-23,300
22354011,10/10/2020,9/28/2020,7,88.437,2,2020-10-10,2020-09-28,-12
22356611,11/11/2020,11/11/2020,1,6.414,1,2020-11-11,2020-11-11,0
2235711,10/17/2018,8/18/2019,3,15.79,3,2018-10-17,2019-08-18,305
22370041,8/28/2020,8/28/2020,1,6.62,1,2020-08-28,2020-08-28,0
223713,10/14/2016,10/14/2016,1,10.631889,1,2016-10-14,2016-10-14,0
22372231,8/28/2020,8/28/2020,1,4.862,1,2020-08-28,2020-08-28,0
22373521,10/10/2020,8/28/2020,4,25.534,3,2020-10-10,2020-08-28,-43
223741,1/10/2020,9/30/2019,84,640.375934,12,2020-01-10,2019-09-30,-102
2237541,6/18/2018,7/2/2018,5,100.014,4,2018-06-18,2018-07-02,14
2237551,10/20/2018,8/28/2019,4,57.203,4,2018-10-20,2019-08-28,312
223763,11/23/2019,5/18/2019,3,20.457,3,2019-11-23,2019-05-18,-189
2237671,5/31/2018,5/31/2018,1,13.947,1,2018-05-31,2018-05-31,0
223809,1/26/2018,7/28/2018,3,58.884699,3,2018-01-26,2018-07-28,183
22390211,9/25/2020,9/25/2020,1,13.98,1,2020-09-25,2020-09-25,0
2239371,11/21/2018,9/6/2018,22,147.151,10,2018-11-21,2018-09-06,-76
2239441,10/11/2018,9/7/2018,38,368.692,4,2018-10-11,2018-09-07,-34
22396121,9/1/2020,9/1/2020,1,5.843,1,2020-09-01,2020-09-01,0
22396251,10/24/2020,10/24/2020,1,1.887,1,2020-10-24,2020-10-24,0
224005,5/2/2018,8/27/2017,2,16.567999999999998,2,2018-05-02,2017-08-27,-248
2240541,3/5/2019,3/5/2019,1,14.411,1,2019-03-05,2019-03-05,0
2240841,9/7/2019,9/7/2019,1,2.68,1,2019-09-07,2019-09-07,0
22408601,12/6/2020,12/6/2020,1,28.49,1,2020-12-06,2020-12-06,0
224091,4/5/2017,4/5/2017,1,2.92,1,2017-04-05,2017-04-05,0
224101,1/13/2017,9/6/2019,47,380.598474,9,2017-01-13,2019-09-06,966
2241161,10/6/2019,8/17/2019,2,6.045,2,2019-10-06,2019-08-17,-50
2241551,1/10/2020,1/10/2020,1,12.341,1,2020-01-10,2020-01-10,0
22416231,9/5/2020,9/5/2020,1,7.053,1,2020-09-05,2020-09-05,0
2241801,9/2/2019,9/2/2019,1,0.674,1,2019-09-02,2019-09-02,0
22419351,9/11/2020,9/7/2020,4,78.679,3,2020-09-11,2020-09-07,-4
2242041,7/11/2018,7/19/2018,2,4.679,2,2018-07-11,2018-07-19,8
22422681,9/6/2020,9/6/2020,1,0.33,1,2020-09-06,2020-09-06,0
22423761,11/10/2020,11/9/2020,3,16.195999999999998,1,2020-11-10,2020-11-09,-1
2242401,12/6/2018,9/4/2020,2,16.303,1,2018-12-06,2020-09-04,638
22425361,9/10/2020,9/10/2020,1,1.528,1,2020-09-10,2020-09-10,0
2242651,1/28/2020,9/14/2018,13,105.083,4,2020-01-28,2018-09-14,-501
2242661,9/8/2018,9/8/2018,1,6.573,1,2018-09-08,2018-09-08,0
22430841,9/26/2020,9/26/2020,1,10.159,1,2020-09-26,2020-09-26,0
224313,8/23/2016,8/29/2016,2,10.166132000000001,2,2016-08-23,2016-08-29,6
2243691,11/20/2018,11/20/2018,1,0.702,1,2018-11-20,2018-11-20,0
22438781,10/2/2020,9/23/2020,6,154.847,3,2020-10-02,2020-09-23,-9
2243991,5/26/2019,6/5/2019,3,4.133,3,2019-05-26,2019-06-05,10
224427,10/12/2016,9/4/2017,11,5.821791999999999,6,2016-10-12,2017-09-04,327
2244401,11/12/2019,11/12/2019,1,12.727,1,2019-11-12,2019-11-12,0
224451,1/4/2019,1/4/2019,1,8.634,1,2019-01-04,2019-01-04,0
22447601,10/1/2020,10/8/2020,3,73.57300000000001,2,2020-10-01,2020-10-08,7
224483,2/19/2017,8/1/2017,25,205.086,15,2017-02-19,2017-08-01,163
2244831,7/6/2018,7/6/2018,1,3.37,1,2018-07-06,2018-07-06,0
22450101,10/10/2020,9/12/2020,4,57.009,2,2020-10-10,2020-09-12,-28
22452991,12/6/2020,12/6/2020,1,4.124,1,2020-12-06,2020-12-06,0
224549,1/5/2018,1/5/2018,1,12.05,1,2018-01-05,2018-01-05,0
2245781,5/29/2019,8/9/2018,3,18.692999999999998,3,2019-05-29,2018-08-09,-293
22457901,10/27/2020,10/27/2020,1,17.498,1,2020-10-27,2020-10-27,0
2246001,7/16/2018,7/16/2018,1,8.769,1,2018-07-16,2018-07-16,0
2246251,1/27/2019,8/21/2018,5,13.831,3,2019-01-27,2018-08-21,-159
2246301,8/31/2018,8/31/2018,1,7.248,1,2018-08-31,2018-08-31,0
22464251,10/18/2020,9/13/2020,2,35.159000000000006,1,2020-10-18,2020-09-13,-35
224647,12/20/2018,12/20/2018,1,13.072,1,2018-12-20,2018-12-20,0
224653,1/9/2018,9/28/2016,7,13.009314999999999,3,2018-01-09,2016-09-28,-468
224695,11/21/2016,11/21/2016,1,5.452,1,2016-11-21,2016-11-21,0
2247121,6/12/2019,6/12/2019,1,19.167,1,2019-06-12,2019-06-12,0
2247281,10/26/2018,10/26/2018,1,1.614,1,2018-10-26,2018-10-26,0
224739,9/1/2017,9/1/2017,1,0.935,1,2017-09-01,2017-09-01,0
22478201,9/16/2020,9/16/2020,1,6.515,1,2020-09-16,2020-09-16,0
224791,11/10/2016,11/10/2016,1,7.945,1,2016-11-10,2016-11-10,0
2248301,1/1/2019,9/4/2018,28,115.899,6,2019-01-01,2018-09-04,-119
224839,10/18/2016,8/6/2016,5,47.493950999999996,5,2016-10-18,2016-08-06,-73
2248861,6/3/2018,6/3/2018,1,14.93,1,2018-06-03,2018-06-03,0
224915,1/25/2017,10/13/2016,2,15.128846,1,2017-01-25,2016-10-13,-104
224921,1/17/2018,9/7/2018,20,162.804437,5,2018-01-17,2018-09-07,233
22495491,12/5/2020,12/5/2020,1,4.059,1,2020-12-05,2020-12-05,0
2249591,10/15/2018,9/14/2018,20,129.397,2,2018-10-15,2018-09-14,-31
22498241,10/17/2020,10/17/2020,1,4.591,1,2020-10-17,2020-10-17,0
22499801,11/8/2020,11/8/2020,1,0.664,1,2020-11-08,2020-11-08,0
225013,8/17/2018,8/17/2018,1,4.054,1,2018-08-17,2018-08-17,0
2250311,6/2/2018,9/28/2018,2,20.828,1,2018-06-02,2018-09-28,118
225123,10/11/2017,9/14/2017,3,32.137,2,2017-10-11,2017-09-14,-27
22513,1/11/2019,12/23/2017,2,15.248999999999999,2,2019-01-11,2017-12-23,-384
22513631,10/31/2020,12/20/2020,2,20.02,2,2020-10-31,2020-12-20,50
225137,12/13/2017,7/5/2017,29,476.319,8,2017-12-13,2017-07-05,-161
22517011,10/3/2020,10/3/2020,1,7.937,1,2020-10-03,2020-10-03,0
225177,7/31/2019,7/31/2019,1,0.267,1,2019-07-31,2019-07-31,0
22524401,10/1/2020,10/2/2020,3,48.538,3,2020-10-01,2020-10-02,1
2252651,10/30/2018,9/9/2018,5,18.358,3,2018-10-30,2018-09-09,-51
2252691,12/8/2018,9/6/2018,3,13.38,1,2018-12-08,2018-09-06,-93
225301,3/24/2019,3/24/2019,1,5.904,1,2019-03-24,2019-03-24,0
22530221,10/28/2020,11/15/2020,2,23.532,2,2020-10-28,2020-11-15,18
225303,1/14/2018,1/9/2018,2,14.977,2,2018-01-14,2018-01-09,-5
22533221,10/10/2020,12/20/2020,10,57.245,5,2020-10-10,2020-12-20,71
225343,8/19/2016,9/5/2016,2,16.466911,2,2016-08-19,2016-09-05,17
225347,3/24/2019,3/24/2019,1,6.056,1,2019-03-24,2019-03-24,0
22535431,10/12/2020,11/9/2020,9,81.036,4,2020-10-12,2020-11-09,28
225359,1/25/2020,9/28/2019,31,263.756,5,2020-01-25,2019-09-28,-119
2253641,12/1/2019,9/15/2018,6,33.019,2,2019-12-01,2018-09-15,-442
225379,12/3/2016,12/3/2016,1,0.553,1,2016-12-03,2016-12-03,0
2253811,11/7/2018,4/5/2019,2,27.133,2,2018-11-07,2019-04-05,149
2254211,10/12/2019,9/7/2019,9,75.052,5,2019-10-12,2019-09-07,-35
225423,11/1/2018,9/13/2018,11,87.322,8,2018-11-01,2018-09-13,-49
2254291,10/19/2019,10/19/2019,1,8.292,1,2019-10-19,2019-10-19,0
22543801,10/3/2020,9/26/2020,3,16.202,2,2020-10-03,2020-09-26,-7
22543861,10/16/2020,10/16/2020,1,7.822,1,2020-10-16,2020-10-16,0
225447,1/19/2017,1/19/2017,1,2.611,1,2017-01-19,2017-01-19,0
225459,1/23/2020,9/15/2017,21,82.066,8,2020-01-23,2017-09-15,-860
225479,8/18/2018,8/18/2018,1,1.725,1,2018-08-18,2018-08-18,0
225499,2/10/2017,9/6/2016,7,89.585965,4,2017-02-10,2016-09-06,-157
2255031,1/23/2020,8/27/2020,11,56.072,3,2020-01-23,2020-08-27,217
22552591,10/7/2020,9/26/2020,2,10.437000000000001,2,2020-10-07,2020-09-26,-11
2255351,6/22/2018,6/22/2018,1,6.746,1,2018-06-22,2018-06-22,0
22556721,9/27/2020,9/27/2020,1,11.516,1,2020-09-27,2020-09-27,0
2256011,1/11/2019,8/7/2019,64,593.113,12,2019-01-11,2019-08-07,208
2256181,1/19/2020,1/19/2020,1,3.542,1,2020-01-19,2020-01-19,0
2256541,1/12/2019,9/22/2018,10,44.393,4,2019-01-12,2018-09-22,-112
225665,11/28/2017,6/3/2019,4,11.424,3,2017-11-28,2019-06-03,552
22566991,9/30/2020,9/30/2020,1,4.896,1,2020-09-30,2020-09-30,0
225683,10/20/2016,10/20/2016,1,16.128773,1,2016-10-20,2016-10-20,0
225701,12/26/2016,9/18/2016,7,26.790776,4,2016-12-26,2016-09-18,-99
22572741,10/30/2020,9/29/2020,8,39.236,3,2020-10-30,2020-09-29,-31
225735,12/22/2017,6/7/2019,2,4.859999999999999,2,2017-12-22,2019-06-07,532
225743,1/13/2018,1/13/2018,1,6.679,1,2018-01-13,2018-01-13,0
225753,1/2/2018,6/27/2019,6,68.363,3,2018-01-02,2019-06-27,541
2257801,3/31/2019,6/16/2019,5,31.901,5,2019-03-31,2019-06-16,77
225871,4/6/2017,4/6/2017,1,6.687,1,2017-04-06,2017-04-06,0
22589591,12/5/2020,12/5/2020,1,4.543,1,2020-12-05,2020-12-05,0
225909,7/22/2017,7/22/2017,1,7.077,1,2017-07-22,2017-07-22,0
225915,1/1/2018,7/31/2017,2,7.788,1,2018-01-01,2017-07-31,-154
225949,8/11/2019,8/11/2019,1,7.98,1,2019-08-11,2019-08-11,0
22600261,12/5/2020,12/5/2020,1,11.164,1,2020-12-05,2020-12-05,0
2260391,10/24/2020,10/24/2020,1,6.857,1,2020-10-24,2020-10-24,0
22607201,10/18/2020,10/18/2020,1,6.366,1,2020-10-18,2020-10-18,0
226075,8/10/2018,8/21/2018,2,2.822,2,2018-08-10,2018-08-21,11
22608181,10/3/2020,10/3/2020,1,3.578,1,2020-10-03,2020-10-03,0
22608271,11/11/2020,12/30/2020,2,23.221,1,2020-11-11,2020-12-30,49
226083,1/26/2018,7/6/2019,6,41.808,4,2018-01-26,2019-07-06,526
22609431,10/30/2020,10/30/2020,1,7.624,1,2020-10-30,2020-10-30,0
22610181,10/4/2020,10/4/2020,1,19.775,1,2020-10-04,2020-10-04,0
22613,11/17/2018,7/25/2019,4,28.012999999999998,3,2018-11-17,2019-07-25,250
2261581,2/5/2020,9/26/2020,2,37.302,2,2020-02-05,2020-09-26,234
226169,11/15/2019,8/19/2018,2,11.974,2,2019-11-15,2018-08-19,-453
2261691,6/25/2018,7/27/2018,2,9.547,1,2018-06-25,2018-07-27,32
22617161,12/22/2020,12/22/2020,1,19.659,1,2020-12-22,2020-12-22,0
226229,11/1/2017,11/1/2017,1,19.968,1,2017-11-01,2017-11-01,0
2262361,12/16/2019,8/25/2019,5,20.267,4,2019-12-16,2019-08-25,-113
226247,1/8/2017,8/23/2017,5,42.631,5,2017-01-08,2017-08-23,227
2262611,1/19/2019,2/13/2019,2,11.392,2,2019-01-19,2019-02-13,25
22627261,10/22/2020,11/30/2020,3,5.546,2,2020-10-22,2020-11-30,39
226287,2/7/2020,6/21/2019,2,23.719,2,2020-02-07,2019-06-21,-231
226319,10/28/2017,9/1/2018,8,60.649,5,2017-10-28,2018-09-01,308
2263231,1/18/2020,8/31/2019,3,16.218,2,2020-01-18,2019-08-31,-140
2263531,10/14/2020,8/8/2018,3,11.175,2,2020-10-14,2018-08-08,-798
226393,1/16/2018,9/26/2017,6,58.463,3,2018-01-16,2017-09-26,-112
22642921,10/21/2020,10/21/2020,1,5.416,1,2020-10-21,2020-10-21,0
226435,1/15/2018,9/8/2018,81,462.712117,10,2018-01-15,2018-09-08,236
226453,4/26/2018,4/26/2018,1,7.373,1,2018-04-26,2018-04-26,0
2264771,11/1/2018,8/23/2018,2,8.041,2,2018-11-01,2018-08-23,-70
226489,10/14/2017,9/24/2018,10,21.406,2,2017-10-14,2018-09-24,345
2264891,11/9/2019,7/3/2019,7,27.251,4,2019-11-09,2019-07-03,-129
226511,11/8/2018,9/27/2018,5,27.927,5,2018-11-08,2018-09-27,-42
2265511,1/10/2019,9/7/2018,186,2206.336,4,2019-01-10,2018-09-07,-125
2265631,9/26/2019,9/26/2019,1,7.801,1,2019-09-26,2019-09-26,0
22661851,10/15/2020,10/15/2020,1,12.328,1,2020-10-15,2020-10-15,0
22666921,10/19/2020,12/8/2020,19,360.89,3,2020-10-19,2020-12-08,50
22667591,10/13/2020,12/7/2020,22,725.674,2,2020-10-13,2020-12-07,55
226677,10/11/2018,10/11/2018,1,13.983,1,2018-10-11,2018-10-11,0
2266821,8/9/2018,8/9/2018,1,10.735999999999999,1,2018-08-09,2018-08-09,0
2267,6/3/2019,7/13/2019,2,8.471,2,2019-06-03,2019-07-13,40
22671701,10/13/2020,10/13/2020,1,3.057,1,2020-10-13,2020-10-13,0
226731,12/12/2017,7/24/2020,4,17.740000000000002,3,2017-12-12,2020-07-24,955
226747,1/16/2017,7/21/2017,36,217.293153,13,2017-01-16,2017-07-21,186
2268,11/30/2018,2/23/2019,2,17.162,2,2018-11-30,2019-02-23,85
226809,1/19/2017,9/20/2018,4,25.240000000000002,1,2017-01-19,2018-09-20,609
22682081,10/21/2020,10/29/2020,4,51.057,2,2020-10-21,2020-10-29,8
226833,1/18/2019,9/12/2017,13,54.334949,8,2019-01-18,2017-09-12,-493
2268591,10/14/2019,8/21/2019,4,24.276,4,2019-10-14,2019-08-21,-54
22688281,10/16/2020,10/16/2020,1,6.615,1,2020-10-16,2020-10-16,0
226947,11/29/2019,11/29/2019,1,19.673,1,2019-11-29,2019-11-29,0
2269491,5/16/2020,5/16/2020,1,8.712,1,2020-05-16,2020-05-16,0
226977,1/18/2019,8/29/2018,18,93.699814,9,2019-01-18,2018-08-29,-142
2269821,5/31/2019,5/31/2019,1,16.684,1,2019-05-31,2019-05-31,0
2269971,1/16/2019,9/10/2018,68,1670.088,9,2019-01-16,2018-09-10,-128
22701651,12/20/2020,12/6/2020,2,4.1530000000000005,1,2020-12-20,2020-12-06,-14
2270231,1/10/2020,9/9/2019,167,1146.797,16,2020-01-10,2019-09-09,-123
2270421,6/5/2018,9/13/2018,6,42.881,2,2018-06-05,2018-09-13,100
227065,1/25/2017,9/8/2016,20,91.186216,3,2017-01-25,2016-09-08,-139
227121,10/1/2018,9/9/2019,145,1497.549,6,2018-10-01,2019-09-09,343
227135,6/30/2018,6/30/2018,1,6.595,1,2018-06-30,2018-06-30,0
2271511,2/23/2020,9/22/2019,7,54.979,5,2020-02-23,2019-09-22,-154
22716391,11/29/2020,11/29/2020,1,5.756,1,2020-11-29,2020-11-29,0
22721131,10/22/2020,11/5/2020,6,93.91499999999999,2,2020-10-22,2020-11-05,14
2272151,6/11/2018,6/8/2018,4,47.913,2,2018-06-11,2018-06-08,-3
22722971,10/22/2020,10/22/2020,1,3.116,1,2020-10-22,2020-10-22,0
2272391,1/14/2019,1/14/2019,1,11.746,1,2019-01-14,2019-01-14,0
22725921,10/22/2020,10/22/2020,1,9.842,1,2020-10-22,2020-10-22,0
2272741,6/5/2019,6/5/2019,1,3.933,1,2019-06-05,2019-06-05,0
22728911,10/23/2020,10/23/2020,1,4.09,1,2020-10-23,2020-10-23,0
2272961,8/13/2019,8/13/2019,1,19.041,1,2019-08-13,2019-08-13,0
22730921,10/23/2020,12/5/2020,3,32.037,2,2020-10-23,2020-12-05,43
22731971,12/10/2020,12/10/2020,1,0.914,1,2020-12-10,2020-12-10,0
227323,1/5/2017,9/27/2016,18,177.138049,4,2017-01-05,2016-09-27,-100
227357,1/27/2018,9/15/2018,9,32.127,5,2018-01-27,2018-09-15,231
227369,10/13/2017,11/21/2019,2,8.059000000000001,2,2017-10-13,2019-11-21,769
2274461,11/20/2018,9/30/2018,2,10.187,2,2018-11-20,2018-09-30,-51
22745871,10/25/2020,11/8/2020,6,55.07,3,2020-10-25,2020-11-08,14
227485,4/15/2018,4/15/2018,1,2.677,1,2018-04-15,2018-04-15,0
227519,5/29/2019,5/29/2019,1,5.382,1,2019-05-29,2019-05-29,0
2275321,1/6/2020,9/5/2019,114,2354.559,6,2020-01-06,2019-09-05,-123
227569,9/25/2018,9/25/2018,1,5.045,1,2018-09-25,2018-09-25,0
227575,11/18/2016,8/31/2016,2,18.724046,1,2016-11-18,2016-08-31,-79
2276111,1/3/2019,1/3/2019,1,5.64,1,2019-01-03,2019-01-03,0
227621,8/13/2017,8/25/2017,2,3.4019999999999997,2,2017-08-13,2017-08-25,12
22762191,11/19/2020,12/9/2020,8,40.364000000000004,3,2020-11-19,2020-12-09,20
22766741,10/29/2020,10/29/2020,2,15.497,2,2020-10-29,2020-10-29,0
2276741,4/7/2019,9/21/2019,2,9.511,1,2019-04-07,2019-09-21,167
227681,5/26/2019,5/26/2019,1,2.306,1,2019-05-26,2019-05-26,0
227685,11/5/2016,8/11/2016,2,15.105031,2,2016-11-05,2016-08-11,-86
227689,11/11/2018,6/28/2018,17,50.978,6,2018-11-11,2018-06-28,-136
227691,1/1/2019,8/19/2018,8,20.167584,5,2019-01-01,2018-08-19,-135
227711,12/11/2018,12/11/2018,1,5.091,1,2018-12-11,2018-12-11,0
227715,1/21/2017,9/14/2016,22,46.285601,10,2017-01-21,2016-09-14,-129
227729,1/16/2017,7/24/2018,11,56.644,7,2017-01-16,2018-07-24,554
22775671,11/13/2020,12/3/2020,6,47.378,2,2020-11-13,2020-12-03,20
22775741,10/31/2020,12/5/2020,2,8.859,2,2020-10-31,2020-12-05,35
22777991,11/8/2020,11/8/2020,1,1.776,1,2020-11-08,2020-11-08,0
2277811,12/30/2019,9/7/2019,5,14.972,5,2019-12-30,2019-09-07,-114
227827,10/11/2019,9/7/2018,16,117.592,8,2019-10-11,2018-09-07,-399
22782741,12/10/2020,12/5/2020,5,127.061,1,2020-12-10,2020-12-05,-5
22785281,11/27/2020,11/27/2020,1,0.355,1,2020-11-27,2020-11-27,0
2278541,6/6/2018,6/6/2018,1,11.146,1,2018-06-06,2018-06-06,0
22785511,11/1/2020,11/1/2020,1,1.467,1,2020-11-01,2020-11-01,0
227869,11/8/2019,8/25/2017,3,12.453,3,2019-11-08,2017-08-25,-805
22787631,11/4/2020,11/4/2020,1,11.608,1,2020-11-04,2020-11-04,0
2278901,10/23/2019,3/5/2020,5,17.262,2,2019-10-23,2020-03-05,134
2279511,6/11/2018,8/2/2018,3,14.369,2,2018-06-11,2018-08-02,52
22795941,11/4/2020,11/4/2020,1,16.766,1,2020-11-04,2020-11-04,0
22796081,11/3/2020,11/3/2020,1,1.32,1,2020-11-03,2020-11-03,0
22797121,11/14/2020,12/6/2020,7,247.924,2,2020-11-14,2020-12-06,22
228059,10/17/2016,10/17/2016,1,2.737578,1,2016-10-17,2016-10-17,0
22811011,11/10/2020,11/10/2020,1,53.681,1,2020-11-10,2020-11-10,0
228157,3/23/2019,3/23/2019,1,1.45,1,2019-03-23,2019-03-23,0
228169,8/18/2016,8/18/2016,1,2.528708,1,2016-08-18,2016-08-18,0
22832311,11/11/2020,12/9/2020,19,359.493,4,2020-11-11,2020-12-09,28
2283301,10/7/2018,10/7/2018,1,5.109,1,2018-10-07,2018-10-07,0
228359,10/21/2016,8/16/2017,4,18.797219,3,2016-10-21,2017-08-16,299
22837671,11/12/2020,11/12/2020,1,7.02,1,2020-11-12,2020-11-12,0
2283841,3/8/2019,3/8/2019,1,5.806,1,2019-03-08,2019-03-08,0
2284101,1/23/2020,9/16/2019,10,50.33,7,2020-01-23,2019-09-16,-129
22841671,11/22/2020,11/22/2020,1,5.498,1,2020-11-22,2020-11-22,0
2285661,6/9/2018,6/9/2018,1,8.303,1,2018-06-09,2018-06-09,0
22857191,11/14/2020,11/14/2020,1,0.577,1,2020-11-14,2020-11-14,0
22857271,11/14/2020,11/14/2020,1,7.645,1,2020-11-14,2020-11-14,0
2285741,1/19/2020,8/4/2018,16,89.741,4,2020-01-19,2018-08-04,-533
2285791,1/10/2020,9/9/2020,210,3431.302,8,2020-01-10,2020-09-09,243
228593,11/26/2016,9/16/2017,6,153.414589,2,2016-11-26,2017-09-16,294
228641,2/14/2020,2/14/2020,1,5.918,1,2020-02-14,2020-02-14,0
228667,10/2/2016,9/1/2016,10,16.624651,5,2016-10-02,2016-09-01,-31
22868861,11/16/2020,12/7/2020,29,365.225,4,2020-11-16,2020-12-07,21
2287331,5/19/2019,5/21/2019,2,28.567999999999998,1,2019-05-19,2019-05-21,2
228757,1/20/2018,9/30/2016,53,433.395315,3,2018-01-20,2016-09-30,-477
22882911,11/21/2020,11/23/2020,3,32.17,2,2020-11-21,2020-11-23,2
2288531,12/13/2018,7/22/2018,3,26.622,1,2018-12-13,2018-07-22,-144
22885541,11/24/2020,11/24/2020,1,0.682,1,2020-11-24,2020-11-24,0
228869,10/1/2016,9/15/2017,9,42.039494,4,2016-10-01,2017-09-15,349
2288881,7/25/2019,8/13/2019,2,64.08699999999999,1,2019-07-25,2019-08-13,19
22895161,11/21/2020,11/21/2020,1,8.323,1,2020-11-21,2020-11-21,0
2289751,8/9/2018,8/9/2018,1,6.441,1,2018-08-09,2018-08-09,0
22899031,11/26/2020,11/26/2020,1,9.345,1,2020-11-26,2020-11-26,0
22899631,11/25/2020,11/25/2020,1,10.69,1,2020-11-25,2020-11-25,0
228999,1/12/2017,4/9/2017,2,23.082,2,2017-01-12,2017-04-09,87
2290601,8/25/2018,8/25/2018,1,8.167,1,2018-08-25,2018-08-25,0
229079,8/2/2019,8/2/2019,1,6.427,1,2019-08-02,2019-08-02,0
2290821,1/18/2019,7/19/2018,8,39.037,2,2019-01-18,2018-07-19,-183
229103,11/5/2016,11/5/2016,1,0.031,1,2016-11-05,2016-11-05,0
229127,11/24/2018,12/16/2019,2,20.031,2,2018-11-24,2019-12-16,387
229145,11/1/2016,11/1/2016,1,1.656,1,2016-11-01,2016-11-01,0
22915021,11/24/2020,11/24/2020,1,6.724,1,2020-11-24,2020-11-24,0
229259,4/25/2018,4/25/2018,1,9.18,1,2018-04-25,2018-04-25,0
2292921,2/21/2019,2/21/2019,1,23.826,1,2019-02-21,2019-02-21,0
2293071,2/19/2020,2/19/2020,1,9.389,1,2020-02-19,2020-02-19,0
2293481,4/11/2019,4/11/2019,1,1.927,1,2019-04-11,2019-04-11,0
229351,1/23/2017,1/24/2017,2,15.883,2,2017-01-23,2017-01-24,1
22940731,11/29/2020,11/29/2020,1,3.117,1,2020-11-29,2020-11-29,0
229419,2/28/2020,2/28/2020,1,9.218,1,2020-02-28,2020-02-28,0
2294701,1/6/2019,9/4/2018,3,11.43,3,2019-01-06,2018-09-04,-124
2294841,7/13/2019,7/13/2019,1,1.605,1,2019-07-13,2019-07-13,0
2294861,1/19/2019,3/30/2019,3,9.307,2,2019-01-19,2019-03-30,70
229501,2/14/2018,2/14/2018,1,1.801,1,2018-02-14,2018-02-14,0
2295601,10/12/2020,8/7/2019,6,68.058,4,2020-10-12,2019-08-07,-432
229613,11/9/2016,5/19/2019,4,19.313000000000002,4,2016-11-09,2019-05-19,921
2296231,6/13/2018,6/13/2018,1,6.749,1,2018-06-13,2018-06-13,0
2296611,9/22/2018,9/22/2018,1,7.404,1,2018-09-22,2018-09-22,0
2296631,6/16/2018,8/4/2018,2,16.786,2,2018-06-16,2018-08-04,49
22967511,12/29/2020,12/29/2020,1,1.899,1,2020-12-29,2020-12-29,0
22970561,12/13/2020,12/5/2020,4,18.92,2,2020-12-13,2020-12-05,-8
229739,1/26/2018,4/18/2018,2,23.627000000000002,2,2018-01-26,2018-04-18,82
229855,1/23/2018,6/20/2017,3,17.494999999999997,3,2018-01-23,2017-06-20,-217
2298631,10/13/2018,8/31/2018,5,44.871,2,2018-10-13,2018-08-31,-43
2298811,12/13/2018,12/13/2018,1,17.872,1,2018-12-13,2018-12-13,0
22993571,12/22/2020,12/22/2020,1,4.408,1,2020-12-22,2020-12-22,0
229989,1/29/2017,4/23/2017,3,28.567,2,2017-01-29,2017-04-23,84
2299991,7/10/2018,7/10/2018,1,16.492,1,2018-07-10,2018-07-10,0
230059,5/30/2017,5/30/2017,1,5.866,1,2017-05-30,2017-05-30,0
23006071,12/28/2020,12/28/2020,1,5.651,1,2020-12-28,2020-12-28,0
230101,6/14/2017,6/14/2017,1,3.657,1,2017-06-14,2017-06-14,0
230119,1/29/2017,6/7/2017,8,20.84006,4,2017-01-29,2017-06-07,129
230127,7/19/2019,7/19/2019,1,11.02,1,2019-07-19,2019-07-19,0
23019931,12/13/2020,12/15/2020,2,20.967,2,2020-12-13,2020-12-15,2
230203,12/30/2018,12/30/2018,1,0.904,1,2018-12-30,2018-12-30,0
2302321,9/18/2018,9/19/2018,2,6.8759999999999994,2,2018-09-18,2018-09-19,1
230279,11/15/2019,11/15/2019,1,9.168,1,2019-11-15,2019-11-15,0
2303311,7/19/2018,8/15/2018,2,3.228,2,2018-07-19,2018-08-15,27
2303481,1/25/2019,9/21/2018,11,51.519999999999996,3,2019-01-25,2018-09-21,-126
230383,10/31/2016,9/6/2017,3,35.856,2,2016-10-31,2017-09-06,310
2303971,9/29/2018,9/29/2018,1,5.502,1,2018-09-29,2018-09-29,0
230407,6/13/2019,6/13/2019,1,19.775,1,2019-06-13,2019-06-13,0
2304101,1/25/2020,1/25/2020,1,3.474,1,2020-01-25,2020-01-25,0
2304191,11/12/2019,9/20/2019,2,9.115,2,2019-11-12,2019-09-20,-53
2304301,12/11/2019,12/5/2018,2,17.881,2,2019-12-11,2018-12-05,-371
230435,10/9/2016,9/29/2016,3,8.77665,3,2016-10-09,2016-09-29,-10
2304391,1/19/2019,11/25/2018,2,8.395,2,2019-01-19,2018-11-25,-55
2305331,1/24/2020,8/6/2019,14,132.973,5,2020-01-24,2019-08-06,-171
23064781,12/22/2020,12/22/2020,1,8.995,1,2020-12-22,2020-12-22,0
23065631,12/24/2020,12/24/2020,1,4.401,1,2020-12-24,2020-12-24,0
230667,10/5/2018,7/20/2019,4,40.675,4,2018-10-05,2019-07-20,288
2306841,7/13/2019,8/25/2019,2,13.573,2,2019-07-13,2019-08-25,43
2306881,3/7/2019,3/7/2019,1,6.266,1,2019-03-07,2019-03-07,0
230733,1/1/2018,9/30/2018,157,870.549568,13,2018-01-01,2018-09-30,272
2307341,6/17/2018,9/9/2018,10,92.174,5,2018-06-17,2018-09-09,84
230753,10/2/2016,8/13/2016,4,31.738887,2,2016-10-02,2016-08-13,-50
230767,10/18/2018,8/30/2018,6,73.416,4,2018-10-18,2018-08-30,-49
230783,10/14/2017,7/29/2019,7,46.055,7,2017-10-14,2019-07-29,653
2307981,9/11/2020,9/5/2020,2,9.131,1,2020-09-11,2020-09-05,-6
23082221,12/31/2020,12/31/2020,1,2.609,1,2020-12-31,2020-12-31,0
2308381,12/7/2020,8/15/2020,2,3.741,1,2020-12-07,2020-08-15,-114
2308471,1/23/2019,7/2/2018,4,14.75,2,2019-01-23,2018-07-02,-205
230925,3/21/2018,9/26/2017,2,1.482,1,2018-03-21,2017-09-26,-176
2309361,7/25/2019,7/6/2018,2,13.222,1,2019-07-25,2018-07-06,-384
230943,1/27/2017,1/27/2017,1,11.942,1,2017-01-27,2017-01-27,0
230945,1/18/2017,9/30/2016,18,123.231448,11,2017-01-18,2016-09-30,-110
2309621,8/1/2019,8/1/2019,1,5.621,1,2019-08-01,2019-08-01,0
2309681,2/10/2019,2/10/2019,1,3.995,1,2019-02-10,2019-02-10,0
2309701,6/12/2018,7/5/2018,2,13.695,1,2018-06-12,2018-07-05,23
23099981,12/26/2020,12/26/2020,1,3.027,1,2020-12-26,2020-12-26,0
2310701,1/6/2019,9/21/2018,20,78.878,5,2019-01-06,2018-09-21,-107
2310731,1/8/2020,1/8/2020,1,9.056,1,2020-01-08,2020-01-08,0
2311351,11/7/2018,11/7/2018,1,3.857,1,2018-11-07,2018-11-07,0
231137,1/18/2018,7/10/2017,12,125.93775600000001,6,2018-01-18,2017-07-10,-192
2311701,6/12/2018,6/18/2018,4,49.403,1,2018-06-12,2018-06-18,6
231175,1/14/2020,6/17/2017,4,16.21,4,2020-01-14,2017-06-17,-941
2311891,10/25/2019,11/5/2019,2,7.263999999999999,1,2019-10-25,2019-11-05,11
2311991,10/4/2020,10/4/2020,1,13.188,1,2020-10-04,2020-10-04,0
2312011,6/20/2018,6/23/2018,2,25.795,2,2018-06-20,2018-06-23,3
23127081,12/30/2020,12/30/2020,1,5.024,1,2020-12-30,2020-12-30,0
2312911,10/25/2019,2/9/2019,3,18.415,3,2019-10-25,2019-02-09,-258
2312941,12/22/2019,7/1/2018,5,34.568,3,2019-12-22,2018-07-01,-539
231297,10/9/2019,10/9/2019,1,6.675,1,2019-10-09,2019-10-09,0
2313,7/1/2017,7/1/2017,1,1.087,1,2017-07-01,2017-07-01,0
2313621,6/22/2018,7/1/2019,4,34.888,4,2018-06-22,2019-07-01,374
23137801,12/31/2020,12/31/2020,1,29.954,1,2020-12-31,2020-12-31,0
231381,10/5/2016,9/3/2016,13,230.703763,5,2016-10-05,2016-09-03,-32
231533,10/23/2019,9/18/2019,13,53.234983,7,2019-10-23,2019-09-18,-35
231549,2/4/2017,2/4/2017,2,13.809999999999999,2,2017-02-04,2017-02-04,0
231603,10/30/2017,10/30/2017,1,14.684,1,2017-10-30,2017-10-30,0
231643,10/27/2016,11/26/2017,2,17.751,2,2016-10-27,2017-11-26,395
231675,10/9/2017,11/19/2018,2,26.059,2,2017-10-09,2018-11-19,406
2317,12/31/2017,8/14/2019,6,7.223,2,2017-12-31,2019-08-14,591
231703,12/3/2016,9/27/2017,4,22.024,4,2016-12-03,2017-09-27,298
2317041,9/4/2018,9/4/2018,1,4.953,1,2018-09-04,2018-09-04,0
231745,10/21/2017,9/9/2016,21,70.760679,11,2017-10-21,2016-09-09,-407
2317461,2/1/2019,3/9/2020,5,8.966,3,2019-02-01,2020-03-09,402
2317541,2/9/2019,2/9/2019,1,2.503,1,2019-02-09,2019-02-09,0
2317791,2/4/2020,2/4/2020,1,9.138,1,2020-02-04,2020-02-04,0
2318051,8/18/2019,8/9/2018,3,29.127,3,2019-08-18,2018-08-09,-374
231809,12/30/2019,12/30/2019,1,4.962,1,2019-12-30,2019-12-30,0
2318251,1/9/2019,7/5/2018,7,16.398,4,2019-01-09,2018-07-05,-188
2318871,1/17/2019,1/3/2019,2,7.234,1,2019-01-17,2019-01-03,-14
2319,11/10/2018,6/12/2018,2,4.752,2,2018-11-10,2018-06-12,-151
2319731,2/22/2019,2/22/2019,1,12.244,1,2019-02-22,2019-02-22,0
2320341,1/25/2019,1/25/2019,1,4.657,1,2019-01-25,2019-01-25,0
2320571,6/14/2018,6/15/2018,2,19.959,2,2018-06-14,2018-06-15,1
2320581,1/17/2019,9/22/2019,23,190.975,9,2019-01-17,2019-09-22,248
2321091,7/31/2018,7/31/2018,1,10.02,1,2018-07-31,2018-07-31,0
2321511,10/1/2019,6/14/2018,5,35.684,4,2019-10-01,2018-06-14,-474
232153,10/21/2017,5/6/2018,3,17.474,2,2017-10-21,2018-05-06,197
2322041,1/12/2019,9/6/2020,10,116.83500000000001,6,2019-01-12,2020-09-06,603
2322341,11/5/2018,9/24/2018,3,67.817,2,2018-11-05,2018-09-24,-42
232263,8/29/2018,8/29/2018,1,5.945,1,2018-08-29,2018-08-29,0
232267,11/10/2018,11/10/2018,1,3.452,1,2018-11-10,2018-11-10,0
2322711,3/30/2019,3/30/2019,1,21.693,1,2019-03-30,2019-03-30,0
2322841,6/14/2018,6/14/2018,1,1.684,1,2018-06-14,2018-06-14,0
2323531,6/29/2019,6/29/2019,1,0.028,1,2019-06-29,2019-06-29,0
232421,3/17/2018,9/2/2017,6,22.163,4,2018-03-17,2017-09-02,-196
232467,9/6/2018,9/6/2018,1,8.109,1,2018-09-06,2018-09-06,0
2324961,2/7/2019,8/9/2019,5,40.313,4,2019-02-07,2019-08-09,183
232503,1/5/2018,1/5/2018,1,8.761,1,2018-01-05,2018-01-05,0
232515,5/26/2018,5/26/2018,1,6.111,1,2018-05-26,2018-05-26,0
232561,10/23/2018,8/28/2017,5,13.813,2,2018-10-23,2017-08-28,-421
232587,1/12/2018,9/6/2017,43,83.024577,6,2018-01-12,2017-09-06,-128
2326551,1/19/2020,6/2/2019,7,15.14,2,2020-01-19,2019-06-02,-231
232673,1/12/2019,1/12/2019,1,4.469,1,2019-01-12,2019-01-12,0
232691,1/27/2017,6/25/2017,5,16.015,5,2017-01-27,2017-06-25,149
232721,3/31/2018,3/31/2018,1,2.413,1,2018-03-31,2018-03-31,0
2327231,2/16/2019,2/16/2019,1,9.325,1,2019-02-16,2019-02-16,0
2327371,11/15/2019,11/15/2019,1,4.286,1,2019-11-15,2019-11-15,0
2327471,1/19/2020,9/8/2019,20,87.904,9,2020-01-19,2019-09-08,-133
232781,10/9/2016,6/20/2017,5,15.79764,3,2016-10-09,2017-06-20,254
232821,9/9/2016,9/9/2016,1,5.343095,1,2016-09-09,2016-09-09,0
232963,1/18/2017,9/5/2016,8,77.859735,5,2017-01-18,2016-09-05,-135
232993,12/31/2016,3/17/2018,2,7.8260000000000005,2,2016-12-31,2018-03-17,441
2330301,8/2/2019,8/2/2019,1,2.838,1,2019-08-02,2019-08-02,0
2330691,1/1/2020,3/5/2020,28,353.184,5,2020-01-01,2020-03-05,64
233111,12/8/2017,12/8/2017,1,2.474,1,2017-12-08,2017-12-08,0
2331551,7/15/2018,7/15/2018,1,2.919,1,2018-07-15,2018-07-15,0
233175,1/13/2017,10/1/2016,2,12.491884,2,2017-01-13,2016-10-01,-104
2331911,10/1/2018,9/6/2018,52,776.1129999999999,4,2018-10-01,2018-09-06,-25
2332231,11/2/2019,11/2/2019,1,3.456,1,2019-11-02,2019-11-02,0
233237,10/30/2016,10/30/2016,1,6.617,1,2016-10-30,2016-10-30,0
233275,12/20/2016,12/20/2016,2,18.851,2,2016-12-20,2016-12-20,0
2332751,6/18/2018,6/18/2018,1,3.517,1,2018-06-18,2018-06-18,0
2333201,10/20/2018,10/20/2018,1,7.0,1,2018-10-20,2018-10-20,0
233343,7/8/2017,8/5/2017,2,24.86,2,2017-07-08,2017-08-05,28
2333611,6/16/2018,6/16/2018,1,10.576,1,2018-06-16,2018-06-16,0
233371,1/15/2019,9/29/2019,23,43.066,10,2019-01-15,2019-09-29,257
2334021,1/28/2019,7/10/2018,2,11.182,2,2019-01-28,2018-07-10,-202
2334471,11/27/2020,9/15/2019,2,19.772,2,2020-11-27,2019-09-15,-439
233451,6/1/2018,6/1/2018,1,5.249,1,2018-06-01,2018-06-01,0
233493,1/13/2019,7/8/2018,20,128.868,5,2019-01-13,2018-07-08,-189
2335451,6/28/2019,6/28/2019,1,2.266,1,2019-06-28,2019-06-28,0
2335741,6/18/2018,6/18/2018,1,17.067,1,2018-06-18,2018-06-18,0
2335941,3/14/2020,8/31/2019,8,172.337,2,2020-03-14,2019-08-31,-196
233619,11/18/2018,8/21/2019,4,21.745,4,2018-11-18,2019-08-21,276
233715,10/22/2016,5/21/2017,2,6.4304380000000005,1,2016-10-22,2017-05-21,211
2337201,1/3/2020,11/3/2019,2,14.894,2,2020-01-03,2019-11-03,-61
233735,3/27/2017,3/27/2017,1,8.36,1,2017-03-27,2017-03-27,0
233739,5/19/2018,5/19/2018,1,11.839,1,2018-05-19,2018-05-19,0
233753,9/22/2017,9/22/2017,1,1.079,1,2017-09-22,2017-09-22,0
233773,10/11/2016,10/11/2016,1,5.654938,1,2016-10-11,2016-10-11,0
233799,2/28/2017,3/1/2017,2,20.709,2,2017-02-28,2017-03-01,1
2338181,4/6/2019,4/6/2019,1,3.521,1,2019-04-06,2019-04-06,0
2338391,1/18/2020,7/1/2018,5,15.616999999999999,4,2020-01-18,2018-07-01,-566
233967,6/3/2018,6/3/2018,1,3.178,1,2018-06-03,2018-06-03,0
233973,6/19/2019,7/19/2019,4,15.339,3,2019-06-19,2019-07-19,30
233983,10/10/2016,8/3/2016,9,59.066319,9,2016-10-10,2016-08-03,-68
234001,2/26/2020,9/29/2016,4,20.429625,4,2020-02-26,2016-09-29,-1245
2340411,6/24/2018,6/24/2018,1,9.537,1,2018-06-24,2018-06-24,0
23413,1/19/2017,8/9/2016,6,39.875269,5,2017-01-19,2016-08-09,-163
2341371,9/4/2019,9/4/2019,1,3.467,1,2019-09-04,2019-09-04,0
2341561,1/19/2020,7/14/2019,3,25.936,2,2020-01-19,2019-07-14,-189
234161,7/7/2018,7/7/2018,1,4.2,1,2018-07-07,2018-07-07,0
234163,3/18/2017,3/31/2017,2,4.1899999999999995,2,2017-03-18,2017-03-31,13
2342061,12/13/2018,12/13/2018,1,3.096,1,2018-12-13,2018-12-13,0
234215,11/13/2016,2/25/2018,4,16.72,2,2016-11-13,2018-02-25,469
2342361,1/5/2020,1/5/2020,1,2.004,1,2020-01-05,2020-01-05,0
234237,8/30/2018,8/30/2018,1,4.515,1,2018-08-30,2018-08-30,0
2343181,10/29/2019,9/5/2019,28,314.387,6,2019-10-29,2019-09-05,-54
234323,1/10/2017,9/30/2016,64,243.820417,8,2017-01-10,2016-09-30,-102
2343261,1/28/2019,9/25/2019,2,47.546,2,2019-01-28,2019-09-25,240
2343381,6/3/2019,6/3/2019,1,4.149,1,2019-06-03,2019-06-03,0
2343631,1/6/2019,3/20/2019,5,60.469,3,2019-01-06,2019-03-20,73
2343671,10/8/2020,8/6/2020,4,30.342,3,2020-10-08,2020-08-06,-63
234371,12/18/2019,8/15/2019,21,66.847,5,2019-12-18,2019-08-15,-125
234391,11/4/2018,11/4/2018,1,5.246,1,2018-11-04,2018-11-04,0
2343981,10/12/2018,9/5/2018,16,90.961,3,2018-10-12,2018-09-05,-37
2344121,4/26/2019,7/27/2018,2,24.182,2,2019-04-26,2018-07-27,-273
234517,12/10/2016,8/12/2016,2,13.208224000000001,2,2016-12-10,2016-08-12,-120
2345341,8/2/2019,8/2/2019,1,0.434,1,2019-08-02,2019-08-02,0
2345791,5/22/2019,5/22/2019,1,4.292,1,2019-05-22,2019-05-22,0
2345961,2/20/2020,2/20/2020,1,6.787,1,2020-02-20,2020-02-20,0
234627,10/22/2016,9/5/2016,8,72.377302,5,2016-10-22,2016-09-05,-47
2346831,7/17/2018,7/17/2018,1,2.935,1,2018-07-17,2018-07-17,0
2347,1/15/2019,9/27/2016,16,84.628125,7,2019-01-15,2016-09-27,-840
234711,10/10/2019,9/29/2016,8,33.358696,6,2019-10-10,2016-09-29,-1106
234755,1/10/2017,9/9/2016,140,1491.017639,3,2017-01-10,2016-09-09,-123
2347661,10/14/2019,9/6/2019,11,100.723,3,2019-10-14,2019-09-06,-38
2348411,11/15/2018,11/8/2018,2,10.343,1,2018-11-15,2018-11-08,-7
2348811,10/24/2019,10/24/2019,1,9.312,1,2019-10-24,2019-10-24,0
2349281,9/7/2018,9/7/2018,1,2.974,1,2018-09-07,2018-09-07,0
234955,5/14/2017,9/1/2017,5,56.867,5,2017-05-14,2017-09-01,110
235005,10/15/2016,10/15/2016,1,4.707854,1,2016-10-15,2016-10-15,0
235007,10/10/2018,9/22/2018,9,70.851,6,2018-10-10,2018-09-22,-18
2350241,12/6/2018,12/6/2018,1,17.017,1,2018-12-06,2018-12-06,0
23503,2/17/2018,9/29/2017,4,31.412,4,2018-02-17,2017-09-29,-141
235033,1/11/2017,1/11/2017,1,9.878,1,2017-01-11,2017-01-11,0
235097,1/22/2018,6/19/2017,2,5.754,2,2018-01-22,2017-06-19,-217
235139,1/27/2017,9/16/2016,16,115.555116,11,2017-01-27,2016-09-16,-133
235151,1/15/2018,9/28/2017,3,13.918,3,2018-01-15,2017-09-28,-109
2352281,6/19/2018,6/19/2018,1,7.873,1,2018-06-19,2018-06-19,0
2353961,10/25/2019,6/21/2019,10,433.06399999999996,3,2019-10-25,2019-06-21,-126
235445,7/12/2019,9/19/2017,2,3.1390000000000002,1,2019-07-12,2017-09-19,-661
235473,1/13/2017,1/13/2017,1,5.925,1,2017-01-13,2017-01-13,0
2355131,11/10/2020,12/9/2020,22,367.598,3,2020-11-10,2020-12-09,29
2355261,8/20/2018,8/20/2018,1,4.749,1,2018-08-20,2018-08-20,0
235535,9/20/2019,9/20/2019,1,9.748,1,2019-09-20,2019-09-20,0
235563,12/24/2018,8/6/2018,4,29.652,2,2018-12-24,2018-08-06,-140
2355791,9/22/2018,9/22/2018,1,5.602,1,2018-09-22,2018-09-22,0
2356101,9/21/2019,9/21/2019,1,11.149,1,2019-09-21,2019-09-21,0
235617,7/15/2018,7/15/2018,1,16.093,1,2018-07-15,2018-07-15,0
2356521,3/1/2019,3/1/2019,1,5.929,1,2019-03-01,2019-03-01,0
2357151,11/15/2019,11/15/2019,1,14.462,1,2019-11-15,2019-11-15,0
235799,11/2/2019,7/30/2019,10,153.013,4,2019-11-02,2019-07-30,-95
235827,1/14/2017,9/10/2016,14,78.282453,2,2017-01-14,2016-09-10,-126
235869,8/21/2017,8/21/2017,1,9.341,1,2017-08-21,2017-08-21,0
2358991,1/1/2019,8/18/2018,105,1081.247,7,2019-01-01,2018-08-18,-136
235925,10/27/2017,10/27/2017,1,5.512,1,2017-10-27,2017-10-27,0
2359921,11/1/2018,11/1/2018,1,0.974,1,2018-11-01,2018-11-01,0
2360161,10/25/2018,9/7/2018,33,538.436,9,2018-10-25,2018-09-07,-48
236091,1/18/2020,1/18/2020,1,1.996,1,2020-01-18,2020-01-18,0
2361101,11/16/2018,2/14/2019,2,14.549,2,2018-11-16,2019-02-14,90
2361301,8/9/2018,8/9/2018,1,6.326,1,2018-08-09,2018-08-09,0
2361621,11/1/2018,11/1/2018,1,10.551,1,2018-11-01,2018-11-01,0
2361651,1/11/2019,9/4/2019,131,1300.276,9,2019-01-11,2019-09-04,236
2362761,1/7/2019,6/18/2019,7,61.737,2,2019-01-07,2019-06-18,162
236365,6/29/2019,6/29/2019,1,1.105,1,2019-06-29,2019-06-29,0
2364471,1/5/2020,1/5/2020,1,0.478,1,2020-01-05,2020-01-05,0
2365711,12/31/2019,12/31/2019,1,37.008,1,2019-12-31,2019-12-31,0
236641,1/12/2018,1/12/2018,1,13.429,1,2018-01-12,2018-01-12,0
2366521,9/17/2018,9/17/2018,2,1.422,2,2018-09-17,2018-09-17,0
2366691,1/24/2019,1/24/2019,1,6.963,1,2019-01-24,2019-01-24,0
236713,7/3/2019,7/3/2019,1,4.888,1,2019-07-03,2019-07-03,0
236793,6/4/2018,9/18/2017,2,19.201,1,2018-06-04,2017-09-18,-259
236947,1/11/2020,9/9/2018,234,523.960813,17,2020-01-11,2018-09-09,-489
2369511,8/10/2018,8/10/2018,1,1.569,1,2018-08-10,2018-08-10,0
236983,12/17/2016,9/26/2016,5,21.583548999999998,3,2016-12-17,2016-09-26,-82
2369861,8/22/2018,8/22/2018,1,6.003,1,2018-08-22,2018-08-22,0
237259,1/3/2020,1/3/2020,1,12.536,1,2020-01-03,2020-01-03,0
237283,3/8/2020,3/8/2020,1,3.029,1,2020-03-08,2020-03-08,0
2372941,8/9/2018,8/9/2018,1,10.633,1,2018-08-09,2018-08-09,0
237307,1/10/2017,9/7/2016,86,947.724098,3,2017-01-10,2016-09-07,-125
237309,4/11/2019,4/11/2019,1,6.591,1,2019-04-11,2019-04-11,0
237319,5/14/2017,5/26/2019,2,4.425,2,2017-05-14,2019-05-26,742
237327,1/26/2020,6/13/2019,3,16.93,3,2020-01-26,2019-06-13,-227
237459,11/4/2019,11/4/2019,1,2.967,1,2019-11-04,2019-11-04,0
2375101,2/8/2019,3/8/2019,3,2.392,1,2019-02-08,2019-03-08,28
2375251,1/11/2020,9/20/2020,22,240.327,8,2020-01-11,2020-09-20,253
2376241,9/8/2018,9/8/2018,1,1.249,1,2018-09-08,2018-09-08,0
237633,12/12/2016,12/12/2016,1,2.004,1,2016-12-12,2016-12-12,0
2376341,11/3/2018,9/28/2018,2,28.391,1,2018-11-03,2018-09-28,-36
237637,1/27/2017,8/9/2019,10,64.74,7,2017-01-27,2019-08-09,924
237641,1/1/2017,11/5/2016,5,6.64,3,2017-01-01,2016-11-05,-57
2376931,9/19/2019,9/19/2019,1,13.269,1,2019-09-19,2019-09-19,0
2378261,9/2/2018,9/2/2018,1,6.569,1,2018-09-02,2018-09-02,0
2378511,5/4/2019,5/4/2019,1,0.914,1,2019-05-04,2019-05-04,0
2378941,8/9/2018,8/9/2018,1,7.544,1,2018-08-09,2018-08-09,0
2379061,7/31/2018,8/4/2018,2,6.996,2,2018-07-31,2018-08-04,4
237909,8/18/2017,8/18/2017,1,5.61,1,2017-08-18,2017-08-18,0
2380801,1/26/2019,1/26/2019,1,4.961,1,2019-01-26,2019-01-26,0
2381921,8/29/2018,8/29/2018,1,11.333,1,2018-08-29,2018-08-29,0
2383141,5/18/2019,8/7/2018,4,30.789,1,2019-05-18,2018-08-07,-284
2383431,2/8/2020,2/8/2020,1,1.468,1,2020-02-08,2020-02-08,0
2383471,1/3/2019,8/12/2018,11,51.991,4,2019-01-03,2018-08-12,-144
2383551,2/13/2020,2/13/2020,1,7.611,1,2020-02-13,2020-02-13,0
238415,12/11/2019,2/22/2017,2,22.823,2,2019-12-11,2017-02-22,-1022
238417,3/24/2018,3/24/2018,1,9.81,1,2018-03-24,2018-03-24,0
2384431,10/7/2018,10/7/2018,1,1.578,1,2018-10-07,2018-10-07,0
2384561,10/4/2018,10/4/2018,1,0.178,1,2018-10-04,2018-10-04,0
2384971,10/20/2018,10/20/2018,1,6.552,1,2018-10-20,2018-10-20,0
238501,5/1/2017,5/1/2017,1,10.131,1,2017-05-01,2017-05-01,0
2385301,1/22/2020,9/30/2019,42,543.215,8,2020-01-22,2019-09-30,-114
2386101,1/13/2019,6/14/2019,2,22.395,2,2019-01-13,2019-06-14,152
2386191,7/7/2019,7/7/2019,1,2.567,1,2019-07-07,2019-07-07,0
238677,1/5/2018,5/1/2018,3,9.002,1,2018-01-05,2018-05-01,116
2386891,10/27/2018,3/7/2020,3,17.515,2,2018-10-27,2020-03-07,497
2386971,11/16/2018,8/9/2018,3,7.249,3,2018-11-16,2018-08-09,-99
2387751,1/16/2020,8/28/2019,6,173.56900000000002,3,2020-01-16,2019-08-28,-141
238785,6/10/2018,9/8/2018,4,38.384,3,2018-06-10,2018-09-08,90
238817,12/15/2016,12/15/2016,1,4.383,1,2016-12-15,2016-12-15,0
2388411,10/18/2018,12/9/2018,2,18.430999999999997,2,2018-10-18,2018-12-09,52
238941,1/7/2019,7/13/2018,2,19.591,1,2019-01-07,2018-07-13,-178
238995,10/27/2019,9/9/2018,24,162.698,7,2019-10-27,2018-09-09,-413
2390021,3/2/2019,3/2/2019,1,2.489,1,2019-03-02,2019-03-02,0
2390051,11/4/2018,7/14/2019,2,18.077,2,2018-11-04,2019-07-14,252
239007,1/15/2017,9/29/2016,3,12.992332,3,2017-01-15,2016-09-29,-108
239047,2/19/2017,9/16/2016,3,13.805888,3,2017-02-19,2016-09-16,-156
239071,10/19/2019,9/8/2017,14,24.973264,6,2019-10-19,2017-09-08,-771
239083,10/5/2019,9/22/2018,2,18.86,2,2019-10-05,2018-09-22,-378
239113,8/16/2017,8/16/2017,1,5.334,1,2017-08-16,2017-08-16,0
239151,1/19/2019,8/23/2017,32,120.444,14,2019-01-19,2017-08-23,-514
2391611,11/14/2018,2/6/2019,3,34.58,3,2018-11-14,2019-02-06,84
2392461,11/8/2018,11/8/2018,1,9.264,1,2018-11-08,2018-11-08,0
239249,10/25/2020,8/16/2020,4,15.421,2,2020-10-25,2020-08-16,-70
2392521,11/22/2019,11/22/2019,1,3.593,1,2019-11-22,2019-11-22,0
239299,2/15/2020,2/15/2020,1,8.348,1,2020-02-15,2020-02-15,0
239305,10/10/2016,9/11/2016,8,67.61769,4,2016-10-10,2016-09-11,-29
2393161,12/18/2018,12/19/2018,2,6.931,1,2018-12-18,2018-12-19,1
239353,4/7/2019,9/9/2017,6,40.121,4,2019-04-07,2017-09-09,-575
239409,8/14/2016,8/14/2016,1,8.574377,1,2016-08-14,2016-08-14,0
239427,10/20/2017,10/20/2017,1,4.321,1,2017-10-20,2017-10-20,0
2394451,12/29/2018,12/29/2018,1,0.891,1,2018-12-29,2018-12-29,0
2394661,7/18/2018,7/18/2018,1,4.145,1,2018-07-18,2018-07-18,0
239535,8/27/2019,8/27/2019,1,4.418,1,2019-08-27,2019-08-27,0
2395371,1/23/2019,2/10/2019,3,19.552,3,2019-01-23,2019-02-10,18
2395731,6/28/2018,6/28/2018,1,4.631,1,2018-06-28,2018-06-28,0
2395881,6/29/2019,6/29/2019,1,9.638,1,2019-06-29,2019-06-29,0
2396171,1/26/2020,7/6/2018,2,12.333,1,2020-01-26,2018-07-06,-569
239619,8/11/2017,8/11/2017,1,9.526,1,2017-08-11,2017-08-11,0
239659,3/2/2017,3/2/2017,1,6.55,1,2017-03-02,2017-03-02,0
2396831,10/18/2019,8/7/2019,14,124.793,10,2019-10-18,2019-08-07,-72
239749,5/23/2018,5/23/2018,1,16.377,1,2018-05-23,2018-05-23,0
2397601,7/10/2018,7/16/2018,2,16.786,1,2018-07-10,2018-07-16,6
2398421,1/19/2019,1/19/2019,1,4.135,1,2019-01-19,2019-01-19,0
2399201,11/2/2019,7/26/2019,2,10.994,2,2019-11-02,2019-07-26,-99
2399521,7/8/2018,7/8/2018,1,5.192,1,2018-07-08,2018-07-08,0
2399841,12/11/2018,8/8/2018,2,23.776,1,2018-12-11,2018-08-08,-125
240037,4/22/2018,4/22/2018,1,13.78,1,2018-04-22,2018-04-22,0
2400741,7/4/2018,7/7/2018,2,11.689,2,2018-07-04,2018-07-07,3
240199,3/1/2017,8/17/2016,6,30.858637,5,2017-03-01,2016-08-17,-196
2403711,1/12/2019,9/22/2018,13,78.87,3,2019-01-12,2018-09-22,-112
240373,1/17/2020,9/9/2017,11,54.226,7,2020-01-17,2017-09-09,-860
240375,12/5/2017,12/5/2017,1,1.164,1,2017-12-05,2017-12-05,0
240381,1/10/2017,9/8/2016,169,328.281975,7,2017-01-10,2016-09-08,-124
240461,11/30/2016,9/13/2016,5,42.329404,4,2016-11-30,2016-09-13,-78
2405091,1/27/2019,8/30/2020,6,13.076,3,2019-01-27,2020-08-30,581
2405211,6/30/2018,7/7/2018,3,59.723,1,2018-06-30,2018-07-07,7
2405301,8/11/2019,8/11/2019,1,3.446,1,2019-08-11,2019-08-11,0
2405381,11/18/2018,11/18/2018,1,8.737,1,2018-11-18,2018-11-18,0
240621,12/1/2016,7/14/2018,5,20.775,4,2016-12-01,2018-07-14,590
240709,3/15/2018,3/16/2018,2,32.189,1,2018-03-15,2018-03-16,1
2407111,6/29/2018,7/6/2018,2,22.691000000000003,2,2018-06-29,2018-07-06,7
2407481,1/11/2019,9/11/2019,18,77.249,13,2019-01-11,2019-09-11,243
2407921,10/18/2018,10/18/2018,1,5.215,1,2018-10-18,2018-10-18,0
240805,9/13/2018,9/13/2018,2,5.004,2,2018-09-13,2018-09-13,0
2408541,9/28/2018,9/28/2018,1,0.429,1,2018-09-28,2018-09-28,0
2408621,1/25/2020,6/7/2019,3,16.295,1,2020-01-25,2019-06-07,-232
2408721,3/15/2019,3/15/2019,1,5.721,1,2019-03-15,2019-03-15,0
2408851,1/10/2019,9/8/2019,177,1219.295,19,2019-01-10,2019-09-08,241
2409431,11/28/2018,9/11/2018,9,67.724,5,2018-11-28,2018-09-11,-78
2409941,7/6/2018,8/24/2018,2,5.177,2,2018-07-06,2018-08-24,49
2410561,10/30/2018,10/30/2018,1,0.164,1,2018-10-30,2018-10-30,0
2410811,1/17/2019,8/9/2018,43,180.158,11,2019-01-17,2018-08-09,-161
241099,10/29/2017,10/29/2017,1,1.265,1,2017-10-29,2017-10-29,0
2411821,6/21/2019,6/21/2019,1,4.813,1,2019-06-21,2019-06-21,0
241187,12/15/2017,12/15/2017,1,2.279,1,2017-12-15,2017-12-15,0
241193,2/15/2017,2/15/2017,1,12.894,1,2017-02-15,2017-02-15,0
2412381,1/26/2020,1/29/2019,2,7.459,2,2020-01-26,2019-01-29,-362
2413161,9/8/2019,9/8/2019,1,4.604,1,2019-09-08,2019-09-08,0
2413241,8/13/2019,8/13/2019,1,3.56,1,2019-08-13,2019-08-13,0
241333,1/28/2017,8/5/2017,5,24.06388,2,2017-01-28,2017-08-05,189
241341,9/12/2017,9/12/2017,1,10.072,1,2017-09-12,2017-09-12,0
241363,8/5/2016,8/5/2016,1,3.630625,1,2016-08-05,2016-08-05,0
241375,12/16/2017,3/9/2018,2,11.4,2,2017-12-16,2018-03-09,83
2414161,10/11/2018,9/29/2018,3,22.56,2,2018-10-11,2018-09-29,-12
241429,1/13/2017,7/8/2017,3,12.803,3,2017-01-13,2017-07-08,176
241437,1/31/2017,9/16/2016,10,32.512954,5,2017-01-31,2016-09-16,-137
241451,11/23/2019,11/23/2019,1,4.995,1,2019-11-23,2019-11-23,0
2414531,1/19/2020,6/8/2019,8,71.678,5,2020-01-19,2019-06-08,-225
241463,3/13/2019,5/11/2019,2,5.426,2,2019-03-13,2019-05-11,59
2414701,9/10/2018,9/10/2018,1,6.339,1,2018-09-10,2018-09-10,0
241473,9/6/2019,9/6/2019,1,6.255,1,2019-09-06,2019-09-06,0
241497,1/25/2020,11/16/2019,3,19.387999999999998,3,2020-01-25,2019-11-16,-70
2415211,3/13/2019,4/16/2019,2,35.193,2,2019-03-13,2019-04-16,34
2415491,11/24/2020,11/30/2020,2,8.663,1,2020-11-24,2020-11-30,6
2415581,10/26/2018,9/6/2020,6,28.748,2,2018-10-26,2020-09-06,681
241615,1/19/2018,9/21/2016,10,102.25881,7,2018-01-19,2016-09-21,-485
2416151,3/4/2019,3/4/2019,1,7.783,1,2019-03-04,2019-03-04,0
2416241,10/18/2018,10/18/2018,1,5.546,1,2018-10-18,2018-10-18,0
241625,1/23/2018,9/26/2017,7,20.035,4,2018-01-23,2017-09-26,-119
2416441,1/25/2019,9/30/2018,12,48.222,11,2019-01-25,2018-09-30,-117
2416911,7/14/2019,9/2/2019,4,24.681,3,2019-07-14,2019-09-02,50
2417341,1/23/2020,1/23/2020,1,5.004,1,2020-01-23,2020-01-23,0
241761,10/13/2016,9/2/2016,13,87.453743,6,2016-10-13,2016-09-02,-41
241835,4/26/2018,4/26/2018,1,8.094,1,2018-04-26,2018-04-26,0
241867,1/15/2017,9/17/2016,7,95.734619,6,2017-01-15,2016-09-17,-120
2418931,5/17/2019,5/17/2019,1,2.972,1,2019-05-17,2019-05-17,0
2419171,1/12/2019,8/1/2019,12,29.181,5,2019-01-12,2019-08-01,201
241919,1/11/2019,8/28/2017,14,80.586,5,2019-01-11,2017-08-28,-501
242081,1/22/2018,8/2/2017,7,32.303,6,2018-01-22,2017-08-02,-173
242097,5/12/2019,5/12/2019,1,2.771,1,2019-05-12,2019-05-12,0
2421001,1/16/2020,8/23/2019,20,232.031,9,2020-01-16,2019-08-23,-146
2421261,7/8/2018,7/8/2018,1,17.008,1,2018-07-08,2018-07-08,0
242129,12/16/2016,12/16/2016,1,13.71,1,2016-12-16,2016-12-16,0
2421451,1/10/2019,9/22/2018,5,14.004,4,2019-01-10,2018-09-22,-110
2421681,10/5/2018,10/5/2018,1,1.81,1,2018-10-05,2018-10-05,0
2421881,10/25/2019,10/25/2019,1,26.528,1,2019-10-25,2019-10-25,0
2422301,9/5/2018,9/5/2018,1,1.558,1,2018-09-05,2018-09-05,0
242295,3/22/2018,3/22/2018,1,8.998,1,2018-03-22,2018-03-22,0
2423131,6/30/2019,6/30/2019,1,0.412,1,2019-06-30,2019-06-30,0
2423511,9/7/2019,9/7/2019,1,10.0,1,2019-09-07,2019-09-07,0
2423891,1/18/2020,8/4/2018,9,46.995000000000005,5,2020-01-18,2018-08-04,-532
2424051,5/4/2019,5/4/2019,1,7.464,1,2019-05-04,2019-05-04,0
2424381,10/1/2019,7/3/2018,5,32.634,4,2019-10-01,2018-07-03,-455
2424591,10/1/2018,10/1/2018,1,1.283,1,2018-10-01,2018-10-01,0
2424921,12/16/2018,12/16/2018,1,9.0,1,2018-12-16,2018-12-16,0
242495,1/13/2018,9/30/2017,41,208.75268,6,2018-01-13,2017-09-30,-105
2425161,10/5/2019,4/14/2019,6,51.862,2,2019-10-05,2019-04-14,-174
2425391,3/29/2019,4/29/2019,2,7.411,2,2019-03-29,2019-04-29,31
242585,1/24/2019,1/24/2019,1,5.665,1,2019-01-24,2019-01-24,0
2425891,1/11/2019,9/7/2018,47,665.947,8,2019-01-11,2018-09-07,-126
242605,12/12/2016,12/12/2016,1,0.861,1,2016-12-12,2016-12-12,0
2426431,1/27/2019,7/8/2019,40,549.015,11,2019-01-27,2019-07-08,162
242661,1/1/2018,9/9/2016,201,1188.320367,7,2018-01-01,2016-09-09,-479
242665,11/19/2017,11/19/2017,1,6.976,1,2017-11-19,2017-11-19,0
2426811,7/28/2018,7/28/2018,1,15.948,1,2018-07-28,2018-07-28,0
242683,2/16/2017,3/19/2017,2,0.713,1,2017-02-16,2017-03-19,31
242691,11/27/2016,11/27/2016,1,5.91,1,2016-11-27,2016-11-27,0
2426971,9/7/2019,9/7/2019,1,8.707,1,2019-09-07,2019-09-07,0
2427501,1/11/2019,9/27/2018,37,100.35,7,2019-01-11,2018-09-27,-106
242753,11/10/2018,12/6/2019,5,47.573,5,2018-11-10,2019-12-06,391
2427651,10/11/2018,7/9/2018,2,6.393000000000001,2,2018-10-11,2018-07-09,-94
242775,2/16/2017,2/16/2017,1,5.821,1,2017-02-16,2017-02-16,0
2427751,7/2/2018,7/2/2018,1,1.61,1,2018-07-02,2018-07-02,0
2428151,1/11/2020,9/8/2019,8,48.743,3,2020-01-11,2019-09-08,-125
242825,12/3/2016,12/3/2016,1,4.313,1,2016-12-03,2016-12-03,0
2428261,1/10/2019,9/9/2019,206,2548.998,8,2019-01-10,2019-09-09,242
2428501,12/15/2018,12/15/2018,1,12.557,1,2018-12-15,2018-12-15,0
2428531,7/22/2018,7/22/2018,1,12.816,1,2018-07-22,2018-07-22,0
2428541,7/30/2018,7/30/2018,1,3.242,1,2018-07-30,2018-07-30,0
242861,5/11/2018,5/11/2018,1,17.686,1,2018-05-11,2018-05-11,0
242897,8/30/2016,8/30/2016,1,10.487718,1,2016-08-30,2016-08-30,0
242941,10/6/2017,9/3/2016,12,106.76943800000001,8,2017-10-06,2016-09-03,-398
2429441,12/13/2018,12/28/2018,2,10.023,2,2018-12-13,2018-12-28,15
2429741,7/15/2018,7/15/2018,2,15.286,2,2018-07-15,2018-07-15,0
243063,5/18/2017,5/18/2017,1,8.93,1,2017-05-18,2017-05-18,0
2430961,6/24/2020,8/28/2019,3,9.588999999999999,1,2020-06-24,2019-08-28,-301
243117,6/8/2017,9/14/2019,4,38.457,4,2017-06-08,2019-09-14,828
2431201,11/26/2018,11/26/2018,1,10.818,1,2018-11-26,2018-11-26,0
243229,12/5/2017,4/21/2018,3,37.283,2,2017-12-05,2018-04-21,137
243231,12/22/2018,12/22/2018,1,5.612,1,2018-12-22,2018-12-22,0
2432371,1/7/2020,9/9/2019,10,58.416,8,2020-01-07,2019-09-09,-120
2432451,1/14/2020,12/3/2019,6,47.766999999999996,4,2020-01-14,2019-12-03,-42
2433041,6/23/2019,6/23/2019,1,2.856,1,2019-06-23,2019-06-23,0
2433111,10/2/2020,9/20/2020,12,47.264,6,2020-10-02,2020-09-20,-12
2433971,1/13/2020,9/9/2019,236,1590.971,3,2020-01-13,2019-09-09,-126
243403,12/14/2019,7/5/2020,5,31.87,4,2019-12-14,2020-07-05,204
2434101,10/19/2018,10/19/2018,1,2.509,1,2018-10-19,2018-10-19,0
2434201,12/23/2019,6/16/2019,5,45.766,4,2019-12-23,2019-06-16,-190
243425,1/23/2018,11/8/2019,4,18.980895999999998,3,2018-01-23,2019-11-08,654
243459,12/12/2020,12/12/2020,1,2.812,1,2020-12-12,2020-12-12,0
2434811,12/22/2019,9/26/2020,3,14.671000000000001,2,2019-12-22,2020-09-26,279
243497,10/20/2016,9/5/2019,5,66.596324,4,2016-10-20,2019-09-05,1050
2435881,7/18/2019,7/18/2019,1,6.835,1,2019-07-18,2019-07-18,0
2436041,9/8/2018,9/8/2018,1,7.573,1,2018-09-08,2018-09-08,0
243619,8/26/2016,8/26/2016,1,10.040714,1,2016-08-26,2016-08-26,0
243623,10/14/2020,9/24/2016,26,132.690124,9,2020-10-14,2016-09-24,-1481
2436231,3/15/2019,3/15/2019,1,2.064,1,2019-03-15,2019-03-15,0
2436311,12/20/2020,9/7/2020,7,50.992,3,2020-12-20,2020-09-07,-104
2436751,7/3/2018,7/3/2018,1,15.108,1,2018-07-03,2018-07-03,0
243765,8/9/2016,8/9/2016,1,6.182545,1,2016-08-09,2016-08-09,0
2437651,11/27/2019,11/27/2019,1,6.79,1,2019-11-27,2019-11-27,0
243811,2/23/2019,2/23/2019,1,12.128,1,2019-02-23,2019-02-23,0
2438511,10/29/2019,10/29/2019,1,1.724,1,2019-10-29,2019-10-29,0
243891,2/25/2020,2/25/2020,1,6.125,1,2020-02-25,2020-02-25,0
2438911,10/20/2019,8/3/2019,5,64.476,3,2019-10-20,2019-08-03,-78
24393,1/11/2019,9/8/2019,181,566.479955,22,2019-01-11,2019-09-08,240
243943,9/24/2018,9/24/2018,1,4.688,1,2018-09-24,2018-09-24,0
243967,9/11/2019,9/11/2019,1,3.87,1,2019-09-11,2019-09-11,0
244013,1/30/2019,9/8/2018,23,130.736,9,2019-01-30,2018-09-08,-144
244029,1/28/2017,8/12/2017,9,25.886,2,2017-01-28,2017-08-12,196
244049,12/17/2017,12/17/2017,1,0.823,1,2017-12-17,2017-12-17,0
2441101,10/10/2018,9/4/2018,9,152.438,1,2018-10-10,2018-09-04,-36
244111,10/30/2016,7/30/2017,7,72.395,2,2016-10-30,2017-07-30,273
2441331,8/4/2019,8/4/2019,1,3.919,1,2019-08-04,2019-08-04,0
2441501,10/12/2019,10/25/2019,3,41.024,2,2019-10-12,2019-10-25,13
2441841,1/3/2020,7/30/2019,10,33.294,4,2020-01-03,2019-07-30,-157
2442171,7/4/2018,7/4/2018,1,6.332,1,2018-07-04,2018-07-04,0
244235,1/3/2020,2/18/2020,5,123.664,3,2020-01-03,2020-02-18,46
2442531,12/31/2018,6/2/2019,2,8.027000000000001,2,2018-12-31,2019-06-02,153
2443131,11/8/2019,11/8/2019,1,5.078,1,2019-11-08,2019-11-08,0
2443291,2/16/2019,8/18/2018,2,12.428,2,2019-02-16,2018-08-18,-182
2443761,12/29/2018,12/29/2018,1,5.385,1,2018-12-29,2018-12-29,0
244411,1/4/2017,1/4/2017,1,3.832,1,2017-01-04,2017-01-04,0
2444141,7/27/2018,9/4/2018,4,225.368,1,2018-07-27,2018-09-04,39
244419,11/8/2016,8/1/2017,11,48.03,5,2016-11-08,2017-08-01,266
244421,1/31/2019,1/31/2019,1,4.806,1,2019-01-31,2019-01-31,0
244425,11/3/2017,7/31/2018,2,7.022,2,2017-11-03,2018-07-31,270
2445151,7/14/2018,7/14/2018,1,5.309,1,2018-07-14,2018-07-14,0
2445201,12/31/2018,12/31/2018,2,10.924,2,2018-12-31,2018-12-31,0
2445351,12/6/2020,2/13/2019,3,48.14,3,2020-12-06,2019-02-13,-662
2445361,3/29/2019,7/29/2018,2,8.504,2,2019-03-29,2018-07-29,-243
2445391,5/25/2019,9/28/2018,4,21.881,4,2019-05-25,2018-09-28,-239
244551,8/4/2016,8/4/2016,1,2.538028,1,2016-08-04,2016-08-04,0
2446041,2/15/2019,7/13/2018,2,29.143,2,2019-02-15,2018-07-13,-217
244639,1/20/2017,8/28/2017,5,39.072748,3,2017-01-20,2017-08-28,220
244653,1/27/2017,8/9/2016,4,37.874214,3,2017-01-27,2016-08-09,-171
2447051,8/24/2019,8/24/2019,1,11.24,1,2019-08-24,2019-08-24,0
244711,1/14/2019,8/22/2019,4,17.567,3,2019-01-14,2019-08-22,220
244743,1/21/2017,6/26/2017,6,46.9,4,2017-01-21,2017-06-26,156
244813,3/13/2017,3/13/2017,1,10.817,1,2017-03-13,2017-03-13,0
244855,4/13/2019,4/13/2019,1,2.246,1,2019-04-13,2019-04-13,0
244869,1/17/2019,6/22/2019,2,13.061,2,2019-01-17,2019-06-22,156
244875,1/13/2017,9/7/2018,76,340.393218,20,2017-01-13,2018-09-07,602
244961,1/13/2018,9/4/2020,9,27.519,6,2018-01-13,2020-09-04,965
244981,7/12/2017,9/22/2018,2,12.084999999999999,2,2017-07-12,2018-09-22,437
244983,9/8/2017,9/8/2017,1,9.971,1,2017-09-08,2017-09-08,0
244993,11/23/2016,12/24/2016,2,18.66,2,2016-11-23,2016-12-24,31
245041,1/14/2019,9/23/2019,18,100.204,11,2019-01-14,2019-09-23,252
245051,10/25/2016,6/30/2020,2,15.585368,2,2016-10-25,2020-06-30,1344
2450631,1/30/2019,8/9/2019,5,32.328,1,2019-01-30,2019-08-09,191
2450641,12/9/2019,7/16/2019,2,11.971,2,2019-12-09,2019-07-16,-146
245067,1/26/2020,9/29/2019,4,36.742000000000004,2,2020-01-26,2019-09-29,-119
245077,11/10/2018,9/22/2018,10,36.463,3,2018-11-10,2018-09-22,-49
245087,1/24/2017,9/9/2016,74,717.55944,5,2017-01-24,2016-09-09,-137
245155,1/10/2017,9/9/2016,72,729.558951,5,2017-01-10,2016-09-09,-123
2452281,10/3/2018,9/18/2018,12,68.893,2,2018-10-03,2018-09-18,-15
2452331,10/10/2018,9/12/2018,8,37.189,5,2018-10-10,2018-09-12,-28
245255,2/22/2018,2/22/2018,1,16.372,1,2018-02-22,2018-02-22,0
245271,10/23/2016,11/5/2016,2,27.588906,2,2016-10-23,2016-11-05,13
245273,10/14/2018,10/14/2018,1,5.901,1,2018-10-14,2018-10-14,0
245285,10/22/2017,2/12/2017,3,12.001,3,2017-10-22,2017-02-12,-252
2452891,12/11/2018,12/11/2018,1,21.716,1,2018-12-11,2018-12-11,0
2452941,11/3/2019,11/3/2019,1,6.987,1,2019-11-03,2019-11-03,0
245321,6/16/2018,6/16/2018,1,1.649,1,2018-06-16,2018-06-16,0
2453931,10/12/2019,10/12/2019,1,2.787,1,2019-10-12,2019-10-12,0
245425,12/2/2016,7/28/2017,2,13.464,1,2016-12-02,2017-07-28,238
2454361,1/4/2020,1/4/2020,1,4.783,1,2020-01-04,2020-01-04,0
245455,4/14/2017,4/14/2017,2,8.576,2,2017-04-14,2017-04-14,0
2454621,10/15/2018,9/22/2018,15,55.925,4,2018-10-15,2018-09-22,-23
2454861,1/10/2019,9/7/2018,274,4018.977,4,2019-01-10,2018-09-07,-125
245607,9/14/2018,9/14/2018,1,8.015,1,2018-09-14,2018-09-14,0
245661,3/23/2018,3/23/2018,1,15.03,1,2018-03-23,2018-03-23,0
2456761,7/6/2018,7/6/2018,1,11.562,1,2018-07-06,2018-07-06,0
245749,1/9/2018,3/7/2018,3,25.309,2,2018-01-09,2018-03-07,57
245819,11/22/2019,9/8/2018,11,57.167,6,2019-11-22,2018-09-08,-440
2458771,11/14/2019,11/14/2019,1,3.793,1,2019-11-14,2019-11-14,0
2459001,10/24/2018,2/13/2019,2,14.797,1,2018-10-24,2019-02-13,112
245917,10/13/2017,10/13/2017,1,49.557,1,2017-10-13,2017-10-13,0
2459261,5/20/2019,5/20/2019,1,15.162,1,2019-05-20,2019-05-20,0
245953,3/31/2017,3/31/2017,1,0.6,1,2017-03-31,2017-03-31,0
2459971,10/23/2020,9/9/2020,53,653.051,4,2020-10-23,2020-09-09,-44
245999,6/20/2017,6/20/2017,1,3.323,1,2017-06-20,2017-06-20,0
2460201,12/20/2018,12/21/2018,2,5.089,2,2018-12-20,2018-12-21,1
2460261,8/6/2020,8/6/2020,1,13.637,1,2020-08-06,2020-08-06,0
246041,7/10/2019,7/17/2019,2,9.31,1,2019-07-10,2019-07-17,7
246103,8/16/2017,8/24/2017,2,12.923,1,2017-08-16,2017-08-24,8
2461161,12/22/2018,8/26/2018,4,28.328,3,2018-12-22,2018-08-26,-118
246175,10/17/2019,9/12/2020,4,34.497,2,2019-10-17,2020-09-12,331
2462031,3/3/2020,3/3/2020,1,6.383,1,2020-03-03,2020-03-03,0
246243,12/12/2016,12/12/2016,1,7.604,1,2016-12-12,2016-12-12,0
2462921,9/20/2018,9/20/2018,1,4.255,1,2018-09-20,2018-09-20,0
2463621,1/26/2020,1/26/2020,1,7.473,1,2020-01-26,2020-01-26,0
246385,1/30/2017,9/14/2016,20,252.94564,8,2017-01-30,2016-09-14,-138
2464,4/19/2018,9/13/2017,2,31.146,2,2018-04-19,2017-09-13,-218
2464111,10/1/2020,9/9/2020,35,299.179,3,2020-10-01,2020-09-09,-22
246471,9/14/2016,9/14/2016,1,11.582417,1,2016-09-14,2016-09-14,0
246489,1/12/2017,9/9/2016,34,81.959586,2,2017-01-12,2016-09-09,-125
2465151,1/15/2019,9/27/2018,10,146.186,3,2019-01-15,2018-09-27,-110
2465341,1/23/2020,10/4/2019,2,9.658,1,2020-01-23,2019-10-04,-111
246537,11/14/2018,9/26/2018,16,185.385659,4,2018-11-14,2018-09-26,-49
246621,1/18/2017,5/11/2017,12,55.542736,8,2017-01-18,2017-05-11,113
246669,7/8/2017,7/8/2017,1,1.59,1,2017-07-08,2017-07-08,0
2466881,2/16/2019,4/19/2019,2,7.207000000000001,2,2019-02-16,2019-04-19,62
2467001,10/16/2019,4/6/2019,3,9.972000000000001,2,2019-10-16,2019-04-06,-193
246715,12/27/2017,12/27/2017,1,3.592,1,2017-12-27,2017-12-27,0
246721,8/30/2018,8/30/2018,1,10.668,1,2018-08-30,2018-08-30,0
246733,5/15/2018,8/18/2016,2,8.209365,2,2018-05-15,2016-08-18,-635
2467351,10/3/2018,11/23/2018,2,23.242,2,2018-10-03,2018-11-23,51
2467551,1/12/2019,9/24/2019,14,78.586,9,2019-01-12,2019-09-24,255
246801,1/10/2019,9/7/2018,25,111.110864,8,2019-01-10,2018-09-07,-125
2468541,11/26/2019,11/26/2019,1,15.925,1,2019-11-26,2019-11-26,0
246891,6/29/2019,6/29/2019,1,13.775,1,2019-06-29,2019-06-29,0
2469281,10/4/2018,9/14/2018,4,161.27100000000002,2,2018-10-04,2018-09-14,-20
2469311,7/20/2019,7/20/2019,1,5.021,1,2019-07-20,2019-07-20,0
247025,2/17/2018,2/17/2018,1,15.222,1,2018-02-17,2018-02-17,0
2470341,10/9/2018,10/9/2018,1,13.308,1,2018-10-09,2018-10-09,0
2470941,4/30/2019,8/17/2018,3,17.372,3,2019-04-30,2018-08-17,-256
247127,10/30/2016,10/30/2016,1,4.205,1,2016-10-30,2016-10-30,0
2471301,7/10/2018,7/10/2018,1,7.751,1,2018-07-10,2018-07-10,0
247219,6/21/2018,6/21/2018,1,10.86,1,2018-06-21,2018-06-21,0
2472261,1/15/2019,1/15/2019,1,9.811,1,2019-01-15,2019-01-15,0
2472731,1/24/2019,7/11/2018,14,268.419,5,2019-01-24,2018-07-11,-197
247317,10/25/2019,5/31/2019,2,11.717,2,2019-10-25,2019-05-31,-147
247353,2/10/2019,9/22/2018,2,9.536,2,2019-02-10,2018-09-22,-141
2473621,1/9/2019,1/9/2019,1,9.747,1,2019-01-09,2019-01-09,0
2474181,10/23/2018,11/7/2018,4,36.237,2,2018-10-23,2018-11-07,15
2474281,3/21/2019,7/9/2018,3,40.596,3,2019-03-21,2018-07-09,-255
247459,10/19/2017,9/5/2018,30,157.051875,10,2017-10-19,2018-09-05,321
2474821,1/20/2019,1/20/2019,1,11.957,1,2019-01-20,2019-01-20,0
2474951,7/30/2019,8/22/2018,2,18.247,1,2019-07-30,2018-08-22,-342
2475351,9/26/2019,9/26/2019,1,8.113,1,2019-09-26,2019-09-26,0
2475651,6/10/2019,7/24/2019,2,22.011,2,2019-06-10,2019-07-24,44
2475961,10/7/2018,7/14/2018,3,19.33,3,2018-10-07,2018-07-14,-85
2476281,1/24/2020,1/24/2020,1,7.176,1,2020-01-24,2020-01-24,0
2476951,9/21/2019,9/21/2019,1,8.736,1,2019-09-21,2019-09-21,0
2477351,1/5/2020,10/13/2019,2,14.408999999999999,2,2020-01-05,2019-10-13,-84
2478211,1/10/2019,9/5/2018,153,1350.65,11,2019-01-10,2018-09-05,-127
2478251,7/10/2018,7/10/2018,1,16.783,1,2018-07-10,2018-07-10,0
247827,1/9/2017,1/9/2017,1,10.621,1,2017-01-09,2017-01-09,0
2478461,8/31/2018,8/31/2018,1,9.159,1,2018-08-31,2018-08-31,0
247857,1/11/2020,9/8/2019,39,235.158411,9,2020-01-11,2019-09-08,-125
247909,3/5/2020,3/5/2020,1,9.31,1,2020-03-05,2020-03-05,0
247939,11/13/2016,9/30/2018,3,19.075,3,2016-11-13,2018-09-30,686
2479481,9/9/2018,9/9/2018,1,11.569,1,2018-09-09,2018-09-09,0
247993,1/20/2020,9/28/2016,5,22.174923,4,2020-01-20,2016-09-28,-1209
2479971,12/26/2018,4/27/2019,2,12.445,1,2018-12-26,2019-04-27,122
2480291,7/10/2018,7/12/2018,3,33.333,1,2018-07-10,2018-07-12,2
2480311,7/11/2020,8/11/2020,2,17.493,1,2020-07-11,2020-08-11,31
2480451,1/15/2019,1/5/2019,2,19.845,2,2019-01-15,2019-01-05,-10
2480491,10/9/2018,7/25/2018,3,17.153,2,2018-10-09,2018-07-25,-76
24813,11/11/2018,7/28/2018,3,38.213,3,2018-11-11,2018-07-28,-106
248187,1/14/2020,9/4/2019,36,449.146,12,2020-01-14,2019-09-04,-132
2482101,3/29/2019,3/29/2019,1,17.411,1,2019-03-29,2019-03-29,0
2482201,8/21/2018,8/21/2018,1,28.952,1,2018-08-21,2018-08-21,0
2482331,1/10/2020,9/2/2018,29,418.911,7,2020-01-10,2018-09-02,-495
248237,11/12/2019,9/8/2017,10,62.854755000000004,9,2019-11-12,2017-09-08,-795
248263,12/22/2017,12/22/2017,1,2.932,1,2017-12-22,2017-12-22,0
2483381,10/16/2019,9/26/2020,5,37.264,4,2019-10-16,2020-09-26,346
2483561,10/9/2018,7/20/2018,2,29.826999999999998,2,2018-10-09,2018-07-20,-81
248415,8/25/2019,8/25/2019,1,2.317,1,2019-08-25,2019-08-25,0
248443,8/3/2020,8/3/2020,1,2.319,1,2020-08-03,2020-08-03,0
248467,1/19/2018,9/2/2018,6,36.081,6,2018-01-19,2018-09-02,226
2485041,7/14/2018,8/15/2018,2,10.019,1,2018-07-14,2018-08-15,32
248527,1/26/2019,1/26/2019,1,5.094,1,2019-01-26,2019-01-26,0
2485911,10/22/2019,9/13/2019,6,62.408,3,2019-10-22,2019-09-13,-39
2486291,1/26/2020,1/26/2020,1,4.706,1,2020-01-26,2020-01-26,0
2486731,10/16/2018,9/28/2019,12,99.37,5,2018-10-16,2019-09-28,347
248679,11/17/2016,11/17/2016,1,2.401,1,2016-11-17,2016-11-17,0
2487081,5/10/2019,6/4/2019,2,7.974,1,2019-05-10,2019-06-04,25
2487311,10/19/2019,2/9/2019,3,19.617,2,2019-10-19,2019-02-09,-252
2487701,5/25/2019,5/25/2019,1,2.61,1,2019-05-25,2019-05-25,0
2488,2/10/2019,2/10/2019,1,5.335,1,2019-02-10,2019-02-10,0
248815,11/12/2019,11/12/2019,1,4.547,1,2019-11-12,2019-11-12,0
248855,11/18/2016,4/10/2018,5,45.497,4,2016-11-18,2018-04-10,508
2488921,12/21/2018,12/21/2018,1,4.95,1,2018-12-21,2018-12-21,0
248931,3/17/2017,4/4/2017,2,7.283,2,2017-03-17,2017-04-04,18
2489851,10/21/2018,10/21/2018,1,6.746,1,2018-10-21,2018-10-21,0
249025,10/11/2017,10/11/2017,1,6.399,1,2017-10-11,2017-10-11,0
249103,7/31/2017,7/31/2017,1,12.684,1,2017-07-31,2017-07-31,0
249113,10/22/2018,9/3/2019,13,86.44,7,2018-10-22,2019-09-03,316
249143,5/4/2018,5/4/2018,1,6.475,1,2018-05-04,2018-05-04,0
2491431,9/18/2020,9/18/2020,1,1.567,1,2020-09-18,2020-09-18,0
2492321,1/13/2020,9/5/2019,28,446.854,9,2020-01-13,2019-09-05,-130
249237,10/20/2019,4/21/2017,3,23.466,3,2019-10-20,2017-04-21,-912
2492391,1/25/2019,8/1/2018,4,43.415,4,2019-01-25,2018-08-01,-177
249245,10/12/2016,8/31/2017,17,277.268607,8,2016-10-12,2017-08-31,323
2492461,5/11/2019,5/11/2019,1,8.383,1,2019-05-11,2019-05-11,0
2492501,1/18/2019,1/18/2019,1,2.622,1,2019-01-18,2019-01-18,0
2492681,1/10/2020,9/9/2019,149,871.398,3,2020-01-10,2019-09-09,-123
2492801,7/25/2018,9/14/2018,3,11.533999999999999,2,2018-07-25,2018-09-14,51
2493581,6/19/2019,6/19/2019,1,7.168,1,2019-06-19,2019-06-19,0
2493771,7/12/2018,8/30/2018,3,14.149,2,2018-07-12,2018-08-30,49
2493801,10/3/2020,10/3/2020,1,6.588,1,2020-10-03,2020-10-03,0
2493871,10/15/2018,8/6/2019,8,106.58,6,2018-10-15,2019-08-06,295
249445,1/14/2017,9/4/2016,20,118.311095,8,2017-01-14,2016-09-04,-132
249461,1/18/2018,9/5/2018,89,774.580782,6,2018-01-18,2018-09-05,230
249511,11/22/2017,9/29/2017,2,18.887,2,2017-11-22,2017-09-29,-54
249591,8/26/2016,9/20/2016,3,14.010428999999998,3,2016-08-26,2016-09-20,25
249639,1/7/2020,9/6/2019,6,35.660000000000004,3,2020-01-07,2019-09-06,-123
2496391,12/4/2018,12/4/2018,1,5.055,1,2018-12-04,2018-12-04,0
249643,4/25/2018,4/25/2018,1,10.82,1,2018-04-25,2018-04-25,0
2497021,2/23/2020,2/23/2020,1,8.833,1,2020-02-23,2020-02-23,0
249711,7/20/2020,9/9/2020,3,31.740000000000002,2,2020-07-20,2020-09-09,51
2497191,10/1/2019,2/14/2020,2,7.277,2,2019-10-01,2020-02-14,136
249765,12/20/2018,12/20/2018,1,1.211,1,2018-12-20,2018-12-20,0
2498061,11/20/2018,12/27/2018,2,16.698,2,2018-11-20,2018-12-27,37
2498091,12/13/2018,12/13/2018,2,15.876999999999999,2,2018-12-13,2018-12-13,0
2498301,6/1/2019,6/8/2019,2,9.943,2,2019-06-01,2019-06-08,7
249849,5/31/2017,5/31/2017,1,7.968,1,2017-05-31,2017-05-31,0
249865,11/11/2018,9/22/2017,7,49.491,4,2018-11-11,2017-09-22,-415
2499571,10/11/2018,9/7/2018,26,212.522,7,2018-10-11,2018-09-07,-34
249983,1/20/2017,9/8/2019,4,22.158,3,2017-01-20,2019-09-08,961
250031,10/20/2017,10/20/2017,1,4.377,1,2017-10-20,2017-10-20,0
250079,9/26/2017,9/26/2017,1,4.459,1,2017-09-26,2017-09-26,0
2501011,1/2/2019,9/6/2019,28,57.553,5,2019-01-02,2019-09-06,247
2501091,5/8/2019,5/8/2019,1,3.419,1,2019-05-08,2019-05-08,0
250223,12/1/2018,3/2/2019,2,18.885,1,2018-12-01,2019-03-02,91
2502351,10/16/2019,10/16/2019,1,7.262,1,2019-10-16,2019-10-16,0
250243,12/2/2020,12/9/2020,2,27.186999999999998,2,2020-12-02,2020-12-09,7
250269,12/20/2018,12/20/2018,1,0.571,1,2018-12-20,2018-12-20,0
250291,4/2/2019,4/2/2019,1,7.96,1,2019-04-02,2019-04-02,0
2503881,9/25/2018,9/25/2018,1,3.643,1,2018-09-25,2018-09-25,0
2503991,6/25/2019,6/25/2019,1,9.36,1,2019-06-25,2019-06-25,0
250403,3/2/2017,8/20/2016,2,25.52083,1,2017-03-02,2016-08-20,-194
2504521,12/8/2019,7/15/2018,3,14.132,2,2019-12-08,2018-07-15,-511
250455,1/11/2017,9/17/2019,31,154.442633,6,2017-01-11,2019-09-17,979
250459,1/1/2019,9/4/2020,65,619.357446,4,2019-01-01,2020-09-04,612
250479,3/28/2019,9/6/2017,4,64.47200000000001,2,2019-03-28,2017-09-06,-568
250483,5/23/2019,5/23/2019,1,4.357,1,2019-05-23,2019-05-23,0
250501,11/8/2016,11/8/2016,1,3.641,1,2016-11-08,2016-11-08,0
2505341,1/30/2019,1/30/2019,1,5.331,1,2019-01-30,2019-01-30,0
2506051,10/12/2018,10/3/2018,2,24.852,2,2018-10-12,2018-10-03,-9
2506731,7/14/2018,7/14/2018,1,10.564,1,2018-07-14,2018-07-14,0
2506791,12/19/2020,12/19/2020,1,1.703,1,2020-12-19,2020-12-19,0
2506991,10/20/2018,12/8/2019,2,11.284,2,2018-10-20,2019-12-08,414
2507541,7/14/2018,7/14/2018,1,6.856,1,2018-07-14,2018-07-14,0
2507731,10/23/2018,8/16/2018,6,23.837,5,2018-10-23,2018-08-16,-68
250805,12/8/2017,12/8/2017,1,9.011,1,2017-12-08,2017-12-08,0
2508071,1/14/2019,9/25/2019,47,371.839,9,2019-01-14,2019-09-25,254
250825,12/22/2017,12/22/2017,1,12.275,1,2017-12-22,2017-12-22,0
250875,10/5/2019,9/9/2018,18,39.283997,7,2019-10-05,2018-09-09,-391
250881,10/25/2016,6/15/2017,4,17.896967,4,2016-10-25,2017-06-15,233
2509301,6/2/2019,6/2/2019,1,1.502,1,2019-06-02,2019-06-02,0
2509671,10/23/2018,10/30/2018,2,11.443,2,2018-10-23,2018-10-30,7
2509941,1/20/2019,9/30/2018,3,8.341999999999999,1,2019-01-20,2018-09-30,-112
2510461,5/23/2019,5/23/2019,1,1.9,1,2019-05-23,2019-05-23,0
251051,5/19/2017,5/19/2017,1,11.326,1,2017-05-19,2017-05-19,0
2510601,7/15/2019,7/15/2019,1,4.171,1,2019-07-15,2019-07-15,0
2510631,1/5/2019,11/11/2018,4,23.128,2,2019-01-05,2018-11-11,-55
2510721,1/14/2019,9/17/2019,15,388.173,4,2019-01-14,2019-09-17,246
2510811,11/24/2018,9/5/2019,4,33.748999999999995,2,2018-11-24,2019-09-05,285
251089,11/7/2017,11/7/2017,1,1.389,1,2017-11-07,2017-11-07,0
251155,10/7/2017,8/13/2017,9,59.893,6,2017-10-07,2017-08-13,-55
2511831,10/2/2019,10/2/2019,1,0.752,1,2019-10-02,2019-10-02,0
2512531,9/9/2018,9/9/2018,1,16.205,1,2018-09-09,2018-09-09,0
251261,10/22/2016,3/5/2019,3,3.857479,3,2016-10-22,2019-03-05,864
251273,3/24/2018,3/24/2018,1,0.02,1,2018-03-24,2018-03-24,0
251287,10/10/2019,9/20/2019,25,451.053,4,2019-10-10,2019-09-20,-20
2513301,10/12/2018,9/4/2018,20,376.708,3,2018-10-12,2018-09-04,-38
251341,11/22/2019,12/14/2016,2,4.77,2,2019-11-22,2016-12-14,-1073
2513971,9/4/2019,9/4/2019,1,14.83,1,2019-09-04,2019-09-04,0
251405,9/25/2016,9/25/2016,1,4.871154,1,2016-09-25,2016-09-25,0
251475,1/21/2018,4/28/2018,4,20.43,2,2018-01-21,2018-04-28,97
2515011,3/5/2019,9/4/2018,2,23.31,1,2019-03-05,2018-09-04,-182
251527,12/16/2018,12/16/2018,1,7.412,1,2018-12-16,2018-12-16,0
2516071,6/30/2019,6/30/2019,1,1.772,1,2019-06-30,2019-06-30,0
251609,3/16/2018,8/26/2018,4,17.541,3,2018-03-16,2018-08-26,163
251643,11/13/2018,11/13/2018,1,10.955,1,2018-11-13,2018-11-13,0
2516601,9/15/2018,9/15/2018,1,5.987,1,2018-09-15,2018-09-15,0
2517421,11/21/2018,11/21/2018,1,6.289,1,2018-11-21,2018-11-21,0
2517481,1/14/2019,9/6/2018,122,2443.203,6,2019-01-14,2018-09-06,-130
251767,11/1/2017,9/3/2019,5,40.067,4,2017-11-01,2019-09-03,671
2517881,7/22/2018,8/4/2018,7,50.019999999999996,2,2018-07-22,2018-08-04,13
251795,6/29/2018,6/29/2018,1,3.73,1,2018-06-29,2018-06-29,0
2518251,9/22/2018,9/22/2018,1,2.398,1,2018-09-22,2018-09-22,0
251885,6/6/2019,6/6/2019,1,10.391,1,2019-06-06,2019-06-06,0
2518861,11/16/2019,11/16/2019,1,9.967,1,2019-11-16,2019-11-16,0
251927,2/20/2017,6/17/2017,3,36.221000000000004,2,2017-02-20,2017-06-17,117
251957,1/6/2017,9/8/2017,9,18.644,4,2017-01-06,2017-09-08,245
2520161,6/23/2019,6/23/2019,1,7.064,1,2019-06-23,2019-06-23,0
2520311,1/20/2019,7/4/2019,2,23.102,2,2019-01-20,2019-07-04,165
2520391,11/20/2018,11/20/2018,1,13.182,1,2018-11-20,2018-11-20,0
252059,2/24/2017,9/26/2017,2,2.272,2,2017-02-24,2017-09-26,214
2520661,9/1/2018,9/1/2018,1,14.085,1,2018-09-01,2018-09-01,0
2521091,10/13/2019,9/12/2019,4,42.051,3,2019-10-13,2019-09-12,-31
252133,1/14/2020,6/25/2019,10,18.091,4,2020-01-14,2019-06-25,-203
2521711,2/3/2019,2/3/2019,1,3.378,1,2019-02-03,2019-02-03,0
252255,9/15/2018,9/15/2018,1,13.261,1,2018-09-15,2018-09-15,0
2522561,7/31/2018,7/31/2018,1,3.343,1,2018-07-31,2018-07-31,0
252413,11/1/2016,9/8/2016,7,50.625868,4,2016-11-01,2016-09-08,-54
2524351,12/23/2018,9/22/2019,5,13.049,3,2018-12-23,2019-09-22,273
2525171,12/15/2018,12/19/2018,2,31.546999999999997,2,2018-12-15,2018-12-19,4
2525761,3/10/2019,3/10/2019,1,5.504,1,2019-03-10,2019-03-10,0
2527791,2/28/2020,9/29/2018,6,61.282000000000004,5,2020-02-28,2018-09-29,-517
2527971,7/21/2018,8/3/2018,3,15.591,2,2018-07-21,2018-08-03,13
252801,7/10/2018,7/10/2018,1,8.641,1,2018-07-10,2018-07-10,0
2528481,11/2/2019,12/10/2018,2,11.395,2,2019-11-02,2018-12-10,-327
252849,3/26/2018,4/22/2018,3,24.02,1,2018-03-26,2018-04-22,27
2528531,1/26/2020,5/28/2019,4,31.212,3,2020-01-26,2019-05-28,-243
2528561,10/6/2018,10/6/2018,1,2.464,1,2018-10-06,2018-10-06,0
252877,11/4/2016,5/28/2017,2,6.302,2,2016-11-04,2017-05-28,205
252891,3/24/2017,3/24/2017,1,4.342,1,2017-03-24,2017-03-24,0
2529061,12/23/2018,9/14/2019,2,20.488,2,2018-12-23,2019-09-14,265
2530011,11/13/2019,11/13/2019,1,3.316,1,2019-11-13,2019-11-13,0
2530341,7/28/2018,7/28/2018,1,4.63,1,2018-07-28,2018-07-28,0
2531871,10/23/2018,9/13/2018,23,176.607,4,2018-10-23,2018-09-13,-40
2531991,8/29/2020,8/29/2020,1,8.446,1,2020-08-29,2020-08-29,0
2532081,2/8/2020,2/8/2020,1,0.109,1,2020-02-08,2020-02-08,0
253221,11/13/2019,11/13/2019,1,11.754,1,2019-11-13,2019-11-13,0
2532271,2/16/2019,2/16/2019,1,12.366,1,2019-02-16,2019-02-16,0
2532421,1/26/2019,9/26/2019,4,51.573,3,2019-01-26,2019-09-26,243
253249,4/22/2017,7/19/2019,2,8.836,2,2017-04-22,2019-07-19,818
2532841,2/24/2019,2/24/2019,1,11.344,1,2019-02-24,2019-02-24,0
253371,10/11/2016,9/9/2016,24,183.305626,4,2016-10-11,2016-09-09,-32
253417,10/17/2016,10/17/2016,1,3.96399,1,2016-10-17,2016-10-17,0
253451,1/14/2018,5/31/2018,5,21.778,4,2018-01-14,2018-05-31,137
253469,11/26/2017,11/26/2017,1,7.14,1,2017-11-26,2017-11-26,0
2535,1/20/2018,9/7/2016,192,1812.869159,7,2018-01-20,2016-09-07,-500
2535001,12/21/2019,6/1/2019,15,88.505,6,2019-12-21,2019-06-01,-203
253599,8/7/2018,8/7/2018,1,21.169,1,2018-08-07,2018-08-07,0
2536281,7/19/2018,7/19/2018,1,15.249,1,2018-07-19,2018-07-19,0
253695,12/14/2018,12/14/2018,1,4.344,1,2018-12-14,2018-12-14,0
253709,7/13/2019,7/13/2019,1,9.347,1,2019-07-13,2019-07-13,0
253777,5/23/2017,5/23/2017,1,4.842,1,2017-05-23,2017-05-23,0
2537791,10/27/2019,10/27/2019,1,1.545,1,2019-10-27,2019-10-27,0
2538271,1/19/2020,1/19/2020,1,3.128,1,2020-01-19,2020-01-19,0
253V,10/5/2016,10/5/2016,1,1.417779,1,2016-10-05,2016-10-05,0
254045,8/27/2019,8/27/2019,1,4.815,1,2019-08-27,2019-08-27,0
2541121,10/28/2018,9/15/2018,2,25.794,2,2018-10-28,2018-09-15,-43
2542681,2/8/2019,6/8/2019,3,31.418999999999997,2,2019-02-08,2019-06-08,120
254313,5/27/2018,5/27/2018,1,12.894,1,2018-05-27,2018-05-27,0
254327,10/2/2016,12/10/2016,2,4.404343,2,2016-10-02,2016-12-10,69
2544831,10/17/2019,10/17/2019,1,6.973,1,2019-10-17,2019-10-17,0
2545,1/1/2018,9/3/2018,90,666.364611,11,2018-01-01,2018-09-03,245
2545091,9/2/2018,9/2/2018,1,2.471,1,2018-09-02,2018-09-02,0
254523,8/22/2016,8/22/2016,1,15.805926,1,2016-08-22,2016-08-22,0
2545351,8/23/2018,8/23/2018,1,4.188,1,2018-08-23,2018-08-23,0
2545931,4/27/2019,4/27/2019,1,5.29,1,2019-04-27,2019-04-27,0
254631,1/7/2017,9/24/2016,6,43.101147,2,2017-01-07,2016-09-24,-105
2547281,1/2/2019,7/20/2018,3,16.637,3,2019-01-02,2018-07-20,-166
254745,1/8/2020,5/8/2019,2,12.637,2,2020-01-08,2019-05-08,-245
254771,3/1/2018,8/29/2018,2,17.506999999999998,1,2018-03-01,2018-08-29,181
254773,12/10/2018,12/8/2018,2,4.265000000000001,2,2018-12-10,2018-12-08,-2
2547771,9/13/2018,9/13/2018,1,7.884,1,2018-09-13,2018-09-13,0
254781,1/26/2017,8/18/2016,12,89.090557,5,2017-01-26,2016-08-18,-161
2547911,12/21/2018,4/21/2019,3,16.45,3,2018-12-21,2019-04-21,121
2547991,9/22/2018,9/22/2018,1,8.809,1,2018-09-22,2018-09-22,0
254841,10/26/2017,10/26/2017,2,8.885,2,2017-10-26,2017-10-26,0
2548751,8/13/2018,8/13/2018,1,6.324,1,2018-08-13,2018-08-13,0
254903,5/20/2017,5/20/2017,1,9.512,1,2017-05-20,2017-05-20,0
2549431,12/12/2018,12/12/2018,1,9.393,1,2018-12-12,2018-12-12,0
254951,10/8/2017,9/16/2017,2,10.123000000000001,2,2017-10-08,2017-09-16,-22
255015,10/27/2017,9/22/2018,10,81.158,6,2017-10-27,2018-09-22,330
255093,8/21/2019,8/21/2019,1,13.435,1,2019-08-21,2019-08-21,0
2551001,7/30/2019,7/30/2019,1,5.385,1,2019-07-30,2019-07-30,0
2551091,1/10/2020,9/27/2018,214,3794.754,4,2020-01-10,2018-09-27,-470
255171,5/17/2018,7/18/2019,2,18.8,2,2018-05-17,2019-07-18,427
2552691,7/21/2018,8/1/2018,4,10.406,3,2018-07-21,2018-08-01,11
2552751,10/13/2019,7/28/2019,15,69.856,6,2019-10-13,2019-07-28,-77
2553231,1/25/2020,1/25/2020,1,21.541,1,2020-01-25,2020-01-25,0
2553271,10/24/2018,7/13/2020,2,2.281,2,2018-10-24,2020-07-13,628
2553491,10/28/2020,9/22/2018,5,29.376,4,2020-10-28,2018-09-22,-767
255431,8/26/2017,8/26/2018,2,8.503,2,2017-08-26,2018-08-26,365
255451,10/24/2016,4/8/2017,2,11.013124999999999,2,2016-10-24,2017-04-08,166
255473,9/11/2016,9/11/2016,1,4.0134,1,2016-09-11,2016-09-11,0
2554961,10/6/2018,2/23/2020,2,20.241,2,2018-10-06,2020-02-23,505
2554971,7/27/2018,7/27/2018,1,7.551,1,2018-07-27,2018-07-27,0
255521,12/18/2017,12/8/2016,2,5.33,2,2017-12-18,2016-12-08,-375
2555691,5/24/2019,5/24/2019,1,5.875,1,2019-05-24,2019-05-24,0
255573,6/27/2019,7/16/2019,2,4.9879999999999995,2,2019-06-27,2019-07-16,19
2555971,7/27/2019,7/27/2019,1,7.115,1,2019-07-27,2019-07-27,0
255599,12/30/2018,5/24/2018,3,24.413,3,2018-12-30,2018-05-24,-220
255613,1/12/2019,9/8/2019,64,309.153,12,2019-01-12,2019-09-08,239
2556351,12/1/2018,12/1/2018,1,10.164,1,2018-12-01,2018-12-01,0
255693,1/15/2017,9/18/2016,33,65.816158,6,2017-01-15,2016-09-18,-119
2558251,3/19/2019,3/19/2019,1,13.913,1,2019-03-19,2019-03-19,0
2558291,7/26/2018,7/26/2018,1,1.162,1,2018-07-26,2018-07-26,0
255855,11/3/2016,5/2/2018,2,18.314,2,2016-11-03,2018-05-02,545
2558951,1/6/2019,8/15/2018,2,1.682,2,2019-01-06,2018-08-15,-144
2559381,11/11/2018,11/11/2018,1,6.242,1,2018-11-11,2018-11-11,0
255945,6/22/2019,7/15/2018,2,9.965,1,2019-06-22,2018-07-15,-342
255965,2/1/2019,3/3/2017,3,15.235,1,2019-02-01,2017-03-03,-700
255973,5/6/2018,5/6/2018,1,9.822,1,2018-05-06,2018-05-06,0
2559761,8/31/2019,8/31/2019,1,4.905,1,2019-08-31,2019-08-31,0
256009,4/24/2017,9/2/2016,6,41.258139,2,2017-04-24,2016-09-02,-234
256035,10/12/2016,10/12/2016,1,8.396722,1,2016-10-12,2016-10-12,0
2560601,12/13/2019,12/13/2019,1,3.626,1,2019-12-13,2019-12-13,0
2560811,9/20/2018,9/20/2018,1,17.135,1,2018-09-20,2018-09-20,0
256085,1/12/2018,3/11/2018,6,45.758,4,2018-01-12,2018-03-11,58
256087,4/9/2018,9/9/2016,2,5.185090000000001,2,2018-04-09,2016-09-09,-577
2561411,8/23/2018,8/23/2018,1,6.774,1,2018-08-23,2018-08-23,0
256163,8/20/2017,8/20/2017,2,13.352,2,2017-08-20,2017-08-20,0
2561771,10/21/2018,9/9/2018,16,30.262,7,2018-10-21,2018-09-09,-42
2562081,12/6/2018,9/23/2019,2,34.747,2,2018-12-06,2019-09-23,291
2562241,1/19/2019,1/19/2019,1,17.923,1,2019-01-19,2019-01-19,0
2562891,10/22/2018,7/26/2020,5,17.125,3,2018-10-22,2020-07-26,643
2563261,2/29/2020,2/29/2020,1,13.159,1,2020-02-29,2020-02-29,0
2563321,12/6/2018,12/6/2018,1,5.78,1,2018-12-06,2018-12-06,0
2563391,7/28/2018,7/28/2018,1,7.731,1,2018-07-28,2018-07-28,0
256389,1/30/2018,2/27/2018,3,31.509999999999998,2,2018-01-30,2018-02-27,28
2564131,2/19/2019,2/19/2019,1,3.437,1,2019-02-19,2019-02-19,0
256461,3/30/2017,3/30/2017,1,9.165,1,2017-03-30,2017-03-30,0
2564731,8/23/2018,8/24/2018,3,27.524,2,2018-08-23,2018-08-24,1
2565931,10/26/2018,8/22/2019,2,1.457,2,2018-10-26,2019-08-22,300
2566021,9/29/2018,9/29/2018,1,8.271,1,2018-09-29,2018-09-29,0
2566331,12/18/2019,12/18/2019,1,7.027,1,2019-12-18,2019-12-18,0
2566421,11/11/2018,7/18/2020,2,32.417,2,2018-11-11,2020-07-18,615
256741,2/1/2017,2/1/2017,1,9.858,1,2017-02-01,2017-02-01,0
2567911,1/26/2020,9/6/2019,5,70.41,3,2020-01-26,2019-09-06,-142
256821,7/7/2019,7/7/2019,1,4.828,1,2019-07-07,2019-07-07,0
256925,10/4/2016,2/26/2017,8,67.25726399999999,4,2016-10-04,2017-02-26,145
256985,3/11/2017,3/24/2017,2,3.588,2,2017-03-11,2017-03-24,13
2570101,1/17/2019,7/3/2019,4,28.673,4,2019-01-17,2019-07-03,167
2570371,1/30/2019,9/18/2018,12,325.882,4,2019-01-30,2018-09-18,-134
2570551,7/23/2018,7/23/2018,1,27.384,1,2018-07-23,2018-07-23,0
2570561,5/27/2019,5/27/2019,1,5.504,1,2019-05-27,2019-05-27,0
2570721,3/24/2019,3/24/2019,1,11.328,1,2019-03-24,2019-03-24,0
257075,10/1/2017,10/1/2017,1,6.91,1,2017-10-01,2017-10-01,0
2572061,10/2/2019,10/4/2019,5,16.416,3,2019-10-02,2019-10-04,2
2572271,9/7/2019,9/7/2019,1,7.288,1,2019-09-07,2019-09-07,0
2572691,1/12/2020,9/9/2020,278,3276.008,13,2020-01-12,2020-09-09,241
2573471,9/10/2018,9/10/2018,1,2.963,1,2018-09-10,2018-09-10,0
2573591,1/11/2020,12/8/2019,4,13.818999999999999,4,2020-01-11,2019-12-08,-34
2573861,10/18/2018,3/23/2019,2,12.801,2,2018-10-18,2019-03-23,156
2573991,10/16/2019,10/16/2019,1,7.367,1,2019-10-16,2019-10-16,0
2574011,1/14/2019,9/4/2019,42,296.041,8,2019-01-14,2019-09-04,233
2574711,1/10/2020,9/6/2019,40,373.89,4,2020-01-10,2019-09-06,-126
2575061,3/19/2019,3/19/2019,1,4.581,1,2019-03-19,2019-03-19,0
257521,1/26/2019,7/18/2018,4,18.774,3,2019-01-26,2018-07-18,-192
257523,1/2/2020,6/23/2019,7,33.323,3,2020-01-02,2019-06-23,-193
2575291,6/23/2019,6/23/2019,1,12.628,1,2019-06-23,2019-06-23,0
2575701,9/5/2019,9/5/2019,1,4.769,1,2019-09-05,2019-09-05,0
257581,8/1/2018,8/1/2018,1,4.793,1,2018-08-01,2018-08-01,0
2575911,2/13/2019,2/13/2019,1,0.713,1,2019-02-13,2019-02-13,0
257621,1/15/2019,9/6/2019,15,119.17,9,2019-01-15,2019-09-06,234
2576731,10/20/2019,10/20/2019,1,7.207,1,2019-10-20,2019-10-20,0
257683,6/29/2018,8/7/2018,4,169.175,3,2018-06-29,2018-08-07,39
2576841,11/15/2019,11/15/2019,1,12.447,1,2019-11-15,2019-11-15,0
257795,11/22/2019,11/22/2019,1,2.348,1,2019-11-22,2019-11-22,0
2578531,11/17/2018,11/17/2018,1,0.027,1,2018-11-17,2018-11-17,0
2578571,2/2/2020,8/7/2018,2,17.765,2,2020-02-02,2018-08-07,-544
2578751,3/1/2019,3/1/2019,1,1.045,1,2019-03-01,2019-03-01,0
257901,1/12/2018,12/17/2018,2,16.54,2,2018-01-12,2018-12-17,339
257905,5/29/2019,5/29/2019,1,3.467,1,2019-05-29,2019-05-29,0
2579341,7/28/2018,7/28/2018,1,15.173,1,2018-07-28,2018-07-28,0
2580411,1/22/2019,9/8/2019,40,230.993,7,2019-01-22,2019-09-08,229
2580871,7/25/2018,7/31/2018,3,19.457,2,2018-07-25,2018-07-31,6
2581791,10/26/2018,9/3/2018,8,42.74,3,2018-10-26,2018-09-03,-53
2582121,4/27/2019,4/27/2019,1,7.013,1,2019-04-27,2019-04-27,0
2582511,1/14/2019,9/8/2019,65,552.519,8,2019-01-14,2019-09-08,237
2582551,1/10/2019,1/7/2019,2,10.174,1,2019-01-10,2019-01-07,-3
2582701,12/14/2018,12/14/2018,1,9.099,1,2018-12-14,2018-12-14,0
2582931,1/2/2019,8/8/2019,25,167.43,3,2019-01-02,2019-08-08,218
2583381,11/23/2018,11/23/2018,1,6.018,1,2018-11-23,2018-11-23,0
258381,3/29/2018,8/5/2016,10,70.032379,4,2018-03-29,2016-08-05,-601
2584111,7/28/2018,7/28/2018,1,5.314,1,2018-07-28,2018-07-28,0
258449,8/27/2016,8/27/2016,1,5.369514,1,2016-08-27,2016-08-27,0
258455,1/10/2018,9/13/2018,9,75.687,7,2018-01-10,2018-09-13,246
2584811,9/15/2018,9/15/2018,1,5.292,1,2018-09-15,2018-09-15,0
2586011,7/20/2019,7/20/2019,1,9.75,1,2019-07-20,2019-07-20,0
2586211,8/21/2018,8/21/2018,1,3.216,1,2018-08-21,2018-08-21,0
258635,3/16/2018,3/16/2018,2,18.977,2,2018-03-16,2018-03-16,0
258687,12/10/2017,12/10/2017,1,7.32,1,2017-12-10,2017-12-10,0
258769,5/24/2018,8/7/2017,2,7.5280000000000005,1,2018-05-24,2017-08-07,-290
258771,8/11/2016,8/11/2016,1,5.542347,1,2016-08-11,2016-08-11,0
2587761,12/14/2018,12/14/2018,1,11.301,1,2018-12-14,2018-12-14,0
258797,10/2/2017,9/5/2017,9,45.07,4,2017-10-02,2017-09-05,-27
258831,3/24/2018,9/19/2017,2,7.923,1,2018-03-24,2017-09-19,-186
2588311,1/14/2019,9/7/2018,50,829.541,4,2019-01-14,2018-09-07,-129
2588711,1/11/2020,9/26/2018,19,261.964,9,2020-01-11,2018-09-26,-472
258897,12/1/2017,8/28/2019,2,21.285,2,2017-12-01,2019-08-28,635
2589361,11/1/2018,8/9/2018,2,16.675,2,2018-11-01,2018-08-09,-84
2589851,3/25/2019,3/26/2019,2,42.507,1,2019-03-25,2019-03-26,1
2589921,3/11/2019,3/11/2019,1,2.649,1,2019-03-11,2019-03-11,0
2589941,1/20/2019,9/30/2018,20,130.584,5,2019-01-20,2018-09-30,-112
259043,11/19/2017,9/13/2019,17,86.92699999999999,13,2017-11-19,2019-09-13,663
259057,1/27/2018,12/2/2017,2,5.8260000000000005,1,2018-01-27,2017-12-02,-56
2591101,8/18/2018,8/18/2018,1,10.989,1,2018-08-18,2018-08-18,0
259117,11/14/2016,7/20/2018,2,3.748,2,2016-11-14,2018-07-20,613
2591241,11/15/2018,9/27/2019,6,43.423,4,2018-11-15,2019-09-27,316
259199,11/14/2017,11/14/2017,1,10.307,1,2017-11-14,2017-11-14,0
2592311,1/25/2019,2/21/2019,2,13.056000000000001,2,2019-01-25,2019-02-21,27
259271,1/1/2017,12/25/2019,6,31.084253999999998,4,2017-01-01,2019-12-25,1088
259315,1/7/2020,1/7/2020,1,0.055,1,2020-01-07,2020-01-07,0
2593281,5/17/2019,5/17/2019,1,10.184,1,2019-05-17,2019-05-17,0
2593301,1/13/2019,1/13/2019,1,4.259,1,2019-01-13,2019-01-13,0
2593711,1/25/2020,1/25/2020,1,6.926,1,2020-01-25,2020-01-25,0
2594181,5/10/2019,5/10/2019,1,5.945,1,2019-05-10,2019-05-10,0
2594311,7/18/2020,7/18/2020,1,2.787,1,2020-07-18,2020-07-18,0
259443,12/31/2016,12/31/2016,1,4.323,1,2016-12-31,2016-12-31,0
2594441,8/5/2018,8/5/2018,1,14.81,1,2018-08-05,2018-08-05,0
2594461,10/25/2020,10/25/2020,1,1.597,1,2020-10-25,2020-10-25,0
2594551,8/11/2018,8/11/2018,1,10.583,1,2018-08-11,2018-08-11,0
2595091,4/19/2019,7/20/2019,2,7.665,2,2019-04-19,2019-07-20,92
2595541,1/12/2020,1/12/2020,1,8.055,1,2020-01-12,2020-01-12,0
2596341,11/17/2018,11/17/2018,1,12.605,1,2018-11-17,2018-11-17,0
259639,12/2/2019,8/8/2018,3,30.167176,2,2019-12-02,2018-08-08,-481
2596731,2/26/2019,4/18/2019,7,112.992,4,2019-02-26,2019-04-18,51
259771,8/26/2018,8/26/2018,1,7.124,1,2018-08-26,2018-08-26,0
2598241,10/18/2019,10/18/2019,1,23.535,1,2019-10-18,2019-10-18,0
259829,2/1/2020,2/19/2020,2,7.0169999999999995,2,2020-02-01,2020-02-19,18
259929,9/6/2016,9/7/2016,2,32.866018,1,2016-09-06,2016-09-07,1
2599991,4/6/2020,5/29/2020,2,14.071,1,2020-04-06,2020-05-29,53
260025,4/7/2018,4/7/2018,1,10.525,1,2018-04-07,2018-04-07,0
2600501,12/15/2018,12/15/2018,1,2.225,1,2018-12-15,2018-12-15,0
2600911,6/22/2019,8/31/2019,4,22.715,1,2019-06-22,2019-08-31,70
260101,12/15/2016,12/15/2016,1,3.665,1,2016-12-15,2016-12-15,0
2601871,9/16/2018,9/16/2018,1,7.135,1,2018-09-16,2018-09-16,0
260189,1/11/2017,9/9/2016,64,381.64597,16,2017-01-11,2016-09-09,-124
2601891,1/4/2019,8/3/2018,3,21.642000000000003,2,2019-01-04,2018-08-03,-154
260195,12/5/2016,12/5/2016,1,4.611,1,2016-12-05,2016-12-05,0
260205,7/29/2017,7/29/2017,1,5.908,1,2017-07-29,2017-07-29,0
2602831,7/28/2018,7/29/2018,2,21.621,1,2018-07-28,2018-07-29,1
260357,2/19/2019,9/17/2018,4,4.634,3,2019-02-19,2018-09-17,-155
260417,1/20/2017,1/20/2017,1,3.389,1,2017-01-20,2017-01-20,0
26043,9/23/2017,9/24/2017,3,19.942999999999998,3,2017-09-23,2017-09-24,1
260495,10/29/2017,9/3/2017,10,45.51,6,2017-10-29,2017-09-03,-56
260505,12/26/2018,12/26/2018,1,3.759,1,2018-12-26,2018-12-26,0
2605471,6/18/2019,8/16/2019,2,15.655,2,2019-06-18,2019-08-16,59
260551,11/19/2016,9/22/2016,5,58.578188999999995,3,2016-11-19,2016-09-22,-58
260575,1/12/2020,12/19/2019,4,35.082,4,2020-01-12,2019-12-19,-24
2607021,1/22/2019,9/21/2018,22,89.069,11,2019-01-22,2018-09-21,-123
2608181,8/13/2018,8/3/2018,3,19.025,2,2018-08-13,2018-08-03,-10
2608311,7/29/2018,7/29/2018,1,12.326,1,2018-07-29,2018-07-29,0
2608811,1/16/2019,1/16/2019,1,13.715,1,2019-01-16,2019-01-16,0
260947,1/11/2017,9/23/2018,23,77.864392,8,2017-01-11,2018-09-23,620
260969,1/22/2017,6/16/2019,4,19.741999999999997,4,2017-01-22,2019-06-16,875
260979,1/4/2020,9/22/2019,2,13.504999999999999,1,2020-01-04,2019-09-22,-104
2610271,10/12/2018,11/18/2018,2,15.833,2,2018-10-12,2018-11-18,37
2610881,8/24/2018,8/24/2018,1,15.796,1,2018-08-24,2018-08-24,0
261105,6/25/2018,6/25/2018,1,5.615,1,2018-06-25,2018-06-25,0
2611061,10/27/2018,10/27/2018,1,8.21,1,2018-10-27,2018-10-27,0
261141,2/11/2019,2/11/2019,1,3.873,1,2019-02-11,2019-02-11,0
261173,1/30/2019,1/30/2019,1,1.357,1,2019-01-30,2019-01-30,0
261221,1/11/2017,9/29/2017,34,140.85649,11,2017-01-11,2017-09-29,261
2612381,1/27/2019,7/7/2019,3,14.700999999999999,2,2019-01-27,2019-07-07,161
2612761,1/10/2019,9/24/2018,20,357.272,10,2019-01-10,2018-09-24,-108
261307,12/8/2018,12/8/2018,1,9.051,1,2018-12-08,2018-12-08,0
261309,2/18/2017,2/18/2017,1,6.43,1,2017-02-18,2017-02-18,0
2613441,7/30/2018,7/30/2018,1,0.112,1,2018-07-30,2018-07-30,0
261345,4/10/2019,4/10/2019,1,5.245,1,2019-04-10,2019-04-10,0
2613561,2/16/2019,2/16/2019,1,1.162,1,2019-02-16,2019-02-16,0
2613781,9/3/2018,9/3/2018,1,5.968,1,2018-09-03,2018-09-03,0
261395,3/4/2017,4/29/2017,2,8.097,2,2017-03-04,2017-04-29,56
2614021,7/30/2018,8/1/2018,2,13.89,2,2018-07-30,2018-08-01,2
2614241,12/21/2018,12/21/2018,1,5.487,1,2018-12-21,2018-12-21,0
261521,8/16/2019,8/16/2019,1,7.886,1,2019-08-16,2019-08-16,0
2615361,9/29/2018,9/29/2018,1,7.787,1,2018-09-29,2018-09-29,0
2615451,7/20/2019,8/19/2018,3,34.305,2,2019-07-20,2018-08-19,-335
2615571,10/24/2018,9/27/2018,6,76.123,3,2018-10-24,2018-09-27,-27
2615751,9/19/2018,9/19/2018,1,12.395,1,2018-09-19,2018-09-19,0
261667,10/11/2017,6/26/2017,2,8.838000000000001,2,2017-10-11,2017-06-26,-107
2616931,1/11/2019,9/9/2019,133,555.368,16,2019-01-11,2019-09-09,241
2616961,2/23/2019,2/23/2019,1,9.552,1,2019-02-23,2019-02-23,0
261731,1/12/2017,9/25/2016,35,262.69594,11,2017-01-12,2016-09-25,-109
2617331,10/22/2018,9/6/2018,2,26.345000000000002,2,2018-10-22,2018-09-06,-46
261735,10/2/2016,12/2/2016,2,18.973392,2,2016-10-02,2016-12-02,61
261743,4/4/2017,4/4/2017,1,3.154,1,2017-04-04,2017-04-04,0
2617501,11/3/2018,11/3/2018,1,13.169,1,2018-11-03,2018-11-03,0
261759,11/18/2016,11/18/2016,1,3.423,1,2016-11-18,2016-11-18,0
2617651,7/4/2019,7/4/2019,1,8.489,1,2019-07-04,2019-07-04,0
2617921,7/30/2018,7/30/2018,1,4.697,1,2018-07-30,2018-07-30,0
261793,7/15/2019,7/15/2019,1,2.415,1,2019-07-15,2019-07-15,0
261821,10/10/2016,10/10/2016,1,8.955932,1,2016-10-10,2016-10-10,0
2618971,9/11/2018,9/11/2018,1,6.06,1,2018-09-11,2018-09-11,0
2619481,7/2/2019,7/26/2019,2,11.241,1,2019-07-02,2019-07-26,24
261961,6/8/2017,6/8/2017,1,8.913,1,2017-06-08,2017-06-08,0
262061,8/18/2019,8/18/2019,1,2.059,1,2019-08-18,2019-08-18,0
262085,1/14/2017,9/9/2016,53,721.579074,10,2017-01-14,2016-09-09,-127
262169,3/31/2017,7/22/2017,2,4.964,1,2017-03-31,2017-07-22,113
2622221,1/24/2020,8/6/2019,9,57.801,5,2020-01-24,2019-08-06,-171
2622321,3/12/2019,7/24/2019,2,13.411999999999999,2,2019-03-12,2019-07-24,134
2622421,10/20/2019,8/5/2019,16,69.776,12,2019-10-20,2019-08-05,-76
262281,1/28/2018,1/28/2018,1,4.342,1,2018-01-28,2018-01-28,0
2622821,8/14/2018,8/14/2018,1,15.607,1,2018-08-14,2018-08-14,0
2622871,8/25/2018,8/25/2018,1,14.929,1,2018-08-25,2018-08-25,0
2622881,1/28/2019,3/17/2019,4,27.184,4,2019-01-28,2019-03-17,48
262301,9/28/2016,9/28/2016,1,2.451203,1,2016-09-28,2016-09-28,0
262317,1/15/2018,9/8/2018,27,64.355,13,2018-01-15,2018-09-08,236
2623441,7/31/2018,8/1/2018,2,10.123000000000001,2,2018-07-31,2018-08-01,1
2623761,2/10/2019,4/7/2019,2,14.516,2,2019-02-10,2019-04-07,56
2623931,7/31/2018,7/31/2018,1,14.479,1,2018-07-31,2018-07-31,0
2624241,1/21/2020,8/22/2019,6,31.601,3,2020-01-21,2019-08-22,-152
262431,4/19/2017,4/19/2017,1,11.165,1,2017-04-19,2017-04-19,0
2624781,12/11/2019,12/11/2019,1,3.168,1,2019-12-11,2019-12-11,0
262481,8/4/2016,8/4/2016,1,5.816231,1,2016-08-04,2016-08-04,0
2625241,10/15/2018,9/7/2018,10,132.25,3,2018-10-15,2018-09-07,-38
262577,1/4/2017,9/26/2016,20,190.838154,3,2017-01-04,2016-09-26,-100
2625781,12/23/2018,12/23/2018,1,3.973,1,2018-12-23,2018-12-23,0
2625791,2/21/2020,2/21/2020,1,11.105,1,2020-02-21,2020-02-21,0
262589,2/4/2017,2/4/2017,1,0.598,1,2017-02-04,2017-02-04,0
262641,1/12/2018,9/8/2019,33,350.605,14,2018-01-12,2019-09-08,604
2626761,9/23/2018,9/23/2018,1,14.436,1,2018-09-23,2018-09-23,0
262793,1/18/2017,1/18/2017,1,7.624,1,2017-01-18,2017-01-18,0
262817,1/26/2018,9/15/2018,9,49.34,3,2018-01-26,2018-09-15,232
262841,10/14/2016,8/30/2016,13,102.295438,11,2016-10-14,2016-08-30,-45
262847,11/14/2016,8/4/2016,3,8.03027,2,2016-11-14,2016-08-04,-102
2628481,1/10/2019,9/7/2018,110,638.605,8,2019-01-10,2018-09-07,-125
2628491,2/15/2020,2/15/2020,1,6.272,1,2020-02-15,2020-02-15,0
2629461,12/13/2019,8/15/2018,4,3.362,3,2019-12-13,2018-08-15,-485
262963,1/21/2019,9/6/2019,18,39.845,7,2019-01-21,2019-09-06,228
2629631,2/9/2020,3/7/2020,2,7.992,2,2020-02-09,2020-03-07,27
263,1/11/2018,9/20/2018,29,191.220195,9,2018-01-11,2018-09-20,252
263125,1/18/2018,1/18/2018,1,16.098,1,2018-01-18,2018-01-18,0
263179,1/30/2018,9/5/2016,60,513.583242,4,2018-01-30,2016-09-05,-512
2631951,8/1/2018,9/15/2019,3,16.978,3,2018-08-01,2019-09-15,410
2631971,10/26/2018,12/17/2018,2,25.520000000000003,2,2018-10-26,2018-12-17,52
2633011,8/10/2018,8/31/2018,8,26.948,4,2018-08-10,2018-08-31,21
2633071,1/26/2020,2/9/2019,3,19.656,2,2020-01-26,2019-02-09,-351
263425,9/29/2017,9/29/2017,2,8.193999999999999,2,2017-09-29,2017-09-29,0
263455,2/9/2018,2/9/2018,1,2.832,1,2018-02-09,2018-02-09,0
263457,1/15/2017,9/3/2017,83,791.740376,17,2017-01-15,2017-09-03,231
2635411,10/4/2018,10/4/2018,1,15.156,1,2018-10-04,2018-10-04,0
2635461,12/29/2018,12/29/2018,1,10.453,1,2018-12-29,2018-12-29,0
2635651,1/14/2019,9/28/2018,22,152.453,5,2019-01-14,2018-09-28,-108
2635661,8/11/2018,8/11/2018,1,4.384,1,2018-08-11,2018-08-11,0
2636451,9/21/2019,9/21/2019,1,9.632,1,2019-09-21,2019-09-21,0
2636801,3/31/2019,3/31/2019,1,8.301,1,2019-03-31,2019-03-31,0
2637021,2/1/2019,2/1/2019,1,9.812,1,2019-02-01,2019-02-01,0
2637401,10/4/2019,10/4/2019,1,3.797,1,2019-10-04,2019-10-04,0
263759,7/22/2017,7/22/2017,1,4.682,1,2017-07-22,2017-07-22,0
263803,10/29/2016,9/29/2017,7,41.512,3,2016-10-29,2017-09-29,335
2638101,12/1/2018,5/4/2019,4,13.139,4,2018-12-01,2019-05-04,154
2638421,12/5/2019,7/7/2019,4,30.57,3,2019-12-05,2019-07-07,-151
263953,1/4/2017,10/22/2016,2,10.221889000000001,2,2017-01-04,2016-10-22,-74
2639651,1/24/2019,1/24/2019,1,2.633,1,2019-01-24,2019-01-24,0
2639851,10/12/2018,10/12/2018,1,5.126,1,2018-10-12,2018-10-12,0
264003,1/10/2020,9/2/2019,36,598.384,11,2020-01-10,2019-09-02,-130
2640891,6/16/2019,6/16/2019,1,10.331,1,2019-06-16,2019-06-16,0
264111,11/12/2016,5/20/2018,3,6.74,3,2016-11-12,2018-05-20,554
264159,10/30/2016,8/21/2018,2,7.2219999999999995,2,2016-10-30,2018-08-21,660
264239,3/5/2019,3/5/2019,1,2.681,1,2019-03-05,2019-03-05,0
264251,12/26/2017,9/3/2016,3,17.863007,3,2017-12-26,2016-09-03,-479
2642521,10/30/2019,10/5/2019,2,30.854,2,2019-10-30,2019-10-05,-25
264269,2/21/2019,4/14/2019,3,16.502000000000002,2,2019-02-21,2019-04-14,52
264281,2/17/2020,2/17/2020,1,5.129,1,2020-02-17,2020-02-17,0
264351,1/29/2017,5/11/2018,3,23.375,3,2017-01-29,2018-05-11,467
264471,6/5/2019,9/12/2018,2,10.852,2,2019-06-05,2018-09-12,-266
2644911,1/19/2020,10/21/2018,2,2.404,2,2020-01-19,2018-10-21,-455
264599,2/4/2020,8/30/2019,2,44.308,2,2020-02-04,2019-08-30,-158
264613,12/29/2019,12/29/2019,1,14.35,1,2019-12-29,2019-12-29,0
264691,1/3/2018,9/21/2019,8,88.231,5,2018-01-03,2019-09-21,626
2647031,1/10/2019,5/16/2019,4,32.06,4,2019-01-10,2019-05-16,126
2648431,10/28/2018,9/2/2018,2,5.605,1,2018-10-28,2018-09-02,-56
2648691,1/30/2019,1/30/2019,1,6.946,1,2019-01-30,2019-01-30,0
2648921,10/30/2018,9/7/2018,25,115.584,4,2018-10-30,2018-09-07,-53
265045,10/30/2016,9/9/2016,7,51.366844,5,2016-10-30,2016-09-09,-51
2650611,9/20/2018,9/20/2018,1,6.383,1,2018-09-20,2018-09-20,0
265075,11/12/2019,11/15/2017,2,43.635999999999996,2,2019-11-12,2017-11-15,-727
2650761,8/22/2018,8/22/2018,1,7.805,1,2018-08-22,2018-08-22,0
2651171,2/28/2019,2/28/2019,1,4.151,1,2019-02-28,2019-02-28,0
265179,2/1/2019,5/12/2017,7,24.092,5,2019-02-01,2017-05-12,-630
2652681,1/14/2020,9/8/2019,67,1585.355,5,2020-01-14,2019-09-08,-128
2652721,8/4/2018,8/4/2018,1,6.237,1,2018-08-04,2018-08-04,0
2652881,10/27/2019,8/4/2018,7,18.346,3,2019-10-27,2018-08-04,-449
265335,2/16/2018,9/8/2018,5,24.614,2,2018-02-16,2018-09-08,204
2653661,1/1/2020,9/4/2020,104,1640.69,9,2020-01-01,2020-09-04,247
2654241,10/14/2018,8/18/2018,5,36.74,3,2018-10-14,2018-08-18,-57
2654271,8/21/2019,8/21/2019,1,2.369,1,2019-08-21,2019-08-21,0
2654311,6/16/2019,6/16/2019,1,5.053,1,2019-06-16,2019-06-16,0
2654391,9/2/2018,9/2/2018,1,11.436,1,2018-09-02,2018-09-02,0
2654441,11/25/2018,4/19/2019,3,9.118,3,2018-11-25,2019-04-19,145
265459,12/27/2016,12/27/2016,1,0.243,1,2016-12-27,2016-12-27,0
265519,4/4/2017,4/4/2017,1,8.489,1,2017-04-04,2017-04-04,0
265561,10/23/2017,9/6/2018,25,41.506,11,2017-10-23,2018-09-06,318
265593,11/25/2016,11/25/2016,1,0.88,1,2016-11-25,2016-11-25,0
2656951,1/16/2019,8/8/2019,5,32.472,5,2019-01-16,2019-08-08,204
2657171,9/5/2018,9/5/2018,1,6.142,1,2018-09-05,2018-09-05,0
2657491,10/15/2019,8/5/2018,6,112.472,5,2019-10-15,2018-08-05,-436
265777,1/9/2018,9/3/2019,17,77.605,6,2018-01-09,2019-09-03,602
2657991,3/30/2019,9/19/2019,2,11.546,2,2019-03-30,2019-09-19,173
265803,3/1/2019,4/20/2018,2,24.296999999999997,2,2019-03-01,2018-04-20,-315
2658181,8/5/2018,8/5/2018,1,9.781,1,2018-08-05,2018-08-05,0
265831,9/10/2017,9/10/2017,1,2.397,1,2017-09-10,2017-09-10,0
2658861,6/28/2019,8/7/2018,2,15.468,2,2019-06-28,2018-08-07,-325
2659081,1/1/2019,9/6/2019,147,2716.419,10,2019-01-01,2019-09-06,248
2659771,4/15/2019,4/15/2019,1,13.163,1,2019-04-15,2019-04-15,0
265985,8/4/2017,8/8/2017,2,8.368,1,2017-08-04,2017-08-08,4
265991,1/14/2019,2/7/2019,2,11.424,1,2019-01-14,2019-02-07,24
2660251,2/21/2019,2/21/2019,1,15.442,1,2019-02-21,2019-02-21,0
266033,11/11/2018,2/21/2018,3,29.471,2,2018-11-11,2018-02-21,-263
2660331,2/3/2019,2/3/2019,1,5.903,1,2019-02-03,2019-02-03,0
2660401,5/12/2019,5/12/2019,1,8.823,1,2019-05-12,2019-05-12,0
2661991,8/14/2019,8/14/2019,2,3.9360000000000004,2,2019-08-14,2019-08-14,0
2662131,2/18/2019,9/20/2019,5,114.03999999999999,2,2019-02-18,2019-09-20,214
266293,5/3/2018,9/1/2018,4,24.403,2,2018-05-03,2018-09-01,121
266311,11/1/2016,11/1/2016,1,3.167,1,2016-11-01,2016-11-01,0
2663321,10/1/2018,3/29/2019,17,140.883,3,2018-10-01,2019-03-29,179
2663681,10/4/2018,10/4/2018,1,10.418,1,2018-10-04,2018-10-04,0
266379,10/8/2018,10/8/2018,1,5.295,1,2018-10-08,2018-10-08,0
2663941,6/11/2020,6/11/2020,1,2.184,1,2020-06-11,2020-06-11,0
2664691,10/7/2018,8/2/2019,14,27.318,5,2018-10-07,2019-08-02,299
2665511,12/1/2019,12/1/2019,1,7.029,1,2019-12-01,2019-12-01,0
266587,1/13/2018,9/7/2018,82,111.226113,8,2018-01-13,2018-09-07,237
266675,8/2/2017,8/2/2017,1,5.974,1,2017-08-02,2017-08-02,0
266677,7/16/2017,7/16/2017,1,0.314,1,2017-07-16,2017-07-16,0
2666901,6/14/2019,6/14/2019,1,10.684,1,2019-06-14,2019-06-14,0
266695,3/26/2017,6/17/2017,4,14.318,2,2017-03-26,2017-06-17,83
266709,12/23/2018,9/22/2020,2,3.377,1,2018-12-23,2020-09-22,639
2667521,6/18/2019,6/18/2019,1,2.217,1,2019-06-18,2019-06-18,0
266797,1/24/2020,6/24/2020,4,41.881,3,2020-01-24,2020-06-24,152
266817,2/14/2020,2/14/2020,1,6.574,1,2020-02-14,2020-02-14,0
266829,10/10/2018,6/14/2017,3,13.178,3,2018-10-10,2017-06-14,-483
266837,12/21/2017,8/14/2020,2,6.982,2,2017-12-21,2020-08-14,967
2668651,5/26/2019,5/26/2019,1,4.394,1,2019-05-26,2019-05-26,0
2668911,7/20/2019,7/24/2019,2,18.679000000000002,2,2019-07-20,2019-07-24,4
266949,9/6/2020,9/6/2020,1,18.867,1,2020-09-06,2020-09-06,0
266969,1/23/2019,1/23/2019,1,1.61,1,2019-01-23,2019-01-23,0
2670,10/1/2016,9/5/2016,11,80.789376,8,2016-10-01,2016-09-05,-26
267033,8/14/2016,8/14/2016,1,6.12744,1,2016-08-14,2016-08-14,0
267137,12/17/2017,9/17/2016,8,34.710719,5,2017-12-17,2016-09-17,-456
2671481,2/10/2020,2/10/2020,1,3.546,1,2020-02-10,2020-02-10,0
2671621,9/1/2018,9/1/2018,1,3.505,1,2018-09-01,2018-09-01,0
2672041,9/21/2018,9/21/2018,1,6.353,1,2018-09-21,2018-09-21,0
2672111,7/12/2019,7/12/2019,1,1.899,1,2019-07-12,2019-07-12,0
267323,10/30/2016,8/28/2016,3,24.532266,2,2016-10-30,2016-08-28,-63
2673281,10/3/2018,10/3/2018,1,12.186,1,2018-10-03,2018-10-03,0
2673401,8/24/2018,8/24/2018,1,0.526,1,2018-08-24,2018-08-24,0
2673641,8/10/2018,8/29/2018,3,14.068999999999999,3,2018-08-10,2018-08-29,19
2674031,10/19/2018,8/10/2018,7,37.842,7,2018-10-19,2018-08-10,-70
2674141,10/11/2019,9/29/2018,7,37.464,5,2019-10-11,2018-09-29,-377
2674171,11/11/2018,7/13/2019,3,21.067,3,2018-11-11,2019-07-13,244
267503,6/26/2019,6/26/2019,1,4.824,1,2019-06-26,2019-06-26,0
267505,5/5/2019,5/5/2019,1,0.02,1,2019-05-05,2019-05-05,0
2675091,8/27/2019,8/27/2019,1,3.099,1,2019-08-27,2019-08-27,0
267581,9/24/2016,9/24/2016,1,6.19208,1,2016-09-24,2016-09-24,0
2676771,8/22/2019,8/22/2019,1,3.232,1,2019-08-22,2019-08-22,0
267701,10/28/2017,10/28/2017,1,9.483,1,2017-10-28,2017-10-28,0
267743,1/10/2018,9/8/2017,232,1450.501,7,2018-01-10,2017-09-08,-124
267755,1/27/2020,8/12/2020,10,233.455,3,2020-01-27,2020-08-12,198
267821,10/10/2018,9/6/2018,86,753.006,11,2018-10-10,2018-09-06,-34
2678411,4/15/2019,9/2/2018,3,14.406,3,2019-04-15,2018-09-02,-225
2678721,12/16/2018,12/16/2018,1,9.503,1,2018-12-16,2018-12-16,0
267905,7/17/2019,7/17/2019,1,12.744,1,2019-07-17,2019-07-17,0
267911,1/14/2020,9/9/2019,100,733.745,7,2020-01-14,2019-09-09,-127
2679691,1/15/2020,1/6/2020,2,20.458,1,2020-01-15,2020-01-06,-9
267989,9/19/2017,9/19/2017,1,19.119,1,2017-09-19,2017-09-19,0
268015,12/11/2018,12/11/2018,1,10.725,1,2018-12-11,2018-12-11,0
2680421,3/16/2019,5/4/2019,3,15.759,3,2019-03-16,2019-05-04,49
268063,1/15/2017,1/15/2017,1,17.485,1,2017-01-15,2017-01-15,0
2681961,1/21/2019,12/30/2018,2,11.727,2,2019-01-21,2018-12-30,-22
268197,3/18/2018,9/8/2017,3,9.495000000000001,2,2018-03-18,2017-09-08,-191
2682751,6/15/2019,6/15/2019,1,24.472,1,2019-06-15,2019-06-15,0
2683121,4/6/2019,4/6/2019,1,9.198,1,2019-04-06,2019-04-06,0
2684211,10/27/2018,10/27/2018,1,10.435,1,2018-10-27,2018-10-27,0
2684251,8/19/2018,8/19/2018,1,10.735,1,2018-08-19,2018-08-19,0
2684341,3/29/2019,5/4/2019,2,10.418,2,2019-03-29,2019-05-04,36
268463,11/10/2017,11/10/2017,1,2.074,1,2017-11-10,2017-11-10,0
2684641,8/15/2018,9/13/2018,2,14.289,1,2018-08-15,2018-09-13,29
2684821,8/18/2018,8/18/2018,1,7.357,1,2018-08-18,2018-08-18,0
2684921,8/9/2018,8/9/2018,1,0.992,1,2018-08-09,2018-08-09,0
2685,12/21/2018,4/19/2018,2,18.799,2,2018-12-21,2018-04-19,-246
2685221,9/7/2018,9/7/2018,1,3.788,1,2018-09-07,2018-09-07,0
2685381,2/7/2020,2/7/2020,1,10.818,1,2020-02-07,2020-02-07,0
268585,1/13/2017,9/5/2017,64,466.788,5,2017-01-13,2017-09-05,235
2685851,1/8/2019,8/28/2018,13,105.626,7,2019-01-08,2018-08-28,-133
2685931,11/18/2019,11/18/2019,1,18.764,1,2019-11-18,2019-11-18,0
2686651,1/31/2019,6/16/2020,7,81.993,6,2019-01-31,2020-06-16,502
2687731,7/30/2019,8/10/2018,2,13.689,2,2019-07-30,2018-08-10,-354
268791,3/29/2019,3/29/2019,1,3.04,1,2019-03-29,2019-03-29,0
268799,6/21/2018,9/5/2018,2,26.753999999999998,2,2018-06-21,2018-09-05,76
2688041,7/13/2019,7/13/2019,1,6.662,1,2019-07-13,2019-07-13,0
2688301,8/23/2018,8/23/2018,1,1.363,1,2018-08-23,2018-08-23,0
2688581,11/15/2018,8/30/2019,2,4.0,2,2018-11-15,2019-08-30,288
268915,7/5/2018,7/5/2018,1,6.728,1,2018-07-05,2018-07-05,0
268943,1/19/2019,11/4/2017,2,7.765,2,2019-01-19,2017-11-04,-441
268969,12/14/2017,12/14/2017,1,4.352,1,2017-12-14,2017-12-14,0
269101,4/28/2018,4/28/2018,2,11.479,2,2018-04-28,2018-04-28,0
269123,2/20/2020,2/20/2020,1,6.919,1,2020-02-20,2020-02-20,0
2691351,10/8/2018,10/8/2018,1,7.055,1,2018-10-08,2018-10-08,0
269271,10/10/2017,12/6/2017,3,25.387999999999998,3,2017-10-10,2017-12-06,57
269301,8/13/2016,8/13/2016,1,7.6157,1,2016-08-13,2016-08-13,0
269317,11/20/2019,11/20/2019,1,5.975,1,2019-11-20,2019-11-20,0
2693781,7/3/2020,7/3/2020,1,4.472,1,2020-07-03,2020-07-03,0
2694521,11/6/2019,11/6/2019,1,2.316,1,2019-11-06,2019-11-06,0
269557,12/2/2019,12/2/2019,1,17.655,1,2019-12-02,2019-12-02,0
269593,10/24/2017,10/24/2017,1,14.26,1,2017-10-24,2017-10-24,0
2695981,1/24/2020,8/11/2018,18,271.248,2,2020-01-24,2018-08-11,-531
2697041,4/11/2019,4/11/2019,1,6.186,1,2019-04-11,2019-04-11,0
2697181,3/5/2019,3/5/2019,1,4.27,1,2019-03-05,2019-03-05,0
269741,11/2/2018,11/2/2018,1,10.018,1,2018-11-02,2018-11-02,0
269805,1/19/2020,12/28/2017,2,8.946,2,2020-01-19,2017-12-28,-752
269813,10/28/2018,7/22/2018,4,17.52,4,2018-10-28,2018-07-22,-98
269851,1/16/2018,6/4/2019,2,7.4510000000000005,2,2018-01-16,2019-06-04,504
269853,10/9/2019,7/27/2018,2,5.348,2,2019-10-09,2018-07-27,-439
2699811,2/10/2019,2/10/2019,1,12.4,1,2019-02-10,2019-02-10,0
2699851,10/11/2020,9/22/2019,18,48.623,9,2020-10-11,2019-09-22,-385
2700391,8/11/2018,8/11/2018,1,6.474,1,2018-08-11,2018-08-11,0
270073,1/31/2017,9/15/2017,18,141.020139,2,2017-01-31,2017-09-15,227
2700831,8/12/2018,8/12/2018,1,6.787,1,2018-08-12,2018-08-12,0
2701201,10/10/2018,9/14/2018,7,36.021,3,2018-10-10,2018-09-14,-26
270123,1/28/2017,6/21/2019,3,14.453,3,2017-01-28,2019-06-21,874
270177,2/3/2017,9/6/2016,8,39.866043,2,2017-02-03,2016-09-06,-150
270179,10/14/2018,7/28/2018,12,65.73,9,2018-10-14,2018-07-28,-78
270303,1/16/2018,9/5/2018,84,885.493636,8,2018-01-16,2018-09-05,232
2703191,2/27/2019,8/17/2019,5,50.225,2,2019-02-27,2019-08-17,171
2704211,3/30/2019,3/30/2019,1,5.818,1,2019-03-30,2019-03-30,0
2704701,1/15/2019,1/15/2019,1,14.138,1,2019-01-15,2019-01-15,0
270483,1/13/2020,7/1/2019,6,62.666,4,2020-01-13,2019-07-01,-196
2704841,8/18/2019,8/18/2019,1,2.942,1,2019-08-18,2019-08-18,0
270645,1/10/2018,7/30/2018,71,682.681,3,2018-01-10,2018-07-30,201
2706861,2/15/2019,8/15/2018,2,8.995,2,2019-02-15,2018-08-15,-184
2707051,6/21/2019,9/3/2020,2,10.341000000000001,2,2019-06-21,2020-09-03,440
2707201,9/26/2018,9/26/2018,1,4.682,1,2018-09-26,2018-09-26,0
270897,12/6/2017,6/2/2017,2,20.122,2,2017-12-06,2017-06-02,-187
2710141,10/10/2019,9/15/2019,2,23.159,2,2019-10-10,2019-09-15,-25
271033,10/20/2017,10/20/2017,1,0.867,1,2017-10-20,2017-10-20,0
271081,10/28/2016,8/7/2016,4,19.501783,3,2016-10-28,2016-08-07,-82
2711201,11/15/2019,9/19/2018,5,23.866999999999997,4,2019-11-15,2018-09-19,-422
2711461,11/7/2019,9/13/2018,5,17.832,4,2019-11-07,2018-09-13,-420
2711821,9/1/2018,9/1/2018,1,6.24,1,2018-09-01,2018-09-01,0
2711911,7/27/2019,7/27/2019,1,0.334,1,2019-07-27,2019-07-27,0
2712021,3/15/2019,3/15/2019,1,1.792,1,2019-03-15,2019-03-15,0
271203,10/10/2017,5/12/2018,4,10.361,4,2017-10-10,2018-05-12,214
2712291,11/8/2018,11/8/2018,1,6.539,1,2018-11-08,2018-11-08,0
2712351,9/11/2018,9/11/2018,1,0.704,1,2018-09-11,2018-09-11,0
2712561,10/17/2019,10/17/2019,1,7.829,1,2019-10-17,2019-10-17,0
27133,11/20/2016,4/8/2017,6,35.843,4,2016-11-20,2017-04-08,139
2713971,8/18/2018,8/18/2018,1,17.83,1,2018-08-18,2018-08-18,0
271441,10/26/2016,2/26/2019,2,27.648584,2,2016-10-26,2019-02-26,853
271465,10/20/2018,9/26/2016,8,16.95198,5,2018-10-20,2016-09-26,-754
2714731,1/21/2019,1/21/2019,1,10.178,1,2019-01-21,2019-01-21,0
2714931,12/1/2018,2/22/2019,2,9.975999999999999,2,2018-12-01,2019-02-22,83
271595,10/1/2016,9/24/2016,13,104.24149,5,2016-10-01,2016-09-24,-7
2716311,8/18/2019,8/18/2019,1,6.2,1,2019-08-18,2019-08-18,0
2717171,12/17/2019,12/17/2019,1,6.464,1,2019-12-17,2019-12-17,0
2717441,12/15/2019,12/15/2019,1,7.63,1,2019-12-15,2019-12-15,0
2717511,8/10/2019,8/10/2019,1,16.392,1,2019-08-10,2019-08-10,0
27183,1/9/2020,1/9/2020,1,9.661,1,2020-01-09,2020-01-09,0
271939,1/27/2018,2/3/2018,2,14.426,2,2018-01-27,2018-02-03,7
271941,8/20/2016,8/20/2016,1,6.302619,1,2016-08-20,2016-08-20,0
271971,11/26/2019,8/4/2017,5,16.104,5,2019-11-26,2017-08-04,-844
271985,1/23/2019,9/29/2019,11,42.899,7,2019-01-23,2019-09-29,249
2720181,9/30/2018,9/30/2018,1,9.26,1,2018-09-30,2018-09-30,0
272035,6/20/2017,9/13/2016,8,68.057682,3,2017-06-20,2016-09-13,-280
2722821,1/22/2020,1/22/2020,1,13.856,1,2020-01-22,2020-01-22,0
2724801,1/24/2019,1/24/2019,1,17.101,1,2019-01-24,2019-01-24,0
2724811,1/14/2020,12/18/2019,4,27.936,3,2020-01-14,2019-12-18,-27
272523,9/6/2018,9/6/2018,1,11.659,1,2018-09-06,2018-09-06,0
2725621,8/5/2019,8/5/2019,1,10.398,1,2019-08-05,2019-08-05,0
272577,4/26/2017,6/15/2017,2,20.364,2,2017-04-26,2017-06-15,50
2725971,9/19/2018,9/24/2019,3,57.506,3,2018-09-19,2019-09-24,370
2726181,11/8/2019,8/17/2019,2,21.937,1,2019-11-08,2019-08-17,-83
272685,1/13/2017,9/6/2018,18,47.479,6,2017-01-13,2018-09-06,601
272737,1/11/2020,9/13/2016,39,682.585285,10,2020-01-11,2016-09-13,-1215
272789,11/22/2016,11/22/2016,1,6.554,1,2016-11-22,2016-11-22,0
272865,11/13/2020,11/13/2020,1,2.089,1,2020-11-13,2020-11-13,0
2729051,1/6/2020,7/28/2020,5,12.541,4,2020-01-06,2020-07-28,204
27293,1/12/2017,9/5/2016,45,327.908634,7,2017-01-12,2016-09-05,-129
2729711,6/1/2019,6/1/2019,1,1.519,1,2019-06-01,2019-06-01,0
2729791,1/15/2019,1/15/2019,1,11.47,1,2019-01-15,2019-01-15,0
2729951,10/16/2018,10/3/2018,2,15.783999999999999,1,2018-10-16,2018-10-03,-13
2730511,2/18/2019,2/18/2019,1,7.103,1,2019-02-18,2019-02-18,0
273127,2/9/2020,6/27/2019,5,66.595,4,2020-02-09,2019-06-27,-227
2731491,1/8/2019,1/8/2019,1,4.937,1,2019-01-08,2019-01-08,0
273163,10/11/2016,9/28/2016,24,204.025754,10,2016-10-11,2016-09-28,-13
273199,1/13/2017,9/29/2016,107,1100.607332,14,2017-01-13,2016-09-29,-106
2732371,1/20/2019,9/3/2018,30,158.631,4,2019-01-20,2018-09-03,-139
2732561,10/16/2019,3/24/2019,3,16.017,3,2019-10-16,2019-03-24,-206
273261,6/12/2019,6/12/2019,1,6.67,1,2019-06-12,2019-06-12,0
273305,1/3/2018,9/18/2017,11,90.902,5,2018-01-03,2017-09-18,-107
2733281,3/2/2019,8/16/2018,3,32.269,1,2019-03-02,2018-08-16,-198
2733391,10/27/2018,10/27/2018,1,4.706,1,2018-10-27,2018-10-27,0
273361,1/11/2019,9/3/2019,9,154.78300000000002,2,2019-01-11,2019-09-03,235
2734131,10/30/2020,10/30/2020,1,3.652,1,2020-10-30,2020-10-30,0
2734321,10/24/2020,10/24/2020,1,2.489,1,2020-10-24,2020-10-24,0
273507,10/2/2016,9/5/2016,13,112.501221,5,2016-10-02,2016-09-05,-27
2735101,1/24/2020,3/26/2019,2,14.708,1,2020-01-24,2019-03-26,-304
273517,11/10/2018,9/4/2019,12,78.939209,8,2018-11-10,2019-09-04,298
2736001,10/13/2019,8/11/2019,5,12.78,3,2019-10-13,2019-08-11,-63
2736121,1/26/2019,7/23/2019,5,39.838,3,2019-01-26,2019-07-23,178
273623,1/2/2017,9/5/2016,27,244.316498,5,2017-01-02,2016-09-05,-119
273633,11/15/2017,11/25/2016,2,13.958,2,2017-11-15,2016-11-25,-355
2736521,1/23/2020,8/21/2019,5,13.620000000000001,4,2020-01-23,2019-08-21,-155
2737361,1/13/2019,9/8/2018,16,43.151,12,2019-01-13,2018-09-08,-127
2738311,1/18/2019,1/18/2019,1,13.545,1,2019-01-18,2019-01-18,0
2738981,4/24/2019,4/24/2019,1,2.346,1,2019-04-24,2019-04-24,0
273931,9/16/2018,9/16/2018,1,7.8469999999999995,1,2018-09-16,2018-09-16,0
2739601,11/10/2018,11/10/2018,1,0.018,1,2018-11-10,2018-11-10,0
2740341,12/14/2019,9/29/2019,3,13.504999999999999,3,2019-12-14,2019-09-29,-76
2740431,10/6/2018,10/6/2018,1,5.405,1,2018-10-06,2018-10-06,0
2740471,11/22/2019,11/22/2019,1,11.755,1,2019-11-22,2019-11-22,0
274057,1/7/2019,9/18/2019,9,95.17399999999999,4,2019-01-07,2019-09-18,254
274063,2/9/2017,2/9/2017,1,14.26,1,2017-02-09,2017-02-09,0
2740661,8/8/2019,8/8/2019,1,1.941,1,2019-08-08,2019-08-08,0
274111,1/13/2017,9/15/2017,13,73.712277,4,2017-01-13,2017-09-15,245
274337,12/11/2019,12/11/2019,1,10.833,1,2019-12-11,2019-12-11,0
2744381,8/26/2018,8/31/2019,2,19.769000000000002,2,2018-08-26,2019-08-31,370
274471,9/2/2018,9/4/2018,4,15.469999999999999,3,2018-09-02,2018-09-04,2
274473,10/31/2016,8/4/2016,8,145.349444,3,2016-10-31,2016-08-04,-88
2745481,1/10/2020,12/7/2019,2,8.478,2,2020-01-10,2019-12-07,-34
2745751,12/28/2018,12/28/2018,1,7.823,1,2018-12-28,2018-12-28,0
274589,1/18/2019,12/9/2017,2,3.9189999999999996,2,2019-01-18,2017-12-09,-405
274675,6/9/2018,8/3/2017,2,14.979,2,2018-06-09,2017-08-03,-310
2746881,10/16/2018,10/16/2018,1,11.206,1,2018-10-16,2018-10-16,0
2747001,9/13/2018,9/13/2018,1,26.333,1,2018-09-13,2018-09-13,0
2747171,3/17/2019,8/16/2019,3,25.239,3,2019-03-17,2019-08-16,152
274819,3/18/2017,3/18/2017,1,10.341,1,2017-03-18,2017-03-18,0
274833,8/7/2016,8/7/2016,1,8.76511,1,2016-08-07,2016-08-07,0
2749331,9/16/2018,9/16/2018,1,6.464,1,2018-09-16,2018-09-16,0
274965,10/21/2017,4/1/2018,2,4.403,2,2017-10-21,2018-04-01,162
274967,12/12/2019,12/12/2019,1,5.768,1,2019-12-12,2019-12-12,0
275013,8/8/2017,8/8/2017,1,4.026,1,2017-08-08,2017-08-08,0
275047,1/13/2018,9/9/2016,163,1659.55653,7,2018-01-13,2016-09-09,-491
275073,10/26/2018,9/25/2018,7,17.058,2,2018-10-26,2018-09-25,-31
275101,12/13/2018,8/11/2018,2,23.336000000000002,2,2018-12-13,2018-08-11,-124
275111,6/7/2019,6/7/2019,1,5.282,1,2019-06-07,2019-06-07,0
2751781,10/19/2019,11/17/2018,2,15.950000000000001,2,2019-10-19,2018-11-17,-336
2752911,10/2/2018,10/2/2018,1,2.239,1,2018-10-02,2018-10-02,0
2752931,9/7/2019,9/7/2019,1,3.394,1,2019-09-07,2019-09-07,0
2752991,12/12/2018,12/12/2018,1,0.43,1,2018-12-12,2018-12-12,0
2753311,3/16/2019,3/16/2019,1,10.584,1,2019-03-16,2019-03-16,0
275347,1/29/2020,9/1/2017,32,181.791,7,2020-01-29,2017-09-01,-880
275483,9/28/2016,9/28/2016,1,17.143944,1,2016-09-28,2016-09-28,0
275531,9/24/2016,9/24/2016,1,5.779749,1,2016-09-24,2016-09-24,0
2756161,9/12/2018,9/12/2018,1,10.485,1,2018-09-12,2018-09-12,0
275639,1/14/2017,6/26/2017,4,15.51,3,2017-01-14,2017-06-26,163
2756971,4/17/2019,4/17/2019,1,7.901,1,2019-04-17,2019-04-17,0
275709,7/31/2018,7/31/2018,1,15.045,1,2018-07-31,2018-07-31,0
275791,11/7/2018,6/27/2019,2,2.8040000000000003,1,2018-11-07,2019-06-27,232
2758361,10/14/2019,8/21/2018,2,23.103,1,2019-10-14,2018-08-21,-419
2758811,12/14/2019,2/15/2020,2,7.021,2,2019-12-14,2020-02-15,63
2759011,8/21/2018,8/21/2018,1,10.163,1,2018-08-21,2018-08-21,0
275931,9/28/2017,9/28/2017,1,0.446,1,2017-09-28,2017-09-28,0
275947,9/2/2017,9/2/2017,1,0.759,1,2017-09-02,2017-09-02,0
275953,7/10/2018,7/10/2018,1,0.019,1,2018-07-10,2018-07-10,0
2759561,10/26/2018,9/4/2018,10,261.999,2,2018-10-26,2018-09-04,-52
275963,1/8/2020,8/6/2018,8,55.1,3,2020-01-08,2018-08-06,-520
2760331,8/28/2018,8/28/2018,1,5.891,1,2018-08-28,2018-08-28,0
2760881,10/28/2019,10/28/2019,1,5.227,1,2019-10-28,2019-10-28,0
2761431,1/20/2019,3/2/2019,2,17.8,1,2019-01-20,2019-03-02,41
2761541,6/11/2019,6/11/2019,1,5.367,1,2019-06-11,2019-06-11,0
2761641,8/31/2018,8/31/2018,1,12.567,1,2018-08-31,2018-08-31,0
2761731,10/5/2018,10/5/2018,1,11.21,1,2018-10-05,2018-10-05,0
276191,8/24/2017,8/24/2017,1,2.769,1,2017-08-24,2017-08-24,0
276273,1/18/2020,9/27/2020,28,136.332,7,2020-01-18,2020-09-27,253
2762941,1/10/2020,9/9/2019,127,817.2379999999999,5,2020-01-10,2019-09-09,-123
276321,6/30/2019,6/30/2019,1,12.125,1,2019-06-30,2019-06-30,0
276453,1/11/2018,2/9/2019,54,373.165,6,2018-01-11,2019-02-09,394
2764561,1/21/2019,9/27/2019,7,75.064,5,2019-01-21,2019-09-27,249
276491,11/18/2016,7/29/2020,3,23.179000000000002,2,2016-11-18,2020-07-29,1349
2765381,2/27/2019,2/28/2019,2,28.737000000000002,2,2019-02-27,2019-02-28,1
2765661,4/26/2019,4/26/2019,1,5.311,1,2019-04-26,2019-04-26,0
2765701,12/11/2018,12/11/2018,1,5.74,1,2018-12-11,2018-12-11,0
2765991,2/28/2019,2/28/2019,1,20.378,1,2019-02-28,2019-02-28,0
276601,4/8/2017,9/1/2018,2,22.927999999999997,1,2017-04-08,2018-09-01,511
276613,3/23/2018,3/23/2018,1,16.449,1,2018-03-23,2018-03-23,0
276621,6/29/2018,8/14/2016,5,64.831841,4,2018-06-29,2016-08-14,-684
2766351,10/27/2019,8/9/2020,3,10.556000000000001,3,2019-10-27,2020-08-09,287
2766721,10/3/2019,4/29/2019,7,121.41,4,2019-10-03,2019-04-29,-157
276681,10/12/2016,10/12/2016,1,1.700066,1,2016-10-12,2016-10-12,0
276691,8/9/2017,8/9/2017,1,4.498,1,2017-08-09,2017-08-09,0
2767161,10/5/2019,10/5/2019,1,8.053,1,2019-10-05,2019-10-05,0
276809,9/29/2019,9/29/2019,1,8.532,1,2019-09-29,2019-09-29,0
2768371,1/9/2020,9/4/2018,23,407.957,5,2020-01-09,2018-09-04,-492
2768581,11/23/2018,11/23/2018,1,4.336,1,2018-11-23,2018-11-23,0
276897,4/29/2017,4/29/2017,1,0.68,1,2017-04-29,2017-04-29,0
276909,2/15/2020,2/15/2020,1,6.054,1,2020-02-15,2020-02-15,0
276913,5/25/2018,5/25/2018,1,0.118,1,2018-05-25,2018-05-25,0
276937,1/13/2017,9/11/2017,6,50.565574999999995,2,2017-01-13,2017-09-11,241
2769651,10/12/2018,8/25/2018,5,7.087000000000001,3,2018-10-12,2018-08-25,-48
276981,3/25/2018,3/25/2018,1,0.313,1,2018-03-25,2018-03-25,0
2770051,2/9/2019,2/9/2019,1,12.612,1,2019-02-09,2019-02-09,0
277007,11/28/2020,7/27/2020,2,23.643,2,2020-11-28,2020-07-27,-124
2770731,1/24/2019,4/30/2019,4,15.581999999999999,2,2019-01-24,2019-04-30,96
2771091,7/29/2019,7/29/2019,1,9.676,1,2019-07-29,2019-07-29,0
2772501,4/17/2019,4/17/2019,1,13.75,1,2019-04-17,2019-04-17,0
2772951,1/15/2019,9/24/2018,17,65.821,4,2019-01-15,2018-09-24,-113
2774731,1/11/2019,9/27/2018,31,184.773,6,2019-01-11,2018-09-27,-106
277491,1/10/2019,8/28/2019,204,1955.357,6,2019-01-10,2019-08-28,230
277581,1/13/2018,3/9/2018,2,17.874000000000002,2,2018-01-13,2018-03-09,55
277597,1/10/2020,9/30/2019,101,700.773,9,2020-01-10,2019-09-30,-102
277599,1/28/2018,2/12/2020,2,11.797,2,2018-01-28,2020-02-12,745
277607,5/27/2018,9/18/2020,2,8.855,2,2018-05-27,2020-09-18,845
277659,8/25/2018,8/25/2018,1,9.278,1,2018-08-25,2018-08-25,0
277709,11/22/2017,11/22/2017,1,7.021,1,2017-11-22,2017-11-22,0
2777641,10/17/2019,9/23/2019,7,41.789,1,2019-10-17,2019-09-23,-24
277861,11/26/2017,12/15/2018,2,24.503999999999998,2,2017-11-26,2018-12-15,384
277945,2/1/2018,2/1/2018,1,3.505,1,2018-02-01,2018-02-01,0
277953,2/4/2019,2/4/2019,1,5.513,1,2019-02-04,2019-02-04,0
277955,1/1/2017,9/25/2016,33,409.025488,6,2017-01-01,2016-09-25,-98
277981,11/10/2018,5/7/2017,3,26.645,2,2018-11-10,2017-05-07,-552
278003,4/25/2018,4/25/2018,1,3.518,1,2018-04-25,2018-04-25,0
278007,10/12/2018,10/12/2018,1,4.538,1,2018-10-12,2018-10-12,0
278079,12/14/2019,12/14/2019,1,2.636,1,2019-12-14,2019-12-14,0
278143,10/4/2018,5/22/2019,4,24.729,3,2018-10-04,2019-05-22,230
278145,1/11/2020,9/26/2016,13,72.102759,8,2020-01-11,2016-09-26,-1202
278161,4/5/2018,9/28/2018,2,16.378,2,2018-04-05,2018-09-28,176
278189,10/1/2019,9/9/2019,41,259.018,4,2019-10-01,2019-09-09,-22
2782641,12/28/2018,6/29/2019,2,24.03,1,2018-12-28,2019-06-29,183
2783141,11/6/2018,11/6/2018,2,10.762,2,2018-11-06,2018-11-06,0
2783191,10/27/2018,8/15/2019,2,44.688,2,2018-10-27,2019-08-15,292
278339,1/11/2017,9/20/2016,28,68.820105,3,2017-01-11,2016-09-20,-113
2783501,2/25/2019,3/27/2019,3,18.078,3,2019-02-25,2019-03-27,30
278359,1/1/2020,9/7/2019,159,834.764,3,2020-01-01,2019-09-07,-116
278361,1/20/2017,9/8/2017,27,369.03719,7,2017-01-20,2017-09-08,231
2784201,5/20/2019,5/20/2019,1,5.918,1,2019-05-20,2019-05-20,0
278457,1/11/2017,9/8/2016,278,2974.914074,7,2017-01-11,2016-09-08,-125
2784591,2/28/2020,2/28/2020,1,18.026,1,2020-02-28,2020-02-28,0
2784641,10/20/2019,10/20/2019,1,2.099,1,2019-10-20,2019-10-20,0
278497,11/21/2016,11/21/2016,1,12.928,1,2016-11-21,2016-11-21,0
278527,1/9/2020,10/8/2019,2,12.668,2,2020-01-09,2019-10-08,-93
2785661,9/13/2018,9/13/2018,1,2.197,1,2018-09-13,2018-09-13,0
278617,10/17/2018,9/28/2019,21,113.641,5,2018-10-17,2019-09-28,346
278675,12/18/2019,9/4/2020,4,22.37,4,2019-12-18,2020-09-04,261
2787171,6/3/2019,9/27/2018,2,10.106,1,2019-06-03,2018-09-27,-249
2787221,8/25/2018,8/25/2018,1,12.084,1,2018-08-25,2018-08-25,0
2787241,1/29/2020,9/29/2018,6,55.186,5,2020-01-29,2018-09-29,-487
2787871,6/23/2019,9/8/2019,11,36.099,2,2019-06-23,2019-09-08,77
278791,1/12/2017,5/2/2018,7,19.133585,5,2017-01-12,2018-05-02,475
278797,4/16/2018,4/16/2018,1,11.406,1,2018-04-16,2018-04-16,0
2788151,10/13/2019,9/4/2019,10,66.259,6,2019-10-13,2019-09-04,-39
278863,2/19/2017,2/19/2017,1,6.257,1,2017-02-19,2017-02-19,0
2788991,1/16/2020,9/5/2018,106,380.89300000000003,7,2020-01-16,2018-09-05,-498
278987,12/9/2016,12/9/2016,1,6.974,1,2016-12-09,2016-12-09,0
279059,8/16/2019,9/12/2019,2,16.948,2,2019-08-16,2019-09-12,27
2790801,12/1/2018,12/1/2018,1,5.415,1,2018-12-01,2018-12-01,0
2791121,8/11/2019,8/11/2019,1,4.124,1,2019-08-11,2019-08-11,0
2791511,10/11/2018,9/9/2018,10,55.797,2,2018-10-11,2018-09-09,-32
279219,12/28/2019,12/28/2019,1,1.501,1,2019-12-28,2019-12-28,0
2793411,9/2/2018,9/2/2018,1,8.058,1,2018-09-02,2018-09-02,0
2793421,1/6/2019,9/22/2018,4,13.917,4,2019-01-06,2018-09-22,-106
2793571,11/10/2019,9/13/2019,4,20.396,3,2019-11-10,2019-09-13,-58
2793641,9/12/2019,9/12/2019,1,5.799,1,2019-09-12,2019-09-12,0
2793811,12/12/2018,12/12/2018,1,10.205,1,2018-12-12,2018-12-12,0
279427,1/20/2018,9/25/2019,17,90.417,9,2018-01-20,2019-09-25,613
279459,8/1/2016,9/12/2016,15,252.873156,4,2016-08-01,2016-09-12,42
2794791,1/1/2020,9/6/2019,16,108.48,6,2020-01-01,2019-09-06,-117
2795071,5/31/2019,5/31/2019,1,14.303,1,2019-05-31,2019-05-31,0
2795531,1/12/2020,1/12/2020,1,9.658,1,2020-01-12,2020-01-12,0
2795691,10/6/2018,10/6/2018,1,6.649,1,2018-10-06,2018-10-06,0
2795931,4/18/2019,4/18/2019,1,1.535,1,2019-04-18,2019-04-18,0
2796821,12/20/2019,8/29/2018,3,25.318,1,2019-12-20,2018-08-29,-478
279713,12/2/2017,3/24/2017,2,14.935,2,2017-12-02,2017-03-24,-253
279763,12/2/2016,12/2/2016,1,13.105,1,2016-12-02,2016-12-02,0
2797671,1/17/2020,8/27/2019,10,121.0,4,2020-01-17,2019-08-27,-143
279771,2/13/2019,2/26/2019,2,3.314,2,2019-02-13,2019-02-26,13
2797761,4/24/2019,7/3/2019,6,70.05199999999999,2,2019-04-24,2019-07-03,70
2797801,9/8/2018,9/8/2018,1,5.702,1,2018-09-08,2018-09-08,0
279815,1/10/2020,9/9/2020,74,167.075,13,2020-01-10,2020-09-09,243
2798201,8/26/2018,8/26/2018,1,2.57,1,2018-08-26,2018-08-26,0
2798811,6/20/2019,6/20/2019,1,10.447,1,2019-06-20,2019-06-20,0
2799711,6/23/2019,6/23/2019,1,1.071,1,2019-06-23,2019-06-23,0
2799751,3/29/2019,3/29/2019,1,17.283,1,2019-03-29,2019-03-29,0
2800131,10/18/2019,10/18/2019,1,3.968,1,2019-10-18,2019-10-18,0
2800341,8/26/2018,8/26/2018,1,8.389,1,2018-08-26,2018-08-26,0
280075,5/2/2018,5/2/2018,1,16.564,1,2018-05-02,2018-05-02,0
2800761,3/16/2019,3/16/2019,1,9.699,1,2019-03-16,2019-03-16,0
280087,5/11/2018,5/11/2018,1,12.244,1,2018-05-11,2018-05-11,0
2801181,9/24/2019,9/24/2019,1,1.982,1,2019-09-24,2019-09-24,0
2801461,1/10/2020,1/10/2020,1,0.937,1,2020-01-10,2020-01-10,0
280275,10/30/2016,9/2/2017,12,87.140292,7,2016-10-30,2017-09-02,307
280291,2/4/2019,4/28/2018,2,9.565999999999999,2,2019-02-04,2018-04-28,-282
280293,1/27/2019,9/7/2018,24,77.272,9,2019-01-27,2018-09-07,-142
28033,2/12/2019,4/17/2017,2,3.908,2,2019-02-12,2017-04-17,-666
2803941,1/10/2020,9/6/2019,52,386.13,5,2020-01-10,2019-09-06,-126
2804051,8/27/2018,8/27/2018,1,13.147,1,2018-08-27,2018-08-27,0
2804501,1/20/2019,1/20/2019,1,4.573,1,2019-01-20,2019-01-20,0
2804551,1/10/2019,9/7/2018,312,5000.481,12,2019-01-10,2018-09-07,-125
2805001,1/7/2019,3/15/2019,2,15.581999999999999,1,2019-01-07,2019-03-15,67
280531,9/15/2017,9/15/2017,1,0.943,1,2017-09-15,2017-09-15,0
280543,12/16/2019,12/16/2019,1,17.456,1,2019-12-16,2019-12-16,0
280575,11/20/2016,8/5/2016,4,10.730503,4,2016-11-20,2016-08-05,-107
2806091,8/6/2019,8/6/2019,1,14.584,1,2019-08-06,2019-08-06,0
2806311,1/9/2020,3/21/2019,2,7.837,1,2020-01-09,2019-03-21,-294
280637,1/1/2017,9/8/2017,80,742.076615,10,2017-01-01,2017-09-08,250
2806801,9/23/2018,9/23/2018,2,5.279999999999999,2,2018-09-23,2018-09-23,0
2807051,1/21/2020,1/21/2020,1,7.445,1,2020-01-21,2020-01-21,0
280709,3/22/2019,3/22/2019,1,0.72,1,2019-03-22,2019-03-22,0
2807221,8/29/2018,8/29/2018,2,13.302,2,2018-08-29,2018-08-29,0
280739,3/24/2019,3/24/2019,1,8.669,1,2019-03-24,2019-03-24,0
2807391,10/11/2018,5/27/2019,5,32.662,3,2018-10-11,2019-05-27,228
2807531,10/27/2019,12/27/2019,3,15.407,1,2019-10-27,2019-12-27,61
2808751,12/29/2018,4/12/2019,2,12.053,2,2018-12-29,2019-04-12,104
280899,7/4/2017,7/4/2017,1,10.468,1,2017-07-04,2017-07-04,0
2809071,1/3/2020,5/11/2019,3,6.269,3,2020-01-03,2019-05-11,-237
280915,1/1/2017,9/19/2016,64,249.676783,8,2017-01-01,2016-09-19,-104
2809241,10/28/2018,10/28/2018,1,12.699,1,2018-10-28,2018-10-28,0
2809441,5/14/2019,5/14/2019,1,2.744,1,2019-05-14,2019-05-14,0
280955,9/9/2018,9/9/2018,1,0.761,1,2018-09-09,2018-09-09,0
280987,4/5/2017,4/5/2017,1,15.57,1,2017-04-05,2017-04-05,0
2810351,4/2/2019,6/8/2019,2,34.484,2,2019-04-02,2019-06-08,67
2811351,11/25/2019,9/20/2019,2,7.747,2,2019-11-25,2019-09-20,-66
281147,11/11/2017,11/11/2017,1,23.723,1,2017-11-11,2017-11-11,0
281157,10/11/2016,9/6/2016,3,38.416997,3,2016-10-11,2016-09-06,-35
281163,8/20/2016,8/20/2016,1,4.422852,1,2016-08-20,2016-08-20,0
2811681,1/11/2019,3/27/2019,2,23.982,2,2019-01-11,2019-03-27,75
281187,1/16/2020,9/22/2016,24,122.54746300000001,5,2020-01-16,2016-09-22,-1211
2811871,9/11/2018,9/11/2018,1,6.33,1,2018-09-11,2018-09-11,0
2811921,10/13/2019,10/13/2019,1,12.597,1,2019-10-13,2019-10-13,0
281195,1/18/2019,8/27/2019,8,87.012,4,2019-01-18,2019-08-27,221
281203,1/13/2019,1/13/2019,1,0.961,1,2019-01-13,2019-01-13,0
281239,3/30/2018,9/1/2016,2,5.913661,2,2018-03-30,2016-09-01,-575
2813341,8/25/2019,8/25/2019,1,3.92,1,2019-08-25,2019-08-25,0
281355,12/12/2016,12/12/2016,1,7.407,1,2016-12-12,2016-12-12,0
2813791,12/4/2018,12/4/2018,1,2.307,1,2018-12-04,2018-12-04,0
281471,10/9/2016,6/8/2017,3,11.95816,3,2016-10-09,2017-06-08,242
2814731,12/26/2018,12/8/2018,2,17.094,2,2018-12-26,2018-12-08,-18
281557,1/9/2018,6/29/2019,7,31.906115,3,2018-01-09,2019-06-29,536
281623,1/10/2018,8/15/2017,7,41.547,7,2018-01-10,2017-08-15,-148
2816241,1/16/2019,9/25/2019,26,237.467,14,2019-01-16,2019-09-25,252
2816681,8/28/2018,9/25/2019,2,11.653,2,2018-08-28,2019-09-25,393
281687,10/21/2016,8/2/2016,8,22.85769,5,2016-10-21,2016-08-02,-80
2817211,10/19/2018,10/19/2018,1,14.583,1,2018-10-19,2018-10-19,0
2817911,10/17/2018,9/6/2018,8,48.071,6,2018-10-17,2018-09-06,-41
281809,8/29/2017,9/18/2019,2,11.284,2,2017-08-29,2019-09-18,750
2818091,1/27/2020,9/23/2019,8,55.571,7,2020-01-27,2019-09-23,-126
2818611,6/10/2019,6/7/2019,2,19.57,1,2019-06-10,2019-06-07,-3
2818951,9/15/2019,9/15/2019,1,19.943,1,2019-09-15,2019-09-15,0
281897,7/18/2017,7/6/2017,6,78.335,3,2017-07-18,2017-07-06,-12
281901,10/11/2020,9/30/2017,4,31.186,4,2020-10-11,2017-09-30,-1107
2819291,12/23/2018,8/2/2019,3,12.222,3,2018-12-23,2019-08-02,222
281935,3/22/2017,3/22/2017,1,2.767,1,2017-03-22,2017-03-22,0
282025,4/22/2018,8/12/2018,3,30.322,3,2018-04-22,2018-08-12,112
2820511,1/10/2020,2/3/2020,8,69.25,5,2020-01-10,2020-02-03,24
2821231,10/20/2019,8/17/2019,3,4.925,2,2019-10-20,2019-08-17,-64
2821281,12/16/2020,12/16/2020,1,4.146,1,2020-12-16,2020-12-16,0
2822141,7/6/2019,8/21/2019,2,18.123,2,2019-07-06,2019-08-21,46
282317,10/21/2016,10/21/2016,1,1.530114,1,2016-10-21,2016-10-21,0
282329,10/1/2016,8/1/2016,5,11.543561,3,2016-10-01,2016-08-01,-61
2823291,8/29/2018,8/29/2018,1,6.133,1,2018-08-29,2018-08-29,0
2824661,1/9/2019,1/9/2019,1,3.958,1,2019-01-09,2019-01-09,0
2824811,8/30/2018,8/30/2018,1,7.577,1,2018-08-30,2018-08-30,0
282487,6/19/2019,6/19/2019,1,1.015,1,2019-06-19,2019-06-19,0
2825041,12/18/2019,12/18/2019,1,12.653,1,2019-12-18,2019-12-18,0
282515,1/10/2019,3/3/2020,2,8.297,2,2019-01-10,2020-03-03,418
282567,11/1/2016,7/15/2017,2,8.375,2,2016-11-01,2017-07-15,256
2825961,1/13/2019,9/13/2018,7,37.7,4,2019-01-13,2018-09-13,-122
282631,12/18/2016,12/18/2016,1,10.37,1,2016-12-18,2016-12-18,0
282789,1/10/2019,9/8/2019,316,896.922,13,2019-01-10,2019-09-08,241
2828031,2/9/2019,5/26/2019,3,27.566,2,2019-02-09,2019-05-26,106
2829071,3/1/2019,3/1/2019,1,6.442,1,2019-03-01,2019-03-01,0
2831421,9/22/2018,9/22/2018,1,9.382,1,2018-09-22,2018-09-22,0
2832971,1/24/2020,9/6/2020,29,320.194,9,2020-01-24,2020-09-06,226
2833241,1/3/2019,9/9/2018,10,58.327999999999996,4,2019-01-03,2018-09-09,-116
2833621,1/20/2019,9/26/2020,69,580.292,6,2019-01-20,2020-09-26,615
2833701,1/17/2019,5/8/2019,8,98.216,4,2019-01-17,2019-05-08,111
2833981,3/15/2019,3/15/2019,1,5.332,1,2019-03-15,2019-03-15,0
283441,1/11/2017,9/9/2017,558,2350.979365,31,2017-01-11,2017-09-09,241
283497,3/3/2018,3/3/2018,1,5.054,1,2018-03-03,2018-03-03,0
2835221,1/15/2020,5/11/2019,4,35.588,3,2020-01-15,2019-05-11,-249
283677,3/21/2017,3/21/2017,1,1.65,1,2017-03-21,2017-03-21,0
2837111,9/20/2018,9/20/2018,1,5.705,1,2018-09-20,2018-09-20,0
2837431,1/11/2020,9/19/2020,71,1392.978,3,2020-01-11,2020-09-19,252
2837451,8/31/2018,8/31/2018,1,1.743,1,2018-08-31,2018-08-31,0
2837791,11/10/2018,11/10/2018,1,6.445,1,2018-11-10,2018-11-10,0
2837851,12/1/2019,6/15/2019,2,13.405000000000001,2,2019-12-01,2019-06-15,-169
2838111,9/2/2018,9/2/2018,1,5.609,1,2018-09-02,2018-09-02,0
2838361,10/16/2018,10/16/2018,1,7.093,1,2018-10-16,2018-10-16,0
2840171,9/13/2018,9/13/2018,1,3.687,1,2018-09-13,2018-09-13,0
2840541,1/12/2019,6/6/2019,68,632.188,10,2019-01-12,2019-06-06,145
2840711,2/22/2019,2/22/2019,1,17.276,1,2019-02-22,2019-02-22,0
284199,6/11/2017,6/11/2017,1,2.303,1,2017-06-11,2017-06-11,0
284205,8/17/2017,8/17/2017,1,1.838,1,2017-08-17,2017-08-17,0
2842541,1/1/2019,9/5/2018,23,182.83,6,2019-01-01,2018-09-05,-118
2842621,10/13/2018,10/13/2018,1,9.945,1,2018-10-13,2018-10-13,0
284273,1/24/2018,9/23/2016,3,9.690375,3,2018-01-24,2016-09-23,-488
284303,1/27/2018,8/13/2018,6,61.786,5,2018-01-27,2018-08-13,198
284415,10/28/2016,11/6/2016,4,62.150999999999996,1,2016-10-28,2016-11-06,9
2845491,1/25/2019,9/30/2018,6,37.651,5,2019-01-25,2018-09-30,-117
2845511,1/10/2019,9/28/2018,206,3664.342,6,2019-01-10,2018-09-28,-104
2846271,10/27/2018,10/27/2018,1,1.394,1,2018-10-27,2018-10-27,0
2846901,10/4/2018,9/19/2019,4,69.16,2,2018-10-04,2019-09-19,350
2849041,10/26/2018,9/20/2018,4,20.188,4,2018-10-26,2018-09-20,-36
284913,11/6/2019,11/6/2019,1,7.403,1,2019-11-06,2019-11-06,0
2849391,10/14/2018,11/8/2018,2,15.865,2,2018-10-14,2018-11-08,25
2850771,10/11/2018,9/3/2018,11,23.617,6,2018-10-11,2018-09-03,-38
2850851,11/10/2018,2/2/2019,2,6.49,1,2018-11-10,2019-02-02,84
2851831,12/6/2020,9/8/2018,2,5.061,1,2020-12-06,2018-09-08,-820
285215,11/30/2017,11/30/2017,1,0.923,1,2017-11-30,2017-11-30,0
28523,1/18/2018,9/27/2019,17,100.932,9,2018-01-18,2019-09-27,617
2852511,12/8/2018,12/8/2018,1,12.087,1,2018-12-08,2018-12-08,0
2852601,9/2/2018,9/2/2018,1,7.265,1,2018-09-02,2018-09-02,0
285271,1/3/2019,9/7/2018,161,1486.14,4,2019-01-03,2018-09-07,-118
285303,10/16/2016,9/17/2017,9,39.068701,4,2016-10-16,2017-09-17,336
2853101,9/24/2019,9/24/2019,1,5.878,1,2019-09-24,2019-09-24,0
2853301,7/12/2019,7/12/2019,1,7.955,1,2019-07-12,2019-07-12,0
2853501,10/5/2018,9/30/2018,2,19.881,2,2018-10-05,2018-09-30,-5
285363,10/22/2016,9/22/2019,7,51.831612,6,2016-10-22,2019-09-22,1065
2853911,1/11/2019,8/29/2019,20,66.103,6,2019-01-11,2019-08-29,230
285403,11/27/2018,9/11/2016,4,36.490823,3,2018-11-27,2016-09-11,-807
2854231,4/30/2019,4/30/2019,1,7.667,1,2019-04-30,2019-04-30,0
285427,3/24/2020,3/24/2020,1,3.766,1,2020-03-24,2020-03-24,0
285469,12/12/2017,3/3/2018,3,6.252,1,2017-12-12,2018-03-03,81
285563,2/13/2017,2/13/2017,1,2.626,1,2017-02-13,2017-02-13,0
2855661,10/13/2018,10/13/2018,1,5.234,1,2018-10-13,2018-10-13,0
285655,10/11/2019,7/12/2019,3,12.988,3,2019-10-11,2019-07-12,-91
2856821,10/13/2019,5/4/2019,3,30.695,3,2019-10-13,2019-05-04,-162
2856851,6/7/2019,6/7/2019,1,30.575,1,2019-06-07,2019-06-07,0
2857001,9/7/2018,9/7/2018,1,6.534,1,2018-09-07,2018-09-07,0
2858441,8/20/2020,8/20/2020,1,2.377,1,2020-08-20,2020-08-20,0
285847,10/11/2017,5/2/2018,3,17.796,2,2017-10-11,2018-05-02,203
2858661,2/9/2019,2/9/2019,1,5.776,1,2019-02-09,2019-02-09,0
285871,10/17/2016,9/11/2017,9,57.293994,6,2016-10-17,2017-09-11,329
2858801,9/21/2019,9/21/2019,1,7.141,1,2019-09-21,2019-09-21,0
285913,1/19/2019,9/21/2018,21,152.414333,10,2019-01-19,2018-09-21,-120
2861261,9/13/2018,9/13/2018,1,14.891,1,2018-09-13,2018-09-13,0
2861521,2/1/2019,2/1/2019,1,5.984,1,2019-02-01,2019-02-01,0
2861701,10/4/2019,9/28/2018,3,18.223,3,2019-10-04,2018-09-28,-371
286241,5/17/2018,9/29/2017,2,9.949,2,2018-05-17,2017-09-29,-230
286293,2/9/2020,2/9/2020,1,17.229,1,2020-02-09,2020-02-09,0
286307,12/8/2018,3/9/2019,2,9.709,2,2018-12-08,2019-03-09,91
2863241,10/10/2018,9/6/2018,10,212.495,4,2018-10-10,2018-09-06,-34
2863251,1/19/2019,9/22/2018,2,10.283,1,2019-01-19,2018-09-22,-119
2863321,11/27/2019,7/3/2019,3,16.412,3,2019-11-27,2019-07-03,-147
2863951,3/7/2019,3/7/2019,1,8.619,1,2019-03-07,2019-03-07,0
2864571,12/20/2018,5/12/2019,2,14.097,2,2018-12-20,2019-05-12,143
286473,3/4/2017,3/4/2017,1,6.961,1,2017-03-04,2017-03-04,0
286515,1/12/2020,9/22/2018,17,209.17000000000002,5,2020-01-12,2018-09-22,-477
286525,10/11/2018,9/28/2017,19,70.421,10,2018-10-11,2017-09-28,-378
286531,7/17/2017,7/17/2017,1,5.028,1,2017-07-17,2017-07-17,0
286549,1/16/2020,9/25/2019,8,63.752,5,2020-01-16,2019-09-25,-113
286613,11/10/2017,7/17/2018,2,8.03,2,2017-11-10,2018-07-17,249
286723,10/28/2019,10/28/2019,1,9.336,1,2019-10-28,2019-10-28,0
2867381,8/29/2019,8/29/2019,1,6.937,1,2019-08-29,2019-08-29,0
2867421,3/3/2019,5/25/2019,2,13.634,1,2019-03-03,2019-05-25,83
2867571,3/11/2019,4/6/2019,2,17.423,2,2019-03-11,2019-04-06,26
286793,12/14/2017,12/14/2017,1,3.086,1,2017-12-14,2017-12-14,0
2868371,10/9/2018,10/9/2018,1,2.533,1,2018-10-09,2018-10-09,0
2869901,10/8/2018,11/26/2018,2,8.022,2,2018-10-08,2018-11-26,49
2869911,1/10/2020,12/7/2019,2,32.066,2,2020-01-10,2019-12-07,-34
287007,12/2/2017,12/2/2017,1,12.782,1,2017-12-02,2017-12-02,0
287045,2/22/2018,5/8/2018,3,19.749000000000002,2,2018-02-22,2018-05-08,75
2870621,5/8/2019,5/8/2019,1,1.16,1,2019-05-08,2019-05-08,0
287115,9/1/2020,9/1/2020,1,11.192,1,2020-09-01,2020-09-01,0
2871311,9/26/2019,9/5/2018,2,14.361,2,2019-09-26,2018-09-05,-386
287193,10/22/2019,10/22/2019,1,8.857,1,2019-10-22,2019-10-22,0
287219,12/26/2016,12/26/2016,1,11.37,1,2016-12-26,2016-12-26,0
2873201,10/31/2018,9/7/2018,4,26.719,4,2018-10-31,2018-09-07,-54
2873361,11/17/2018,11/17/2018,1,3.343,1,2018-11-17,2018-11-17,0
287337,1/11/2018,8/8/2018,55,298.238,9,2018-01-11,2018-08-08,209
2873671,9/14/2019,9/14/2019,1,7.868,1,2019-09-14,2019-09-14,0
287561,6/12/2017,6/12/2017,1,4.802,1,2017-06-12,2017-06-12,0
287563,4/15/2017,4/15/2017,1,1.152,1,2017-04-15,2017-04-15,0
2875681,5/2/2019,9/5/2018,5,49.091,4,2019-05-02,2018-09-05,-239
2876151,11/24/2018,11/24/2018,1,5.533,1,2018-11-24,2018-11-24,0
2876381,4/16/2019,4/16/2019,1,4.319,1,2019-04-16,2019-04-16,0
2876411,4/20/2019,4/20/2019,1,10.494,1,2019-04-20,2019-04-20,0
2876821,2/8/2020,6/10/2020,3,35.459,2,2020-02-08,2020-06-10,123
287889,6/13/2017,6/8/2017,2,22.680999999999997,2,2017-06-13,2017-06-08,-5
287975,12/7/2018,12/7/2018,1,2.283,1,2018-12-07,2018-12-07,0
288005,11/17/2016,3/3/2020,6,35.831,5,2016-11-17,2020-03-03,1202
2880051,1/15/2019,4/27/2019,13,80.48100000000001,9,2019-01-15,2019-04-27,102
288155,12/11/2016,12/11/2016,1,5.079,1,2016-12-11,2016-12-11,0
288173,11/23/2016,8/10/2017,8,45.801,5,2016-11-23,2017-08-10,260
2881791,1/1/2019,9/9/2018,90,1905.673,5,2019-01-01,2018-09-09,-114
288209,6/18/2019,8/30/2020,2,4.712,2,2019-06-18,2020-08-30,439
288321,5/31/2018,7/25/2017,2,29.176000000000002,2,2018-05-31,2017-07-25,-310
288345,1/13/2017,8/11/2018,3,17.447,2,2017-01-13,2018-08-11,575
2883621,12/29/2018,12/29/2018,1,5.27,1,2018-12-29,2018-12-29,0
2884731,4/11/2019,6/22/2019,2,28.250999999999998,1,2019-04-11,2019-06-22,72
288505,6/28/2017,7/21/2019,2,8.812,2,2017-06-28,2019-07-21,753
2885671,10/15/2018,9/27/2018,8,49.251000000000005,2,2018-10-15,2018-09-27,-18
288583,2/3/2017,2/3/2017,1,6.833,1,2017-02-03,2017-02-03,0
2886131,1/5/2019,9/9/2018,5,12.708,2,2019-01-05,2018-09-09,-118
2886471,11/30/2018,11/30/2018,1,2.778,1,2018-11-30,2018-11-30,0
2886701,1/9/2020,1/9/2020,1,7.54,1,2020-01-09,2020-01-09,0
288717,1/13/2017,9/9/2016,121,248.700775,11,2017-01-13,2016-09-09,-126
2887201,10/10/2020,9/24/2020,5,34.192,4,2020-10-10,2020-09-24,-16
288801,1/4/2019,8/2/2018,4,29.031,2,2019-01-04,2018-08-02,-155
2888011,12/10/2018,12/10/2018,1,7.889,1,2018-12-10,2018-12-10,0
2888271,1/18/2020,9/10/2019,4,10.146,4,2020-01-18,2019-09-10,-130
2889131,1/13/2019,1/13/2019,1,14.318,1,2019-01-13,2019-01-13,0
2889481,2/29/2020,9/10/2019,4,23.709,4,2020-02-29,2019-09-10,-172
2889801,8/12/2019,8/12/2019,1,6.867,1,2019-08-12,2019-08-12,0
289039,2/22/2018,2/22/2018,1,7.898,1,2018-02-22,2018-02-22,0
289103,1/30/2018,2/24/2018,4,10.581,4,2018-01-30,2018-02-24,25
2891311,10/8/2019,10/8/2019,1,0.056,1,2019-10-08,2019-10-08,0
2891831,9/21/2018,9/9/2018,2,10.870999999999999,2,2018-09-21,2018-09-09,-12
289199,12/6/2016,5/16/2017,2,14.312000000000001,2,2016-12-06,2017-05-16,161
2892291,11/16/2019,8/31/2019,11,60.968,5,2019-11-16,2019-08-31,-77
289271,1/8/2017,8/31/2016,4,51.267789,3,2017-01-08,2016-08-31,-130
2893101,1/11/2020,2/14/2020,2,21.926000000000002,2,2020-01-11,2020-02-14,34
2893241,6/5/2019,9/26/2019,2,21.019,2,2019-06-05,2019-09-26,113
2893341,10/6/2019,10/6/2019,1,28.22,1,2019-10-06,2019-10-06,0
289337,5/18/2019,8/17/2019,3,5.269,2,2019-05-18,2019-08-17,91
2893481,11/19/2018,2/6/2020,3,18.680999999999997,3,2018-11-19,2020-02-06,444
2894241,6/17/2019,7/26/2019,2,17.726,2,2019-06-17,2019-07-26,39
2894631,1/27/2019,2/6/2020,3,37.43,3,2019-01-27,2020-02-06,375
2895011,10/10/2019,9/12/2019,4,63.323,3,2019-10-10,2019-09-12,-28
2895091,1/26/2019,1/26/2019,1,10.839,1,2019-01-26,2019-01-26,0
2895211,9/15/2018,9/15/2018,1,14.81,1,2018-09-15,2018-09-15,0
289543,10/31/2016,10/31/2016,1,17.605,1,2016-10-31,2016-10-31,0
2895431,6/6/2019,6/6/2019,1,7.171,1,2019-06-06,2019-06-06,0
289573,3/12/2017,9/16/2017,4,31.558999999999997,4,2017-03-12,2017-09-16,188
2895741,9/8/2018,9/8/2018,1,14.17,1,2018-09-08,2018-09-08,0
2895771,11/14/2018,11/14/2018,1,29.223,1,2018-11-14,2018-11-14,0
2895781,9/11/2018,9/12/2018,2,19.467,1,2018-09-11,2018-09-12,1
289605,8/27/2016,8/27/2016,1,4.570396,1,2016-08-27,2016-08-27,0
2896641,10/9/2018,10/9/2018,1,11.957,1,2018-10-09,2018-10-09,0
2897281,2/7/2020,2/7/2020,1,3.209,1,2020-02-07,2020-02-07,0
2897341,1/18/2019,1/31/2019,3,28.29,2,2019-01-18,2019-01-31,13
2898171,12/3/2019,9/3/2019,5,28.875,3,2019-12-03,2019-09-03,-91
289835,5/21/2017,6/3/2017,2,3.3920000000000003,2,2017-05-21,2017-06-03,13
2898951,10/31/2019,10/31/2019,1,11.659,1,2019-10-31,2019-10-31,0
2899501,6/5/2019,6/5/2019,1,0.249,1,2019-06-05,2019-06-05,0
2900001,9/9/2018,9/9/2018,1,2.86,1,2018-09-09,2018-09-09,0
2900121,12/12/2018,9/20/2019,4,11.726,4,2018-12-12,2019-09-20,282
2900181,8/19/2019,8/19/2019,1,4.271,1,2019-08-19,2019-08-19,0
2900391,9/12/2019,9/12/2019,1,13.807,1,2019-09-12,2019-09-12,0
290063,1/10/2017,9/30/2016,9,105.096472,3,2017-01-10,2016-09-30,-102
2901311,6/1/2019,6/1/2019,1,6.12,1,2019-06-01,2019-06-01,0
2901331,10/13/2019,10/13/2019,1,2.846,1,2019-10-13,2019-10-13,0
290137,1/21/2019,7/9/2017,2,9.176,2,2019-01-21,2017-07-09,-561
2901761,12/22/2018,12/22/2018,1,1.129,1,2018-12-22,2018-12-22,0
290195,5/9/2018,8/23/2018,3,49.222,2,2018-05-09,2018-08-23,106
290219,1/1/2017,9/7/2017,203,1016.504491,14,2017-01-01,2017-09-07,249
2902421,12/10/2019,9/14/2019,2,14.346,2,2019-12-10,2019-09-14,-87
2902471,10/4/2018,10/4/2018,1,8.728,1,2018-10-04,2018-10-04,0
2902491,9/7/2019,9/7/2019,1,4.773,1,2019-09-07,2019-09-07,0
2903211,2/15/2019,4/20/2019,2,36.414,1,2019-02-15,2019-04-20,64
290383,1/14/2017,9/25/2016,38,137.13511400000002,7,2017-01-14,2016-09-25,-111
2904281,1/17/2020,1/17/2020,1,12.578,1,2020-01-17,2020-01-17,0
2904511,6/7/2019,6/7/2019,1,6.611,1,2019-06-07,2019-06-07,0
2904561,8/18/2019,8/18/2019,1,3.998,1,2019-08-18,2019-08-18,0
290507,12/3/2016,12/3/2016,1,9.212,1,2016-12-03,2016-12-03,0
290559,11/14/2017,12/19/2018,2,19.802,2,2017-11-14,2018-12-19,400
2906151,10/26/2019,9/7/2019,3,70.997,3,2019-10-26,2019-09-07,-49
290641,4/9/2017,6/23/2017,2,4.797999999999999,1,2017-04-09,2017-06-23,75
290683,8/28/2016,8/28/2016,1,0.40089,1,2016-08-28,2016-08-28,0
2906911,10/27/2019,10/27/2019,1,8.746,1,2019-10-27,2019-10-27,0
2907041,9/28/2019,9/28/2019,1,0.545,1,2019-09-28,2019-09-28,0
2907151,3/9/2019,9/27/2019,3,20.018,3,2019-03-09,2019-09-27,202
2907421,10/18/2020,12/19/2018,3,23.018,3,2020-10-18,2018-12-19,-669
2907941,11/17/2018,6/28/2019,2,4.827999999999999,2,2018-11-17,2019-06-28,223
290975,1/23/2018,8/6/2018,17,79.259,10,2018-01-23,2018-08-06,195
2909931,9/6/2019,9/6/2019,1,7.404,1,2019-09-06,2019-09-06,0
2910381,9/11/2018,9/11/2018,1,8.903,1,2018-09-11,2018-09-11,0
291067,1/27/2019,9/30/2018,36,122.46,8,2019-01-27,2018-09-30,-119
291089,11/15/2019,11/15/2019,1,2.413,1,2019-11-15,2019-11-15,0
291097,10/11/2020,9/16/2017,10,42.768416,4,2020-10-11,2017-09-16,-1121
291107,12/3/2016,12/3/2016,1,11.849,1,2016-12-03,2016-12-03,0
291127,2/3/2017,6/26/2017,3,20.395,1,2017-02-03,2017-06-26,143
2911411,1/22/2019,9/6/2019,8,83.926,4,2019-01-22,2019-09-06,227
2911461,12/2/2018,12/2/2018,1,3.43,1,2018-12-02,2018-12-02,0
2911521,12/17/2018,12/17/2018,1,5.644,1,2018-12-17,2018-12-17,0
291161,1/11/2019,8/5/2017,9,49.292,6,2019-01-11,2017-08-05,-524
2912351,1/19/2019,1/19/2019,1,8.9,1,2019-01-19,2019-01-19,0
291247,9/26/2018,9/26/2018,1,5.557,1,2018-09-26,2018-09-26,0
291317,2/10/2018,5/7/2017,3,17.892,3,2018-02-10,2017-05-07,-279
2913181,11/3/2018,11/3/2018,1,0.082,1,2018-11-03,2018-11-03,0
291331,3/9/2019,4/26/2019,2,23.136,2,2019-03-09,2019-04-26,48
2913601,10/12/2018,10/12/2018,1,0.569,1,2018-10-12,2018-10-12,0
2913901,11/15/2018,9/13/2018,2,43.650999999999996,2,2018-11-15,2018-09-13,-63
2914101,9/24/2018,9/25/2018,2,30.386,2,2018-09-24,2018-09-25,1
291481,1/31/2018,2/13/2020,2,18.073,2,2018-01-31,2020-02-13,743
2915241,11/14/2019,9/9/2019,13,72.159,11,2019-11-14,2019-09-09,-66
2916311,9/11/2018,9/25/2018,2,6.908,1,2018-09-11,2018-09-25,14
291663,1/28/2019,8/3/2017,12,71.566619,7,2019-01-28,2017-08-03,-543
291757,10/22/2016,10/22/2016,1,3.331849,1,2016-10-22,2016-10-22,0
291769,10/8/2017,12/28/2017,2,12.709,2,2017-10-08,2017-12-28,81
291793,10/2/2016,9/7/2016,20,166.335674,9,2016-10-02,2016-09-07,-25
291821,10/10/2018,9/19/2019,11,31.866,7,2018-10-10,2019-09-19,344
2918351,1/31/2019,11/9/2018,3,19.125999999999998,2,2019-01-31,2018-11-09,-83
2918531,1/12/2019,9/19/2020,8,81.76899999999999,8,2019-01-12,2020-09-19,616
291891,3/22/2019,3/22/2019,1,18.543,1,2019-03-22,2019-03-22,0
2919381,11/7/2018,7/14/2019,2,21.372999999999998,2,2018-11-07,2019-07-14,249
291961,10/13/2018,9/28/2016,6,50.456926,2,2018-10-13,2016-09-28,-745
291973,1/18/2019,8/3/2017,4,39.703,4,2019-01-18,2017-08-03,-533
292025,4/26/2017,5/17/2017,2,10.027000000000001,2,2017-04-26,2017-05-17,21
292045,10/24/2017,3/9/2018,16,89.488,4,2017-10-24,2018-03-09,136
2920881,11/25/2018,12/21/2018,2,30.439,2,2018-11-25,2018-12-21,26
2921371,12/29/2018,12/29/2018,1,5.768,1,2018-12-29,2018-12-29,0
292201,2/24/2017,2/24/2017,1,7.472,1,2017-02-24,2017-02-24,0
2922331,1/10/2020,9/25/2020,6,47.568,4,2020-01-10,2020-09-25,259
2922501,10/1/2019,10/1/2019,1,8.432,1,2019-10-01,2019-10-01,0
2923051,2/22/2020,2/22/2020,1,10.351,1,2020-02-22,2020-02-22,0
292385,9/12/2018,9/12/2018,1,12.813,1,2018-09-12,2018-09-12,0
292399,5/26/2017,5/26/2017,1,8.832,1,2017-05-26,2017-05-26,0
292507,11/3/2017,11/3/2017,1,9.976,1,2017-11-03,2017-11-03,0
292567,1/30/2017,9/7/2016,15,159.65805,10,2017-01-30,2016-09-07,-145
2925711,1/23/2019,3/9/2020,8,86.262,4,2019-01-23,2020-03-09,411
2925831,10/20/2018,2/16/2020,2,7.578,1,2018-10-20,2020-02-16,484
2925881,10/5/2019,10/5/2019,1,9.487,1,2019-10-05,2019-10-05,0
292681,1/3/2017,8/12/2020,17,124.281779,2,2017-01-03,2020-08-12,1317
2928031,1/5/2019,9/13/2018,8,36.688,6,2019-01-05,2018-09-13,-114
2928311,11/9/2019,3/22/2019,3,15.681000000000001,2,2019-11-09,2019-03-22,-232
292835,1/1/2020,9/10/2017,10,60.018,7,2020-01-01,2017-09-10,-843
2928531,3/7/2019,3/7/2019,1,3.964,1,2019-03-07,2019-03-07,0
2928781,10/10/2019,9/30/2018,30,206.806,12,2019-10-10,2018-09-30,-375
292925,12/19/2016,9/8/2016,3,20.803295,3,2016-12-19,2016-09-08,-102
2929281,2/17/2020,9/26/2018,7,71.624,3,2020-02-17,2018-09-26,-509
293035,10/19/2020,6/10/2018,8,50.892,7,2020-10-19,2018-06-10,-862
293111,8/26/2018,8/26/2018,1,18.345,1,2018-08-26,2018-08-26,0
293127,1/12/2017,9/3/2017,27,330.016,7,2017-01-12,2017-09-03,234
2931291,12/17/2018,9/13/2018,3,40.974000000000004,3,2018-12-17,2018-09-13,-95
293133,12/17/2017,12/17/2017,1,9.474,1,2017-12-17,2017-12-17,0
2931401,9/13/2018,9/13/2018,1,6.311,1,2018-09-13,2018-09-13,0
293251,1/1/2018,5/16/2018,2,17.418,2,2018-01-01,2018-05-16,135
293335,10/15/2016,9/15/2016,13,74.044635,6,2016-10-15,2016-09-15,-30
2933511,11/30/2018,11/30/2018,1,14.858,1,2018-11-30,2018-11-30,0
293391,1/27/2017,7/30/2017,13,60.028,6,2017-01-27,2017-07-30,184
293415,1/14/2020,7/28/2018,14,71.522,7,2020-01-14,2018-07-28,-535
293437,1/24/2019,9/29/2018,21,144.340434,12,2019-01-24,2018-09-29,-117
2934521,1/12/2019,10/7/2018,2,14.803,2,2019-01-12,2018-10-07,-97
293517,9/11/2018,9/27/2017,2,16.122999999999998,2,2018-09-11,2017-09-27,-349
2935281,8/15/2019,8/15/2019,2,6.711,2,2019-08-15,2019-08-15,0
293537,3/27/2019,8/25/2019,2,16.29,2,2019-03-27,2019-08-25,151
2935411,12/14/2018,9/16/2018,2,23.497999999999998,2,2018-12-14,2018-09-16,-89
2935431,5/26/2019,5/26/2019,1,14.18,1,2019-05-26,2019-05-26,0
293547,1/5/2018,9/30/2017,7,50.813,4,2018-01-05,2017-09-30,-97
293579,2/22/2020,8/26/2017,6,47.918,4,2020-02-22,2017-08-26,-910
293615,4/4/2018,4/4/2018,1,9.768,1,2018-04-04,2018-04-04,0
293621,3/1/2017,8/5/2016,3,5.23253,3,2017-03-01,2016-08-05,-208
293665,1/10/2019,9/23/2019,7,109.38799999999999,3,2019-01-10,2019-09-23,256
2936681,11/2/2018,5/29/2019,7,17.417,2,2018-11-02,2019-05-29,208
293697,1/28/2017,5/4/2019,6,18.173,4,2017-01-28,2019-05-04,826
293753,10/11/2018,10/11/2018,1,5.594,1,2018-10-11,2018-10-11,0
2938981,7/27/2019,7/27/2019,1,1.295,1,2019-07-27,2019-07-27,0
293931,8/1/2016,8/9/2016,9,108.646653,3,2016-08-01,2016-08-09,8
2939341,1/29/2019,1/29/2019,1,8.71,1,2019-01-29,2019-01-29,0
293943,10/17/2017,6/17/2018,10,87.32600000000001,5,2017-10-17,2018-06-17,243
2939431,11/16/2019,9/9/2019,3,11.264,2,2019-11-16,2019-09-09,-68
293949,12/22/2016,12/22/2016,1,4.313,1,2016-12-22,2016-12-22,0
2939761,3/12/2020,3/12/2020,1,8.844,1,2020-03-12,2020-03-12,0
2939811,10/10/2020,9/14/2018,5,44.242000000000004,3,2020-10-10,2018-09-14,-757
293987,6/5/2017,7/19/2020,2,39.88,2,2017-06-05,2020-07-19,1140
293993,7/6/2017,7/6/2017,1,11.356,1,2017-07-06,2017-07-06,0
294005,1/28/2017,2/22/2017,2,5.11,2,2017-01-28,2017-02-22,25
2940171,9/14/2018,9/14/2018,1,10.064,1,2018-09-14,2018-09-14,0
2940821,11/23/2019,11/23/2019,1,2.81,1,2019-11-23,2019-11-23,0
